start	end	text
0	2640	Good evening, everyone.
2640	4920	Thanks so much for joining us tonight.
4920	8880	My name is Serena Longo, and on behalf of Harvard Book Store,
8880	12180	the Harvard University Division of Science, the Cabot Science
12180	15100	Library, and Mass Humanities, I'm so
15100	17640	excited to welcome you to our program tonight
17640	21040	with Daniel L. Everett presenting his latest book,
21040	26280	How Language Began, The Story of Humanity's Greatest Invention.
26280	27840	In just a moment, I'll turn things over
27840	29440	to Professor Melissa Franklin, who
29440	31480	will be introducing the program tonight.
31480	33960	But first, I'd like to say a few words about the series
33960	37680	and how you can learn more about our spring season.
37680	39760	The Science Book Talk series features talks
39760	41920	throughout the academic year by authors
41920	45340	of recently published science-related literature.
45340	48120	Just next week, we're very excited to welcome renowned
48120	51480	physicist and Princeton professor Paul J. Steinhart
51480	54520	for his book, The Second Kind of Impossible.
54520	57440	And in April, we'll be joined by a biologist and best-selling
57440	62600	author, Neil Shubin, for his new book, Some Assembly Required.
62600	64640	If you'd like to stay up to date on the series
64640	68360	and our newly posted talks, we have a few options.
68360	70920	Nearly all of our events are filmed and recorded
70920	71800	for the public.
71800	74000	You can access them at the web address,
74000	78880	science.fas.harvard.edu, slash book talks, which I've written
78880	81160	here on the board.
81160	83720	And also, you can find out announcements
83720	89840	about our spring lineup at harvard.com slash science.
89840	93320	And lastly, you can learn about Harvard Bookstore's many other
93320	97080	non-science book talks, which take place nearly every day
97080	101000	and in and around Harvard Square by visiting us at harvard.com
101000	104240	and signing up for our weekly email newsletter.
104240	107640	Tonight's talk will be followed by some time for your questions,
107640	110160	after which we'll have a book signing and refreshments
110160	112320	in the Cabot Science Library.
112320	114080	If you haven't picked up one already,
114080	116880	we have copies of how language began for sale
116880	120520	at the back of the hall and in the Cabot Library as well.
123440	125680	And as always, a few thank yous.
125680	128520	Thanks to our partners here at Harvard who make this series
128520	131280	and, of course, the cheese, all important cheese,
131280	133120	possible at the reception.
133120	135920	And thank you to all of you for being here,
135920	138920	for purchasing books that support an independent bookstore
138920	142040	and for affirming that science matters.
142040	144280	And finally, just a quick reminder, of course,
144280	147720	to silence your cell phones before the talk begins.
147720	149920	And so now I'm so pleased to bring up
149920	153240	Melissa Franklin, Harvard Physics Professor,
153240	156160	and the first woman ever to receive tenure
156160	157960	in the Harvard Physics Department.
157960	158460	Woo!
158460	163800	[? Applause. ?]
163800	166440	Hi, I'm really excited about this talk.
166440	169640	You know, we have a lot of these science book talks,
169640	174160	but they're mostly physics.
174160	177560	I'm really excited to have something really, we're
177560	183960	branching out, and I'm very excited about tonight's talk.
183960	187800	And if any of you have any ideas about more talks
187800	190640	on this subject, I see people here I've never seen before.
190640	193440	So I think it's a different audience than the physics
193440	195800	talks, maybe.
195800	196960	Yes?
196960	198480	Yes, OK.
198480	201680	And so if anybody has any ideas, my name's Franklin at Physics,
201680	207120	just ideas for interesting books in your part of sciencey
207120	209640	things, please let me know.
209640	213520	I want to introduce Daniel Everett, who
213520	217480	has a really interesting past.
217480	222760	And in particular, he started his education
222760	225320	at the Moody Bible Institute in Chicago.
225320	227400	I spent years in Chicago, but I've never
227400	228880	seen the Moody Bible Institute.
228880	233440	It's at La Sal in West Chicago Street.
233440	234920	Nobody's from Chicago.
234920	238000	OK, well, anyway, that's kind of an interesting start.
238000	240680	And from there, he went to Brazil
240680	245400	and got his PhD at the University of Campinas, which
245400	250600	is called Las Campos.
250600	256280	And he did his research also in the South Amazon,
256320	260560	studying the praja in the Amazon basin.
260560	263520	And now, he taught at a lot of different places.
263520	265800	He taught in Pittsburgh at Manchester,
265800	270800	which I think is in England, not Manchester by the sea,
270800	273520	and at Unicamp, which is also in Brazil.
273520	276880	And he's had many, many interesting positions
276880	278360	of leadership.
278360	281880	In the meantime, he has written many books.
281880	283480	The one I like the best, of course,
283480	286560	is Dark Matter of the Mind, because I'm a physicist.
286560	288080	And that's why, initially, I thought
288080	295280	this would be a good talk in this series.
295280	299440	Dark Matter of the Mind, even though you're linguist,
299440	301520	you know what dark matter is.
301520	307080	Yes, of the mind in the culturally articulated
307080	307720	unconscious.
307720	311200	Another one I like is, don't sleep.
311200	313240	There are snakes, life and language
313240	317080	in the Amazonian jungle, or Amazonian jungle.
317080	318960	The one we're talking about today,
318960	321520	how language began, the story of humanity's greatest
321520	323440	invention, and the one that's coming.
323440	326680	I'm also really excited about American Aristotle,
326680	330960	the life and mind of Charles Sanders Pierce.
330960	334640	There are other books, so you're not going to run out.
334640	338600	I mean, if you start now, and you're under 50,
338600	342480	you could get there.
342480	347320	Just to say, if you don't have the length of attention
347320	351120	for books, there's a fantastic New Yorker profile
351120	353880	on Dr. Everett.
353880	356040	So I'm very excited, because I hear
356040	357640	that it's going to be exciting.
357640	365360	Lots of really questions which are probing and questions.
365360	366400	Good probing questions.
366400	371240	So I'm very, very, very excited to welcome Daniel Everett.
371240	371740	Oops.
388600	391080	OK.
391080	393800	So I'll walk around a bit.
393800	397120	I come to Harvard now about once a week, twice a week,
397120	399960	because I'm writing this biography of Charles Sanders
399960	405320	Pierce, who graduated from Harvard in 1859.
405320	407240	When he was going here as a student,
407240	410440	his home set where Seaver Hall currently sits.
410440	412960	Those of you who are familiar with Harvard Yard.
412960	415720	And the person who designed that hall,
415720	420240	H.R. Richardson, was a fellow student of Peirce's
420240	421840	in the 1859 class.
421840	423680	There were eight of them.
423680	427920	And Peirce wrote little summaries of each of them,
427920	431560	said Richardson wasn't very smart.
431560	434920	And he also talked about Strong Vincent, a great American
434920	437800	Civil War hero who died in Gettysburg,
437800	440360	saying that he was a bit flashy and also dull.
440360	442960	Peirce thought everybody was dull.
442960	447160	But he was the first summa cum laude in chemistry
447160	448040	from Harvard.
448040	452480	And he was a geophysicist for 31 years for the US government.
452480	455840	He was an astronomer at Harvard and is mainly
455840	459600	known as a mathematician, logician, and philosopher.
459600	461440	So that's very different from this work,
461440	464720	although you'll see that Peirce is implicated
464720	468000	in the evolution of human language.
468000	471560	So I want to thank several people.
471560	472840	And you can see their names.
472840	476200	So now we'll go to something else.
476200	477360	Not that grateful.
477360	480280	Language is a biocultural behavior.
480280	484600	So language is a biocultural complex.
484600	487000	And thus, research into its origins
487000	490120	is necessarily interdisciplinary.
490120	492160	And so if you're an archaeologist,
492160	495800	you're not going to find out by yourself how language came
495800	498200	about, and you're not going to do that if you're a linguist.
498200	501600	So it requires a lot of people working together.
501600	505120	And I started on this project by myself,
505120	507280	but have been working quite a bit with archaeologists,
507280	511040	in particular Larry Barham from the University of Liverpool,
511040	513760	whose specialty is Homo erectus.
513760	517560	There are also a lot of different ideas
517560	518760	about what language is.
518760	521240	I'll tell you the right one in a bit.
521240	524200	But language requires to understand
524200	525280	the evolution of language.
525280	528000	We need some archaeology, linguistics, and field
528000	529880	research on contemporary languages,
529880	531600	semiotics.
531600	532760	That's where Peirce comes in.
532760	535600	Comparative biology, philosophy, cognitive science,
535600	539000	paleo-neuroscience, neuroscience, evolutionary theory,
539000	540040	and genetics.
540040	543560	So it is quite a daunting task for anyone
543560	548240	to even try to summarize the research that's going on there.
548240	550280	So we could ask the first question we might ask is,
550280	551000	what is language?
551000	554000	What is it that we think evolved?
554000	557000	And one view is that language is a grammar,
557000	560760	is a set of sentences described by a recursive grammar.
560800	565920	That's a very popular definition of it among linguists.
565920	567680	And or the other idea, and the one
567680	569600	I'm going to urge upon you this evening,
569600	573960	is that language is the transfer of information by symbols.
573960	578280	So there is no firm cutoff between humans and other species.
578280	580880	Humans are better at communication by language
580880	582480	than other species are, but it's not
582480	587960	something that is found exclusively in humans.
587960	590240	But I'll try to make that clear.
590280	591720	Who has language?
591720	593560	Well, everything communicates.
593560	598640	If you follow Purse's work, the entire universe is a sign.
598640	600480	Everything is communication.
600480	601440	Minerals communicate.
601440	603960	The trees right now will start communicating
603960	605680	with the environment the shorter days
605680	607600	and start to grow their leaves back.
607600	609560	So everything communicates.
609560	611000	But not everything has language.
611000	613640	Only humans really appear to have language.
613640	616880	And when we talk about other species,
616880	619960	we have to be very careful about what we say about them.
620000	622120	Relative to humans, to get this right.
622120	625520	So communication, again, is the transfer of information
625520	629800	by signs, which I'll make clearer as we go along.
629800	634400	And language is the transfer of information by symbols.
634400	639680	Symbols that are open-ended and created by people.
639680	641160	Well, they could be created by anybody,
641160	643880	but they just happen to be created by people.
643880	646240	And so there are three types of signs
646240	648440	that are very important to the story.
648440	650320	And two of those are found throughout nature.
650320	651640	Icons and indexes.
651640	653880	An icon is something that resembles something else.
653880	656000	There's some sort of correspondence,
656000	658280	you know, a reflection in the water,
658280	665960	or a certain kind of feeling that you get
665960	669720	that corresponds to a particular musical event.
669720	673400	An index is a sign that's connected physically
673400	674840	to what it represents.
674840	678240	So smoke is connected physically to fire.
678240	679520	That's an index of fire.
679520	683440	A footprint is an index of the creature that made it.
683440	686840	Symbols are signs that refer to objects
686840	690080	by convention, habit, or rule.
690080	691760	And to simplify things, I'm simply
691760	696200	going to say that symbols are conventional signs.
696200	699080	They are things that don't have to mean what they mean.
699080	701360	There's no necessary connection to what they mean.
701360	706520	So dog refers to a canine in English, perro in Spanish,
706520	708400	and cachorro in Portuguese.
708400	712560	Neopai in Pideha, these are just conventional things.
712560	716520	They're just physical forms that are conventional
716520	721120	to refer to meanings that are significant in that culture.
721120	723960	So the threshold to productive symbols
723960	727880	was likely fairly sudden, but the evolution of the platforms
727880	730480	for language and symbols took evolutionary time
730480	732560	and are not limited to Homo sapiens.
732560	734760	They don't just get a creature that one day stands up
734760	736320	and starts talking.
736360	739200	We expect to see a lot of correspondence
739200	744360	and a lot of continuity between our species and other species
744360	746640	when we look at communication.
746640	750760	So we find that birds have particular song
750760	753160	dialects, depending on the geographical area they're
753160	756800	found, even in the same species that dolphins communicate,
756800	761640	that chimpanzees and gorillas have fairly interesting
761640	763080	communication systems.
763080	766300	They're not human language, but they're also not totally
766300	768580	unlike human language.
768580	772260	One view is that the view that language is primarily
772260	777820	a former grammar came about in our species and Homo sapiens
777820	781300	about 100,000 to 200,000 years ago.
781300	784260	The alternative view, which I will talk about tonight,
784260	788260	is that language has existed for about 60,000 generations
788260	789540	or more than a million years.
790540	796700	So another thing to clarify is that speech is secondary.
796700	799380	The sounds that are coming out of my mouth
799380	802180	are just one way to express language.
802180	805220	It can be expressed by color-coded shapes.
805220	807020	It can be expressed by hand signals.
807020	811180	It can be expressed by mouth signals, by sounds.
811180	815100	And you don't need a lot of speech to have language.
815100	816460	After all, think of the computer.
816460	818820	How many speech sounds does a computer
818820	823060	have, individual things that it can recognize?
823060	825180	Well, it has two, one and zero.
825180	829100	And everything that can be said can be said with ones and zeros.
829100	833700	Computers have better memories, in some respects, than we do.
833700	837020	So they can remember and distinguish longer sequences.
837020	839780	So we tend to have more than just two symbols.
839780	842980	Actually, you could have just one symbol and have a language.
843020	848140	Because you could have ah means tree, and ah means by the tree,
848140	851820	and ah means over there by the tree, or something like that.
851820	852860	But that's hard to remember.
852860	855180	So those systems don't tend to do too well.
855180	858020	In fact, I don't know of any languages like that.
858020	859860	The smallest system that I'm aware of
859860	864260	is Pidaha, which has eight consonants if you're a man,
864260	867980	seven consonants if you're a woman, and three vowels.
867980	870900	And it also has two tones, which is something
870900	873260	when we talk about the evolution of speech,
873260	875460	we sometimes forget that there are tone languages
875460	878180	and that people can distinguish words by tones,
878180	879820	rather than just by consonants and vowels.
882500	884300	There's some evidence, some people,
884300	886780	to come to Fitch, for example, as a biologist at the University
886780	891540	of Vienna, thinks that early species of humans
891540	893100	had full speech capabilities.
893100	895700	In fact, he argues that non-human species
895700	898860	have full speech capabilities.
898860	901580	The answer is it doesn't really matter that much
901580	904260	because language is not about speech,
904260	909260	it is about symbols and transfer of information by symbols.
910900	913820	However, so if you talk about the components
913820	915900	of all languages, so every language in the world
915900	918820	has the three vowels, i, a, u.
918820	922100	And I tell you that Pidaha only has three vowels.
922100	924300	If you're a linguist, you can guess that those vowels
924300	927460	are i, a, u, because every language has those vowels.
927460	930100	Those are called the quantal vowels.
930100	931900	They're just the easiest to hear.
933260	934660	In fact, they're so important that,
934660	938180	according to Phil Lieberman, who's son Daniel,
938180	942420	I believe, teaches here, has argued
942420	946020	that the entire evolution of the tongue in the human mouth
946020	948260	is to be able to produce those vowels.
948260	950740	They're that important and they help distinguish
950740	952140	the speech of all languages.
954700	956060	Did they come later?
957060	958980	Well, according to Fitch and others,
958980	961380	they didn't come later, but according to work
961380	966380	by Jeffrey Leitman and Phil Lieberman,
966660	968540	but especially Jeffrey Leitman's work,
969780	973260	there is a rapid evolution in the vocal apparatus
973260	975540	starting about the time of Homo erectus,
975540	980540	which would be explained if that's when language started.
980580	985100	They would need better speech to communicate with language,
985140	989180	although you don't have to make clear sounds to have language.
989180	993340	You can have garbled speech and it's still language.
993340	995500	It's like getting a Model T Ford.
995500	996820	Is that a car?
996820	997660	Yes, it is.
997660	999300	It's not a Ferrari, but it's a Model T.
999300	1001020	So we didn't start off necessarily
1001020	1003180	with the full capabilities that we have today,
1003180	1006980	but we had enough speech to get by.
1006980	1008780	There are a lot of external conditions
1008780	1011820	on human speech evolution.
1011820	1016460	So work by Damian Blasey and Sean Rogers and Caleb Everett,
1016460	1020580	who not coincidentally shares my name,
1020580	1023460	all argue for exocentric factors
1023460	1026180	affecting the evolution of speech.
1026180	1028460	Anyway, our hero is Homo erectus.
1028460	1031420	I'm sure that he or she looked just like this.
1031420	1036420	I was very, I'm always intrigued to discover new findings
1036940	1039260	in the literature about the accomplishments
1039260	1041780	of Homo erectus because we tend
1041780	1043740	to really downgrade Homo erectus.
1043740	1045100	You know, if you remember, if you're old enough
1045100	1049780	to remember the American comedian Rodney Dangerfield,
1049780	1052980	you know his line is, I don't get no respect.
1052980	1055740	That's how I feel about Homo erectus at times.
1057700	1059900	Everybody's impressed with the latest artwork
1059900	1062700	from Neanderthals or Sapiens,
1062700	1065740	but erectus is really where it all started.
1065780	1070540	And in fact, in recent study published,
1071940	1074940	there's been some news about it in the last couple of days,
1074940	1077140	it was discovered that Homo sapiens,
1077140	1082140	modern Homo sapiens in Africa have DNA evidence
1082380	1087380	that shows that they interbred with a Homo species
1087500	1091700	that existed prior to the split of Neanderthals and Sapiens.
1091700	1093100	Well, that's Homo erectus.
1094100	1097540	They didn't mate with chimpanzees and gorillas,
1097540	1100500	as far as we know, they had to see a certain amount
1100500	1104140	of similarity between themselves and erectus,
1104140	1107820	almost certainly, and there would have done that.
1108820	1112340	Homo sapiens and erectus co-existed for many years together.
1112340	1116180	In fact, Homo erectus is the most successful species
1116180	1118340	in the history of our genus Homo.
1118340	1120940	So they existed from 1.8 million years ago
1120980	1123020	to about 140,000 years ago,
1123020	1125220	some would say even more recently.
1125220	1126940	They're far more successful than we are,
1126940	1130500	they existed well over a million years longer
1130500	1132780	than Homo sapiens has existed.
1132780	1135500	Their height was between 5'8 and 5'11,
1136500	1138740	so they weren't little Australopithecines,
1138740	1142300	they were big guys, they had big bones,
1142300	1145220	they could have pretty much taken
1145220	1147940	on any Homo sapiens walking around.
1147940	1150300	They were wide-ranging polymorphic species,
1150300	1152700	they had a lot of variation in skull size
1152700	1155060	and in physical strength,
1156540	1160420	and they arguably did possess a modern vocal apparatus,
1160420	1162220	from what we can tell from the,
1163380	1165780	it's very difficult to find the small little bones
1165780	1168020	that define a modern vocal apparatus,
1168020	1169820	but in recent work there has been discoveries
1169820	1171980	of what appear to be hyoid bones
1171980	1173780	that belong to Homo erectus,
1173780	1176500	which would have meant that they had
1176500	1178940	fairly modern speech capabilities.
1178940	1180660	They were ocean travelers,
1182540	1184980	magnificent tool makers,
1184980	1188380	they invented fire, they started communities.
1188380	1190060	Much of what we take for granted
1190060	1192860	as human accomplishments are human accomplishments,
1192860	1195500	they're just from a non-sapien species of human.
1197220	1199780	So there are gradualist versus saltationist views
1199780	1202340	of language origin, so did language come about gradually
1202340	1204380	or just pop into being?
1204380	1206300	I think it came about gradually,
1206300	1207700	just to set the groundwork.
1209300	1212460	Is language uniquely human or non-unique human set
1212460	1215020	of abilities shared with other animals?
1216260	1220620	Descartes, who was very good mathematician,
1220620	1223020	but an extremely poor philosopher,
1224340	1227260	Charles Sanders Purse in fact has all sorts of sections
1227260	1230660	about why Descartes was a bumbling idiot,
1230660	1234260	but of course Charles thought that about many people,
1234260	1238780	but he severely attacks all of Cartesian philosophy,
1238780	1242180	but one of the interesting distinctions of course
1242180	1245860	is that Descartes felt that only humans had cognition
1245860	1248540	and that other animals were basically meat machines.
1248540	1251980	They were just, you didn't need to be kind to animals
1251980	1254140	or worry about them because they had no consciousness,
1254140	1257660	they had no brains, they had brains but no minds
1257660	1261700	because dualism comes from Descartes in modern times.
1262580	1264260	So there's a very different view from Descartes.
1264260	1266500	This is the view that we are just continuous
1266540	1269220	in nature, humans are just animals like others,
1269220	1270980	shouldn't be a shock for people these days,
1270980	1273140	although it is a shock for many linguists
1273140	1274420	to think in those terms.
1275780	1276980	So the evolution of the brain,
1276980	1281940	how big was Homo erectus' brain and what does it matter?
1281940	1285980	Their average brain size was about 950 cc's
1285980	1290900	whereas Neanderthals brain was about 1,400 cc's
1290900	1295900	and a modern human's brain is about 1,250 to 1,300 cc's
1296660	1300060	although many modern European females
1300060	1304780	have brains in the size range of Homo erectus,
1304780	1309780	about 950 cc's and as people who study the brain
1310100	1314700	have come to realize size doesn't matter so much.
1315700	1318820	But you can find, you can see the ranges here,
1318820	1322100	the circle is where we find most of the Homo erectus'
1322100	1324820	brain sizes but you also find some sapiens in there
1324820	1327340	and Neanderthals and as you go out towards
1327340	1330340	the upper edges of the chart you do start to get
1330340	1333860	into fairly sapiens exclusive territory
1333860	1337140	but just remembering that we don't fully understand
1337140	1339060	the brain that's putting it mildly
1339060	1342460	and so the main thing that matters
1342460	1343820	is the organization of the brain
1343820	1346300	and that's extremely difficult to tell with fossils
1346300	1348300	how their brains were organized.
1348300	1351820	So human ancestry is represented in this chart
1351820	1356580	with erectus at the bottom, maybe Floresiensis
1356580	1359740	who was from the islands of Flores,
1359740	1362540	this sometimes called the hobbit little creature
1362540	1366100	who was over there, according to some linguists
1366100	1367980	there are still stories about them told
1367980	1371100	by the indigenous peoples, I don't think that's probably
1371100	1373500	right but they do have stories about little creatures
1373500	1375540	running around through the jungles.
1375540	1380540	But from erectus came all the other creatures
1381020	1385100	that are related to us, all the other 20 or so species
1385100	1388940	of Homo but erectus was the first.
1388940	1391500	Now where does Charles Sanders' purse come in?
1393060	1395540	He was by the way banned from Harvard
1395540	1397620	so it's really interesting that his papers
1397620	1399300	are here at Harvard then one has to come here
1399300	1403860	to study purse because Charles Elliot
1403860	1406140	who was president at the time didn't want him on campus
