start	end	text
1406140	1411140	because he was seen coming out of a hotel
1411540	1414220	with a woman who wasn't his wife so he lost his job
1414220	1418860	at Johns Hopkins University and that was the only job
1418860	1420700	he ever had in academics and he was banned
1420700	1422620	from the Harvard campus even though his brother
1422620	1424820	was the dean of mathematics and his father
1424820	1427740	had been professor of mathematics for 50 years here anyway.
1428820	1431900	So he was the one who invented for the very first time,
1431900	1434980	first and second order logic.
1434980	1437740	That's credit is often given to Gottlieb Frege
1437740	1441460	but in fact, purse had it worked out in some ways
1441460	1444460	before Frege and independently about the same time.
1444460	1448660	He invented semiotics, the theory of science before Sosir.
1448660	1451460	He invented pragmatism from William James.
1451460	1453220	There's actually an interesting correspondence
1453220	1455040	between purse and James.
1455040	1457340	Purse was a member of the National Academy of Sciences
1457340	1460660	and he was explaining to James why he could not nominate him
1460660	1462740	for membership in the National Academy of Sciences
1462740	1464660	because most scientists took James.
1464660	1466540	He said, we consider you a literary man,
1466540	1467980	not a real scientist.
1470140	1474100	But James got famous for the idea of pragmatism
1474100	1476140	although the idea comes from purse.
1476140	1477460	At the time that he was alive,
1477460	1479980	he was considered America's greatest mathematician.
1479980	1482820	The German mathematician Ernest Schroeder wrote him
1482820	1486280	and said that your genius and your reputation
1486280	1489620	shall shine like the sun for eons into the future
1489620	1494260	which clearly was wrong but he was a brilliant
1494340	1495180	mathematician.
1495180	1497820	He made fundamental discoveries in mathematics.
1497820	1502300	He was the first person to link the absolute length
1502300	1504980	of a meter to a wavelength of light for measurements.
1504980	1508100	He took over 20 different places in the globe.
1508100	1512660	His only book he ever wrote was on the physical properties
1512660	1517660	of light, photometric researches and he's the first person
1518020	1520220	to notice that the Milky Way rotated,
1520220	1522420	all sorts of things he did in his spare time.
1522860	1527380	And as I will argue in the biography about purse,
1527380	1529260	he was the inventor of cognitive science
1529260	1532620	as we know it, sort of as we know it today.
1532620	1536420	Anyway, this is purse as a young man here.
1536420	1538900	He was an interesting guy.
1538900	1541420	I'm gonna skip this and go on to culture
1541420	1544580	because culture really is the important thing here.
1544580	1546540	You can't have a language unless you have a culture
1546540	1549100	and you can't have a culture unless you have a language.
1549100	1552180	They're symbiotically related.
1552180	1555960	Each determines or constrains and leads to the conditions
1555960	1557340	to develop the other.
1557340	1560420	So in my definition, culture is an abstract network,
1560420	1562820	shaping and connecting social roles,
1562820	1565260	hierarchically structured knowledge domains
1565260	1566900	and ranked values.
1566900	1569420	So ranked values are very important to culture.
1569420	1570900	So it's not enough to know that people
1570900	1571740	have the same values.
1571740	1573660	So for example, if you're French,
1573660	1576260	you might think that good food is very important
1576260	1579580	and that being in good shape is also very important.
1579580	1582460	And if you're from, say, Houston, Texas,
1582460	1584380	you may believe the same things.
1584380	1587460	But if you think that good food is more important
1587460	1589780	than being in shape, you'll look one way.
1589780	1592300	And if you think that being in shape is more important
1592300	1594780	than good food, you'll look another way.
1594780	1598860	So the value rankings are as important or more important
1598860	1601140	than the actual values themselves.
1601140	1602740	Culture is always shifting.
1602740	1610380	So universal grammar is a very popular term.
1610380	1613740	It was made popular in modern times by Noam Chomsky.
1613740	1616660	Although the term goes back to the 12th century,
1616660	1618580	grammarians known as the modesty.
1618580	1621820	And in the US, the first person to ever talk about universal
1621820	1625380	grammar was Charles Sanders Purse.
1625380	1630780	His view of grammar was both he and Chomsky, interestingly
1630780	1635020	enough, felt that recursion, I can
1635020	1636780	talk about recursion separately, but anyway, they thought
1636780	1640020	that recursion was the basis of grammar.
1640020	1644060	But for Purse, it was meaning, recursive meanings, not forms,
1644060	1645140	not the sentences.
1645140	1648660	But the way that, so for example, if I say bachelor,
1648660	1653100	I have to interpret that in terms of, say, unmarried man.
1653100	1655780	And I interpret unmarried in terms of other symbols.
1655780	1658260	And I interpret man in terms of other symbols
1658260	1662020	so that every symbol starts us to a recursive chain that
1662020	1664340	has no end.
1664340	1665380	Everything is connected.
1665380	1667940	And to understand one thing, we have to understand a great
1667940	1668980	deal of culture.
1671420	1676060	So the difference is for Purse universal grammar followed
1676060	1678180	from logical principles.
1678180	1681660	There was nothing necessarily genetic about it.
1681660	1683740	It simply followed from logical principles.
1683740	1686620	If you had symbols, they were subject to certain logical
1686620	1689140	constraints, and those would affect the form of the
1689140	1691540	language.
1691540	1695060	Whereas the second version of universal grammar, Chomsky's
1695060	1700220	is that not only is human biology responsible for
1700220	1704620	underwriting human linguistic capacity, but the genes are,
1704620	1706580	there are specific genes linked to language.
1709260	1712860	So those are very different views of universal grammar.
1712860	1715260	So now let's move on to tools.
1715300	1718260	Tools turn out to be a very important part of reasoning
1718260	1721460	about the origins of human language.
1721460	1725420	Tools are individual devices or processes that meet perceived
1725420	1728900	needs of individuals and communities, or a set of
1728900	1731780	devices, processes, and expertise used to harness the
1731780	1734460	properties of a particular material.
1734460	1737540	Full culturally constructed repertoire of knowledge,
1737540	1739940	conventions, devices, and processes.
1739940	1741900	Values are vital at each stage.
1741900	1744540	So tools are really complicated.
1744540	1746740	This is clearly a complicated tool.
1746740	1747980	But so is a shovel.
1747980	1753980	A shovel has a specific kind of function, and if you make a
1753980	1757820	shovel out of rubber, it won't work very well.
1757820	1761300	So there's a whole lot of things that have to go into a tool
1761300	1765340	as simple as a shovel or a knife to make it be what it is.
1765340	1769100	And it starts to take on meaning features that go
1769100	1771060	beyond its function.
1771100	1774820	Human technology enmeshes the material with the ideational.
1774820	1780540	We have ideas, and they're manifested materially.
1780540	1783900	Tools involve social constructivism.
1783900	1786900	Tools become symbols as they emerge from the values,
1786900	1789060	knowledge, structures, and social roles of a particular
1789060	1790140	culture.
1790140	1793380	Symbolism in erectus tools is therefore crucial evidence.
1793380	1796620	So that's one thing we really need to look for in addition
1796620	1799300	to the other accomplishments of erectus.
1799300	1802540	Now, it's true that other species have tools.
1802540	1807460	But other species' tools tend to be opportunistic.
1807460	1809500	And one of the interesting things, for example, about
1809500	1812060	erectus is that they took very good care of their tools.
1812060	1813020	They colored their tools.
1813020	1815660	They carried their tools with them over long distances.
1815660	1817500	They planned ahead.
1817500	1820420	No other species is known to do that.
1820420	1823620	Although it's a good Darwinian, I wouldn't want to say that
1823620	1825740	no other species could, you know, I wouldn't want to
1825740	1827300	predict what no other species could do.
1827300	1829540	Because every time somebody tries to do that, we find
1829540	1831820	that they can.
1831820	1834140	Learning of technical skills takes place using a
1834140	1836660	combination of language, gesture, imitation, and
1836660	1837660	guided intervention.
1837660	1840220	This applies to all erectus, neanderthal, ensus, and
1840220	1841500	sapiens tools.
1841500	1844100	And we'll be getting to that.
1844100	1846980	This is partially based on lab experiments with stone tool
1846980	1847540	users.
1847540	1851020	And my experience in the Amazon, I see this too.
1851020	1855420	So at the many archaeology departments, they have
1855420	1861740	napping labs, K, N, A, P, P, not N, A, P. And they learn to
1861740	1862420	make stone tools.
1862420	1864020	Graduate students learn to make stone tools.
1864020	1865540	And they bruise their hands.
1865540	1866340	They cut their hands.
1866340	1867700	It's really hard.
1867700	1870420	So the simplest form of stone tool is like the older one
1870420	1873260	tools, which we'll see a picture of.
1873260	1875900	Those take a couple of hundred hours very often for
1875900	1879780	students, PhD students, to learn to make accurately.
1879780	1883980	When we get into the more complex tools, it takes a
1883980	1884740	lot longer.
1884740	1888060	And what people have found in these labs is that even the
1888060	1892100	simplest tools, it's very hard to simply show by example how
1892100	1892940	to do it.
1892940	1898580	Language tends to be implicated in this skill
1898580	1899220	acquisition.
1899220	1901380	Now, this could simply be because they're sapiens, right?
1901380	1902180	And sapiens talk.
1902180	1905860	So why not avail yourself of the speech that you have?
1905860	1911500	In the Amazon, I have watched many men teach their sons
1911540	1915180	how to make tools like blowguns and bows and arrows.
1915180	1917940	And a lot of the time is in silence.
1917940	1921340	But then you'll often hear a question and an answer about
1921340	1924140	something that was very difficult to see or a movement
1924140	1926020	that was very quick.
1926020	1932060	So tools take explanation in many cases.
1932060	1935860	So once again, on a sign, a sign refers to an object.
1936260	1941580	So if I have a sign, if I say water, that's the object.
1941580	1944540	And the representation is W-A-T-E-R.
1944540	1946700	And the interpretation that you're going to make is
1946700	1949700	something to drink.
1949700	1953740	So icons, their physical resemblance, correspondence,
1953740	1956540	they don't tend to have much intentionality about them.
1956540	1959660	A reflection in the water is there, whether you intended
1959660	1961500	it to be there or not.
1961500	1964260	But they can last after a reflection.
1964300	1967420	But they can last after someone's not there.
1967420	1973340	So the smell of a footprint can last for quite a while.
1973340	1976820	All animals are able to interpret indexes.
1976820	1978980	In fact, when we talk about animals'
1978980	1982660	interpretation abilities, almost all the time in the
1982660	1985180	experiments when they're talking about animals' learning
1985180	1987660	symbols, in the Persian sense, they're not learning symbols.
1987660	1991740	They're learning indexes and icons, which are very
1991740	1993820	different levels of cognitive
1993820	1997580	accomplishment from symbols.
1997580	1999620	And so symbols are the final ones.
1999620	2001460	And these are the properties that are important for us.
2001460	2002780	No symbols, no language.
2002780	2004420	They involve displacement.
2004420	2006660	The thing that we're talking about doesn't actually have
2006660	2007740	to be there.
2007740	2010180	I can say water and hold this up, or I can say water
2010180	2010820	without it there.
2010820	2012460	And you still know what I'm talking about, that the
2012460	2015460	object doesn't actually have to be there.
2015460	2016900	Indexes last a long time.
2016900	2020140	These footprints are about 3.7 million years old, found by
2020140	2024820	Mary Leakey in, they're called the Laetoli footprints.
2024820	2027820	And if you follow them out, you can see that it's a large
2027820	2031660	Australopithesis probably, Australopithecus walking with
2031660	2033780	a small one, and they walk, and they turn and look at
2033780	2035980	something, and then they walk on.
2035980	2039620	And it rained after they had walked by, and this is volcanic
2039620	2041820	ash that hardened like concrete and left their
2041820	2043620	footprints there.
2043620	2046460	This is Australopithecus africanus.
2046460	2049420	And as far as we can tell, they're the first creature to
2049420	2051620	ever preserve an icon.
2051620	2056980	So they're starting to look at things and contemplate, I
2056980	2058460	don't think that's too strong a word,
2058460	2059740	contemplate the similarities.
2059740	2063740	So this stone, which is about 3 million years old, is called
2063740	2065140	the Makapansgat pebble.
2065140	2068860	It was found in a cave in South Africa, and it's unlike
2068860	2073780	the material that the other stones in the cave were from.
2073780	2079180	And if you look at it, it has an interesting characteristic.
2079180	2081900	It looks like a smiley face.
2081900	2085740	And this thing is about 3 inches by 2 inches, so it's too
2085740	2088780	big to have gotten caught between their toes and carried
2088780	2090900	up there coincidentally.
2090900	2093540	This seems to be something that Australopithecus and
2093540	2096420	Australopithecus found interesting and carried up to
2096420	2101140	the cave with no particular functional role other than it
2101140	2104100	looked like a face.
2104100	2107300	Australopithecines also made tools.
2107340	2111540	They're tools about 3.3 million years old, found in
2111540	2112300	different places.
2112300	2117340	They're the Oldowan tools discovered initially by the
2117340	2120220	Leakey family.
2120220	2122740	Icons are all over the place.
2122740	2126180	In addition to seeing icons in nature, we have them in
2126180	2128420	churches, and here are tools that have been actually made
2128420	2133300	into icons and symbols, both.
2133300	2136420	And from symbols to grammar, so how complex does a
2136420	2137300	grammar have to be?
2137300	2140340	Everybody will agree, every linguist will agree that you
2140340	2144900	can't have a language until you have a grammar.
2144900	2147220	But how complex does the grammar have to be?
2147220	2149700	Well, there are a couple of different possibilities.
2149700	2153500	And one of the points that I make in the book is that we
2153500	2155860	find all of these in the world today.
2155860	2160060	So one we could call a G1 grammar, which is just words
2160060	2162220	put in a linear order.
2162260	2166940	And that seems to be the case, for example, in Peta Ha and
2166940	2171100	Riau, which is a language of New Guinea, which is
2171100	2173060	John Saul Mary.
2173060	2175100	So there's no other structure, let's say, in a
2175100	2175820	language like this.
2175820	2180140	There's just those three words, John Saul Mary.
2180140	2185500	A G2 grammar would be like a G1 grammar, but have additional
2185500	2187620	hierarchy or structure into the phrases.
2187620	2194140	So the man you saw yesterday is here, where you saw
2194140	2200180	yesterday as a sentence hierarchically located inside
2200180	2204940	a larger sentence, or you could simply say the very big
2204940	2207220	ball rolled down the hill.
2207220	2208860	There you start to get more structure.
2208860	2211660	It's not simply linear order of words.
2211660	2214980	A G3 grammar has both recursion and hierarchy.
2214980	2216300	So what is recursion?
2216300	2219260	It's the ability to put one thing inside another of the
2219260	2221020	same type and just keep doing it.
2221020	2228340	So the man who is here said that Bill said that Mary said
2228340	2232180	that Peter said that John bought a house.
2232180	2234180	When you start to get structures like that so that
2234180	2237340	you can say there's no longer a sentence in a language, then
2237340	2239140	recursion is the best way to handle that.
2239140	2242180	And recursion is communicatively very useful.
2242180	2244260	You can pack a lot more information in a
2244260	2247340	sentence with recursion.
2247340	2250740	But I've argued that although recursion can be found in any
2250740	2253980	language, it's not a necessary component of all languages.
2253980	2256140	And in fact, there are good reasons why some
2256140	2257500	languages would avoid it.
2259940	2261820	So erectus had icons.
2261820	2263500	We know that they carry things around.
2263500	2266940	They didn't carry around smiley faces that we know of, but
2266940	2271300	they did carry around phallic symbols like this cuttlefish
2271300	2277620	bone that was found in Morocco about 450,000 years ago.
2277620	2282980	And erectus also started making quite complex tools.
2282980	2287460	So there are three grades of tools in the paleolithic,
2287460	2289460	especially in the lower paleolithic.
2289460	2291940	There are oldivon tools about 3 million years ago.
2291940	2296020	There are achulian tools made as recently as 200,000 years
2296020	2296820	ago.
2296820	2299980	And then finally, there are levelwa tools, which are the
2299980	2304060	most complex tools found in the paleolithic.
2304060	2307180	So these are refined, which means they've been thinned.
2307180	2312140	These take quite a bit of effort and skill to function.
2312140	2314700	And they have various parts to them.
2314700	2317580	You don't just start off banging two rocks together to
2317580	2318260	get one of those.
2318260	2319780	You have to have a plan.
2319780	2322620	There are certain things that have to be cut out of the tool.
2322620	2327100	It has to have a certain shape to be functional.
2327100	2329220	So when erectus started working on tools, they might
2329260	2330700	start with a large piece of rock.
2330700	2333900	And out of that, they had to break out the pieces that
2333900	2337220	they needed to get the kind of functional tool.
2337220	2342780	And they make them all pretty much the same to work for them.
2342780	2345140	Erectus was the first to come up with a controlled use of
2345140	2346140	fire.
2346140	2349540	The pre-shaping of stone tools, working them before they
2349540	2352980	actually started chiseling out the tools, they used wood and
2352980	2354580	bone tools as well.
2354580	2357180	And we think they might have also used hafted tools.
2357180	2359820	And hafted tools are quite important because that's when
2359820	2363140	you tie a handle on that shows a lot of functional
2363140	2364500	improvement over others.
2364500	2368020	And it shows a lot of foresight and planning.
2368020	2375620	So these tools had a great deal of complexity over
2375620	2377420	hundreds of thousands of years.
2377420	2383340	And in recent research in modern-day Ghana, Larry
2383340	2387500	Barham has discovered about 900,000-year-old tools that
2387500	2390820	seem to have been dyed with ochre.
2390820	2394340	That's a significant finding because dyeing tools shows
2394340	2399380	that that's not simply a functional aspect of toolmaking.
2399380	2404340	That is an aspect of toolmaking that shows thought
2404340	2407140	that goes above the mere function of the tool.
2407140	2410780	Hafting tools, combinatorial thinking, imagining the
2410780	2414660	future, and likely invented by erectus.
2414660	2416620	It's one of the most significant technological
2416620	2420220	breakthroughs in human toolmaking.
2420220	2423340	And ochre is also very important.
2423340	2426420	And we see things like hand axes.
2426420	2429980	They had a tool kit, not nearly as extensive as an
2429980	2433260	Neanderthal tool kit or as a Homo sapiens tool kit, but as
2433260	2435820	an extensive tool kit.
2435820	2437700	They had hand axes and cleavers.
2437700	2439540	They had picks.
2439580	2441180	And so we see different stages.
2441180	2443980	We should recall the simple stage of Oldowan tools that we
2443980	2447860	saw that Australopithecus had.
2447860	2449500	We see achulian tools.
2449500	2452060	These are already starting to get refined and showing a lot
2452060	2453340	more work.
2453340	2457860	And then we get to the Cadillac of the tools of
2457860	2461420	erectus-level-wa tools.
2461420	2464220	Not everyone agrees that erectus-made-level-wa tools.
2464900	2471900	Some are dated as early as 625,000 BC.
2471900	2473900	But not everyone agrees with those dates.
2473900	2478980	The dates that do have the widest agreement are about
2478980	2482740	300,000 years ago.
2482740	2484900	That would mean that they could have been used by
2484900	2487420	Neanderthals or sapiens or erectus.
2487420	2490740	So it's difficult to limit them exclusively to erectus.
2490740	2493820	However, a million years ago, we see larger tools that are
2493860	2497300	made with the same way that level-wa tools are made.
2497300	2503220	Level-wa tools require a lot of hammer work before the
2503220	2506900	final stage, which is lifting the core out of the larger
2506900	2507780	tool.
2507780	2511700	And that takes a lot of planning, a lot of discussion,
2511700	2514020	or a lot of skill.
2514020	2518860	And many of the people who study the tools, a fairly wide
2518860	2522980	consensus, is that level-wa tools can't be learned by
2522980	2524020	imitation alone.
2524020	2527620	There has to be linguistic instruction when we get to
2527620	2529740	this level of tool complexity.
2529740	2534620	And these tools were, in fact, found as early as a million
2534620	2538380	years ago tools that were made by the same process.
2538380	2540820	Not everyone would call them by the same name, but they
2540820	2542940	were made by the same process.
2542940	2545460	So every tool that was made had to have various
2545460	2546540	functional features.
2546540	2551020	So if we find tools that have nothing but functional
2551020	2555220	features, it's difficult to see anything symbolic in that.
2555220	2558820	We can say of any tool that it's an index of the task to
2558820	2562100	be performed, it's an icon of other tools.
2562100	2564580	You have one tool as a model to make another tool.
2564580	2571300	So it does represent a growth in signification.
2571300	2573420	But to get to the level of symbols, we need to see
2573420	2576500	things that aren't simply part of the function.
2576500	2580020	And we start to see some of this at the end of the
2580020	2580980	Acheulean age.
2580980	2586020	We see tools that are made a little bit more elaborately
2586020	2587140	than they need to be made.
2587140	2590940	They're painted, they're dyed.
2590940	2593940	And in fact, when Larry and I were working on some tools
2593940	2599180	that he had just brought back from Africa this past summer,
2599180	2603500	another expert on erectus tools walked into his lab at
2603500	2607020	Liverpool and said, oh, those are from East Africa.
2607020	2612620	Because apparently East African and West African erectus
2612620	2615540	designed their tools in different ways.
2615540	2618540	So the design of the tools was representative of the group
2618540	2619900	that they came from.
2619900	2623940	They indicated robustness.
2623940	2626540	One of the earliest ideas when they started to find these
2626540	2630300	non-functional aspects of erectus tools was that it was
2630300	2633660	men showing off for women, making the tools to show that
2633660	2634740	they were better tool makers.
2634740	2636580	But of course, we have no idea whether it was men who made
2636580	2638660	the tools or women who made the tools.
2638660	2639500	So we don't know.
2639500	2641380	There was somebody who was probably showing off, but we
2641380	2642940	don't know who was showing off.
2642940	2646860	But then we find really interesting things about
2646860	2651460	erectus that are difficult to explain.
2651460	2656620	And we find that, so this shell is 750,000 years old.
2656620	2660140	And the markings on this shell were done in Java by a
2660140	2665380	homo erectus using a shark tooth on this large shell.
2665380	2668020	And the marks were made without ever picking up the shark
2668020	2672340	tooth, their constant continuous representation.
2672340	2674740	And we start to see a lot of this kind of thing with
2674740	2679100	erectus, this kind of attempt to represent things such as
2679100	2679980	this rock.
2679980	2683580	We find these geometric shapes that erectus is starting to
2683580	2687340	carve into shells and into tools so that we realize that
2687340	2690900	erectus is starting to see things beyond their mere
2690900	2692260	functionality.
2692300	2697860	And then about 250,000 years ago, we find this Venus of
2697860	2701980	Barakat Ram, which is in the Israel Museum in Jerusalem,
2701980	2708500	which has got red ochre on it, partially formed by humans,
2708500	2710940	partially formed by nature.
2710940	2714460	But it's the first real artwork that we know about.
2714460	2716300	There are others about the same time.
2716300	2719460	And it does seem to have been made by erectus.
2719460	2724220	So erectus tools, they have symbolic and social components.
