start	end	text
1201300	1205380	Here's the API, here's the docs, and it presents it in a nice format, so it's a kind of combination
1205380	1211780	of documentation as well as a nice on-the-eye presentation.
1211780	1215020	There's also another example is Exa.
1215020	1216980	It was just a simple LS replacement.
1216980	1217980	It's a tool.
1217980	1219700	It tells you how you install it here.
1219700	1220700	That's where it is.
1220700	1223740	But hey, it tells you what it does.
1223740	1224740	It's short.
1224740	1225740	It's simple.
1225740	1226740	It's to the point.
1226740	1227740	It looks nice.
1227740	1233420	Now, choosing what fits best for your code kind of depends on what you're doing, right?
1233420	1238340	Like you don't necessarily know if a technical post would be the right one or whatever.
1238340	1241300	It all comes down to what you think is the best thing, and that is at the end of the
1241300	1243020	day the important part.
1243020	1245900	Choose what fits best for you.
1245900	1247740	So Ferris has gone through all this.
1247740	1248740	They've done it.
1248740	1249740	It's pushthecreates.io.
1249740	1250740	Actually, it is.
1250740	1254460	You can actually go check it out right now if you wanted to.
1254460	1255460	It's great.
1255460	1257260	It's all done.
1257260	1260900	Before I close out, I did want to talk about one tool that I think is the most important
1260900	1267740	tool that will help you in pretty much everything with shipping and create, and that's empathy.
1267740	1272540	Being able to look at the code and what you have as if you were someone else, would you
1272540	1274180	like the documentation?
1274180	1277380	Would you like the API as it stands?
1277380	1279780	Would you feel safe and welcoming while you're here?
1279780	1283620	All of these things can be done if you peer through your project as if you were someone
1283620	1284620	else.
1284620	1289260	If the answer to some of those questions is no, then you can go through and fix them.
1289260	1293020	And empathy, I think, will be the easiest thing in order to figure out, hey, what do
1293020	1294020	I need to change?
1294020	1296940	What should I change about my stuff?
1296940	1299660	Because your create is a lot more than just the code.
1299660	1300660	It's all the metadata.
1300660	1301660	It's all the interactions.
1301660	1303500	It's all the social things.
1303500	1308100	Coding is a social thing, and so if you have all that stuff that makes it easier for other
1308100	1311780	people, your code will be successful.
1311780	1312780	So thank you.
1313220	1315220	That was everything I have for today.
1315220	1317220	So, all right.
