start	end	text
1552720	1559280	colorblind until they're adults. So a friend of ours didn't discover he was colorblind until he was
1559280	1563600	a doctor and they complained that he was feeling the form was wrong. And that's because he didn't
1563600	1571040	realize they were different colors for different things. And perhaps the most famous example of
1571040	1576240	this is the dress. Yes. Where suddenly people wear that some were seeing it this way and other
1576240	1582000	people were seeing it the other way. Yeah, the blue and black and white and gold. Yeah. And it
1582000	1587600	turned out blue and black because they then went to Photoshop, right clicked on it, checked exactly
1587600	1592320	what color was in the dress is actually blue and black. When I told some of my friends that
1592320	1596800	they still they still think I'm lying to them. And this is not a story. And yet,
1596800	1603680	you know that we perceived it differently. One theory is I'm sure you know this is to do with,
1604720	1613520	of course, our perception of color is very depends on what we think is illuminating the scene.
1615680	1619680	And one theory about the dress is if you think it's being illuminated in daylight,
1619680	1623280	it looks one color if you think it's being illuminated in artificial light, it's another color.
1623920	1630640	So I mean, and again, this is an example. That's nice for me because of course, that's the prior.
1630640	1634640	Your prior is what you think it's been illuminating in which you have to take into account to
1636000	1640640	actually work out what the colors really are. Basically like the checkerboard illusion where
1640640	1645040	you see the shadow and the two grays. Oh, yes. And they look completely different. Yeah,
1645040	1649440	I think we think the different color. And it's not people tend to think that we're lying to them
1649440	1653680	when you show them that this is actually the same color. You have to legitimately prove it.
1657120	1661200	What did you think about a fixed firm belief? Because that's obviously what some of us have
1661200	1665600	and there's this cognitive dissonance when you show them that our perceptions are not really
1666560	1671920	always that accurate. Well, that's it. I mean, I would follow Carl
1671920	1680080	Friston here and say there's a sort of hierarchy. And at the bottom of the hierarchy, you have what
1680080	1688240	is the real color of this square. And you have priors and about what is being illuminated and
1688240	1692160	you could be persuaded that actually it's a different kind of illumination. But at the
1692160	1699360	top of the hierarchy, you have belief like perception is accurate. And that's very,
1699360	1705040	that could be very firmly fixed. And in the sense in schizophrenia, I think you have
1707200	1713280	something eventually goes wrong at the top. So the idea that everybody is trying to deceive me
1713280	1718560	because this high level prior that cannot really be changed. And it's very difficult to come up
1718560	1723040	with evidence against that idea that everybody is trying to deceive you, because of course,
1723040	1728880	you're one of the people who's trying to deceive them anyway. And it's funny because in those
1728880	1734080	schizophrenic patients, some of the psychotic patients, these optical, these perceptual illusions
1734080	1739920	don't work on them. Yes, that's right. Which shows that their priors have changed.
1743520	1749440	But that's very confusing. And I think that's more research is needed, as they say, because
1750160	1754720	in some cases, their priors are too strong. In other cases, their priors are too weak.
1755280	1760720	So there has to be some solution to this observation has to be made.
1761600	1766640	So Chris, tell me, what do you think then about because part of when I worked, I mean,
1766640	1770960	we did the philosophy and ethics of mental health, you see how we've had three biological sort of
1770960	1776080	revolutions in psychiatry, for example, when Prozac was invented. I mean, that was one of them.
1776080	1783440	People went crazy. This was the new craze. And it's functional MRIs, better neuroimaging.
1784320	1791200	When is psychiatry going to actually get a hold of you that they really want to do?
1792000	1796480	Is this going to happen in your opinion? Or do you think we're going to continuously fail at this?
1796480	1804560	Because I guess like what I was saying earlier, I think, for example, there's these very rare,
1804560	1809760	I can't remember what is it, 1% of people who get a diagnosis of schizophrenia actually have an
1809760	1818640	autoimmune disease. Okay, I didn't know that. There's a book. Someday there's a journalist who
1818640	1827760	this happened to. And she describes it very well. And I think what will happen is that there are
1827760	1836480	multiple causes of schizophrenia and psychosis. And they will gradually be discovered. But not all
1836480	1841600	of them. I was a bit like in the olden days, I think there used to be something called mental
1841600	1852320	deficiency. And currently, you know, every week, another 1% is explained by some unique genetic
1853600	1861840	alteration, which is gradually explaining all these things. And I think something analogous
1861840	1867360	might happen with schizophrenia, though, they'll be found, you know, there'll be a genetic version
1867360	1874480	and there'll be an autoimmune version and there'll be various other versions. And each time that will
1874480	1879680	then become part of the neurology and what's left will be unexplained and left to the psychiatry
1879680	1886160	so somehow. I want to try to figure out the sort of evolutionary basis for psychosis and
1886880	1891520	schizophrenia. And I remember, I think I was reading something in evolutionary psychiatry,
1891520	1895760	it was a journal, I can't remember the name, but we were talking about how a lot of foreigners,
1895760	1900640	people who move from one country to another, into develop schizophrenia at a higher rate
1900640	1906080	than those who stay in their own place. And if you have to think about the evolutionary advantage
1906080	1910720	of that, it would be trust people around you a little less, because you don't know them and
1910720	1914880	they might not have your best interest at heart. So it's fascinating to think that there might be a
1914880	1921200	lot of evolutionary basis behind some of these mental illnesses. That's right. I mean, I'm very
1921200	1928720	interested in this game, that's the Bayesian story. There's this idea of volatility. So if you, if
1928720	1935040	you're, so this is a new way of looking at learning. So you can have fast learning and have slow
1935040	1941520	learning. Normally we think of slow learning surely bad, but this is, it entirely depends on
1941600	1949760	the environment you're in. If you're in a stable environment, then it pays to learn slowly,
1949760	1954240	because what you've learned in the past probably still applies. So you don't need to change very
1954240	1961760	much. But if you're in a volatile environment, you have to learn quickly, because the situation
1961760	1967520	keeps changing. And I guess if you move to a foreign country, you're precisely in a more volatile
1967520	1972480	environment. And it's interesting that this does seem to have an effect on the dopamine system.
1973760	1981120	So that in the, yes, I think as you increase the amount of dopamine, the learning rate will
1981120	1986160	increase or learning faster, which is good for a volatile environment. And of course, if you have
1986160	1992240	a high level prior that says I'm an involuntary environment, when you're not, this could be
1992240	1999360	produced all sorts of peculiarities. While we're on the on neuro anatomy, I mean, when you talk
1999360	2004480	about how we might have emerged or evolved consciousness, and which parts of the brain
2004480	2011840	do you think are most responsible for this? This is very controversial, as you probably know.
2013440	2020480	I think there are two aspects to this. I think first of all, I think it's pretty well agreed
2021200	2027680	that consciousness requires long range connectivity between different brain regions.
2027680	2035360	And if this breaks down, you become unconscious. Now, certainly in the case of self conscious or
2035360	2043440	meta consciousness, I think the frontal cortex is critical. Because in a sense, it's at the top
2043440	2052000	of this hierarchy. And it is where we don't know much about it yet, where you're modeling how the
2052000	2058480	rest of the brain works. And I think that's necessary for this, say this high level of
2058480	2065600	consciousness for sentience, which is what I like to call this lower level of consciousness,
2065600	2074480	which we probably share with many, many animals. That probably doesn't involve the frontal cortex
2074480	2080960	to the same degree and is probably much more dependent on the long range connectivity.
2081840	2088720	So one of the things, if we think about sentience, for example, one of the things that has fascinated
2088720	2097200	me for a long time is what's it called corollary discharge and the reafference principle.
2098320	2105680	So when we move, and again, Helmholtz was involved in this as part of the reason, when we move our eyes,
2108640	2112400	obviously the image on our retina is jumping about all over the place.
2112720	2118800	But we don't see the world jumping about we perceive it stable. And this goes right back to the very
2118800	2125760	beginning of evolution, when organisms were able for the first time to move under their own power.
2128320	2133120	Almost immediately, they had to be a mechanism which enabled them to recognize the difference
2133120	2137840	between movement out there due to something else moving and movement out there due to them moving.
2138000	2142160	And this is where the reafference or corollary discharge comes in, because you basically,
2142160	2148000	when you move yourself, you have to say in the signal to the receptive parts of the brain to say,
2148000	2155360	this is not the world moving, this is me moving. And I think that's perhaps that sort of interaction
2155360	2160720	between brain areas is the start of something like sentience. And if that's the case,
2161520	2166800	and if that's the case, it's certainly present in fish and insects and
2168960	2177120	all sorts of much lower organisms and us. I was speaking to Ian McGillchrist, I'm not sure if
2177120	2180880	you're familiar with him. We were speaking just the other day, and we're talking about like
2180880	2187120	Kazanica's work, for example, his work, how important that copus callosum is in terms of
2187120	2192480	that long range connection you're talking about, because you split that and a lot can happen.
2192480	2196160	Well, what comes to your mind when you think about split brain patients?
2196160	2199360	How does it affect anything in terms of your view of consciousness?
2201120	2203840	Well, I'm a little bit dubious about this.
2211040	2214000	I mean, one problem is that they don't do the operation anymore.
2214960	2222800	So we can't sort of replicate the results. The other problem is that occasionally people
2222800	2228640	turn up who never had a copus callosum, and they seem to be remarkably normal,
2231280	2239280	compared to the late cases where they are split. So I mean, clearly,
2239680	2246800	so I guess I'm not really sure what I would predict ought to happen. I mean, a lot of the
2246800	2254720	brain imaging work, in a sense, went against this idea of distinct properties for the left
2254720	2260560	and the right brain. So for example, language was always used to be very much in the left brain,
2260560	2264880	but the brain imaging show there's all sorts of aspects of languages in the right brain as well.
2265120	2274160	There's this interesting phenomenon of left sided neglect, where there does seem to be some
2274800	2279440	lateralities of attention so that one side of the brain seems to attention to both fields
2279440	2288560	and the other side to any one, which is slightly odd. So I'm very confused about the role of
2288560	2297280	laterality. In terms of that, that it's sort of a hemispatial neglect, Professor Michael
2297280	2303920	Graziano at Princeton, he has ancient schema theory. So he sort of says that it's more about what
2303920	2309600	we're attending to, and then we build models to tell us what we're attending to, and that's what
2309600	2316320	we sort of call consciousness. It's more of a caricature. We're not really seeing reality as it
2316320	2322400	is. We're just everything we see. Yes, I mean, that's another version of what we were talking
2322400	2326240	about earlier. We have a model of the world, and that's what we see, not the world itself.
2327200	2331600	But I think, yes, his ideas are very interesting in relation to how attention works, and particularly
2331600	2337120	the idea that we, once we, you know, we can model our own attention, we can perhaps model
2337120	2341280	other people's attention, and I would even go as far as to say, maybe it's the other way around,
2342160	2346720	that we start off by having to note, it's very important to us to work out where other people
2346720	2353200	are attending to. I mean, this is not just for us. I mean, there's always nice work with Thomas
2353200	2359840	Sello on chimpanzee. So the low ranking chimpanzee has to make sure the high ranking chimpanzee
2359840	2367120	can't see the food, so they can then go and get it. So knowing where other people are attending to
2367120	2371520	is very important. And maybe once we have worked out how to do that, we suddenly realize we can
2371520	2378960	apply it to ourselves. There's a similar version in relation to theory of mind. So the sort of
2379520	2383920	standard idea was we first of all learn how to think about our own minds, our intentions,
2383920	2388320	our beliefs and desires, and then we apply it to other people. But some people have suggested
2388320	2393600	it's actually the other way around. We find it so useful to work out what other people are wanting
2393600	2399200	and knowing and desiring that there's a pressure to find that out. And then we find we can apply it
2399200	2405680	to ourselves as well. Fascinating. So what I'm going to do is, Chris, the podcast is obviously
2405680	2411440	called Mind Body Solutions. So we're trying to figure out the infamous mind body problem. So
2411440	2415920	I'm going to run through a couple theories with you or a couple of philosophical views. And I just
2415920	2419520	want to hear your thoughts on them. Let's start off with panpsychism. What are your thoughts on
2419520	2426320	panpsychism? Yes, I don't really understand this. I mean, as I said at the beginning, I think
2426320	2432480	consciousness is a biological thing. So I expect to find it in biological entities or
2434240	2440720	machines that are built to represent sort of copies of biological entities. So it could
2440720	2447120	be in silicon. And I don't really, I mean, the philosophers say that this doesn't solve the
2447120	2454320	hard problem of how you get subjected to experience out of a physical entity. And I guess I would say
2455840	2461040	I don't really worry about that at this stage. But the idea that spoons are conscious in some
2461040	2467280	sense doesn't really help me with what I'm trying to do. Do you think it's a problem with semantics
2467280	2472720	here? We're just all just saying the same word in a very different way? I think that's partly,
2472720	2479280	yes, I mean, what it depends on. I mean, does it make any sense to say that spoons are having
2479280	2485680	subjective experience? But if you then think about something like IIT integrated information theory,
2486480	2491520	do you think that's following a similar path? Or because they're also trying to search for a neural
2491520	2497040	basis of consciousness, of course. I mean, they're clearly searching for a neural basis of consciousness.
2497120	2502960	And I think I would agree that long range connectivity in the brain is very important.
2504080	2509520	What I don't quite get with integrated information theory is that they start from,
2510240	2515520	I can't remember five principles of how what consciousness is. And I don't agree with them.
2517680	2522000	I can't at this moment, because I don't agree with them, of course, I can't remember what they are.
2522000	2528720	But I think, for example, that it's integrated. And for example, semi-executive was always saying
2528720	2535360	that consciousness wasn't integrated at all. And it was very messy and so on. So I think their starting
2535360	2543200	point of what consciousness is, is not the same as mine. Do you think global workspace theory
2543200	2548880	does a better job at explaining it? Yes, I think that's one of the best ones around at the moment.
2549840	2551440	Why do you think that?
2552480	2560560	Why do I? I mean, lots of partly because I stand the heart of a friend of mine. But I think
2562480	2569760	but it also I think it fits the data very well. In my paper, I point that out so that
2570800	2574400	if you think it's to do with working, it goes back to the idea of working memory.
2575360	2581120	Working memory very much involves Prato and frontal cortex. You find that Prato and frontal cortex
2581120	2588080	are the bits of the brain that are less active and disconnected in coma and vegetative state and
2588080	2592960	things like that. In the experiments, I actually did when I was still doing brain imaging, where we
2592960	2598800	were showing looking at the difference between things that you were conscious of and things
2598800	2603760	that were affecting the brain that you were not conscious of. When you were not conscious of a
2603760	2609680	face, for example, the face area lit up. But when you were conscious of that face, then Prato
2609680	2616880	and frontal cortex lit up as well. So that sort of fits with this sort of story. I guess my
2617680	2623680	worry about global workspace theory is that I don't really quite understand the
2624320	2630000	ignition story. And of course, it doesn't bring in other people, which
2630320	2637200	is a question. And how the reporting works and all that sort of thing. But I think it's the best
2637200	2648000	one around at the moment. Though I also like, of course, Hakuenlau and David Rosenthal's
2648000	2654800	higher order theory. Can you give me some reasons for that one as well?
2655760	2660320	Well, that one, I think what is that may be talking about a different thing. So I think
2660320	2665360	higher order thought theory, I think, is actually talking about this metaconsciousness,
2665360	2670640	which is this higher level where you're aware that you're aware. And there's lots of evidence that,
2671600	2679040	for example, we talk about explicit metacognition, which metacognition being means thinking about
2679120	2684640	thinking. So I'm particularly interested in our ability. When we make decisions,
2685680	2691840	we can actually think about how likely is this decision to be right? How much confidence do I
2691840	2697440	have in this decision? And we have this feeling of confidence, we can actually describe how confident
2697440	2703280	we are to other people. This is actually useful in when we work with other people
2704240	2709440	to compare our levels of confidence. And again, there's lots of brain imaging work,
2709440	2715440	particularly from Stephen Fleming, showing that when people have to use confidence,
2715440	2720640	they're actually using a particular part of the frontal cortex, that is the frontal polar area,
2720640	2727360	BA10, which seems to have a special role in thinking about thinking. And it seems to be
2727360	2733520	thinking about thinking is very closely related to this higher order thought theory of consciousness.
2736080	2742480	So I like that idea. Yeah, I think it seems like a lot of these theories have so many good
2742480	2748480	ideas that somehow just going to accumulate and provide us with one at some point. It's almost
2748480	2753680	like they all kind of need each other a little bit. Yes, I think that's right. And then, of course,
2753760	2759200	there's an interesting paper recently, which looked at all these different theories of consciousness
2759200	2763360	and the way that they test themselves. I mean, the experiments they do to test them,
2763920	2769360	which quite nicely showed, as you might expect, that they test their own theory, but it has no
2769360	2773760	impact whatever on any of the other theories. So the tests that you use for global workspace
2773760	2779520	theories, Jolly Good for global workspace theory, but has no relevance for IIT or higher
2779520	2784400	order thought. So in a sense, they have to somehow come together, which is beginning to happen.
2784960	2789120	I remember when I was chatting to Michael Graziano, he was telling me how you can take
2789120	2794800	attention schema theory and actually plunk it onto global workspace theory. And then you have
2794800	2800880	a much better theory of consciousness as a global workspace theory is one of the better ones in
2800880	2809040	terms of explaining. I think that's right. But I'm reminded, I don't know whether you read these
2809040	2815440	novels by Sebastian folks. But one of them, I can't remember what it was called, but it's in fact,
2815440	2822640	it's a series of five different stories. And one of them is about this neuroscientist in Italy who
2822640	2829200	discovers the basis of neural basis of consciousness. And I was involved because he asked me to comment
2829200	2834640	on this before everyone knew whether it was plausible and so on. And the hippocampus had a
2835440	2841200	major role. But what I found quite nice about this story was that when she does define in the
2841200	2844960	story, she finds the neural basis of consciousness and everybody agrees it's neural basis of
2844960	2855680	consciousness. And then everybody loses interest. This podcast becomes completely relevant. Let's
2855680	2863760	hope no one can forget it. That's exactly what happened with the Yarn Vettel. I mean, going back
2863840	2872080	to what you said earlier. Once it's done, once we figure it out, it's like magic. Nicholas Humphrey
2872080	2878160	and I were chatting about it, because he calls it phenomenal surrealism. No longer considers it
2878160	2884800	an illusion. He thinks it's more real than real, like red, even redder than red, because we perceive
2884800	2892800	it as red. But yeah, he sees it as magic. That's a good point. Actually, it says consciousness is
2892800	2899440	more real. I think his paper is redder than red. I can't remember exactly the name.
2900080	2907120	Yes, but just on the same topic, though, once the magician tells you the trick, I mean, you're
2907120	2915120	done. The search is over this whole magical experience. It's finished. Yes, I think so. Some
2915120	2920240	people, I won't name names, like to keep their theories, has a little bit of magic. It has a
2920240	2927920	little bit that no one can quite understand. Do you think when people make these definitions,
2927920	2933680	let's say, like when we claim that it's a hard problem of consciousness, that we're adding the
2933680	2938320	element that we don't need? I mean, Daniel Dennis is trying to quine qualia, a quining qualia or
2938320	2942960	a way to make it easier for us to actually find a neural basis of consciousness. You think that's
2942960	2948400	a better approach? Not necessarily an illusion, but to at least make... I think it is a better
2948400	2953920	approach. Yes, I mean, the other extreme is, is it McGinn? Is it the people who call themselves
2953920	2965520	mysterious, who say we won't ever solve it? And I think that that's clearly a, what's the word,
2965520	2968880	a challenge. If you say it's impossible to solve, then it's like, right, we're going to do it.
2970320	2974160	You think this is a way for philosophers just to keep their jobs in certain...
2978720	2984400	Tell me, Chris, when it comes to theory of mind, I mean, you and I, if you've done such great work
2984400	2992000	in terms of working together, humans, why are we meant to work together? Over time, how do you think
2992000	2998400	that this has led to such crazy amounts of technological revolutions? I mean, in terms of
2998400	3003600	what we've done as a species, why do you think humans have done so much more than, let's say,
3003600	3012080	our cousins, chimpanzees, bonobos, etc.? Well, I think, yes, I think the basic reason is that,
3012080	3016880	as we were saying earlier, that we are able actually to share our subjective experiences.
3018560	3023440	We can, as a result of this, we can actually alter our subjective experiences and make them,
3023440	3029040	in some sense, more accurate, better models of what the world is like, because we can talk to
3029040	3033360	each other about what the world is like, and we can get better theories. I mean, this is what
3033360	3038000	science is all about. You have the better and better model of the world. It never gets there,
3038000	3048560	but it gets better each time. And we can... I mean, there's this lovely book by Celia Hayes,
3048560	3054960	which is all about cognitive gadgets, which is about cultural, has given us ways of...
3055920	3064960	new ways of thinking. And these may be more important than... these cognitive tools may
3064960	3071440	be more important than, say, stone tools or iron tools or whatever. I mean, mathematics is an example
3071440	3079840	of a tool which has been created by humans interacting together. So, I mean, and writing
