start	end	text
3079840	3087920	is another example. So, I mean, universal literacy has only been around for the last
3089440	3094240	hundred years or so. So, these are the things that have made us...
3097280	3101120	given us all these advantages, which means that we're now dominating the world and probably
3101120	3107280	about to destroy it, but that's another matter. And the other thing, it's very frightening,
3107280	3113440	it could all be lost. Exactly. I mean, that's the... I mean, I often ask this, I mean,
3114080	3119120	I don't believe there is any sort of teleology. I don't... I'm very agnostic regarding anything
3119120	3124960	regarding the origins of the universe or why we hear what we are to do. But do you think,
3124960	3130640	for example, AI would be the next evolutionary step? And do you think it's meant to be? Do you
3130640	3136480	think that's what humans are actually here to do, in a sense? Well, in some sense, yes. I mean,
3137120	3142480	you could... Yes, we wouldn't want to say it was meant to happen, but we would say the way the
3142480	3148960	system works means it will happen. It's the next logical step. That's obviously something that will
3148960	3155600	survive, let's say something a bit more catastrophic on the planet. Should we send it into space or
3156720	3164800	whatever with it? I mean, that's very interesting. And I'm sad that I probably won't live to see this
3164880	3172160	happening. But I'm certainly very interested in, yes, what's happening in AI and DeepMind and all
3172160	3177120	this sort of thing. Sort of quantum computing. I mean, they're doing a lot of intriguing stuff,
3177120	3182480	but I also don't think I'll be alive, to be honest. But I still don't think most of us would be alive
3182480	3188480	at that point. Things are going down south very quickly. But I think even DeepMind, the amazing
3188480	3195280	things they're doing is all happening at this lowest level from a biological point of view.
3195280	3200720	I mean, in my paper, I show this diagram at three levels. And the bottom level, we have
3202000	3206240	model-free learning, as it's called, which depends on having huge amounts of evidence
3206240	3212320	and doing statistical learning. And I think that's what AI can do at the moment.
3213200	3218080	So, sorry, continue, Chris, what were you saying?
3218640	3222800	No, I was just going to say the next step up is to start making models and they're beginning
3222800	3226640	to do that. But I'm not sure whether that's how far that's gone yet.
3228720	3234560	Michael was telling me that they are applying that theory to certain AI. And it's starting to
3234560	3240880	work quite well. I mean, they're making some progress, but they're just very far away to
3241120	3245840	do it with obviously to the complexity that we've reached over billions of years. It takes a long
3245840	3251760	time. But I think we'll get there. I don't know. I mean, certainly, in relation to theory of mind,
3251760	3257680	there are, I mean, my worries about our ideas about how theory of mind works is we don't really
3257680	3264080	have a good computational account of how that works. And people are beginning to develop it
3264080	3272480	like, what's his name, 10 and down? But the, I think it's not quite there yet. And they typically
3272480	3275920	say, yes, we've solved this with that. Well, that's not what I meant by theory of mind.
3277840	3283040	Do you feel that, I mean, we're obviously following this computational approach right now, but
3283040	3286880	it's because this is the current framework we live in. I mean, people often have this argument
3286880	3292000	that when we understood the way pumps work, that's how we thought the brain worked when the train
3292000	3296800	station, we thought it works the same way. Do you feel that perhaps there might be something
3296800	3300160	we'll figure out in the future that we'll go beyond this computational model? Or you think
3300160	3306880	we got it this time that we're almost there? No, I was thinking that there were certainly
3306880	3310800	better things. I guess that's very interesting point, because that's absolutely right. I mean,
3310800	3314880	what was wrong with Freud's approach? Because he started off by having this model of the mind
3314880	3320640	that it was basically hydraulic. And he didn't know about information flow and such like, so I
3320640	3327280	think that was a big step forward is to go. So he was just talking about energy. And the switch
3327280	3334560	to be able to talk about information, I think was a crucial step in this direction. And there may
3334560	3338800	well be another crucial step, of course, because we haven't made it yet, we have absolutely no idea
3340240	3346240	what it is. But in some sense, I mean, this is a sort of Turing story that you can model anything
3346240	3352400	on a general computer. So you could model your hydraulic system, you could model your steam
3352400	3360240	engine type system. What we don't know is what we should be modeling, I guess. But I mean,
3360240	3366640	I agree entirely that we're always using the technology we currently have. But I think we're
3366640	3373680	beginning to get a sort of meta technology. So we have a technology of technology, which may be
3373680	3385600	the critical step to the next stage on idealism. Idealism. I guess I'm not quite sure what that
3385600	3391760	means. Do you mean in the sort of platonic sense? So basically that it's all mind, because there's
3391760	3397280	a lot of theories now. I mean, for example, Donald Hoffman, Bernardo Kerstrup, there's a lot of people
3397280	3404400	who are saying that it's all in the mind, everything is mind. And making some very good
3404400	3409040	physical theories like physics, using a lot of physics to actually prove that space time, for
3409040	3414320	example, isn't as real as we thought it was, according to the mathematics, and then trying
3414320	3420400	to figure out how consciousness could be fundamental to that. Yes, I haven't really thought about that.
3420400	3425600	Is this a bit solipsistic in the sense that say we are creating the world out there?
3427040	3433440	I think, yes, I'm not so happy with that. I mean, I'm very keen to believe that there is a real world
3433440	3444640	out there that we're trying to find out about. But I agree that the way what we impose upon it is
3444640	3450960	obviously must be, to some extent, created by our minds. I mean, this is almost a sort of Bayesian
3450960	3458560	thing that we, the priors come from within. So in that sense. A sort of naive realism. We know
3458560	3463200	that there's something there, but we're just not seeing it as accurately as we might. Yes, I'm a
3463200	3467520	naive realist, I think. So I think, yes, we're getting more accurate. But I believe that there is,
3468160	3472480	I mean, if we don't believe there's anything out there, there's no way we can improve our accuracy.
3472480	3478080	We have to be something, I mean, I'm very keen on prediction errors. I mean, that's a sort of
3478080	3483360	Bayesian story. Errors are a very good thing because they tell us about what we don't know.
3485600	3490720	So I'm keen on the idea that there are things that we don't know that we will be able to find out
3490720	3497840	a bit about. Tell me, Chris, when you started out with this, because there's a book by John
3497840	3507120	Hogan or Hogan or Hogan called Mind Body Problems. And what the author does is look at different
3507120	3513120	scientists, philosophers, Christoph Koch, for example, each one, and it almost goes into a
3513120	3519040	personal deep dive into their life and how their personal experiences might have led them to their
3519040	3525280	current belief in consciousness. So for example, if someone was very spiritual or very religious,
3525840	3531040	somehow things consciousness will be fundamental. Someone who's not, grows up very atheist,
3531920	3537840	tends to think consciousness is an illusion. So how do you think your spiritual views and beliefs
3537840	3545120	have shaped the way you think about consciousness today? Well, I was certainly brought up in a
3545120	3557840	very religious family, Anglican, of course. But I still get a great deal of pleasure from
3558880	3568160	services and singing psalms and peculiar rituals of this sort. So I quite like to be an Anglican
3568160	3571760	on the grounds that these are the Christians who don't actually believe in God. So that's
3572560	3580800	so from that, I mean, so there's that side of it. I guess my main interesting consciousness
3580800	3588160	probably was because I very early on trained as a clinical psychologist. And I actually
3588160	3594480	interacted with people with psychosis, who had hallucinations and delusions. And I became
3594480	3600400	completely fascinated by what an earth hallucination, what it meant to be having a hallucination.
3601360	3606960	And of course, I was also reading Philip K. Dick, which is a very strong experience.
3608320	3612480	And his theme, of course, is that, you know, reality is not what we think it is.
3613600	3619360	And what we, you know, we have been, it's an illusion that's been created by evil
3620560	3626000	capitalists of some kind to keep us down. So I mean, so those two sides may be extremely
3626000	3631120	interesting hallucinations. Why should my belief, my beliefs about the world be any better than
3631120	3637600	these patients that I was interacting with? And I guess that was my start in thinking about.
3638640	3643840	So I was thinking about hallucinations. And I realized very rapidly that this is actually
3643840	3649920	all about consciousness. So hallucination is the extreme subjective experience, because it
3649920	3657120	doesn't actually, it's not based on what's coming into the senses. So it's almost subjective
3657120	3662640	experience without reality. So that was, and I guess that was my main starting point.
3663920	3668400	And then at some point, I mean, in your book, Making at the Mind, I remember reading it a
3668400	3674560	long time ago, for the first time. And I mean, it blew my mind as well. I mean, you talk about
3674560	3677920	various different things in your papers, in your books, altered states of consciousness,
3678000	3682720	so one of them. How do you think altered states of consciousness give us a better idea of
3682720	3689680	understanding of consciousness in itself? Well, there's some very interesting, I mean,
3689680	3696480	I talk about this a bit in my paper. But I think the altered states of consciousness make us realize
3696480	3707120	that, you know, there's more to it than we typically experience. And I mean, that certainly
3707120	3711120	it's a very basis for studying levels of consciousness when you're talking about altered
3711120	3719840	states due to lack of various things. But also the use of psychedelic drugs reveal that you can
3719840	3724880	have states of consciousness that are not like what we are used to. And again, I think that's
3724880	3730800	very important. It's rather like the dress to realize that there's more to consciousness than
3730880	3740160	perhaps we realize. I'm not quite sure in what direction this is going to go in. But one of the
3740160	3745520	things it's maybe important is going right back to us why and how we started talking about how do
3745520	3752880	you study subjective experience. And there is always this problem of psychology that introspection
3752880	3760400	is difficult. And we need better tools for doing introspection. And I think studying altered
3760480	3767760	states is one of the ways of improving the tools because it in a sense, defines different dimensions
3767760	3773520	within which we might describe our conscious experience. So it's giving us a better sort of
3773520	3777440	framework for beginning to talk about our subjective experience, which is what we
3778080	3779920	desperately need. So that's
3781120	3785280	There are a lot of universities nowadays studying like the effects of psilocybin,
3786240	3792320	as the certain drugs on patients with depression, etc. And it seems to be very promising.
3794320	3802320	Yes, I'm still a little bit suspicious. But it's certainly worth looking at further.
3802960	3808400	I think the one I read, I remember there was a five or six month follow up on patients who
3808400	3817680	had taken a high dose psilocybin trip programs at very high dose. And most of the patients'
3817680	3822960	experiences seem to be back to normal at their baseline, which obviously needs to still be peer
3822960	3828560	reviewed a lot more and tested. But that does seem to be quite promising. Because currently,
3828560	3833360	if you look at our current approach, treating depression, I mean, anti-depressants are not
3834240	3838240	not up to standard. It's a point, actually, how effective they are.
3839600	3844400	Well, no, that's a big problem. I mean, also in the study of psychosis, because
3845200	3850160	basically, big pharma has stopped doing any research. Because there's no
3851520	3857440	there's no obvious direction to take. So we certainly need to somehow get back into that.
3858400	3864880	Although, I'm not quite sure where that would take us. But no, I think this is interesting. But
3864880	3871360	as I say, bigger trials are needed. And there's also the work on ketamine.
3874480	3876160	Yes, there's been a lot of studies on that as well.
3878320	3886240	I think it's Joanna Moncriff, who wrote a book on big pharma and how a lot of these drugs are
3886240	3891760	just completely controlled by the pharmaceutical industry. And now it's taken over, it's taken
3891760	3896240	a life on its own that the way the science no longer really matters at this point.
3898800	3902320	Do you feel the same way as a clinical psychologist that look in psychiatry? I mean,
3902320	3907760	these patients are all no longer sorting out the psychological elements and the social elements.
3909360	3912880	I mean, it's partly to do with a matter of expense. But I mean, the drugs,
3913520	3918800	they're still giving the same drugs that were discovered based in the 50s. And as I said,
3918800	3923120	the sum of useful companies are no longer interested in trying to develop better drugs,
3923120	3929920	because they don't know how to. There's a lot of work with what's it called cognitive
3929920	3936640	behavior therapy. Although this is not quite as good as we were hoping.
3937120	3946080	Sorry, that was something I was going to say. But it's partly,
3948080	3953760	when I was studying schizophrenia a long ago, there were these huge mental hospitals,
3954400	3959680	which were full of patients and they were all closed down. And it was believed that this would
3959680	3964640	help them and they would no longer be institutionalized. Now, this has not worked. It was effectively
3964640	3973600	a money saving enterprise. And they're now treated in the community, which is a euphemism for not
3973600	3984960	being treated at all. I'm sure that much better procedures could be applied if there was the money
3984960	3992560	to do so. But we still don't, I mean, whether this is not about cure, this is about management.
3993280	4000640	And apart from these odd things like the very rare cases that have autoimmune
4000640	4005200	problems, which can actually be cured, the rest of it, we still don't know.
4008320	4012720	When you look at autistic patients, I mean, mines are clearly better than one. I mean,
4014560	4019520	you speak about this, you've got a graphic novel, you've got, you've done a lot of lectures on it.
4020400	4024640	Yeah. How do you think that patients with on the autistic spectrum
4026160	4032000	differ from the average person in terms of how they perceive the world from a theory of mind
4032000	4035280	perspective? Well,
4038720	4044960	certainly at the more extreme ends of the spectrum, I think they generally have difficulty in
4045920	4055760	recognising that behaviour is driven by beliefs, rather than reality. And therefore,
4055760	4061760	the difficulty in understanding that people can have false beliefs, difficulty in understanding
4061760	4067360	that people can, I mean, this is the dangerous part, people can be deliberately deceiving you
4067680	4073840	by trying to impart a false belief in you. So they can be over trusting.
4076640	4083680	So there are these sorts of problems. They, the other area where they may have difficulty
4083680	4088880	is recognising, you know, which is part of the same thing. Things like white lies that you
4088880	4095760	can deceive people for good reasons. And you don't always have to obey the rules. So they
4095760	4101360	tend to be very ruled down because of not recognising these sort of grey areas, which
4101360	4108320	can make them difficult to work with because they object to people doing minor infringements,
4108320	4116480	which I'm sure our Prime Minister would suffer from. I think that's one of the things that I
4116480	4122720	do like most about the Bayesian brain approach is that you try and explain these with using
4122720	4128000	Bayes theorem and using these priors. I mean, it does explain quite a lot of psychiatric disorders.
4128000	4135440	I mean, too many incorrect priors fix more. Yes, I think the dangerous it may be explains too much.
4137520	4141680	And I mean, I think it explains things on a low level, but we need much more
4144080	4150640	testable predictions. So it's perhaps too good at explaining things, but we need to actually have
4150640	4158640	some new hypotheses that we can demonstrate. And if you okay, so we've done we've spoken about
4158640	4165040	panpsychism, idealism, so people just thinking all in the mind. What about those who believe in
4165040	4169120	quantum consciousness? I mean, this isn't the microtubules you've got to hammer off.
4171440	4179040	This is something more. I don't think we need it. I mean, I think the microtubules
4179040	4185120	is largely discounted as far as I understand it. But I'm not convinced that we need
4188400	4193840	a special as yet, we don't need to bring in these rather
4194320	4200640	abstruse physical mechanisms to explain
4202560	4210560	how the brain works. I had I'm what I had once had an interaction with Penfield about
4211760	4219920	I mean, and one of his arguments is that the brain cannot be a computer because
4220880	4227360	you know, people can solve non computable problems or some other details. And I was objecting to
4227360	4232960	this because I was saying was, I mean, in fact, when you look at the computation involved,
4234000	4238400	at an unconscious level, we do actually much better than we do at the conscious level. Our
4238400	4244000	conscious processing is actually much more primitive than the unconscious processing. So
4244640	4251120	if we really need quantum type explanations, it may apply at the unconscious level of how
4251120	4255920	well the brain works, but we don't really need it for the conscious level. It seems to me that's
4255920	4261520	a different problem. In a few weeks, I'm chatting to Mark Swalms. I'm not sure if you're familiar
4261520	4269920	with his work. Mark Swalms. Oh, yes, psychoanalysis. Yes. So he sort of thinks it's a bit more
4270480	4277680	a lot more primitive, actually, that it's not so much to do with the prefrontal cortex and that
4277680	4283120	sort of communication out downward, it's more from the bottom up that we consciousness sort of
4283120	4288640	evolves. Do you have thoughts on that? Yes, I mean, I think that goes back to this idea that the
4288640	4294000	frontal cortex is particularly involved with self consciousness and meta consciousness, and that
4294000	4301360	sentence may well be much more bottom up. I'm not myself too keen on psychoanalytic approaches
4301360	4308080	to this, because I don't quite know how they fit, or what it's all about. But I would certainly
4308080	4315200	agree that there's a lot of, I mean, the bottom end of sentence, which as I say, is probably
4315200	4322800	shared with fish and bumblebees and so on. The frontal cortex may not be so relevant, and this
4322800	4331600	is certainly, in that sense, very primitive. When you think of other species like, let's say dolphins,
4333440	4338720	what else, let's just octopi, I mean, is it octopuses or octopi? I'm not sure what the correct
4338720	4343840	term there is, but a lot of people have done studies now with octopuses, and they seem to think
4343840	4350720	that they're a lot more complicated than we thought. Yes, I think that's absolutely true.
4350720	4356880	I mean, one task, which I mean, there's this chapter on the virtues written a great deal about
4356880	4362720	consciousness is a philosopher about invertible consciousness, and I think makes a very good
4362720	4371200	case for octopuses, which I think, anyway, to the extent that the, it's now, I think the government
4371200	4380400	has recognized that octopuses and squids should be protected in certain ways. But there's a very
4380400	4388080	interesting task, which I talk about in my paper, which I, which is this reversal learning, you know
4388080	4397840	about this, this is, so it's a very simple task. For example, you can have two food wells, which
4397840	4404320	have, you know, one's red and one's blue, and food is hidden under one of them. And most creatures
4404320	4412240	can learn with trial and error that it's hidden under the red one. And so they do that for some
4412240	4418720	time, and then you switch without telling them you switch the reward to the blue one. And then
4418720	4422560	after a few trials, they realize they were wrong, and they realize it's down to the blue one, and
4422560	4429840	you can go on doing this, this is very boring, and a very simple model free learning device
4429840	4435440	can learn this. But every time you switch, it takes a certain number of trials until it gets
4435440	4442800	the right answer. But most creatures show something which is called learning to learn. So after a few
4442800	4450400	switches, they can switch much more quickly. And this involves actually a higher level,
4450400	4455680	you now have to go up to a level which recognizes that the world has two states, it's either the
4456320	4462720	the red's good or the blue's good. And you have to recognize when the state changes.
4464160	4467680	And this is also very interesting from a Bayesian point of view, because when it's in the,
4467680	4472960	this is all probabilistic. So even when it's, when it's usually under the red one,
4473680	4479520	it's only under the red one, say 80% of the time. So very occasionally you'll find it's
4479520	4485120	under the other one, you'll be wrong. But because you realize it's a state, you say this
4485680	4490400	I know this is just noise. So I ignore these prediction errors. This is very becoming very
4490400	4498560	sophisticated. You say prediction errors are not, not always important. I can, in some situations,
4498560	4503680	I ignore them. But you've also learned that after a certain amount of time, it's going to switch.
4506000	4509520	And therefore we start saying, well, I'm reaching the point where I suspect that these
4509520	4514720	prediction errors are becoming important. Because they may be telling me there's going to be a
4514720	4519440	switch in the state of the world. So I'll start attending to them. And that's how you can switch
4519440	4523520	very rapidly, because you roughly know where it's going to be. And as soon as their prediction
4523520	4529120	error, at this point, then you say, I'm going to switch to the other one. So this is highly
4529120	4535360	sophisticated and enables you to switch quickly. Now, what is interesting is that
4537680	4539360	most creatures can do this.
4540000	4547840	This is what Jonathan Birch points out, this rapid learning to learn this
4549200	4555600	reversal learning switch can be found in many animals, you know, go fish, probably I haven't
4555600	4561920	done bumble bees yet, but they probably will. And I think this is a marker of sentence. You
4561920	4567600	now have a model of the world that it can be in two different states, rather than just learning
4567600	4573600	this response is good, or this response is good. That's the difference between the model free learner
4573600	4577840	who just knows whether the response is good or not, and has to learn it. And the model
4579200	4583200	determined learner who realizes there are two different states of the world. And this is what
4583200	4588000	I have to learn about. And I think that's where sentence is. And if this really is a marker
4588000	4593840	of sentence, then many creatures have it. That's quite intriguing. So even goldfish are able to
4593840	4601200	do this. That's pretty cool. And let's see, that's fascinating. When you think about
4603200	4608160	virtual realities, I mean, we're reaching a point where meta, we're talking about things like meta
4608160	4614000	and metaverse, people are thinking about how we're all at some point going to be computerized,
4614000	4619760	we're going to plug ourselves in, become part of a virtual world. Do you think that it's possible
4619760	4626400	that this is actually a virtual? Do you ever have those sort of philosophical thoughts as a
4627520	4631040	very prominent figure in the neuroscience and psychology field?
4631840	4635840	No, I have to say, I mean, I've certainly been interested in the idea of a brain and a fat.
4637680	4641040	And this really goes right back to Descartes, who was worried about, you know,
4641040	4644800	there's an evil demon that's determining what I'm perceiving.
4644960	4653680	And I guess, but I've never really taken that on board. And I guess it's, again, it's to do with
