start	end	text
2945840	2948560	which has nothing to do with the class variables,
2948560	2950000	we want to do something extra, okay?
2950000	2952800	So, something different which is not concerned with the variables.
2952800	2955760	At that time, you will be using a static method
2955760	2957920	because we are not concerned about instance variable.
2957920	2959840	We are not concerned about class variables.
2959840	2963520	Example, let's say I want to print the info about this class, okay?
2963520	2964960	Not about student, but the class.
2964960	2967840	So, I will say def about, you know, in fact,
2967840	2969600	instead of saying info for class,
2969680	2971120	I would say get school name.
2971120	2972320	That will make more sense.
2972320	2975360	So, I'm changing the name from info to get school for class method, okay?
2975360	2976080	Not for this.
2976080	2977360	And let me also change from here.
2977360	2978400	So, we'll say get school.
2978400	2979760	Here, I will define a function
2979760	2981200	and the function name will be info
2981200	2983920	because when I say info, I want to know the class name, okay?
2983920	2986160	So, this is not related to the object.
2986160	2988560	This is not related to class as I will keep it blank, okay?
2988560	2991440	So, if you don't want to relate this to a class, keep it blank.
2991440	2994480	If you don't want to relate this to an object, keep it blank.
2994480	2995680	No self, no class, okay?
2995680	2996400	Static method.
2996400	2997360	And this will return.
2997360	2998080	This will print.
2998080	2999360	In fact, not return, this will print.
2999360	3000480	We can do whatever you want.
3000480	3004000	So, we can say this is student class.
3004000	3004720	You can do that, right?
3004720	3006320	So, we are printing this is student class
3006320	3008720	and in ABC module.
3008720	3009040	That's it.
3009040	3010080	You can print whatever you want.
3010080	3012480	As I mentioned, important is this method
3012480	3014480	is nothing to do with the class variables
3014480	3015680	and the instance variable.
3015680	3016960	Now, where it will be useful.
3016960	3019520	So, let's say if you want to perform any operation
3019520	3021120	which has something to do with the other objects
3021120	3023200	or the class objects, we can use static methods here.
3023200	3024480	Or if you want to perform some operation
3024480	3026400	like finding a factorial for number, right?
3026400	3028000	Because the factorial has nothing to do
3028000	3029680	with the class variables or instance variable.
3029680	3030800	Maybe you're passing a value.
3030800	3032880	You just want to know what's the factor of the number.
3032880	3034240	You can use static methods there.
3034240	3036240	Now, since we are using a static method,
3036240	3039120	we need to use a special decorator here as well.
3039120	3040880	So, we have to say any guess.
3040880	3042480	We will be using static method.
3042480	3044640	So, for class method, we have to say class method
3044640	3046880	and for static method, we have to use static method, okay?
3046880	3048160	And then you can call it.
3048160	3050480	So, you can say, you have to use a class name.
3050480	3052640	So, you will say student dot info, right?
3052640	3053280	So, this is static.
3053280	3054400	So, you don't have to pass anything.
3054400	3055920	Not even class and not even object.
3055920	3057600	Let's run this code and it works.
3057600	3058080	Okay?
3058080	3060000	So, basically, we have different types of methods.
3060000	3062400	We have instance method which works with instance variable.
3062400	3065920	Class method works with class variable and static works with nothing.
3065920	3068320	It has, if you want to do something extra with a class,
3068320	3070640	nothing to do with class variables or instance variables,
3070640	3071360	go with static.
3076160	3078800	Now, to this point, we have talked about different types of variables
3078800	3081200	and we have talked about different types of methods, right?
3081200	3084320	So, we can write variable and methods instead of class, right?
3084320	3087040	So, a class will have variables and methods.
3087040	3090640	The question is, can we have a class inside a class?
3090640	3091760	That sounds weird, right?
3091760	3093920	Why would anyone want to have a class inside a class?
3093920	3095120	So, let's try to understand that.
3095120	3098720	So, let's say I have a class here and this class name is student,
3098720	3100800	as usual, the way we have done earlier.
3100800	3103520	And when we talk about students, we have different types of variables, right?
3103520	3105040	Let me define that function first.
3105040	3107600	And the variables which I want here is self.
3107600	3108880	First, I want a name.
3108880	3110800	Of course, in the last example, we have taken marks,
3110800	3112480	but here, let's take something different.
3112480	3115920	I would take a name of a person and that will be coming from a user,
3115920	3117760	of course, or from when you create an object.
3117760	3118480	We'll say name.
3118480	3121680	The second thing I want is roll number and I want these two details.
3121680	3125200	And then I will assign name here and I will say self.roll number.
3125200	3126560	Now, we have used to it, right?
3126560	3128560	So, I would say roll number, right?
3128560	3131760	Now, once we got these two variables, what I want is I want to print them.
3131760	3135200	The way you print these values is by defining some functions, right?
3135200	3136800	Of course, you can do that directly.
3136800	3138320	Example, if I create an object here.
3138320	3141520	So, let's say the object is S1 and I will say student.
3141520	3143840	And when you create this object, you have to pass values as well, right?
3143840	3147520	The first one I want is navin and roll number is let's say 2.
3147520	3150960	The second object we want here is S2 and we'll say student,
3150960	3152560	in which we'll be having two things.
3152560	3156880	Of course, I would say this is Jenny and the roll number is let's say 3.
3156880	3159920	So, I have navin and we have Jenny here, we got 2 and 3.
3159920	3161600	Okay, so let's say I want to print.
3161600	3162960	I want to print S1.
3162960	3165520	So, I want to print all the details about S1, okay?
3165520	3167360	I want to print the name and roll number.
3167360	3173120	So, the way you do that is by saying S1.name and we can say S1.roll number.
3173200	3174800	So, this is how you can print the values, right?
3174800	3176400	Let me run this code and you can say it works.
3176400	3178240	We got the details about S1.
3178240	3181680	Now, what I want to do is I don't want to, see, this doesn't look good, right?
3181680	3184400	What you should be saying is you should say S1.show.
3184400	3187920	So, when I say S1.show, it should print all the details about S1.
3187920	3190880	Maybe it has roll number, name or different variables, right?
3190880	3193680	So, of course, we need to define that function or method here.
3193680	3195120	So, we'll set F, show.
3195120	3200080	So, this will print self.name and we'll print self.roll number.
3200080	3201520	So, we are printing these two data, right?
3201520	3204000	It should work. Let's run this code and you can see we got the same data.
3204000	3206720	Now, let's say student also has a laptop.
3206720	3207280	Of course, right?
3207280	3209920	When you say you are doing IT, in fact, we have done that, right?
3209920	3211520	So, you are a student of Therisco.
3211520	3214800	You will be using a laptop to run your code or the extra doesn't matter.
3214800	3216720	And let's say we want laptop here.
3216720	3219200	So, of course, I want to know which laptop we are using.
3219200	3220400	So, I want to know your config.
3220400	3224560	Now, in that case, I will also ask a user, hey, tell me which laptop you are using.
3224560	3227680	The problem is when you talk about laptop, there are different things important, right?
3227680	3228880	It's not just about brand.
3228880	3231120	You will not simply say, hey, I have HP laptop.
3231120	3232320	I have a Lenovo laptop.
3232320	3235200	You will also mention the configuration, maybe CPU and RAM.
3235200	3236080	That's very important.
3236080	3239200	Maybe any i5 CPU with, let's say, 8GB RAM is enough.
3239200	3240560	So, I want to know your config.
3240560	3241360	So, what you will do?
3241360	3243040	Will you pass three variables?
3243040	3247760	Like, you will pass a brand, HP, and then you will also pass the CPU,
3247760	3252160	which you are using, let's say i5, or you will also pass, let's say, RAM of 8GB.
3252160	3253200	Yes, you can do that, okay?
3253200	3254960	So, I have to accept these variables here.
3254960	3256640	I have to accept that here, right?
3256640	3257680	And we can do that.
3257680	3259920	The other option which we have is different, okay?
3259920	3263600	So, the other option which we can do here is, we can create a class, okay?
3263600	3269200	We can create a supply class as laptop, or instead of creating a class outside the student,
3269200	3271040	we can also create a laptop inside student.
3271040	3273760	So, a laptop will be only used by student, and in this case.
3273760	3275760	So, I will say a class and I will say laptop.
3275760	3280160	So, we are creating a laptop class inside a student, so that we can get that group, okay?
3280160	3284240	So, we have to also set depth here, and we have to say init, right?
3284240	3285520	And then let's create a variable.
3285520	3289200	So, the first variable we need here is brand, and let's say the brand is HP.
3289280	3290320	That's the first thing we need.
3290320	3292960	Second thing we need is the CPU which you are working with.
3292960	3296720	I would say CPU is i5, and the third one is RAM.
3296720	3297440	Let's say aGB RAM.
3297440	3298880	So, we got these three things, right?
3298880	3300400	Now, we got these three variables.
3300400	3302080	And where to create the object of it?
3302080	3304400	So, we can create the object here itself.
3304400	3307760	So, we can create the object inside the init, and normally that's what we do.
3307760	3311840	So, if you want to create the object of laptop, we should be creating that object inside the
3311840	3312800	outer class, okay?
3312800	3316080	So, the object of laptop will be inside the student class.
3316080	3317280	The way to do that is very simple.
3317360	3319600	Here, you will say self.lap.
3319600	3322320	You can create any variable you want, and you will say laptop.
3322320	3324720	Or we are getting error, so we have to say self.laptop.
3324720	3325440	Okay, this works.
3325440	3328480	So, you can see in the constructor itself, you can define a variable.
3328480	3331920	So, in the outer class, you can define a variable lab, and you can define the object.
3331920	3336960	So, if you really want to use a laptop, you have to say the student object.lap.
3336960	3341760	Example, outside, if I want to use it, I will say s1.lap.
3341760	3343280	Whatever brand you want to fetch.
3343280	3347120	So, you cannot simply say lab.brand, you have to say s1.lab.brand.
3347120	3349680	Because the lab object is inside the student class.
3349680	3350560	This is one way.
3350560	3352800	What if you want to create another object of it?
3352800	3354080	Let's say I don't want lab.
3354080	3354400	I want...
3354400	3357680	So, you can simply say lab1 is equal to s1.lab.
3357680	3359440	You can get another object for s2.
3359440	3362720	You can say lab2 is equal to s2.lab.
3362720	3365200	Because for every object, you will get different laptop object.
3365200	3366800	Okay, trust me, this is how it works.
3366800	3368400	In fact, you can also check that.
3368400	3369840	We got two different laptop objects here.
3369840	3370960	We will print lab1.
3370960	3371760	And let's print laptop.
3371760	3373520	So, let's print the ideas of lab1, lab2.
3373520	3374720	We got two different objects here.
3374720	3375600	So, this works.
3375600	3376000	Okay?
3376000	3377760	This is where you create inner class.
3377760	3378000	Okay?
3378000	3381520	So, we have a laptop as an inner class of a student.
3381520	3382000	Right?
3382000	3383920	You could have done the outer class as well.
3383920	3386400	I mean, you could have created different classes that you want that works.
3386400	3390720	But sometime, when you know that this class will be used only for student, nothing else,
3390720	3392720	then you don't have to create a separate file for that.
3392720	3394480	You can do that in student class itself.
3394480	3396480	Now, can I directly create the object outside?
3396480	3399360	Let's say I don't want to get an object of laptop inside the student class.
3399360	3400880	Can we do it outside directly?
3400880	3401360	Let's try.
3401360	3403760	So, I will say lab1 is equal to...
3403760	3405760	I will say student.laptop.
3405760	3406800	Now, why student here?
3406800	3409120	Because you cannot simply access laptop directly.
3409120	3409280	Right?
3409280	3411920	Because laptop class belongs to a student class.
3411920	3415360	So, we have to always say student.laptop constructor.
3415360	3417280	You cannot simply create laptop directly.
3417280	3417520	Okay?
3417520	3418720	So, this is one thing you have to remember.
3418720	3422640	You can create the object of inner class inside outer class.
3422640	3425280	Or you can do that outside the outer class provided.
3425280	3426720	You are using the outer class name.
3426720	3428160	So, you have to say student.laptop.
3428160	3428320	Okay?
3428320	3428960	This works.
3428960	3431840	In fact, just to enhance the example, what I will also do is,
3431920	3435360	we can create a show method for a laptop as well.
3435360	3436880	So, we can say show for laptop.
3436880	3438480	And you can see we have two show methods.
3438480	3439840	One is student and one is laptop.
3439840	3440080	Okay?
3440080	3443120	So, in such student, we have show method inside laptop.
3443120	3443840	Also, we have show.
3443840	3445520	But these are two different show methods.
3445520	3448960	The show method of student will print the data about a student.
3448960	3451840	And the show method of laptop will print the show method of student.
3451840	3452640	I know that makes it.
3452640	3453120	That's weird.
3453120	3453760	So, let's do that.
3453760	3460800	So, I will say print self.brand, self.cpu, and self.ram.
3460800	3462000	Okay? So, we are printing this data.
3462000	3464400	So, this show is different from this show.
3464400	3466080	Let me now print laptop here.
3466080	3466800	Let me on this quote.
3466800	3470160	And you can see it brings only the name and the roll number.
3470160	3471360	I also want to print the laptop.
3471360	3472400	Oh, you need the object, right?
3472400	3473520	We have removed that statement.
3473520	3478800	Because if you want to access laptop, you have to say self.lap is equal to laptop.
3478800	3480400	But you have to say self.
3480400	3481120	So, this is important.
3481120	3484800	And after printing, this will call laptop show because we also want to do that.
3484800	3486880	So, you will say self.laptop show.
3486880	3487040	Okay?
3487040	3489840	So, we are printing data about a student and laptop as well.
3489840	3490560	So, this should work.
3490560	3492400	Let's run this code and it worked.
3492400	3495440	You can see we got data about a student and laptop as well.
3495440	3498400	So, this is how you create the class inside a class.
3503440	3506480	Now, in this video, we'll talk about inheritance.
3506480	3508560	Now, we talk about a concept of oops, you know,
3508560	3510880	where which is object-oriented programming.
3510880	3513040	We have so many concepts to talk about.
3513040	3514960	And one of them is inheritance.
3514960	3519440	Now, in real life, what we have is we have this parent and child relationship, right?
3519440	3521680	So, whatever belongs to your parents belongs to you.
3521680	3525040	Example, if my father or mother has a phone, it's my phone, right?
3525040	3527200	By default, my phone would be my phone.
3527200	3529120	But my father's phone would be my phone, right?
3529120	3530000	That's how it works.
3530000	3532000	So, if your parent's house, it's your house.
3532000	3533840	That's what we say inheritance, right?
3533840	3537280	In the same concept, you can implement in programming as well.
3537280	3540240	In fact, all the languages which follows oops concept,
3540240	3542080	they do implement inheritance, right?
3542080	3544320	And the way you do that is with the help of classes.
3544320	3545760	Class inherit a class.
3545760	3546400	Let's try that.
3546400	3549120	What I'm talking about is, let's say if you have a class
3549200	3550800	and class is a, okay?
3550800	3552720	Again, it should be a logical name.
3552720	3555360	So, you can go with employee class, you can go with student class,
3555360	3558080	you can go with laptop class, whatever class you love.
3558080	3563200	But time being, just for the example, we are going for class a and class b or class c.
3563200	3566080	In future, we'll try to implement some other examples
3566080	3568320	using different names and with proper example.
3568320	3571600	But at this point, just to keep it simple, let's go for class a.
3571600	3575360	Now, if we talk about this class a, this class a will have multiple features, right?
3575360	3577120	Maybe we can define two methods here.
3577120	3578320	So, we'll set definition there.
3578320	3582000	The first method which I want to go for is, let's say feature one, okay?
3582000	3584480	So, let's say we got this function which is feature one
3584480	3587120	and this function does provide you something, okay?
3587120	3590320	So, time being, we are printing feature one working.
3590320	3591440	That's it, nothing much.
3591440	3593840	Of course, it can be a complex code, but make it simple.
3593840	3595040	Let's keep it that.
3595040	3596560	And then we can have another feature here.
3596560	3597760	Let me just copy paste this code.
3597760	3601200	So, I will say copy and paste and this would be my feature two.
3601200	3605200	So, we got feature one and feature two and this will point feature two is working.
3605200	3607120	So, this class a has two features.
3607120	3608960	We got feature one, feature two, right?
3608960	3612160	And the way you can access them is with the help of object, right?
3612160	3613840	And the way you create an object is very simple.
3613840	3617840	You simply say a one is equal to a, that's how you create the object, right?
3617840	3619280	Where a is your constructor.
3619280	3622640	Again, you can define that in it method here, but not needed at this point.
3622640	3623520	So, this will work.
3623520	3627040	And using this a one, you can call feature one, you can call feature two, right?
3627040	3631360	So, you can say a one dot feature one and a one dot feature two.
3631360	3632160	And this will work.
3632160	3635120	Let me just run this code and you can see we got feature one working,
3635120	3635920	feature two working.
3635920	3637360	So, this code is working.
3637360	3640640	Now, what I'm excited about is, let's say we have one more class.
3640640	3642000	Let's talk about class B.
3642000	3644080	So, let me just create a class B here itself.
3644080	3646240	So, here I will say class B.
3646240	3648160	And class B will also have two features.
3648160	3650800	I will name this as feature three and feature four.
3650800	3653280	Instead of typing them, let me just copy paste the code here.
3653280	3657200	And we'll name this as feature three and feature four, right?
3657200	3659600	See, normally what happens, you know, when you work on a project,
3659600	3661440	of course, we have a very big team, right?
3661440	3664240	So, example, if one person is defining a class, okay?
3664240	3667520	In that class, we provide you four features or four methods.
3667520	3671600	Maybe you want to define some other class in which you need some extra features
3671600	3674160	and you also want the existing features.
3674160	3675760	You don't have to really find it, right?
3675760	3676560	You can use it.
3676560	3678160	And the way you do that, you're simply saying,
3678160	3680720	example, in this class B, we got two features, right?
3680720	3682960	We got feature three, we got feature four.
3682960	3686160	And of course, if I create the object of B one,
3686160	3688640	so it's a B one is equal to B.
3688640	3690960	And the functions which you can call using B one.
3690960	3693840	So, if I say B one dot, you can see we got only two options.
3693840	3695920	We got feature three and feature four, of course, right?
3695920	3698480	Because in B class, we have only two features.
3698480	3702000	What if you want to get the features of A as well?
3702000	3704960	And that's where inheritance comes into picture.
3704960	3709520	So, we can say, hey, this B is a child class of A, right?
3709520	3712560	And the moment you say child class, it will import all the features.
3712560	3717040	What I will say is this B is a child class or you can say subclass.
3717040	3719120	We have different terminology we can use here.
3719120	3721840	And we can simply say in the bracket, you can say A.
3721840	3726240	So, this class B is inheriting all the features from A.
3726240	3727200	And we got it, right?
3727200	3730000	Just writing that one thing, you know, just bracket A.
3730000	3733040	We are saying B is inheriting the features from A,
3733040	3736080	which means with the object of B, which is B one in this case,
3736080	3738720	the moment I say B one dot, see the options.
3738720	3741840	You can access feature one, feature two, feature three and feature four.
3741840	3744320	And that's the importance of inheritance,
3744320	3747600	which simply means if you already have a class which provides you some feature,
3747600	3750720	and in future, if you want to create your own classes,
3750720	3754720	in which you want to use those features, you just need to inherit them, right?
3754720	3756240	So, we can use some terminologies here.
3756240	3760640	We can say superclass, subclass, or we can say parent class or child class.
3760640	3762960	So, timing will refer them as superclass and subclass.
3762960	3768160	So, super is a class which is A and a class which inherits the class,
3768160	3769840	we will call them as subclass.
3769840	3772240	So, B is subclass and A is superclass.
3772240	3774720	So, that's the concept about inheritance.
3774720	3778320	Now, this is also called as a single level inheritance.
3778320	3779840	We have some other types as well.
3779840	3782160	We also have a multi-level inheritance.
3782160	3783040	Now, what it means?
3783040	3784800	Example, let's say if I have another class here,
3784800	3787920	let me get one more class here, and this class is let's say C.
3787920	3791760	So, we'll call this class C or this class C inherits B.
3791760	3794960	Now, what will happen is whatever you do in this class, let's say timebin,
3794960	3797600	I will define only one feature here, we'll say feature five.
3797600	3799440	You can see how lazy I am.
3799440	3801600	So, this is feature five working, right?
3801600	3803680	So, we got C class which has only one feature.
3803680	3808320	But the moment you create an object for C one, so I will say C one is equal to C.
3808400	3811280	The moment I say C one dot, see the methods you can use.
3811280	3812640	So, we can use feature one now.
3812640	3814960	So, feature one feature two are coming from A, right?
3814960	3816560	But C is only extending B.
3816560	3817440	So, that's our relationship.
3817440	3820480	We have grandparent, we have parent, and then we have child, right?
3820480	3825360	So, a child can access all the features from parent, grandparent, great grandparent, right?
3825360	3826320	So, that's how it works.
3826320	3827360	Okay, this is working, right?
3827360	3830240	So, we got single where you have one superclass, one subclass,
3830240	3833040	then we have multi-level where you have superclass, subclass,
3833040	3834800	and then I get subclass of that superclass.
3834800	3835760	Okay, this is working.
3835760	3837520	What if you go for multiple?
3837520	3838880	What is multiple here?
3838880	3841840	Let's say the C is not only taking from A and B.
3841840	3843280	We got some other class as well.
3843280	3848000	Just for time being, what I will do is I will say B is not inheriting A, okay?
3848000	3850160	So, A and B, they are two different classes.
3850160	3851840	Nothing, they are not related to each other.
3851840	3854400	A provides two features, B provides two features, okay?
3854400	3856240	So, there's no relationship between A and B.
3856240	3858080	They are two different classes.
3858080	3861360	C says, I want to access features from both, from A and B.
3861360	3864240	So, in this case, the C will inherit from A and B both.
3864240	3865600	So, you will say A, B.
3865680	3868400	So, C will copy from both, or C will inherit from both.
3868400	3869520	So, we will say C1.
3869520	3872080	The moment you say C1, you can see you can access all the features.
3872080	3873440	That's not the case with B1 now.
3873440	3876560	B1 can only access two features, feature three and feature four,
3876560	3880000	because B is not inheriting A, okay?
3880000	3880640	Point to remember.
3880640	3882960	So, we got A, we got B, and then we got C.
3882960	3885680	C is inheriting both the classes, A and B.
3885680	3887520	So, this is called as multi-pull.
3887520	3889120	So, this is your multi-pull, right?
3889120	3891840	So, we have done with single, we have done with multi-level,
3891840	3893360	and then we have multi-pull.
3893440	3895280	This is how we can work with inheritance.
3900080	3903280	Now, to this point, we have talked about OOPS concept, right?
3903280	3905760	In which we have seen inheritance, right?
