start	end	text
3905760	3906720	Now, what is inheritance?
3906720	3911520	If you already have some classes, and if you want to use the existing features,
3911520	3916000	you will simply say class B, which will take the features from A, right?
3916000	3918240	So, class B inherits A.
3918240	3921600	Or you can go with a concept of multiple inheritance,
3921600	3924800	where one class will extend from two different classes,
3924800	3926400	or more than two classes, right?
3926400	3928560	So, in this case, we have class A, class B,
3928560	3931840	and then we have class C, which has a feature five,
3931840	3933840	but it is also inheriting A and B.
3933840	3936080	So, we can say C has five features, right?
3936080	3937280	So, that makes sense.
3937280	3939840	Now, what we'll do in this video is we'll talk about two topics.
3939840	3944400	The first one is the constructor in inheritance, how it behaves,
3944400	3949680	and we'll also talk about method resolution order, or you can say MRO.
3949680	3951200	So, let's start with the constructor.
3951200	3953840	Timebin, let's ignore C, okay?
3953840	3956640	So, let's say we don't have this C, so we'll ignore that part.
3956640	3960160	And, in fact, we'll delete that part for timebin.
3960160	3964960	And let's focus only on A and B, where B is inheriting A, okay?
3964960	3967520	So, in total, in B, we have four features, right?
3967520	3969920	Now, what happens is, if I create an object of A,
3969920	3973520	so let's say if I say A1 is equal to constructor of A,
3973520	3974400	so this will work, right?
3974400	3976240	So, when you say A bracket, that's a constructor,
3976240	3978400	it will call a method which is in it.
3978400	3981120	Now, even if you don't define it, it is there somewhere, right?
3981120	3983760	But let me define my own constructor, own init here.
3983760	3986320	So, I will set def, and we'll define the init method,
3986320	3988240	and this init method will print one stuff.
3988240	3991200	So, I will say print in A init.
3991200	3993200	Nothing much, we are not doing anything extra here,
3993200	3996000	we are just printing in A init, that's it.
3996000	3996640	Now, what do you think?
3996640	3997360	What it will print?
3997360	3999520	Of course, we are creating object of A, right?
3999520	4001120	So, it will only execute A.
4001120	4004000	See, with the object of A, you cannot access features of B, okay?
4004000	4006480	So, even if I try example, if I say A1 dot,
4006480	4009600	you can only access feature one and feature two.
4009600	4011520	But yes, if you have an object of B,
4011520	4013520	you can access all the features, right?
4013520	4014880	Features from A and B,
4014880	4018320	because B is a subclass and A is superclass.
4018320	4021280	And as I mentioned, subclass can access all the features
4021280	4023520	from superclass, but that's not vice versa, right?
4023520	4025840	A superclass cannot access all the features of subclass,
4025840	4027280	not even one feature of subclass.
4027280	4028160	Okay, this is fun.
4028160	4030640	Now, what if I create object of B?
4030640	4032080	So, I'm not getting object of A here,
4032080	4032800	I'm getting object of B.
4032800	4034800	Doesn't matter what is A1 or B1,
4034800	4036560	important is if I create an object,
4036560	4038880	B, which call the constructor, that's the question,
4038880	4040480	because we are not getting object of A,
4040480	4041760	we are getting object of B.
4041760	4044240	Will it call the constructor of A?
4044240	4044880	That's the question.
4044880	4047200	Let me just run this code and it works, okay?
4047200	4049040	So, even if you have the object of B,
4049040	4052240	it will still call the constructor of A, right?
4052240	4053360	That's how it works.
4053360	4055840	But what if you have your own constructor?
4055840	4058080	What if you have your own init method?
4058080	4060560	Example in B, see in B, we don't have that init, right?
4060560	4061680	And that's why it is going up.
4061680	4065280	So, let me repeat, since we don't have init inside B,
4065280	4067440	that's why it is going to A.
4067520	4070000	But what if you already have an init with you?
4070000	4072080	So, I will simply copy paste here in B.
4072080	4074160	So, both have init, but then in this,
4074160	4076400	I will print in B init, right?
4076400	4078640	So, in A, we are printing in A init,
4078640	4080640	in B, we are printing in B init.
4080640	4081680	So, this makes sense.
4081680	4083680	Now, if I run this code, what it will print?
4083680	4086960	It will print in A init or in B init.
4086960	4088960	Of course, if you are getting object of B,
4088960	4091360	it should only call the init of B, right?
4091360	4092720	And let's see if that works.
4092720	4094800	And let me just run this code and we are right.
4094800	4099120	So, when you run the code, you can see we only got in B init.
4099120	4101680	So, that means if you create an object of B,
4101680	4105120	first it will try to find the init of B.
4105120	4107200	If it is not there, then it will go for A.
4107200	4108880	Okay, that's the point you have to remember.
4108880	4112000	But what if you also want to call the init of A?
4112000	4112800	Is it possible?
4112800	4115040	I mean, if I create an object of B,
4115040	4118160	can I call the init of both the classes?
4118160	4119840	I mean A and B.
4119840	4121840	See, by default, it will call only B, right?
4121840	4123760	What if I want to call A as well?
4123840	4127040	And that's where we have a very special keyword or a method,
4127040	4129440	you can say, and that is super.
4129440	4130720	So, with the help of super,
4130720	4133840	so you can say super and it's a method, basically.
4133840	4135680	So, you will say super dot.
4135680	4137040	The moment you say super,
4137040	4139840	you can access all the features of the parent class.
4139840	4141120	So, you can say super dot init.
4141120	4143040	So, what we are doing is we are trying to call
4143040	4145200	an init method of class A.
4145200	4146560	So, the moment you say super,
4146560	4148960	you are representing the super class, okay?
4148960	4150720	Which in this case, it is A.
4150720	4154400	So, we are trying to call the init method of class A.
4154400	4155440	That's important.
4155440	4156560	And now, let's run this quote.
4156560	4158080	And you can see we got both the output.
4158080	4161440	We got in A end and we got in B end.
4161440	4164080	So, point to remember is when you create an object of B,
4164080	4166560	it will call the init of B first.
4166560	4167920	And from the init of B,
4167920	4170000	you are trying to call the init of A.
4170000	4171200	So, it will jump up,
4171200	4172960	it will execute the init of A first,
4172960	4174960	which will print in A in it.
4174960	4177600	And then it will come back to print in B in it, okay?
4177600	4179040	That's why we got the output.
4179040	4180080	So, this makes sense.
4180080	4183120	So, we can work with constructor in inheritance, right?
4183120	4184880	Now, let me add a twist here.
4184880	4187600	So, what I will do is I will remove this super from here.
4187600	4188480	Let's clean it.
4188480	4192320	And I will not even say that this is B.
4192320	4194960	So, class A and class B, two different things, okay?
4194960	4196320	They're not linked with each other.
4196320	4197360	But then we have class C.
4197360	4199920	As we have done earlier, we'll say class C.
4199920	4204640	And class C will inherit both the classes A and B, okay?
4204640	4208320	And now, if I say def and init,
4208400	4210160	you know what we are trying to do here.
4210160	4214160	First of all, we'll print in C in it, okay?
4214160	4215840	And then I will create the object of C.
4215840	4217680	So, there's no object of A and B.
4217680	4218720	I'm trying to object of C.
4219440	4220160	Now, what do you think?
4220160	4224000	Will it call the init of C or A or B?
4224000	4224640	Of course, right?
4224640	4226240	When you say the object is of C,
4226240	4228480	it will call the init of C only.
4228480	4229440	Let's run this code.
4229440	4230080	And that's right.
4230080	4232240	We got the output as in C in it.
4232240	4233520	So, this works perfectly.
4234080	4237360	But what if you want to call the init method
4237360	4238640	of a superclass?
4238640	4240240	But there's a twist here.
4240240	4242320	Now, C has two superclasses, right?
4242320	4244000	One is A and B.
4244000	4246960	The moment you say super, dot init.
4246960	4248080	Now, what do you think?
4248080	4249280	Which init it will call?
4249280	4251440	Will it call the init of A or B?
4251440	4252480	That's a question.
4252480	4253680	Let's run this and let's see what happens.
4253680	4254880	The moment you run this code,
4254880	4256880	you can see it says in A init.
4256880	4258640	That means we are unfair here.
4258640	4260160	We are biased towards A.
4260160	4262240	We are not taking B here, right?
4262240	4264000	This is completely wrong.
4264000	4266960	Oh, but the thing is, we have a concept of MRO,
4267040	4269840	which is method resolution order.
4269840	4270720	So, what happens is,
4270720	4273040	whenever you have this multiple inheritance,
4273040	4275840	it will always start from left to right.
4275840	4277360	Which means, so first,
4277360	4278640	so the moment you say init,
4278640	4281920	it will try to find the init of itself.
4281920	4283520	So, since we have init here,
4283520	4285360	it will execute the init of C.
4285360	4287520	Then, the moment you say super, dot init,
4287520	4288800	now we have two classes, right?
4288800	4289760	A and B.
4289760	4291360	And on the left side, we have A
4291360	4292880	and on the right side, we have B.
4292880	4294800	So, it will prefer left one first.
4295200	4297200	It goes from left to right.
4297200	4298800	And that's something you have to remember.
4298800	4301920	It's always from left to right, okay?
4301920	4303760	And that's why we got in A init.
4303760	4305840	The same thing can be done for methods.
4305840	4308560	Example, let's say, we have two methods which are same.
4308560	4311360	So, in this case, you can see we have feature one in A
4311360	4312880	and feature one in B.
4312880	4315840	Both are the same methods with the same name, of course.
4315840	4318240	And in this, I will print some different message.
4318240	4320880	Here, I will print feature one A.
4320880	4323280	And here, I will say feature one B.
4323280	4325280	That means, the feature one is in A
4325280	4326800	and feature one is in B.
4326800	4331200	And now, if I try to call, so I will say A1 dot feature one.
4331200	4332880	Will it call from A or B?
4332880	4334960	That's a question and we know the answer, right?
4334960	4338960	It will always call from A, because it goes from left to right.
4338960	4340400	And you can see the output.
4340400	4341440	So, this is something you have to remember,
4341440	4344560	which is a concept of method resolution order.
4344560	4346720	So, basically, in this video, we have talked about three things.
4346720	4350640	The first one is how constructor behaves in inheritance.
4350640	4353600	The second one is how to use that super method.
4353600	4358160	And the third one is MRO, which is method resolution order.
4358160	4360160	Now, in fact, with the help of super method,
4360160	4360960	it can be called function.
4360960	4361840	Let's see that.
4361840	4365440	So, let's say from, we have a function here, which is def,
4365440	4367360	and I will say feature, feed.
4367360	4368080	That's it.
4368080	4372160	And in this, I'm trying to call the method of super class, right?
4372160	4374400	So, we can say super dot.
4374400	4375680	And we can use that thing, okay?
4375680	4377680	So, we can say super dot feature two.
4377680	4379040	And let's see if it is working.
4379040	4380400	Let me call feature.
4380400	4381920	It should call the feature two.
4381920	4382880	So, yes, it works.
4382880	4386000	So, you can also use super method to call other methods as well,
4386000	4386880	not just in it.
4386880	4390320	So, to represent this super class, we use super method, okay?
4395280	4397840	Now, we have started talking about objects, right?
4397840	4399200	Then, we move towards class.
4399200	4401600	And then, we have discussed about inheritance.
4401600	4404720	Now, it's time to focus on one of the major concept in OPS,
4404720	4406080	which is polymorphism.
4406080	4407760	Oh, that's a weird word, right?
4407760	4409440	Now, when we talk about polymorphism,
4409440	4412160	it's break down this word poly and morphism.
4412160	4413840	So, poly means many, right?
4413840	4415840	And when you say morph, it means forms.
4415840	4419600	So, that means one thing can take multiple forms.
4419600	4422480	Example, like, as human, you know, we have different forms.
4422480	4425280	As the situation changes, we change ourselves, right?
4425280	4429120	Example, we behave differently at different location at office.
4429120	4431280	We behave differently when we are with our friends.
4431280	4432400	We behave differently.
4432400	4434080	So, we are polymorphic.
4434080	4436800	In the same way, when we talk about object-oriented,
4436880	4439280	objects will have multiple forms.
4439280	4442160	So, this concept is very important when you talk about software development.
4442160	4445360	So, we use this concept a lot when it comes to loose coupling,
4445360	4446560	dependency injection.
4446560	4449520	We also have a concept of interfaces, which we'll see later.
4449520	4451760	There are four ways of implementing polymorphism.
4451760	4454880	The first one is duct typing in Python.
4454880	4457360	The second one is operator overloading.
4457360	4460720	Then, we have method overloading and method overriding.
4460720	4464240	In the next few videos, we are going to talk about all these topics, okay?
4464240	4466480	And one of the interesting ones is duct typing,
4466480	4468880	especially if you are coming from different backgrounds, let's say,
4468880	4472480	if you have already seen Java or C++ or C sharp,
4472480	4475920	this has been different for you because in Java or in C sharp,
4475920	4478800	we have to mention the type of the variable which you work with, right?
4478800	4481120	We have to mention the type of object you work with.
4481120	4483040	But Python, we have something different, right?
4487920	4490480	In the last video, we have talked about polymorphism, right?
4490480	4493840	Which simply means you have one thing which will behave in a different way.
4493840	4496720	Or you can say one thing and multiple forms, right?
4496720	4497760	That is many forms.
4498480	4502160	Now, in this video, we'll talk about the first way of doing that,
4502160	4503680	and that is your duct typing.
4503680	4505120	I know that's a weird word, right?
4505120	4506000	Duck typing.
4506000	4511040	We have this famous line, which is if there's a bird which is walking like a duck,
4511040	4515040	which is quacking like a duck, and which is swimming like a duck,
4515040	4517280	that bird is a duck, right?
4517280	4519680	Which simply means it doesn't matter if it's a duck or not,
4519680	4522640	what matters is the behavior of that bird.
4522640	4525680	If it is matching with duck, that's a duck, right?
4525680	4528240	Now, how do you implement that in programming?
4528240	4530400	So what we will do here is let's take an example.
4530400	4532480	Let's say if I have x equal to 5.
4532480	4533600	Now, we talk about the type.
4533600	4536080	Now, in Python, we have a concept of dynamic typing,
4536080	4538720	which simply means the type you can mention later.
4538720	4540720	Example, when you say x equal to 5,
4540720	4543680	the type which we are representing now is integer.
4543680	4546560	But what if you say x equal to, let's say, Navin?
4547120	4549520	Are we changing the type of x here?
4549520	4550400	See, that's not the case.
4550400	4553840	What is happening here is when you say 5, in your memory,
4553840	4556480	you got a space which is of type integer.
4556480	4558080	When you say Navin, in your memory,
4558080	4560720	you got a space which is of type string.
4560720	4563040	The x is just a name to it, okay?
4563040	4566960	So when you say x equal to 5, there is an object of type integer,
4566960	4568800	you are just naming it as x.
4569360	4570960	Later, when you say you got Navin,
4570960	4574800	you got some space in your memory and you are representing that with x.
4574800	4577120	x is just a name to it, okay?
4577120	4579280	So we don't have specific type to x.
4579280	4582560	The moment you say type of x, you are actually getting the type of 5.
4582560	4585840	When you say the type of x, you are getting the type of Navin, right?
4585840	4587040	So that's one thing you have to remember.
4587040	4591120	The moment you give a variable name, that's just a name to a memory.
4591120	4594160	Now, to understand that typing what we'll do is we'll take another example.
4594160	4596160	To explain this, what we'll do is we'll create a class
4596160	4597840	and we'll name this class as laptop.
4597840	4600800	And this laptop class will have a method which is, let's say, code.
4600800	4604000	So in this code, what I will do is I want to execute my code, right?
4604000	4606400	So as a programmer, what we do is we write code, right?
4606400	4608160	We write code and we compile it,
4608160	4610320	we run it and we get the output at the end.
4610880	4616880	But then to do that, we also need an IDE which is Integrated Development Environment.
4616880	4621120	And in this case, if you want to write a code, you need to pass an IDE.
4621120	4626640	So we are expecting in the arguments that someone will pass an IDE to us.
4626640	4630560	And using this IDE, I will say IDE.execute.
4630560	4634000	So the question is, the IDE is of what type?
4634000	4635280	Is it a type of integer?
4635280	4636160	Is it a type of float?
4636160	4637520	Is it a type of string?
4637600	4640080	Now, of course, when you say execute, that means there's something
4640080	4642800	which is not there in the existing classes which you have.
4642800	4645600	That means the type of IDE is something very unique,
4645600	4647920	it is something which is user is defining, right?
4647920	4650400	That means if you want to create this object IDE,
4650400	4651680	you need to create your own class.
4651680	4654960	Let me get a class here and I will call this class as PyCharm.
4654960	4657280	Now, for different languages, we use different IDEs.
4657280	4660080	In fact, for one language, we have multiple options, right?
4660080	4663040	Example, when you work on Java, maybe you will be using NetBeans,
4663040	4666880	Eclipse, IntelliJ, for Python as well, we have different IDEs.
4666880	4669840	We are using PyCharm here because it works well.
4669840	4672400	Now, when you say PyCharm, of course, it will have a method, right?
4672400	4675520	So let me define a method which is def execute.
4675520	4677120	So you can see we have these two statements.
4677120	4679680	The moment you say execute, it will say compiling and running.
4679680	4680560	That's what you do, right?
4680560	4683520	We are code gets compiled and your code get run.
4683520	4684400	Now, will this work?
4684400	4686640	Of course not because we are not calling anything.
4686640	4688800	So when you run this code, you will not get any output.
4688800	4689680	Let me just try it out.
4689680	4691200	I will right click and say run demo.
4691200	4694080	You can see there's no output because we are not calling methods.
4694080	4695920	Let me call code.
4696000	4699040	The way you call code is by creating the object of laptop first
4699040	4700960	because you cannot call code without laptop.
4700960	4704880	So I will say lap one is equal to laptop.
4704880	4707440	And with the help of lap one, now you can call code.
4707440	4709440	So you can say lap one dot code.
4709440	4712480	But there's one problem here, which is inside a code,
4712480	4715440	you have to pass an argument which is of IDE.
4715440	4716320	That's a question now.
4716320	4718640	How do you pass an IDE here?
4718640	4721520	So what I will do is first you need to create an object of IDE.
4721520	4723920	You will say IDE, of course, you can have different names here,
4723920	4725280	but let me go with IDE.
4725280	4728560	So IDE equal to this will be of type PyCharm.
4728560	4732960	So the type of IDE we are working with is PyCharm, which is usually fine,
4732960	4733440	of course.
4733440	4736560	And then when you are calling code, you have to pass IDE.
4736560	4737360	And now it should work.
4737360	4739920	You can see from this code, you got compiling and running.
4739920	4742560	So the type of IDE here is PyCharm.
4742560	4744080	But is it fixed?
4744080	4746320	Can we change the type of IDE later?
4746320	4748240	Maybe let's say we have one more IDE.
4748240	4750640	Let's say in future, I'm creating my own editor,
4750640	4752720	which is way better than PyCharm, maybe.
4752720	4754960	And in that as well, we have the same method.
4755040	4755920	Let's say execute.
4755920	4757920	And in that, I'm doing some extra stuff.
4757920	4760880	So my IDE also does spell check.
4760880	4762320	Maybe PyCharm does that.
4762320	4764400	My IDE also does what?
4764400	4767920	Convention checks, the name of the variable and different stuff.
4767920	4771120	And then it also does compiling and running.
4771120	4773120	So my IDE does extra stuff.
4773120	4776000	Now what if I want to change the type of IDE?
4776000	4779040	Is the IDE type fixed to PyCharm not exactly
4779040	4780720	because this is dynamic typing?
4780720	4783840	So you can replace this IDE type from PyCharm
4783840	4785440	to editor provided.
4785440	4787600	You have that method, which is execute.
4787600	4791200	It doesn't matter which class object you're passing.
4791200	4795520	What matters is that object should have the execute method.
4795520	4797520	Because in IDE, we are saying execute.
4797520	4801440	So now, even if you change from PyCharm to my editor,
4801440	4802560	there is no problem.
4802560	4804880	The code will still work.
4804880	4806240	Provided you have that method.
4806240	4808720	So if you should be having this method, which is execute.
4808720	4809760	And that's the case.
4809760	4812960	If there's a bird, and if that bird behaves like a duck,
4812960	4815280	it works like a duck, it quacks like a duck,
4815280	4817840	it swims like a duck, it should be a duck.
4817840	4821040	In the same way, if there is an object, which is IDE,
4821040	4823280	and it has a method execute, that's it.
4823280	4825920	We are not concerned about which class object it is.
4825920	4828240	What we are concerned about, it should have that method,
4828240	4829200	which is execute.
4829200	4831520	And that is called as duck typing.
4831520	4832400	I know it is amazing.
4832400	4834720	And if you're coming from different background, like Java,
4834720	4836480	so we have a concept of interfaces.
4836480	4837120	So that's what we do.
4837120	4838320	We create interface.
4838320	4841360	And we have this my editor and PyCharm as a class,
4841360	4842960	which will implement that interface.
4842960	4845440	But if you are new to this programming, don't worry.
4845440	4846320	That's the Java part.
4846320	4846960	This is simple.
4851920	4854400	We have started talking about polymorphism.
4854400	4857840	And in that, we have seen one example of duck typing.
4857840	4861440	Now, in this video, we'll talk about operator overloading.
4861440	4863760	So what is operator overloading?
4863760	4865680	So we know the concept of operators.
4865680	4866960	So we have two operands.
4866960	4868640	Example, if you want to add two numbers,
4868640	4872800	you can say 5 plus 6, where 5 and 6 are your operands.
4872800	4874560	And plus is the operator.
4874560	4876160	So we know that.
4876160	4878240	And then we have a concept of polymorphism.
4878240	4880000	So it simply means you have one thing
4880000	4881760	which has multiple forms.
4881760	4884320	Now, if you can think about this, we have two integers.
4884320	4886160	And then we are trying to add them.
4886160	4888880	We can also add an integer and a float.
4888880	4891200	So in different programming language, it does support.
4891200	4892160	What about two strings?
4892160	4894000	So if you say you have two strings, let's say,
4894000	4895120	hello plus world.
4895120	4895760	Will it work?
4895760	4896880	And the answer is yes.
4896880	4899600	So plus works with the strings as well.
4899600	4902640	But what if you want to say you have a number 5?
4902640	4906240	So let's say we got a and a is 5.
4906240	4909760	And then we got b and b is, let's say, world.
4909760	4912960	Now, can I print by saying a plus b?
4912960	4916160	The moment you try to underscore, you can see we got an error.
4916160	4920000	It says unsupported operand types for plus.
4920000	4923600	So we cannot use int and string for plus.
4923600	4926080	So all these things are predefined.
4926080	4929360	All these things, they are called as a synthetic sugar,
4929360	4932400	which simply means it is trying to simplify the code
4932400	4933360	for the user.
4933360	4936000	See, behind the scene, things are a bit different.
4936000	4936720	Imagine this one.
4936720	4940640	Example, if I say a is 5 and b is 6.
4940640	4941360	Now, what do you think?
4941360	4943120	What is happening behind the scene?
4943120	4945520	Now, trust me, whatever happens in Python
4945520	4947680	happens with the help of object.
4947680	4950560	And here as well, when we talk about a and b,
4950560	4952800	the type of it is int.
4952800	4955040	So int is a class here.
4955040	4956400	And when you say class, of course,
4956400	4958400	class will have certain methods.
4958400	4960160	So behind the scene, what is happening
4960160	4964160	is when you say a plus b, which is of type integer,
