start	end	text
0	9560	My name is Adam, and for the last 12 years I was a cook.
9560	14000	When Daria and I moved to Thailand and started this channel, it was just supposed to be about
14000	15000	food.
15000	17680	That's it, that's all I know.
17680	22600	But it turns out that when you follow the stories of food, if you just go where the
22600	27840	road takes you, it might change your entire life.
27840	32280	This is a story that I still can't believe or lucky enough to get to tell.
32280	35920	One I'm honestly terrified I won't be able to do justice.
35920	41400	A story of the forgotten people living in Thailand's northwest jungle, of migrants
41400	47920	and refugees and so-called stateless children, of perseverance and survival, triumph and
47920	54880	tragedy and of course, food.
55640	64920	This is our road trip to a town called Sangkla Buri, an ancient village along the Myanmar
64920	70680	border where we came to find the local food, but left with so much more.
84880	95480	If you've heard of the Three Pagodas Pass, the famous border crossing between Thailand
95480	101120	and Myanmar, that's where we're headed.
101120	107200	There's a lot of stuff on this trip that is going to take a good deal of research and
107200	111760	understanding and we're kind of going into a situation that none of us really know what
111760	112760	to expect.
113200	119160	But right now we only have one priority, which is lunch.
119160	125120	This is Highway 323, soon to be replaced by a new expressway but for now the road to
125120	132040	Kanchana Buri, Thailand's jungle curry capital.
132040	138120	We left Bangkok around 9am in a van on loan from an embassy, invited guests of some mutual
138160	143080	friends and with almost three full days ahead of us, to track down the most interesting
143080	150640	food we can find in one of the most unexplored corners of Thailand.
150640	154080	Now the thing about this country is it's a true melting pot.
154080	159400	There are said to be around 46 different ethnic groups making up the modern kingdom and that
159400	163200	doesn't even include the foreigners like me.
163280	169040	Thai cuisine represents nothing less than history, each dish telling a story, the mixing
169040	175320	and blending of cultures and techniques between Siam and the Chinese, Indian, Lao, Malay,
175320	177080	even Portuguese.
177080	182760	But the farther you get from the urban centers, the more the melting pot hasn't melted.
182760	187720	Trying stuff cooked here is like turning back time, a window into a world that used to be
187720	189320	a lot less complicated.
193200	203720	Alright, so the guests and guides and hosts for our trip to Northwest Thailand are starting
203720	208920	to learn quickly what it's like to travel with OTR, the good and the bad.
208920	212280	The good is we eat really, really well.
212280	216720	The bad is we have to sit here and stare at it for a really long time until we're actually
216720	220200	ready to start eating because we've got to get all of our coverage and then you guys
220200	223240	are going to really hate me in a moment because you're going to have to sit here while I try
223240	225880	everything one by one and say, wow, this is delicious.
225880	233640	Vasana, JP and what are a driver who is really upset at me already because he's just slowly
233640	236680	starting to go, you've got to wait, you've got to wait.
236680	251200	Alright, let me introduce you to the people sitting across from me since they're the
251200	256720	reason we're here two hours into a seven hour road trip far away from anywhere we've
256720	258440	ever been.
258440	264440	This is Jean-Pierre or JP and he's been in Thailand since before I was born.
264440	269360	He's the only one out of six of us who's been anywhere near our destination before.
269360	274960	In fact, he's come to the remote borderlands several times in his former capacity as Thai
274960	278720	director of the Asia Development Bank.
278720	284880	And Vasana originally from Bangkok, once Thailand's trade representative to the United States,
284880	289640	for the last two decades focused on public service ever since finding herself in the hospital
289640	295480	for two months, injured on 9-11 when the towers fell.
295480	302120	This is no normal group, and honestly, it's not a normal road trip.
302120	308080	See where we're going is a place called Sangkla Buri, almost 400 kilometers northwest of Bangkok
308080	313760	and right next to the Burmese border, right in the middle of the most sparsely populated
313760	316560	part of the entire country.
316560	321920	For a guy into food history, it's the Holy Grail, a place where some of the first ethnic
321920	327520	groups to settle Southeast Asia still live, practicing cultures and cooking dishes long
327520	330420	lost to the outside world.
330420	335200	But it's also a place with such hardship that JP and Vasana are heading there because
335200	341000	they're bringing a donation from Bangkok's Rotary Club, school supplies, toys, and money
341000	344840	on its way to a school for stateless children.
344880	350900	And into the undocumented tribes in the mountains are here fleeing violence across the border.
350900	356160	Sangkla Buri is famous for its preserved and ancient way of life, but also for human
356160	362160	trafficking, ethnic violence, and most of all, its wild mystery.
362160	365360	There's only one road in and out.
365360	370320	Many of the local people are unregistered and Thai's not the primary language or even
370320	371320	Burmese.
371320	374600	It's the domain of the Keren.
374800	378760	Native to the nearby mountains or brought here as slaves by the Japanese to build the
378760	381680	so-called Death Railway.
381680	387320	And most of all, it's the home of the Mon, the ancient people who introduced the region
387320	392920	to rice farming, Buddhism, and so much of modern cuisine.
392920	399920	Long absorbed into Thailand, outlawed in Myanmar, the majority in Sangkla Buri.
400920	409120	Somewhere in the middle of the Khao Lam National Park, the signal started fading on our phones.
409120	413360	By the time we reached 100 kilometers north of where we had our lunch, the jungle got
413360	414800	denser.
414800	420320	And for a hundred more, we kept on going, driving through forests and mountains, through
420320	426200	police checkpoints, and finally crossing the River Kwee, looking out over a region that
426200	430480	all of a sudden was very real.
430480	435720	The town was dark when we arrived, nine hours after leaving our home in Bangkok.
435720	437480	The next day we'd separate.
437480	443200	Jasper, Daria, and I on our food trip and JP and Visana off to do their good work on
443200	445680	behalf of Rotary Club.
445680	450800	So at a hotel restaurant near the water, we had our dinner and raised a glass to the journey
450800	454960	before tomorrow, starting the real one.
465560	470920	There's an old story that about a thousand years ago, a monk named Tong Su made a pilgrimage
470920	475640	to what's now Myanmar to study under mon Buddhist teachers.
475640	480760	He'd eventually settle here, building a temple in the remote mountains near the River Kwee.
481520	487040	Now Tong Su was known as a healer, and his reputation drew followers, forming a settlement
487040	490600	of mon, Karen, and the ethnic dye.
490600	497040	Today it's a place known as Sangkla Buri.
497040	501600	This part of town, this side of the water, is the home of the ethnic mon.
501600	506120	And before we get into anything else, let me talk about the food.
506120	511040	As I mentioned earlier, the mon were the first to bring rice farming to Southeast Asia, coming
511040	516320	from what's now China in the Yangtze River basin about 5,000 years ago, following the
516320	523280	rivers to the south, first settling the Irrawadi, then the Chao Praia, then everywhere.
523280	527840	Now there's not much known about ancient mon cuisine, that's why we're here, but
527840	534240	there are a few dishes among today's mainstream Thai food that we know trace back to the mon.
534280	539240	There's Khao Kluk Gapi, shrimp-paste fried rice, served with an assortment of meats and
539240	543200	vegetables and based on a traditional mon dish.
543200	548840	There's Khao Cheh, rice soaked in chilled jasmine water and associated with Songkran,
548840	550600	or the Thai New Year.
550600	557080	And most of all, Khanom Jeen, Thailand's favorite noodles, served from the far south along
557080	561680	the Malay border all the way to the old Lan Na Kingdom in the north.
561720	564800	Khanom Jeen was the signature of the mon people.
564800	571080	In fact, the name, while today meaning Chinese snack, actually derives from a mon word,
571080	572760	Hanom Tien.
572760	575000	And it's not unique to Thailand.
575000	578760	The noodles themselves are a part of the cuisine all across the region and wherever
578760	585000	they show up, it's an indication that sometime, hundreds or thousands of years ago, there
585000	590480	was mon influence and culture, an ancient trade route or a mon settlement or civilization
590480	593640	long since destroyed or assimilated.
593640	600120	In Vietnam, the noodles are called Boon, Num Ban Chok in Cambodia, Idiyapam in South
600120	604320	India in Sri Lanka and in Myanmar, Mohinga.
604320	621840	So we actually, we have not arrived at the market yet, that's down the hill and it ends
621840	624600	soon so we need to rush.
624600	630680	But the very first thing we saw was a Burmese lady selling Mohinga by the side of the road
630680	632800	and with fresh Khanom Jeen noodles.
632800	637760	So that is extremely exciting and we are detouring on the way to the market and hopefully
637760	640360	we still have time to make it there.
640360	642240	But right now, I don't really care.
650240	655640	Mohinga is the national dish of Myanmar, a soup made from fish stock served with fried
655760	661520	garlic, chickpea fritters and here, condiments including what I think is tamarind but I don't
661520	666640	know because I don't speak mon and communication might become an issue.
666640	669640	That's alright, we can talk through food.
669640	674840	I might just sit right here because the other customer just left and we're going to chase
674840	678000	this with some water.
686000	689600	This is the first time I understand why all of our Burmese friends say we have to start
689600	695080	every day with a bowl of Mohinga, not to insult the restaurant version of this dish but it's
695080	696800	clearly not made to be a restaurant dish.
696800	702320	This is so comforting, subtle, I would say a lot less fishy than I expected.
702320	706320	Look at him, look at him, look at the namgom.
707000	716800	Plus, what dish is not made better with crispy fried garlic, this is just, it's very, very
716800	717800	good.
725400	729360	With breakfast done, our destination was the morning market.
729360	733680	Open every day from 5 a.m. until about an hour after sunrise.
733680	737520	The early morning in Sanclaburi has a feeling all its own.
737520	742240	The quiet stillness of the remote mountains punctuated with the sounds of two-stroke engines
742240	747240	and people on their way from place to place, with an energy of somewhere both welcoming
747240	749760	and incomprehensible.
749760	755520	Everyone going out of their way to smile or watch us walk by, a warm start to the day,
755520	761240	and also a reminder in case we ever forget that we are very much outsiders.
761240	765160	In the thousand years or so since the first settlers followed Tongsu and built a home
765160	770640	here in the valley, while the entire world has grown up, the Mon language and culture
770640	775400	has more or less remained the same, although for the people themselves it's been a long
775400	780800	and often tragic journey and one that needs to be understood to gain any kind of context
780800	783200	about where we are.
783200	788840	At the time Sanclaburi was established, the Mon were the rulers of what's now Thailand,
788880	793760	having built a kingdom called the Dvaravati, based in what today is the neighboring province
793760	795840	of Supanburi.
795840	801560	For this part of the world this was the first real empire and it was Mon, establishing trade
801560	806720	with China and India in bringing religion from Theravada missionaries.
806720	812880	The Dvaravati would fall to another Mon kingdom, the Lavo, which would gain even more influence
812880	818120	and territory and the Mon seemed destined to rule Southeast Asia forever.
818400	820520	But that's not what would happen.
820520	825600	In the 11th century the Lavo would be defeated in a series of battles by the Khmer and would
825600	828280	become a sort of vassal empire.
828280	834920	The Khmer would absorb Mon language and traditions and people too, enslaving a huge number of
834920	836440	the Lavo.
836440	841280	Then 400 years later the Khmer would fall to Ayutthaya in the ethnic die and the last
841280	844400	vestiges of the Mon would disappear.
844480	848240	To the west this story would be completely different.
848240	853400	Far removed from Angkor or Ayutthaya, in what's now Myanmar the Mon had been locked in an
853400	859160	ancient and endless war with their rivals, the Bha-Mar, the rulers of the powerful Pagan
859160	860560	Kingdom.
860560	865880	In the 1200s just as Thailand's Mon were being crushed by the Khmer, Myanmar's Mon
865880	870320	gained the upper hand, establishing their own kingdom.
870320	875320	As it relates to our story where things really developed here in Sanclaburi as a Mon town
875320	881760	was win in the 16th century, that kingdom would fall again to the Bha-Mar and thousands
881760	887720	fled the massacres that followed and came to the remote jungle lands here, around Tongsu's
887720	888720	temple.
888720	893480	Anyway, long story short, over the border the clashes continued for another two centuries
893480	900080	between the Mon and the Bha-Mar, with the Mon finally routed in 1757, the Burmese army
900080	905200	chasing them as far as Ayutthaya and then raising that city to the ground.
905200	909200	Now it's worth mentioning that since the ethnic Mon had long been absorbed and welcomed
909200	915760	into Siamese society, many of the nobles in Ayutthaya's court were of Mon descent.
915760	921760	And as both Toxin, who revived the Siamese empire in Tonburi, and Rama I who'd built
921760	927280	the palace in Bangkok both had Mon roots, there was plenty of room for the new refugees
927280	930800	to integrate into the new Thai kingdom.
930800	933240	Again though it was different across the border.
933240	938320	The Mon and Bha-Mar had now been at war for almost a thousand years, with the violence
938320	942640	persisting until the British arrived and enforced an uneasy peace.
942640	949280	They carved out a Mon state, bordering Thailand and ending just across the hills from Sanclaburi.
949280	957080	Then the British colony fell, the war began again, and it is very much still ongoing today.
957080	962920	And we'll pick up that story later but first, we've arrived at Sanclaburi's Mon village
962920	974120	morning market.
974120	980640	This is such a cool atmosphere, it's really hard to explain how unlike, this reminds me
980640	985640	of Yunnan province, it's the only place I've ever been where you know you can go deep into
985640	989800	the countryside, at least the last time I was there and you end up finding these village
989800	994360	markets where everything is different, the languages are different, the people are just
994360	1006520	differently.
1006520	1010000	One thing by the way, if you're listening around me, I don't recognize the languages
1010000	1011080	that are being spoken.
1011080	1016920	So, from what we understand, Thai, Burmese are both minority languages here, the majority
1016920	1022760	language is Mon, Korean is a secondary language, so good morning.
1022760	1027000	So there's a lot of languages being spoken that I have never heard before.
1027000	1033640	Yeah, let's go into the market, we have one hour before this since, the dog is literally
1033640	1058400	playing with him and asking for cabbage as treats, that is so funny.
1058400	1075520	This just smells so good.
1075520	1080540	And I just hope somebody comes here to let me eat some of this, Honglei is usually made
1080540	1087280	with pork belly, this looks like beef, but I'm not sure what that is or what the difference
1087280	1091440	is, we've got four different types of bowls of stuff here, there's something cooking back
1091440	1095960	there so somebody's going to come back to this house and let me eat.
1095960	1100800	Here comes our man, he just went and picked up something.
1100800	1105200	I'm not sure what happened when we followed the smell of food cooking to a platform just
1105200	1111120	behind the morning market, but the long story short is that this is not a restaurant, it's
1111120	1116880	the house of a very confused Mon family who probably didn't expect their own day to start
1116880	1127000	with Jasper and I barging in trying to order breakfast, Toto we're not in Kansas anymore.
1127000	1131880	There's a section of Sangkla Burri intended for visitors, a place with at least something
1131880	1136160	of a tourist infrastructure and we figured this would be a good time for us to maybe
1136160	1142440	go down there, to shake off our embarrassment and see the other side of town and maybe find
1142440	1153520	a place to actually sell us something to eat.
1153520	1158120	The walk from the morning market to the quote tourist center of Sangkla Burri is only about
1158120	1163880	400 meters, maybe five minutes up one hill and down another, but here, for at least a
1163880	1167520	few square blocks, the vibe is completely different.
1167520	1173840	A pretty straightforward cluster of optimistic trinket shops, signs in Thai and even English
1173840	1180560	and restaurants serving dishes more well known by the general public.
1180560	1188640	We stopped here for a famous place that sells Joe in Chinese kanji or Joke in Thai, this
1188640	1195360	one with what looks like ground pork, crispy garlic, a bunch of ginger, a soft and semi
1195520	1203920	runny egg, and of course, patonggo, which is what in Chinese you would call yotiao, Chinese
1203920	1212800	donuts if you will, so you should have this with your Joe, but actually that's very good.
1217440	1222000	I never ordered Joe, I don't know why, because I lived in China for so long I kind of never
1222000	1227120	saw the point, you know, this is what you eat when you don't have enough rice so you
1227120	1230800	boil it to make it stretch longer, but maybe that's a little unfair, this is delicious.
1234080	1239200	I have work to do, I've got two coffees.
1239200	1243920	The bridge that connects this mon settlement with the other side of Sangkla Burri is the
1243920	1250320	symbol of the region, the biggest man-made wooden bridge in Thailand and at 850 meters,
1250400	1255680	one of the longest on earth, an attraction that brings at least some curious onlookers to the
1255680	1262400	town, usually after visiting the waterfalls in the Khao Lam National Forest. It's a bit ironic,
1262400	1266880	kind of a metaphor for the region I guess that this bridge only gained attention and the village
1266880	1273200	first saw visitors in 2013, not because of its grandeur, but because it made the national news
1273200	1280480	after being destroyed in a flood, then rebuilt by hand the next year. It's an engineering marvel,
1280480	1286000	each piece of wood cut from the nearby forest and all of it done by hand, no heavy equipment
1286000	1292720	needed. It's called the Utama Nusorn Bridge, named in honor of a mon Buddhist monk named Luang
1292720	1300800	Po Utama, and that brings us back to where we left off, when the British left Myanmar in 1948.
1301760	1306160	We pick up with the Bahmar now in control of the newly independent country,
1306160	1310080	for the record in case you're wondering, yes the name Burma comes from a word for
1310080	1316640	Bahmar, and actually so does Myanmar, both variations of the same term. Anyway, with the
1316640	1321600	mon state now no longer under any kind of protection, an independence movement took hold
1321600	1327680	and the Burmese sent in the military to shut it down, and by that I mean they pretty much laid waste
1327680	1332800	to the whole region. One of the mon villages destroyed within a few months of the end of
1332800	1338320	colonization was a place called Yebu, once home to a population of a few thousand,
1338320	1345760	about 40 kilometers northwest of the Thai border at the Three Pagodas Pass. In June 1949, Yebu was
1345760	1353200	burned to the ground and a local monk, Luang Po Utama, gathered around 60 families and led them
1353200	1358160	through the mountains, avoiding the Burmese patrols and crossing into Thailand where they'd
1358160	1364320	settle their own corner of Sangkla Buri. Now to that point this region was fraught with its own
1364320	1370800	ethnic tensions, with occasional flare-ups between the various different groups, but Utama was a bridge
1370800	1376720	builder pun very much intended, and the land his followers settled was actually in a village that
1376800	1384480	had previously been majority Karen, a place called Nong Lu, a Karen word meaning roofs made of palm leaves.
1385200	1390240	The mon areas in Sangkla Buri were scattered throughout the valley, and the main town became
1390240	1395600	something of a diverse community, with the new cultural center a temple Utama would build in
1395600	1402240	1953. Now that's all on the other side of the water, where our hotel is and where today there's
1402240	1407840	something of a small but reasonably developed city. The bridge itself would come decades later,
1407840	1414480	with construction led by Utama himself starting in 1986, connecting Nong Lu to a village on a
1414480	1421680	peninsula that until almost that time was neither a village nor a peninsula. Everything we've told
1421680	1427200	you so far about the history of Sangkla Buri, from Tongsu's pilgrimage to the death railway and even
1427200	1433360	Utama's new settlement, was based around the river Kwe. It gave life to the region and all
1433360	1438400	through the centuries as new migrants arrived, they'd settle pieces of land along the river.
1439120	1445520	But in 1979 construction would begin on a hydroelectric power plant, which would dam the river,
1445520	1451440	about 80 kilometers to the south. In 1984 the work would be completed and the ancient valley
1451440	1457120	would begin to fill with water, and within months, a thousand years of history and the homes of countless
1457120	1464080	people would be below the surface. Now many of the families that lived in the valley were refugees,
1464080	1470080	undocumented migrants and ethnic minorities, and as they'd lived off the grid, they had no citizenship
1470080	1476320	and thus received no compensation. But thanks to Utama, along with a grant of land from the Thai
1476320	1482800	government, Sangkla Buri came together to help build a new village, a home for displaced families
1482800	1488400	who'd once come because they'd already been displaced by any of a dozen wars and conflicts,
1488400	1495680	both recent and very, very long ago. And that is the story of where we've spent this morning,
1495680	1501120	and the people we've encountered in this unique place, keeping alive a culture long lost with
1501120	1518800	their own history just below the water. Wow. I've never, I've never seen anything like that before.
1523680	1524400	That's insane.
1527600	1530400	It's almost surreal in real life. You know what I mean? You can see pictures of it,
1530400	1536080	but when you're actually right next to something where, you know, it's incredible.
1560400	1575120	It's
1580080	1587120	welcome.
1590400	1619680	We had about an hour left before we'd need to meet up again with JP and Visana to travel
1619680	1625120	further into the countryside. So we asked our boatman where he'd go for lunch if he wasn't on the
1625120	1632320	water and he sent us here to a local mon restaurant just past the mohinga stall where we'd started
1632320	1639360	our day. First of all, tell me what we're eating. What is this? This looks amazing.
1649680	1673520	The specialty here is a dish called hang le, actually quite well known in Thailand and
1673520	1678400	something I listed among my top 10 favorite Thai foods in a video we did last year.
1679120	1684560	It's known in Bangkok as a dish influenced by the Burmese, something that probably came from
1684560	1689840	Myanmar. But this is the first time I've ever known the real roots of hang le,
1689840	1693840	a unique specialty not of Myanmar itself but of the Mon people.
1708400	1729840	Oh my gosh. That smells amazing.
1738400	1749440	Crispy pork, excuse me, crispy pork skin. Everything is better with pork rub.
1751360	1756720	Crispy pork skin, everything is better with crispy pork skin. I did not expect that in a stewed vegetable dish.
1760000	1762640	This is just the best version I've ever had of this.
1762640	1789520	Thank you so much. Okay. Thank you.
1790480	1793920	Now, can he tell us what he just said so that we can actually translate that on screen later?
1796000	1799360	Okay, we just had one of the best meals we have ever had in Thailand,
1799360	1804800	the best hang le curry I've ever had. We have 25 minutes before we need to be back on the other
1804800	1809680	side of the lake. After we cross the bridge, that's where our drive is meeting us because we have
1809680	1814720	plans all afternoon. But I just saw somebody down the road here that's serving on no khao soi.
1814720	1818720	And so we're going to try and fit that in. This is going to be the fastest food segment we've
