start	end	text
1818720	1822800	ever filmed, but we can't come all the way to the Myanmar border and not have a bowl
1822800	1835600	of homemade on no khao soi.
1849440	1861600	We got to run.
1872080	1877840	In 1949, after Utama's successful journey with the 60 mon families to Sankla Buri,
1878400	1883760	it wasn't long before more refugees would follow. At first, it was family members and
1883760	1890400	neighbors of that first group of modern arrivals, but in 1962, the trickle became a constant flow.
1891280	1896880	That was when Neh Nguyen seized power in Myanmar in a military coup, and in one of his first
1896880	1902720	moves, his government outlawed the mon language, mon culture, basically erasing the mon people.
1903520	1908320	When the refugees would come, many would arrive illegally, but through work they'd at least
1908320	1913920	earn Thai registration and according to the law, their children born here would become Thai citizens.
1914560	1920080	But that law would be repealed in 1972, in large part because of just how many people
1920080	1926000	were pouring across the long border from Myanmar. This change didn't just affect the new arrivals,
1926000	1931440	by the way, but also many of the hill tribes in the border regions who spoke their own languages
1931440	1936960	and lived separated enough from society that they couldn't actually prove that they'd always been
1936960	1943600	here. In 2008, the Thai government reversed the law again, but since then, very few applications
1943600	1949280	for birthright citizenship have actually been accepted. There's a simple truth which is that
1949280	1958480	the Thai-Burmese border is long. In fact, 2,416 kilometers, about the same as from Paris to Moscow.
1959200	1963440	It's impossible to police and with so much turmoil on the Myanmar side,
1964080	1971120	there are a lot of undocumented immigrants. When a child is born to refugee parents on this side
1971120	1977440	of the line, the newborn is neither Burmese nor Thai. They're stateless, which means they don't
1977440	1982800	have a passport, but also that they don't receive government medical insurance. They can't buy a
1982800	1989760	smartphone, can't open a bank account, or get a legal driver's license. As of 2023, according to
1989760	1996720	Thailand's Health Security Office, there are 520,000 stateless persons residing in the country,
1997360	2002800	and many of them are here, living a life of survival in places like Sanclaburi.
2007120	2008720	Let's see what we have at the convenience store.
2012960	2018640	Can I have just a Coke?
2032080	2034240	This doesn't even need to be part of the video, I just wanted to,
2034240	2036640	I don't like to come here and not support and buy something.
2043520	2049680	It's about 2 in the afternoon and we've been taken by JP and Visana to ride along with the
2049680	2055600	medical worker from Children of the Forest, the organization supported by the Bangkok Rotary Club,
2055600	2060560	on her rounds as she checks in on some of the makeshift communities built on the outskirts of
2060560	2068960	Sanclaburi. This place, the home of about 125 people, is mixed between Maan, Khorin, and Burmese,
2069520	2074640	all living on a remote property owned by a monastery, which allows migrants to stay and
2074640	2083280	build their own places to live for a rent of about $5 per year. Delito, the medic, is herself a refugee,
2084080	2089760	first coming into Thailand from a city in Maan State about three hours away. That was almost
2089760	2098320	24 years ago. Obviously, a lot of people who come here, it's not easy. I'm sure when you came,
2098320	2104800	you didn't speak Thai, or did you, when you first arrived? I can't speak Thai, okay? I'm really
2104800	2113840	scared. I don't have any paper, but it's lucky one of the Thai men is take me with his motorbike,
2113840	2121760	we passing to the checkpoint, but before it's my job is I'm working also the boyapun on the
2122400	2129600	on the what is the hospital, like a clinic near the border. So when we take the patient
2129600	2136560	to the Thailand, we have a border pass, like a letter you can take. So the also the people
2136560	2143440	is around there, they know as I just come and go, so they're not checked. So I live here. Since
2143440	2150160	of I came in here at the Sangla Buri about six months later, I have a paper, not Thai
2150160	2157520	idea. I have a paper after that. Now I have a serial card. There are hundreds of settlements
2157520	2162320	like this throughout the border region and Delito tries to visit each one once a month.
2162880	2168880	More often, if there's an urgent need for medical service, like here where there's a newborn
2168880	2179360	from a one single mother, this scare and then she's a single mother. And then her job is making
2179360	2185520	broom. But now is the this house is not their house. The owner didn't come because of no broom
2185520	2195520	flower here at the moment. So she no job. But since of she have a baby about 10 days. So her
2195520	2201680	mother is people around here contact me, she have a problem, no food, no husband. And then please
2201680	2209760	come and help. So we come and helping her now is her baby dead. Since this land is owned by the
2209760	2216160	Buddhist temple, nobody gets turned away, which means not only is this place known as Frogstream
2216160	2221520	Village, a mixture of languages and cultures, but also of the needs of the people here.
2222240	2227200	For some, it's a temporary stop, a place to stay until the next job comes along in the orchards
2227200	2233680	or rubber plantations. But for many, it's the only option. Among the people staying here are also
2233680	2239760	those who are disabled or look after disabled family. There are single parents, the elderly,
2239760	2244880	people without any other options. In fact, some of the residents living in makeshift
2244880	2251760	housing close enough to Myanmar to hear the gunfire have been here for as long as 25 years.
2253120	2260560	Her daughter is have a polio polio. Yes. Since I was born, he said about one month and then
2260560	2271520	get sick and then like that. But his wife is a die. When she's a three years old, but now she's a 22.
2279200	2287920	This house and then we helping. Helping is when the kids sick. One of the boys is get sick and big,
2288320	2296080	upset and then take to the, take down to the Ratchaburi hospital. And then this house
2296080	2303360	is we have we also also the pregnant woman around here. So she have my telephone number
2303360	2309920	who have a problem and then they worry they can't speak Thai or they don't have ID card and then
2309920	2315760	come and contact her. She have my telephone number. She contact me just before she said one of the
2316480	2321760	patient who have a problem with the leg is a car. No money to go.
2326880	2333040	It's not all despair at Frogstream Village. Many of the children are now students at Delito's school,
2333040	2338000	Children of the Forest, where not only do they learn Thai, but also gain something priceless.
2338720	2345040	A name, a registration, not citizenship, but legal documentation and access to the Thai school
2345040	2351920	system. Hope. For the people living here, there is work. They've formed something of a village
2351920	2357440	business, collecting a special kind of plant, which grows in the nearby mountains. This is
2357440	2363440	the making room. And this is the business here. This is the people in here that that is the main
2363440	2371520	the main business is making room. Okay. And they sell this room. There is a room factory here.
2371520	2376480	And then they're making room here. And then this room they take to the whole Thailand Bangkok or
2376480	2380400	everywhere. Really? Yes. Yes. That is all is from here.
2388160	2392400	This is hard work. You see how intense that I mean this is thick. This is packed in really thickly.
2393680	2396320	I would stab myself right through the hand if I even tried.
2397280	2415360	I have a feeling in the mon language, he's hilarious. I just don't understand anything about that.
2415360	2422640	Oh, he said, uh, if, if you come and buy with the dollar, it might be, he said it's a very good,
2422720	2430320	good for them. If you have like, it's been more than 10 years since I've been back to America.
2430320	2431920	I don't have any dollars. I would love to.
2436480	2443120	So we found we've somehow this still is a food video because even here, even
2443840	2451840	along the Thai Burmese border, in a refugee village, for people who don't have Thai ID,
2451840	2460480	who don't speak Thai for the most part, Mon Karen and Burmese living here on the land
2460480	2465600	owned by a Buddhist monastery, we have still found somewhere serving food. And we have our
2465600	2473600	favorite sticky rice flour and what looks like black sesame doughnut and some squash,
2473600	2479840	which she's giving us with a dipping sauce. As we were about to leave Frogstream Village,
2479840	2485840	I noticed something that caught my eye, a restaurant or more accurately, a snack counter,
2486400	2491600	serving things like fried chicken, sticky rice, pastries and the kind of fritters you'd see in
2491600	2498640	any proper Burmese market here open for business servicing a refugee camp of 125 people.
2498640	2507440	Okay, no Ken, no problem. Yeah, yeah. Please, please, please.
2518160	2523280	I'm sure. Is that what she said? Not done every day? Is not every day people come to film
2523280	2536480	food video here? They're going to be famous for their food, you can tell it is, is they're
2536480	2539200	going to be famous for their food when they're on on our OTR.
2539440	2553840	It was like the best, best franchise we've ever had. That's a good comparison. It was really good.
2558400	2558960	Thank you very much.
2570160	2579040	As we left the village to head somewhere else, Delito received a phone call. It was her mother
2579040	2584560	in Myanmar, letting her know that she was safe as their home village had been bombed by the Burmese
2584560	2591520	military earlier that same morning. It's a fact of life for her living here in safety while every
2591520	2597840	day she worries about her family three hours away. Can you go home right now? There's the border.
2598160	2602400	Can you go back to visit your family and come back in Myanmar to Thailand or not right now?
2603120	2610160	Right now, now is the way it is. In Thailand you can go, but in Myanmar they're closing the road,
2610720	2619520	so have a wall in there. They're closing so you can't go. Even now my mom's hometown is fighting.
2620000	2630320	And here it's safe and then if you if you have like a one-day working, you can buy food right
2630320	2641120	in Myanmar. It's no job fighting, no food, no job, so people is just, just even with all the trouble
2641120	2648160	of coming here with no ID, it's still better than maybe some people's safety in Burma.
2649600	2655360	Safe, safe, safer than Burma because again here is no fighting, right? Even if you don't have money,
2655360	2661680	but only you have to scale when they come and take, you scale again. So if you like,
2661680	2666000	living in the jungle, you're walking in the rubber garden, that is your safe life.
2666800	2669680	That is what the people here around here.
2672720	2677920	So this is, if this looks improp too, it is improp too, and I was just telling your father
2677920	2681760	actually is behind us that my favorite thing about filming is when I don't know what's going on
2681760	2685360	and somebody just says, hey, at this time you need to be here. I'm like, great, that's awesome.
2685360	2690640	It's less work for me. Okay. I've been told now that we needed to be at Children of the Forest at
2690640	2694240	3.30, which I don't even have time to process where we are. We'll do that tomorrow morning. Okay.
2694240	2698640	But we just got here, we changed vehicles, we're in another pickup truck and going right back to the
2698640	2703200	back. Where are we going? Okay, so we're moving from, you've just been to some of the villages on
2703200	2709440	the road. Now we're going off road into the jungle, see some rubber plantations quite deep in the
2709440	2714320	jungle, about 15 kilometers into the jungle. And we're going to visit some of our students that
2714320	2719120	come to the school, give you an idea of just how far our students are prepared to travel,
2719120	2724320	just to get an education. And you'll meet some mothers and you'll meet some patients as well
2724320	2729760	that were helping. So it should be an interesting trip. Amazing. And then I see there's a cooler
2729760	2733600	being loaded into the back of the, into the back of the truck as well. That's right. Yeah, we've
2733600	2739280	got a, we thought might as well treat the villages there. We know them quite well and make it exciting
2739280	2744640	for them. So we're going to, they're doing a little bit of food and that now, enjoying doing that.
2744640	2748640	And we're going to take some ice, take some coke and some snacks for the kids over there as well.
2749360	2760480	Anthony Bourdain once said that the greatest meals you could ever have are the ones you don't go
2760480	2766720	looking for. Instead, life is about putting yourself in a position where they might just
2766720	2773760	happen. Like jumping into the back of a pickup truck heading as deep as the path goes off road
2773760	2774480	into the jungle.
2781200	2784320	There was a time, I remember when I was a little kid, when I could be in the back of a truck
2784320	2790160	and just get tossed around and it was no problem. And now every single bump I'm like in 10 years,
2790160	2791520	that has been a murder in my back.
2791520	2808640	Guys, Jasper, this is going to make a really bad headline if I lose my balance and just crush
2808640	2812480	and crush the kids. That's going to be really bad for everybody.
2815920	2821280	I love how the car is driving so much more gently now that all the kids are in the back.
2821280	2828480	When it was just us, it was like, no, I hope nobody knows that word.
2829920	2834880	I can't swear around the kids. This is why I could never be a teacher.
2839360	2844320	Yeah, I don't know if this is translating to video, but we are, this is just a straight drop
2844320	2852240	off everywhere along the side of the bus. It's just a dead drop the whole way. I'm going to
2852240	2855920	give this back to Jasper because I clearly have no idea how to operate a camera. But yeah,
2855920	2859120	we have been driving alongside a straight drop and there keep being times when
2859840	2863360	they'll yell out to us, hang on tight. This is a slippery part.
2863360	2876720	Well, the car has stopped and we are surrounded by people and I almost forgot that we were,
2876720	2880640	we had a direction. I was just going to keep going and then we're just going to end up as deep
2880640	2883840	as you can get in the jungle and then we're going to turn around and come back and I can't
2883840	2893920	believe that there's a settlement here, but oh my God. Everyone's even kids are laughing at me.
2898400	2900320	My back, what back? My back is done.
2906560	2910240	There are things that you see and experience once in a lifetime,
2910960	2915840	places that open your eyes to a world so far removed from anything you've ever encountered
2915840	2922560	that you can't help but leave a different person. This is one of those places. It's a makeshift
2922560	2926720	settlement so far into the jungle that for six months a year during the rainy season,
2927360	2933760	it's completely inaccessible. The only way in or out a four hour hike each way to reach the nearest
2933760	2941040	paved road, a hike that unbelievably many of the 30 children who call this enclave home make every
2941040	2946800	single day just to get to school, to receive an education and get that life-changing piece of
2946800	2955520	paper documenting their own existence. Our host is Daniel Hobson, born in the UK, but in Sanclebury
2955520	2961360	for two decades. The founder of Children of the Forest, the place the kids here find their hope.
2962320	2967200	Why would somebody build a house here? This isn't just, I want to be deep in the jungle.
2967200	2972560	Are the parents working for the rubber? Are they independent? Are they working for rubber
2972560	2979920	companies? Why does this exist? Yeah, you're right. It's the following work, which is typical of all
2979920	2983200	the stateless families really around this area. Wherever the work is, that's where they'll go.
2983200	2988720	They don't have their own land, their own home, so they'll follow where the work is. And at the
2988720	2994000	moment the work is here in this huge rubber plantation, which they'll be tapping tonight
2994000	2998640	from about 12 o'clock. They'll start tapping and they'll finish maybe seven or eight in the morning,
2998640	3005200	so they'll sleep during the day. And that's every day, or that's seasonal? In the heavy rain,
3005200	3009840	you can't tap the rubber, but at the moment it's kind of the best time of year. That's when the
3009840	3015120	rubber is flowing, the best is right now. So they'll be tapping it for three nights and then they'll
3015120	3020480	take a break one night. Do you find the kids that you teach, or that your teachers teach, coming
3020480	3025280	from a place like this, where they have to... I would guess that somebody who would go to the
3025280	3032160	initiative of walking 12 kilometers, each direction to get to school every day, is going to not be
3032160	3038720	lax with their work. Is that fair? That's a fair statement. It's great to see the motivation
3038720	3042960	just to get to school. It takes them probably about two hours to get to school. And then once
3042960	3046880	they're there, yeah, they're going to take that opportunity to study hard. And we've been working
3046880	3052800	with this village now for almost 20 years. So we've actually seen children that have studied hard,
3052800	3056960	gone through the elementary school, gone on to high school, and are actually now studying in the
3056960	3064240	city to be teachers, community development workers, hotel management, vocational colleges.
3066160	3069920	And what are we looking at real quick, just so we understand, these are all houses around us,
3069920	3074480	or is this like a platform, which I guess is just for communal meals? I don't know,
3074480	3079040	if you can kind of explain to me just what we see, is every building going down this way,
3079040	3087040	a family's home? Yeah, that's right. Every building here is a home. There's a community spirit here,
3087040	3091440	even though, strictly speaking, it's not a village, it's not a community. It's just workers that are
3091440	3098560	on the land, the landowner of the rubber plantation happens to own. But there's a community spirit,
3098560	3103920	and they're all Karen in this area. So these are all, these are all Karen families? Yeah,
3103920	3108320	that's right. So it would have started with just what, one or two families when they, and then
3108320	3112480	they ask their cousins and distant cousins to come, and then they kind of build up a
3112480	3115600	village because, like you said, following the work, coming here for the work.
3117120	3122080	The Karen tribe of Thailand's far west are also like the Mon, an ancient people,
3122080	3127760	with their own history in Southeast Asia dating back at least as far as the third century AD.
3128640	3134720	But unlike the Mon, there is no unifying Karen culture or identity. The Karen are a Highland
3134720	3139360	people, scattered throughout the mountains of Myanmar and Thailand, and as far as the Andaman
3139360	3144400	Islands off the coast of India. And their settlements were built so far apart that in different places
3144400	3149760	they practice vastly different cultures and traditions. But like the Mon, they're also
3149760	3155120	marginalized, and also at war with the Burmese government in a fight for ethnic autonomy.
3156000	3161680	That's the story for the families that live here. Refugees who fled persecution and now get by
3161680	3167040	working the rubber trees in a harsh and unforgiving landscape, starting again at the very bottom of
3167040	3173040	society, completely cut off from the conveniences of 21st century urban life simply because of who
3173040	3179600	they are and where they were born. Like everything else here in the settlement,
3179600	3184400	food is usually based around what can be farmed or foraged in the nearby mountains,
3184400	3190880	along with staples like rice purchased with hard-earned income. But today we're in for a treat.
3191760	3196640	This morning, while we were in the town, Daniel went to his own local market and bought a whole
3196640	3203360	pig, delivering it here a few hours earlier. And since then, a few of the villagers have been
3203360	3210160	hard at work, preparing a true feast, a celebration of life and survival, and to welcome us to their
3210160	3214960	small corner of the jungle with their very best Karen hospitality.
3218480	3223360	So earlier today, some of the guys who we came here with went to the local market and bought
3224160	3228800	some fresh pork, which apparently was just as fresh and amazing as it gets. So then they've been
3228800	3235760	cooking all day to prepare this feast for the village tonight. We have pork curry. This is
3236320	3240480	this is rice because obviously it's all going to be based around rice. So pork curry, rice,
3240480	3245200	this is a soup made from the innards of the pork. So we have intestines, we have kidney,
3245200	3252880	we have liver, and then we have the meat from, I see hoof and I see spine along with gourd and
3252880	3261680	vegetables. And that is going to be hearty and flavorful and very healthy. We have eggplants
3261680	3267760	and we have these nuts, and it's going to be served along with the classic Burmese
3267760	3271840	and got the fish paste. And that's what we have. And I think everybody here is about to,
3272800	3276480	they're about to lose it. If I don't say, okay, let's open the floodgates and eat
3277280	3281760	because this just smells and looks amazing. This is really a feast prepared for everybody here tonight.
3291760	3297120	The pork curry is just dynamite. Yeah.
3305680	3308000	Who is the cook? Who do I, who do I compliment? Who is the cook?
3314240	3319040	I just really want to compliment the chef because the soup is mind blowing how good that is.
3322000	3328960	I just, I just, is this the chef? Thank you. Please, please help me to explain that this is,
3329520	3334160	everything is really special. This is incredibly good that I would be proud to serve this at,
3334160	3339120	I would be proud to serve this at my restaurant. She's embarrassed and walking away.
3343920	3349520	As if we needed one more component for a very, very long and very fascinating day.
3350400	3354160	We were on the way home to the hotel and there's a night market and we,
3354160	3357840	the pickup truck stopped and Daniel said, you know what? This is actually
3357840	3362480	pretty cool night market. You guys should check it out. So our day is not quite done yet. We have
3362480	3368240	one more stop and it's the last, the last part of one of the most really, really,
3368240	3373360	unbelievably interesting days we've ever had on the channel. And I need caffeine to keep going.
3373360	3376000	So let's start with a, with an instant coffee.
3380080	3384960	Just a few blocks from our comfortable beds after a day that saw us start at sunrise on the
3384960	3390400	peninsula, explore the Mont Village, take a boat trip around the reservoir, eat a bunch of awesome
3390400	3395920	stuff and then spend the afternoon and evening deep in the mountains. Well, there's still one more
3395920	3402640	stop. And by now, who cares? We can't get any more tired. So we might as well just keep going
3402640	3409360	and do what the locals here in this amazing town do when their hard days are over. Hang out and
3409360	3416080	enjoy the night market. I am so tired. Oh, I forgot that I'm wearing a hat. That I'm like...
3416080	3423920	Cowboy, Daria, you, you could not, you could not look like more of a tourist. Camera around your,
3423920	3429120	camera around your waist and a stupid hat on. It doesn't, at least it doesn't say Ronaldinho.
3433440	3451840	Look at this. The crispy fried garlic makes everything better. I did not intend for you to
3451840	3457200	take that spoon from me. I was showing that to you, not giving that to you. Pretty good, yeah?
3462880	3469040	Daria, you and I have traveled off camera to most corners of Thailand and there's always a market
3469040	3477760	like that. You're a mess with your camera and your, your hat.
3486400	3490240	I've turned into an ATM. My pocket is literally like an ATM now. We're,
3490800	3496400	just, we walk past the, walk past the food stand and all of a sudden there's just
3497200	3503360	money coming out of my, coming out of my pocket. Okay, thank you.
3503760	3521680	All right, before we get to the last part of this video, I need to go into one final bit of history.
3522320	3529600	In this case, our own, or at least why we got in that van 48 hours ago. It starts of all things
3529680	3535200	with ice hockey. Actually, a video we filmed back in March about a donut shop at Bangkok's
3535200	3540160	hockey stadium where we interviewed a man named Greg Beattie, who happens to be the president
3540160	3546320	of the local Rotary Club. Rotary, if you don't know, is a service organization. It was founded in
3546320	3552000	1905 and since then has grown to almost one and a half million members worldwide with a focus on
