start	end	text
0	9520	Cool. Hello everyone, welcome to your course AI for Art, Esthetic and Creativity. Today
9520	19200	we have a very special speaker. She has an excellent background in different domains and
19200	28880	she will tell you hopefully more about herself and her work. Sarah is a great friend and
29520	38480	colleague of me and she kind of accepted to give us a lecture talk today. So from here I
41040	47840	let Sarah to continue. Please go ahead. Thanks Ali. It's such a pleasure to be here. I've heard
47840	53440	so much about this class. I don't think I have a slide about my background but I can tell you a
53440	59920	little bit about myself. I finished my PhD in neuroscience so across the street from Seasale
59920	65920	last year and now I'm a postdoc in the vision group and the journey throughout my PhD was
65920	72320	a little bit of a winding path. I started thinking about explicit symbolic models for things like
72320	77360	physics and we'll talk a little bit more about that along the way. So modeling how the mind
77360	82480	makes inferences about things that we see but that hits a ceiling when we come up against
83120	89120	questions of vision and types of seeing like looking at art that is really difficult to develop
89120	94880	some kind of computational formalism for that we don't have good models for. And at the same time
94880	99280	as I was kind of hitting that wall in my own thinking I was developing a parallel interest
99840	104640	in visual art and doing a lot of different projects both with individual artists and with
104640	111680	larger museum archives that I'll talk a little bit about and started to look at art as a ground for
112240	116560	asking kind of difficult questions on the frontier of our thinking about the mind.
116560	121600	If we look at how humans create art and in view art can we understand something about
122320	126720	how they view the world and domains that we don't yet have good models of cognition for.
127600	132640	So I kind of started steering my my PhD in that direction. I'll share a little bit of that work
132640	138240	as well and as I said now I'm a postdoc with Antonio and Ellie asked me to share a little bit
138240	145840	of my my inspiration behind that path. I don't have a good story about a specific moment I think
145840	152720	it's been a lifelong interest for me since I was super small and reading a lot of poetry I guess
153360	158080	thinking about kind of the the origin and nature of structure and our experience of the world.
158080	164240	I know that's quite an abstract thing but the structure that we see in visual patterns where
164320	169280	does that come from? Is that something that lives inherently in the brain and we imprint it on to
169280	173680	kind of noisy and unordered stimuli or is it something that's external you know a nature
173680	179600	nurture question and then our brains kind of evolve to reflect and I got interested in this
179600	185920	meeting point this kind of layer between the self and the world where all the action happens so to
185920	194000	speak and had training in applied math before I came to MIT and would think about ways to describe
194000	198720	kind of structured inputs to processing systems and understand something about the structure of
198720	204000	external inputs and then my neuroscience background learned a little bit how to how to
204000	208320	think about and model the structure of a processing system right the structure of different parts of
208320	213840	the brain and it's really been through my interest in visual art that we can start to think about
213840	219680	and describe what happens when those two things meet and how we synthesize our world of visual
219680	225040	experience in domains related to art and then other kind of higher level aspects of cognition
225040	231680	like scenes or associations with moods of scenes and that kind of thing so that's that's where I am
231680	238720	now and I think I'd like to start us off unless anybody has any leading questions about where I
238720	245120	come from with kind of a provocation and you can you can think of this as a frame for what I'll share
245120	251200	today but it's intended to be provocative and so the statement I'll make is that visual perception
251200	257520	itself human perception which we attempt to mirror and model in computer vision and computer science
257520	263280	in some cases that human perception is something that's fundamentally constructive and I say that
263280	269360	because it solves an ill posed inverse problem like ones you've probably heard of before and
269360	276080	doing that doing that solving requires a little bit of creativity so where am I coming from there
276080	282000	the back of your eye as you know is is a 2d flat canvas right made up of a hierarchy of cells
282000	287840	that were visualized in in drawing in art by Ramonica Hall hundreds of years ago and are now
287840	292880	visualized using electromagnetic imaging and we can get actually pretty fine brain detail
292880	299280	of the cells in the back of our eye that constitute a 2d canvas that takes in incoming image data
299280	305760	and represents images in terms of patterns of activations via this kind of mosaic of cells
306800	312960	yet we experience this richly 3d world so there's a setup of a problem that you've probably heard
312960	319440	before right 2d canvas but we have 3d rich experience scenes have depth objects have 3d shape
319440	323280	and furthermore what we see carries lots of different meanings and associations
323920	329920	so where is all of that kind of higher level information in a 2d image classical kind of
329920	336640	computer vision problems we look at this kind of painting by Suzanne you might not only recognize
336640	343520	3d structure of this cottage on the mountain side right even though the image itself is 2d
343520	347920	I might have all sorts of associations with it I might be able to say oh it's spring time
347920	352400	think something about the time of year I might even be able to infer something about the geography
352400	358400	by the palette used to convey what fields might be there think a little bit about the landscape
358400	365040	I might be able to appreciate depth in pictorial space so even on this 2d plane if I put my mouse
365040	371120	up here in the front maybe these fields are closer to me as a viewer than these ones that are far away
371120	375120	but once again I'm just looking at a flat picture where is all of that information
376320	381360	our brain has to solve an inverse problem like this anytime we look at a visual scene it has to get
381360	387280	from low two-dimensional information to kind of rich 3d but there's a fundamental problem here
387280	394480	and I pointed to that is that infinitely many 3d objects can cause the same 2d project projection
394480	399680	that's the under constrained nature of this inverse problem that vision poses and you've
399680	405840	experienced this quite explicitly anytime you've seen a shadow and not the object causing the
405840	410720	shadow right and you've had to infer oh is that actually you know a monster on the wall or is
410720	416720	that somebody's hand being projected but there are infinitely many configurations in three dimensions
416720	421200	that could be projected downwards onto two dimensions and cause some configuration in
421200	427920	pictorial space so how do we constrain that problem when we're solving for what we see
428720	433920	right so this problem is ill-posed because it has as I said many infinitely many possible solutions
434640	440560	and choosing between them requires some additional information and in the case of the brain
441280	446240	modern neuroscience understands this as requiring the brain to construct something so that's what I
446240	452480	mean when I say perception is fundamentally constructive or creative it requires the brain
452480	459120	to construct a best explanation of what it's seeing of incoming information and if we call
459120	464320	that perception then maybe you'll permit me to make a bit of a stretch and say that that makes
464320	471920	perception itself an act of creation or an act of synthesis of a scene so one kind of popular
471920	478160	way to solve this inference problem is by using models of the world right and we can approach
478160	482560	that from a Bayesian lens maybe you've seen the work of Josh Tinnenbaum in the bcs department
484000	488400	or maybe we can do that purely with deep learning it's kind of an attention that we could explore
488960	494800	later today but I'll give you an example here and this is let me back up for a second that if we
494800	499520	were in person this is the point where I would do kind of a live in person demo so I want you to
499520	505040	imagine that we're all sitting kind of in a dark room or we're sitting in a studio space and out
505040	511360	in front of you there is a table covered in black velvet and I've set some stuff on that table you
511360	518080	don't know what it is I set it there when the lights were off and then I take a single line of red
518080	523440	laser light and I'm going to gradually sweep it over the scene so I'm constraining the visual
523440	528960	information you're going to receive about what's out there in the world to something kind of really
528960	534320	low dimensional compared to what you normally get to understand kind of a garden of forms that would
534320	539200	be sitting on the table so imagine you're there in the studio with me and you see the following
539840	544240	you have to kind of infer what you see on the table maybe you could write it in the chat or
544240	550080	just think to yourself when you see this give it a moment what's sitting here on the table
552560	554880	or what kinds of things what different things
557680	564240	maybe this would be a good use of the chat I can pull it up or you can describe features of what you see
574560	581120	a bunch of blocks on the table great there's something cubic up now I see the corner there right
582800	588880	multiple vases multiple forms with kind of different underlying shapes something cylindrical yep
589840	593280	two things do you see I think there's a sphere actually there in the middle
596480	601200	what is the experience of this light do you actually feel a physical corner when you see
602080	604560	bent light round the corner of that cube
608000	609680	oh oh goodness
613200	618240	interacting with chat is a bit tough all right anyway the point I want to make here is that
618240	625360	I can present really kind of low level information and you can if I dare open open the chat up again
625920	629680	yeah there's a single base there's a single table and many forms sitting on top
629760	634240	that's right so there's just a tabletop and then lots of different shapes also covered in black
634240	640080	velvet so the light doesn't scatter and the light traces the outline of these 3d shapes
640640	646560	and you can appreciate something about what the shapes are just by watching how light bends
646560	652560	around their surface and the relative motion as it traverses that facade right as it moves
652560	658000	over the surface of the sphere the light bends according to its curvature and I would argue
658000	665760	here that because you have some notion of what a sphere is and some notion of what a cube is
665760	672560	that is you have a relatively abstract model of these underlying shapes in your mind a mental
672560	678240	model you can do some inference when you see light move over their surface on this way even though
679120	684000	I choose an example like this because you've probably never seen this example before right
684800	688320	never seen a single line of laser light move over this table surface
688960	693760	even this this kind of setup but you can still do that inference pretty well and you did in the chat
695120	700400	so if you'll if you'll stay with me here I'm suggesting that this is an example just your
700400	706400	perceptually of how we can bring kind of models of the world and shapes and forms that comprise
706400	712880	it to bear on simple visual stimuli and how we can even do that by using articulated light
713440	719280	to isolate aspects of those stimuli and to kind of elucidate our perception to us
720160	724560	so we do a lot of things like this in the MIT museum studio where I teach the vision and art
724560	729280	neuroscience class which I'll talk about in a moment but that's where this this was filmed
729280	734080	let's see if it'll let me advance even though I open the chat all right so another kind of setting
734080	739680	in which we often hear and think about models of the world and this kind of inference is in
739680	745600	intuitive physics and I bring this up because some of my background is also in this type of work
745600	751680	investigating how the brain represents physical properties like mass that it uses to reason
751680	756720	physically about the world right you would have to estimate the mass of this block that's falling
756720	761520	and making a depression on this pillow before you would know the right amount of grip force
761520	765840	you would need to use to to reach in and pick it up without dropping it right and this is something
765840	771360	we do incredibly automatically and it's a skill set we develop regularly from a very early age
771920	779440	and I found that the brain represents properties like mass with an amount of abstraction and invariance
779440	786160	to the type of physical scene in which mass is revealed that would be necessary if mass like
786160	792640	this were to be used as an input to an abstract generalized engine for physical simulation or
792640	798720	what we call a physics engine in computer graphics and simulation suggesting that there is
798720	805680	kind of some first evidence that the brain does use these kind of generalized simulation engines
805680	811520	to solve low-level inference problems like inferring mass because we can make some hypothesis about
811520	816320	the nature of the underlying representations it would need if it were to solve problems in this
816320	820880	kind of way rather than by simple pattern matching or in a pixel based way where we would assume
820880	825760	that the representation of mass would be quite different from scene to scene because the low
825760	831200	level visual data about the scene is different but in fact that's not what we find we find representations
831200	835840	of physical variables like mass and friction that generalize across any kind of physical scene
836400	841120	that we test where we hold a lot of other different parameters constant right like object color
842160	846880	and this suggests an account of physical reasoning in the brain that has been that has been studied
846880	853040	pretty extensively computational right and that we model via probabilistic simulations of a physics
853040	857840	engine I don't think that video is going to play for us right but this is the kind of work when I
857840	864240	was doing when that I was doing when I was writing down like explicit models of the world that could
864240	869280	be inverted to explain something about underlying parameters we were using for vision and in that
869280	876720	in this case those models were physical right but what about cases like like art where it's
876800	882320	difficult as I mentioned to develop some kind of computational formalism where we don't know the
882320	887520	underlying model for instance how to create the Cezanne painting we saw in the beginning
888240	893280	a priori right how do we even start what are the underlying dimensions we'd need to write down to
893280	901120	either make sense of how we see things or how they're created so this whole area is kind of what we
901120	905680	dive into in that vision in art and neuroscience course so this is something you're interested in
905760	910400	it's of course an unsolved problem but we spend the fall semester every year
911440	916480	kind of delving into it through both neuroscience literature through art practice through computation
916480	922480	and then through studio work so kind of hands-on experimentation with principles underlying vision
922480	927520	that we then externalize and experience ourselves and try and visualize in artistic contexts
929440	932800	to give you a little bit of a taste of that class we would look at
933360	938560	these examples say by by an artist in minor white and ask if we were trying to set up
939360	945520	a typical kind of describe a model and then invert it to understand vision setting you know what is
945520	951680	the veretical percept in either of these right if before we were considering mass of some object
951680	958000	that the brain has to infer and then we can write down a physical law describing how mass plays into
958080	962720	action unfolding in a scene a law describing dynamics and then invert it to think about
962720	967120	how the brain represents mass what would the analog be here what would we write down as the
967120	972320	veretical percept you can share some thoughts in the chat that is also an exercise you could just
972320	978560	do yourself right maybe here you can start to get it a shadow of something outside the window
979120	984960	I see a bike maybe a bike seat there that's kind of not the point kind of not trying to infer what
984960	991040	caused the specific physics of this this image you're kind of getting at something different
991040	997200	and especially here what if the artist isn't around for us to ask anymore these are actual
997200	1003440	photographs right these are photographs of something but the act of looking at it isn't about
1003440	1008560	inferring the underlying cause of the image it's about inferring something else sort of aesthetic
1008560	1013920	parameters that define visual experience or kind of render visual experience at a lot higher of a
1013920	1020000	level how do we begin to get traction on problems like this either in seeing or in or in generation
1020800	1026000	as I said you know in art we also come up against a great difficulty in that you know there are
1026000	1032320	infinitely many ways to render recognizable depictions of common objects right with all
1032320	1038160	sorts of idiosyncrasies illusory boundaries difficult for models to detect but we recognize
1038160	1044800	a woman in these images with the dress almost instantaneously and similarly we come up against
1044800	1050560	another under constrained inverse problem is in that there's infinitely many ways to render and
1050560	1057280	depict kind of abstractions of commonly recognizable forms which again are difficult for
1057280	1062880	current day models but they're pretty easy for us I can recognize a figure and maybe have different
1062880	1069040	associations with it in each of these different images so we think a little bit about this
1069760	1075280	in the course like I mentioned you can ask me a bit after this talk as well if you're if you're
1075280	1081520	interested in it it's called vision and art and neuroscience all of our info is is online most
1081520	1088960	of the syllabus past exhibition catalogs at vision.mit.edu it's offered through through bcs
1089840	1095200	and as I said we we investigate during half the class in the seminar portion of the class
1095760	1099520	kind of the underlying principles of vision and we work through a series of modules
1100320	1107280	that build up visual processes from early level like v1 visual processing all the way up to kind
1107280	1113840	of more rich images and we do this in parallel in a studio section during the other portion of the
1113840	1119360	class where we're translating these principles of vision into the studio and building artistic
1119360	1125200	contexts where we can kind of become aware of our own perceptual processing at work so examples like
1125200	1129120	the one I showed you at the beginning right with the with the laser line moving over
1129120	1134400	that garden of objects are examples of settings that can allow us to maybe perceive our own
1134400	1139840	perception at work right or shed some light on what's going on when we look at at normal scenes
1139840	1144560	right there's all these unconscious inference processes happening even when we look at corners
1144560	1148800	in a room but we're not aware of them and so we ask here if we can create settings
1149520	1155600	where we do become intensely aware of them and that awareness becomes kind of the art experience
1155600	1160960	right and so it's the art of perceiving one's own perceptual processes at work and then over
1160960	1166160	the course of the class everybody develops an individual artwork for exhibition which is super
1166160	1172560	lovely and it's it's an opportunity that we don't often have in other classes at MIT so we run this
1172560	1178880	for five years now had five different exhibitions and COVID be it a virtual exhibition and then
1178880	1186080	this year's just opened in December and is actually still up in the MIT museum studio just off of lobby
1186080	1192000	10 10 150 if anybody is on campus and wants to go check it out it's most it's open most days when
1192240	1199920	staff are there but this course is the parallel to your IAP class that thinks about things more
1199920	1205040	in the language of computational neuroscience than deep learning and in some aspects of the
1205040	1211520	course will present deep learning or deep generative models as contexts for probing representations
1211520	1216720	that might be shared by human minds and machines and we'll look at that a little bit later in this
1216800	1222080	lecture but think more traditional computational neuroscience lectures readings visual art and
1222080	1226880	then a studio component where you experiment with some of the stuff hands on so that's what we do
1226880	1233600	envision art neuroscience we start to to probe at the richness of this art neuro and machine
1233600	1237520	learning intersection there's a lot of different things we can do there and for the rest of this
1237520	1242400	talk we're going to highlight a number of different projects that approach that intersection in
1242400	1247280	different ways and highlight kind of different ways that you could think about engaging this
1247280	1252160	material in these questions data sets and resources that we have available and kind of
1252160	1258480	different ways of carving up the problem into bits so we'll start by thinking about modeling
1258480	1264720	kind of the structure underlying human creativity at scale without trying to prespecify
1265520	1271360	laws that you would write down for say a physics engine right can we use deep generative models
1271360	1278080	to kind of approximate or appreciate or grok the structure underlying large data sets of human
1278080	1284480	cultural artifacts and then use those models to experiment with cultural history on kind of a
1284480	1289600	timeline that allows rapid evolution in the present so I'm speaking specifically about a project
1289600	1293760	that I don't know if some of you have seen and I know Ali has seen a collaboration that I led with
1293760	1299280	the Met a couple of years ago again it was fun that we were in person because we were able to
1299280	1304800	actually go to the Met and see a lot of these objects but back in 2017 the Metropolitan Museum of
1304800	1311600	Art was the first or one of the very first to release an open access catalog of a few hundred
1311600	1317520	thousand digital images of works in the Met collection and released them into the public domain
1317520	1323600	which is wonderful for for us as computer scientists and programmers and people interested in ML and
1323600	1328960	art because what a rich data set that is right what a rich data set all in one place
1328960	1333840	don't get me started on the issues with museum APIs but a lot of museums have followed suit in
1333840	1339440	releasing their digital collections into the public domain so they're free and open for experimentation
1340240	1346000	they approached us at MIT and open learning and a couple of programmers at Microsoft and asked if
1346000	1352080	we might want to do a series of projects with this digital collection and so we did and we asked
1352080	1357600	whether we can build deep generative models associated with archives like this of created
1357600	1362800	work that are embedded in their cultural context which might ask which might allow us to ask like
1362800	1369040	slightly more specific questions art historically than just you know what if you train StyleGAN on
1369040	1374000	all of wiki art all at once right not conditionally so we're not appreciating any categorical
1374000	1379520	differences between images but if we just showed it all of wiki art okay here we want to ask something
1379520	1384880	a little more fine grained can we notice you know differences in the development of feature languages
1384880	1392720	between maybe time periods or geographical regions right and can we develop ways of collaborating
1392720	1399040	with those models to iterate archives forward so experimenting with chimeras between existing
1399040	1404480	works and developing new works right that might sit somewhere between works that are already on a graph
1406080	1411840	so one of the challenges that we faced here initially was that the data set was pretty big
1411840	1417040	400,000 images but each individual category in that data set was not some might only have
1417040	1422800	a couple hundred images and there's a lot of sketches and drawings and kind of uncategorized
1422800	1429120	work too that makes up that 400,000 so you're in a situation where in theory you have a rich
