start	end	text
1429120	1435120	labeled data set but in practice it might be quite difficult to train anything that looks
1435120	1439600	photorealistic or gives a good sense of any individual category of work because the categories
1439600	1446480	themselves are not that large so at that point this was pre like style again too we started working
1446480	1454800	on this in 2017-2018 um I asked whether we could instead of training a single model on say a subset
1454800	1460960	of this met collection like this category of vases called yours whether we could find corresponding
1460960	1467680	subspaces of what we're now referring to as foundation models like big an image net that kind
1467760	1473760	of approximate our data set right so if we think about foundation models as a shared resource that
1473760	1478880	ideally everybody would have access to and there were ways to think about contributing to then maybe
1478880	1485680	these smaller problems become or can become a way of defining subspaces of those big models that we
1485680	1491520	can interact with right rather than having to retrain a model and on our data set so we used
1491520	1496240	GAN inversion here and instead of training a new model on just this category of viewers
1496800	1502160	we asked whether we could embed each image that already existed into in the met collection
1502160	1508560	and into the feature space of big GAN image net which happens to have a category for vases so we
1508560	1513680	selected categories that were shared between image net and the met collection there are a handful
1513680	1519840	about a dozen um and we maximized for each of those images the similarity between the met image
1519840	1524400	and the big GAN image using a two-part loss right so we wanted them to be similar both at the pixel
1524400	1530240	level and at the semantic level and we did that by looking at two different layers of a pre-trained
1530240	1536000	res net as the embedding network so once we've embedded these models these images into big GAN
1536000	1540720	we can then visualize the individual embeddings but we can also do something a little bit more
1540720	1546640	interesting than just look at approximations of these images which might not be very good we can
1546640	1550800	think about the underlying feature language that might have been learned and then look at
1550800	1556720	interpolations between the existing images in the met collection I hear murmurs in the
1556720	1562640	background if anybody has a question hit the chat you're super welcome to speak up um so next we
1562640	1568160	look at interpolations between these existing images on the graph and we can create kind of
1568160	1575040	hypothetical or dreamlike images that exist between the spaces of existing works in the collection
1575040	1581360	and these are pretty interesting and beautiful and they allow us as I was mentioning to ask
1581360	1585920	questions about what collaborations between geographical regions might have looked like
1585920	1590720	right because we do have categorical information about where each image in the met collection
1590720	1596800	came from it allows us to suggest new objects and the spaces between them so it allows us to
1596800	1602400	interpolate and the other beauty of these kinds of executable models of culture is that it allows
1602480	1608320	us to iterate on existing collections really rapidly um and evolve them forward and so we
1608320	1613280	can kind of start to imagine archives of the future that would have embedded within them
1613840	1619280	world models corresponding to the data set that exists at one point in the archive right so the
1619280	1624640	archives could kind of evolve themselves forward and suggest future versions of their collections
1624640	1630560	based on what's already been created and that this is again this was back in 2019 which is a
1630560	1636240	long time ago in computer vision terms um but even just with with inversion into to began in the
1636240	1641040	channel I was really impressed at the quality of the the images and the hypothetical objects that
1641040	1646160	we could get for example here are a bunch of different generated teapots from the met latent
1646160	1651760	space in the teapot category which again happened to be shared between ImageNet at that point um
1651760	1658960	and the met collection and as I said we did have the the opportunity to exhibit this in the met
1658960	1665760	which was absolutely wonderful um we projected a visualization of this latent space superimposed
1665760	1671360	on a map of the met collection and allowed people visitors to the to the great hall to kind of step
1671360	1677360	in to this latent space as projected onto the ground and explore the traversal of the spaces
1677360	1686320	between works um and a projection behind them on the wall. We also made a web app version of all
1686400	1692720	this that exists even though we we can't visit the met today um it's online at gen.studio if you
1692720	1697680	want to go have a look after this and then all of the the code base is linked the github is linked
1697680	1703600	at the bottom um if you want to check out any of that more specifically but again it places us
1703600	1708960	kind of a different framing of latent space traversal than we're used to that I was interested
1708960	1713840	in this project was to place us on you know we've gotten a lot further along in the video um
1713840	1719200	you can go look at the at the website places us on a map between the objects when we're doing
1719200	1724400	the interpolations right so we select an object to start now we land in the latent space of big
1724400	1730400	gen close to that object and then we can move ourselves around on the map between objects and
1730400	1736560	their embeddings in that latent space right and as we're moving physically in 2d space here online
1736560	1742560	we can visualize what exists at that point in latent space and then we can find its nearest
1742560	1748640	neighbor visually uh in the met collection and find what object in the existing collection
1748640	1753360	is most similar to the hypothetical work that we discovered in the interstices between two
1753360	1760400	existing works um so give that a look and this project lives on today um and a couple of different
1760400	1765760	forms I'm still working with the artist Matthew Richie he was a collaborator uh with us on the
1765760	1774160	met project um on a couple of different tendrils of of this work where we're asking all right so
1774880	1779520	we can model projections of existing images in the met in the met collection by finding their
1779520	1787280	embeddings in some kind of large foundation model but now in 2021 we have things like StyleGAN ADA
1787280	1791760	that can can train on smaller data sets and do reasonably well in approximating data sets that
1791760	1796960	would correspond to a single category in the met collection so we've done that um we've trained
1796960	1804400	these models on sketches um Babylonian cuneiform tablets Japanese watercolors and some 18th century
1804400	1811520	European landscapes among other things and have individual models correspond to each of these
1811520	1816880	genres within the met collection and then we've been working with a friend in New York who has a
1816880	1823440	robotic oil painter and can actually create layered paintings of really short walks in latent
1823440	1829520	space along different dimensions in this model so think about physically visualizing some of the
1829520	1834480	durability work you've looked at in this course right could we make time paintings of really
1834480	1841920	short walks in latent space by superimposing robotic paintings of the visualized image kind
1841920	1847360	of at different points along that walk so that's that's being exhibited right now at UNT
1847360	1850880	in their contemporary art gallery let's see I've got a question in the chat room
1853200	1859040	oh it's just a compliment I will take it at any point yeah I think
1859040	1865120	can you please read it yes uh someone mentioned that this is a creative reason one of the most
1865120	1870880	creative reasons they've seen to do latent space interpolation since it scans yeah I think that
1870880	1876160	I had a slide a moment ago if you want to rewind in the recording of this suggesting that kind of
1876160	1881840	part of the advent of using GANs to model kind of large databases of creative work is that they
1881840	1887360	allow us to do a couple of things right that interpolation and that iteration and in cases
1887360	1891760	where you can't write down a feature language underlying a set of works because you don't
1891760	1898160	know our priority what it is you can imprint that or you can learn something of that in a deep
1898160	1905360	generative model right and then you can collaborate with that and hypothesize what might lie on a
1905360	1912080	graph of human creation if we presume that any creation artistic creation at some point in
1912080	1919920	historic time is if you think about it as the manifestation of a point on kind of a sea of
1919920	1924960	cultural influences and multi-generational practice iterative practice that's been shared
1925040	1931040	between peoples and generations and the creation of a single work is the enactment of that process
1931040	1937360	at some point in space it's natural to think of that in some sense as a model that we can capture
1937360	1942960	in a latent space where we're manifesting some part of structured space at some moment but this
1942960	1949280	allows us to iterate on that which I argue is similar to some historic processes of iteration
1949280	1956400	and collaboration across groups of people really quickly right um so I've been trying to take this
1956400	1963600	a little further now and ask all right we can make paintings of short walks in latent space we can
1963600	1968720	hypothesize objects that might have existed but we don't think they ever did but we still don't
1968720	1975760	know much about these models even if we train StyleGAN 2 on a set of 2,000 paintings in the
1975760	1981200	net collection uh you've probably seen some of the interpretability work adjacent to what Ali
1981200	1986560	has shared or David Bao's work so that style of thinking we don't know anything about this Japanese
1986560	1991680	watercolor model like what do its individual neurons represent is there a neuron for trees
1991680	1997840	well what is a tree here it's some brushstrokes we recognize as a tree but it's not something that
1998640	2004480	BigGAN trained on image that would necessarily recognize as a tree maybe more simply kind of in
2004480	2010560	the in the steerability context what do dimensions in the latent space of a model like this
2010560	2018400	correspond to right sure we can find things like zoom and 3d rotation because we can name those
2018400	2023120	transformations and then find directions that maximally correspond to them using that kind
2023120	2027440	of steerability technique there are all sorts of other directions like the ones we're visualizing
2027440	2033200	here that certainly have some affective meaning to the viewer that we don't know what they are in
2033200	2038720	the models terms or in the viewer's terms so at this point in this project we're thinking about
2038720	2044320	starting to name and understand dimensions underlying generative models trained on
2044320	2049200	bodies of artistic work from museum digital collections not only limited to the met but
2049200	2055600	around the world uh and our motivation here is to kind of create these alternate and imaginary
2055600	2060800	histories of art built from unique latent walks that we can visualize in real time with this painting
2060800	2067040	or computationally and then maybe understand something about aspects of picture language
2067040	2073600	that might be shared across you know vastly different genres so Babylonian cuneiform tablets
2073600	2080240	transformed from numeric to symbolic and image-based at a very particular point in history and can we
2080240	2086880	find a dimension in style GAN trained on a very different genre of art that corresponds to a
2086960	2092160	similar kind of transformation and as such can we build up kind of a picture language that would
2092160	2098240	correspond to diverse forms of art making right that you might not see in any of these different
2098240	2103440	categories of digital images on an archive but we might start to appreciate once we can investigate
2103440	2112560	them by training deep generative models on them let's get back to great okay so when we're thinking
2112640	2117680	about this intersection we've seen one example of modeling the structure underlying creativity at
2117680	2123760	scale and i've done other projects and you can find many examples online both of my work and
2123760	2128720	other peoples of trying to do this not for creativity at scale but for individual instances
2128720	2135680	of individual artists and modeling either the style or the processes of individual art making
2135680	2142400	techniques so all of these are kind of flavors of starting to imprint or grok or understand the
2142400	2147680	structure underlying creativity but not symbolically right so we don't we don't know how to interpret
2147680	2152480	these models even though we can visualize them and create really interesting hypothetical objects
2152480	2157680	that might be indistinguishable either from existing work or from one artist's particular style
2159120	2164400	we can also think about these models as a tool themselves for collaboration both in their creation
2164400	2170000	and iteration with others who contribute to their models and with the models themselves
2170000	2175440	which as i described represent kind of executable versions of collective cultural structure we
2175440	2181200	permit permit ourselves to think about them that way or facets of kind of a global creative identity
2182240	2186800	but as i mentioned now we're at a point with tools and computer vision where we can start to ask
2187600	2193840	what rep representations actually underlie these models trained on artworks that are themselves
2193920	2197760	executable versions of some collective cultural structure right well what is the structure what's
2197760	2204480	going on under the hood do they correspond to dimensions that we find meaningful when we look
2204480	2210240	at visual scenes and so in the next part of the talk i'll share a couple maybe more technical
2210240	2216000	projects that explore specific ways that humans can interact with generative models
2216640	2221280	in order to maybe learn something about human vision as well right so can we build
2221760	2227440	shared vocabularies that help us interpret dimensions underlying these models by designing
2227440	2233120	experiments that allow us to visualize and interact with images and latent walks like you've been
2233120	2239040	seeing i'll pause here because i need a sip of water and i'll keep an eye on the chat in case
2239040	2248480	anyone has any questions before we go on
2253760	2259440	all right looks like we are question free so far five more seconds
2262880	2268160	i guess i have a question yeah so this might be talked about later but i was wondering a little
2268240	2274480	bit about like in your research and kind of this field how much of like human interaction is like a
2274480	2279760	big part of it and kind of like the human coming in and saying uh how they think about something
2279760	2284800	and see where that agrees with the computer or like kind of like where that role is played
2286240	2289920	wonderful question so these kind these kinds of high-level questions that
2289920	2294880	get it some experiential component or design component of the worker i think really useful
2294880	2299440	ask more of them i'll tell you for different projects what that looks like and in the next
2299440	2305440	section of work it's going to be really obvious because there's human annotations but for this
2305440	2311920	project so the human would come in here you know we train models on datasets of art selected from
2311920	2316800	the met collection and these are small and these are subsets and they were gathered by
2317520	2322960	matthew richie and myself going through different genres in the digital collection of the met online
2323920	2329520	and like hand selecting images from those different genres right representative images of
2329520	2336160	different categories of work or maybe in a less fine grained way all images under some designation
2336160	2342320	so japanese watercolors between the 17th and 19th centuries so we made that selection and
2342320	2347760	tried training these models on a bunch of different such selections and decided which ended up you
2347760	2353040	know with so few examples providing at least a representative sample of the kind of work that
2353040	2360960	we know we saw there right and then here the selection of like walks through latent space
2360960	2363920	so think of those in the same way you've been thinking about the steerability walks
2364800	2369840	they were very arbitrary so that was a completely human selected so it's a kind of a different
2369840	2376400	approach to interpretability where it's steered by the human eye right we're not doing it automatically
2376400	2382400	and we're not doing symbolic it symbolically we don't know what these correspond to but that's
2383440	2387600	trying some arbitrary walk through latent space trying many of them and then the human then
2387600	2392640	selecting what to them felt like an artistic expression this is an art exhibit and then
2392640	2398080	in the next step we'll ask how can we do that in a more systematic way and start to build
2398080	2402480	a language corresponding to what those different walks could be a language that's shared by humans
2402480	2408400	and that takes at least right now a lot of human a lot of human interaction
2409200	2412240	you could think about ways to automate that we'll talk about that in a second
2413440	2418960	but with any kind of human interaction it's nice to preserve the opportunity for direct
2418960	2423680	engagement with models rather than intermediation by a captioner or something like that because
2423680	2428880	then you could imagine using your technique on different subsets of humans right on different
2428880	2433840	kinds of experiences so you might imagine getting an art historian to label and select
2433840	2438000	different walks through latent space here corresponding to very nuanced changes in the
2438000	2443280	development of Babylonian like cuneiform tablets right that a captioner couldn't recognize I
2443280	2448320	couldn't recognize so you might want to be able to pull different kinds of humans into the loop
2448320	2453680	at different times to engage in ways that kind of use their knowledge to create a unique synthesis
2453680	2459920	with a generative model so that's what engagement looked like here and then with this next project
2459920	2466560	it'll be super it'll be super clear and I'll make sure to speak specifically to that so thank you
2466560	2474880	yeah cool so next this is probably a summary of what you've seen so far in your IAP course so
2474880	2480160	there's a lot of different work on discovery of interpretable directions in the latent space
2480160	2485120	of different generative models right and we can steer images along those dimensions to create
2485120	2490320	interpretable transformations that allow us to interact creatively with deep generative models
2490320	2498240	right here we are deep learning for creativity but a lot of these examples presume what concepts
2498240	2503120	we're searching for in the latent space and in fact they do that really explicitly right we
2503120	2508880	will pre-define a zoom transformation and then maximize the similarity between some transformation
2508880	2514000	in the latent space and a zoom transformation as applied to some image maybe you've experimented
2514000	2520000	with code for doing that but that presumes we know we're looking for zoom in the first place
2520000	2524400	what if we find ourselves looking out into more you know uncharted waters so to speak
2525360	2531040	here we ask how we can learn kind of a vocabulary of visual concepts maybe one that you would apply
2531040	2536160	to those style gains we just saw train on the net images right we don't maybe we could look for zoom
2536160	2539920	but maybe there's all sorts of more interesting transformations we could do to those images
2539920	2544240	but we don't know what they are yet how can we learn a vocabulary of visual concepts rather
2544240	2550000	than pre-define them or labeling them after the fact so there are a variety now of unsupervised
2550000	2556240	methods for distilling these kinds of transformations in latent space that find principal components
2556240	2560240	of feature space of different layers the models activation maybe you've played around with methods
2560240	2565600	like GAN space that search for and rank where the largest principal components of the feature space
2565600	2570240	which do provide us with interpretable transformations but they're labeled after the
2570240	2576480	fact so we don't know if they're meaningful to humans kind of in their genesis but we can we
2576480	2580960	can describe them right by providing labels to them another point where the human kind of comes
2580960	2587520	in the loop but we want to see if we can build in human vision to the discovery process right so
2587520	2593520	to supervise it but to not pre-commit to what kinds of concepts we're searching for so in this
2593520	2598960	project we're trying to build or define a method for building a visual concept vocabulary for an
2598960	2605360	arbitrary GAN latent space so to put it more specifically we want to learn embeddings d maybe
2605360	2611200	you've called this w we want to learn some kind of walk in the latent space z if again we'll focus
2611200	2617840	on big GAN here of transformations that are salient to us in visual space and we can't define
2617840	2624320	an objective and optimize our d our walk to produce a transform in x in the image because we
2624320	2628560	want to learn the vocabulary concepts rather than pre-commit to them and we would have to pre-commit
2628560	2633360	to what that objective is right in order to optimize d so we're going to take a different
2633360	2641280	approach and instead sample the space of salient or possible transformations for some given point
2641280	2647680	in space for some given z and then use those sample directions as a screen so to speak onto
2647680	2652640	which we can project human perceptual judgments so that's a little bit of a gratuitous metaphor but
2652640	2657200	maybe a useful way of thinking about it and then we'll we'll disentangle the concepts that are
2657200	2662960	projected onto that screen into a vocabulary of open-ended compositional visual concepts
2664560	2670960	and what we're interested in here is the overlap between what's represented inside a model
2670960	2676240	so some deep features in a model's representation and concepts meaningful to humans in visual
2676240	2681280	seeing understanding we're asking how we might start to define although not completely but
2681280	2687200	start to define a shared vocabulary between the two or for a given model determine what lies in
2687200	2693120	that set overlap and I don't have to dwell too long on a lot of the specifics here it's all
2694160	2699120	online at that URL if you want to read the paper but as I mentioned the first thing we're going to
2699120	2705360	do is generate a set of sample images that produce minimal meaningful transformations in images
2706000	2710000	and then humans come in the loop again we're going to ask them to label them but here we're
2710000	2715280	forming the basis for the data set that we'll build our vocabulary off of and we want to keep in
2715280	2720720	mind that we want a vocabulary in the end that is both diverse so corresponding to a lot of
2720720	2725680	different changes that you can produce in an image and specific where a single transformation
2725680	2732320	corresponds quite reliably to one visual change across viewers so we do that by defining
2733120	2739120	mutually orthogonal what we call layer selective directions and these minimize change in the feature
2739120	2745200	representation at some layer of big care and at some layer we'll call it layer l and this allows
2745200	2751120	us to capture relatively focused changes because we hold constant how much the representation
2751120	2756160	can change at some layer and we do that for different layers to capture changes at different
2756160	2761760	levels of abstraction so as you can see layers closer to the image output control or fine grained
2761760	2766480	aspects of the image like the color of the walls and the bedspread and as we get closer
2766480	2771280	back to the latent space we're allowed to make kind of more higher level changes in things like
2771280	2777760	zoom and perspective of the scene and its composition so what objects are present so here we have a
2777760	2782800	base set of minimal meaningful transformations that capture changes in images at different levels
2782800	2789280	of abstraction we're going to ask people to label them because we don't know what's going on visually
2789280	2794560	in these scenes right so we started at a pretty small scale with just four categories in the
2794560	2800560	places data set and looked at big and trained on image net and places we'll just talk about places
