start	end	text
0	3000	This meeting is being recorded.
3000	11000	Hello, everyone. Welcome to your course, AI for Art, Aesthetics, and Creativity.
11000	22000	Today we have a very special speaker, Joshua Soldiksten, who is a Senior Research Scientist
22000	34000	at Google Brain, and he is one of the pioneers of diffusion models and deep learning.
34000	43000	At least in the, as far as I can see in the literature for the area of deep learning,
43000	49000	but he can tell me more and correct, tell us more and correct us.
49000	64000	So let's ask Joshua to, if you would like to share a little more about his interest and what he inspires him, and then start from there.
64000	73000	Great. Yeah, so I wasn't prepared for the interest question, but I've done a lot of different things.
73000	82000	I mean, most in the science, but I worked on the Mars rovers after graduation, and then I went into the PhD in biophysics, and then I did computational neuroscience,
82000	87000	and then I worked in the computational neuroscience lab, and then I started doing machine learning.
87000	96000	And so I don't know if there's like any single coherent thread, except that I'm chasing things that I think are really, really cool.
96000	104000	And I will say I get like an amazing sense of satisfaction from figuring things out that like no one has ever figured out before.
104000	110000	And I think that might be one of my driving motivations.
110000	125000	And so I think creating something new is maybe one of the most satisfying parts I feel about science, and maybe something else, something that you also feel if you're like creating art.
125000	131000	Cool. So thanks for the invitation for being here. I hope this will be a fun talk.
131000	143000	I'm going to tell you about diffusion probabilistic models, especially I'm going to tell you about content from these two papers in the lower right.
143000	152000	Ali already said this a few times, but pretty please interrupt me with questions through the talk. It's like so good to get feedback from the audience from giving a remote talk.
152000	161000	I also actually left time in the talk for questions. So if you don't ask any questions, then we're going to end up comfortably early.
161000	166000	Cool.
166000	186000	So before I dive in at all, I just want to start by calling out my collaborators, especially Eric and Eru and Surya on the 2015 paper and Abhishek, Ben, Dirk, Stefano and Yang on the 2021 paper.
186000	208000	Maybe a particular call out to Yang Song, who was the first author on the most recent ICLR paper and did like an absolutely incredible job, as well as to maybe Ben Pool, who was Yang's primary mentor, and also deserves an outsize share of the credit.
208000	216000	I'm going to spend most of this talk diving into the nuts and bolts of this class of models.
216000	227000	Since this is an AI plus creativity class though I wanted to just start by sharing some of the ways this kind of model is already being used to create art.
227000	247000	Maybe the first of these is there is this group of artists on Twitter, and I suppose probably in real life too, using classic techniques called guided diffusion to generate amazing images conditioned on textual pumps.
247000	257000	And so here we see two different examples of this. Here we see the prompt is a surreal album cover depicting a boost of eternal dread, hashtag pixel art.
257000	267000	And actually putting things in pixel art in the prompt tends to make it the model produced images that might be more likely to appear with that hashtag, and so that's actually part of the prompt.
267000	287000	And you get some images that could be interpreted as a boost of eternal dread, or on the right you prompt is a snowstorm in Los Angeles, and you are able to produce some images that are like the models imagining what a snowstorm might look like in Los Angeles.
287000	301000	And at least to my eyes I'm surprised and impressed by the quality of the results they can get in this way.
301000	311000	The second of these maybe more creative uses that I'm aware of is work that uses diffusion to turn very rough sketches into high quality images.
311000	331000	So here in the top you can see some rough sketches of a few different scenes, and then in the bottom you can see the fusion process running to turn those rough sketches into detailed imagined scenes.
331000	349000	So I also think that this is a pretty cool example of the potential for creative use of this class of models.
349000	362000	Okay, so shared some creative uses of diffusion models, but structure for the rest of the talk is going to look something like this.
362000	370000	I am going to provide some physical intuition for what we're going to be doing.
370000	374000	Then I'm going to work to make that physical intuition more mathematically precise.
374000	386000	Then I'll show how we can generate samples from the model, and then I'll tell you about some surprising connections between diffusion processes and neural ODS, which you may or may not have already heard about.
386000	393000	And then I'll show how we can sample and evaluate conditional distributions.
394000	402000	At a super high level, we're going to use diffusion to destroy any structure in our training data.
402000	415000	Then we're going to carefully characterize this destruction of structure, and we're going to reverse time, and we're going to run the destructive process backwards to build a generative model of the data.
415000	428000	Training a model to reverse time maybe sounds a little bit crazy, but there may be two observations we can make that highlight its causability.
428000	439000	The first of these observations is that we can use diffusion to destroy the structure in our data distribution.
439000	448000	Here I want you to imagine, and this is going to be very much trying to ground this on my physical intuition, which if you have a physics background you might like, otherwise I apologize.
448000	458000	Here I want you to imagine that the density of dye molecules represents a probability density, and our goal here is to learn this probability density.
458000	463000	This is typically a very challenging thing to do.
463000	476000	But even if we can't build a model of the structure in our data distribution directly, what we can do is we can map our data distribution to a much simpler distribution that we can model.
476000	492000	So in this physical example, if we allow diffusion to continue long enough, then eventually the dye molecule would be evenly distributed in the jar, and we'd have a uniform distribution.
492000	509000	It's maybe not immediately clear that this is helpful, but what if we could reverse time and run this process backwards? What if we could start at a uniform distribution and generate the data distribution?
509000	516000	In physics, this is overwhelmingly unlikely to happen spontaneously.
516000	528000	Liquids don't spontaneously unmix any more than a shattered glass will spontaneously reassemble, but we can maybe use machine learning to do it.
528000	540000	And to see our first clue as to why this might be possible, let's zoom in on a small volume of fluid here.
540000	552000	So Q super exciting keynote zoom effect.
552000	574000	So the first clue that time reversal might be possible is that although there's this concept of macroscopic irreversibility where the reverse trajectory is overwhelmingly less probable than the forward trajectory from the microscopic perspective.
574000	579000	The picture is completely different and is symmetric.
579000	587000	So here we've zoomed in and now each bright spec corresponds to a single dye molecule undergoing diffusion.
587000	597000	And if we were in person, I'd ask you whether this video was like being played forwards or backwards, but I'm just going to tell you that this video is being played backwards in time.
597000	599000	And here I'll flip it around.
599000	604000	And now it's the same video, but it's being played forwards in time.
604000	619000	And you can see that despite like flipping the arrow of time, the motion of the dye molecules, the behavior of the dye molecules looks looks completely identical and make that more concrete.
619000	625000	The diffusion kernel has the same functional form both both forwards and backwards in in time.
625000	641000	So at every time step, the next time molecule position is drawn from a very small Gaussian centered around its current position and more generally depending on situation might also be be a drift run.
642000	663000	This is really great for us, because it means that if our forward diffusion process was a sequence of small Gaussians, then our reverse diffusion process is also going to be a sequence of small Gaussians.
663000	677000	And I'm showing this in continuous state space. I'm not going to talk about it today, but you can do the same thing for like diffusion over binary variables.
677000	689000	All right, this is probably a good time to pause for questions for a question and also barking dog, which you may or may not be able to hear.
689000	694000	Yes, you can definitely hear the dog.
694000	700000	Cool.
700000	707000	So just to maybe do a summary slide away, I told you we're going to use the fusion process to destroy all the structure in the data.
707000	713000	And then we're going to learn the reversal of this diffusion process.
713000	726000	And learning the reversal of this fusion process is going to end up being requiring estimating a function for the mean and covariance of each step of the process.
726000	747000	And that reverse diffusion process is going to form our model of the data.
747000	757000	So maybe just to illustrate what this means for real data, we might start with data points corresponding to images on the left.
757000	764000	And running diffusion on these data points will correspond to mixing in more and more and more random noise to the images.
764000	773000	And after some amount of time will be left, we'll erase all the structure and we'll just be left with a color of noise.
773000	796000	In the right image, we see a 1D example. Here the x-axis is time and we are diffusing a 1D bimodal distribution into a 1D Gaussian.
796000	807000	And we're going to learn the time reversal of this process. We'll be able to generate data samples by running the diffusion process that starts at noise and ends at the data distribution.
807000	816000	And here we see this go through the images where a noise sample corresponds just a color noise image and ends up as a sampled image.
816000	827000	And on the right you can see this for the simple 1D distribution.
827000	840000	Okay, so I've just tried to provide intuition for what is going to happen and I'm about to dive into a bunch of math.
840000	864000	So this is an excellent time to pause and poll for questions if anyone has anything they want to ask about.
864000	870000	Maybe I can ask a question. If you could please go to the previous slide.
870000	891000	In order to understand a little more of this slide. So you are saying you are sort of introducing noise in 1D. Does it mean that you are showing the noise that over time you're adding to each pixel?
891000	901000	Yeah, so maybe something that's implicit in the slide which I should describe explicitly.
901000	912000	So here on the right pane we're showing the evolution of samples in like a 1D distribution.
912000	919000	So in the left in the right pane just like in the left pane there are four samples and they're evolving in 1D.
919000	931000	If you take an image you can think of an image as being like a really long vector of length like number of pixels times number of colors.
931000	940000	So if you have like a thousand by a thousand image with three colors then it will be like a vector of length like three million.
940000	949000	And so then what we're doing is we're doing the same thing we're doing on the right but we're doing it in this like three million dimensional space instead of this like one dimensional space.
949000	958000	So like you can think of that image as being a point in this three million dimensional space and we're just diffusing the image like through the space.
958000	973000	And if you look at what that looks like that looks like noise being mixed into the image as you like take the image and like diffuse each of its coordinates by this process.
973000	976000	Perfect, thank you so much.
976000	984000	Thank you for the question.
984000	990000	Yeah, so so making this a little bit more mathematical.
990000	996000	We're going to start with samples from a data distribution Q of X zero.
996000	1008000	So Q of X zero might for instance be like the distribution over natural images so it might be many many many examples of images.
1008000	1022000	And for every forward diffusion step, we are going to decay the slide sample slightly towards the origin and add a small amount of Gaussian noise.
1022000	1041000	And this this corresponds to diffusion in a quadratic well or harmonic well. And if you run this for enough steps, then at the end we're going to end up with an identity covariance Gaussian distribution centered at at the origin.
1041000	1058000	So this is going to be our forward diffusion process, which is going to take your sample X zero and destroy all destruction your sample X zero until by X capital T, you just have like a random noise vector.
1058000	1067000	And here once again illustrating this we're going to start with a whole bunch of points. And here you've seen a one day example and like a three million D example and here's like a 2D example.
1067000	1077000	Here we're taking a bunch of points that originally have some like structure and we're mixing diffusing them until they have no structure left.
1077000	1084000	Now for the reverse process, we're going to start at the identity covariance Gaussian.
1084000	1090000	And because we know that the reverse process is the same functional form as the board process.
1091000	1104000	We know that the reverse distribution of trajectories can match the forward distribution. If we also make it a sequence of small Gaussians.
1104000	1115000	And so here we have to do is we have to learn the mean and the covariance of these Gaussians.
1115000	1122000	And so if we find the right functions f mu and sigma and you make our step size small enough.
1122000	1132000	Then then after running like big T steps of the reverse diffusion process will end up back at our data distribution.
1133000	1143000	F mu and sigma here are going to be like super complicated functions. These are these are like the outputs of like state of the art neural networks.
1143000	1155000	But what's nice about this is we've like transformed the problem of building a density model into the problem of learning functions for the mean and the covariance of a sequence of Gaussians.
1155000	1163000	You can see in a second that this is basically going to be a supervised regression problem.
1163000	1177000	You can see this this illustrated. So you start with a noise sample and your general process is going to like run a diffusion process which which turns that noise sample into into samples of the data.
1177000	1185000	Here's just illustrating the same thing with like a cartoon panel.
1185000	1195000	Ah, the well that we ended up at I called it a quadratic well. That's that's to respond to a to a question in the chat.
1195000	1200000	Or or in physics sometimes they call it a harmonic well.
1200000	1219000	So basically if you run if you run diffusion diffusion and energy landscape, which is a quadratic, then then the particles rather than just like drifting away to infinity will like will like, you know, diffuse and drift, but they'll kind of stay roughly around the origin because the quadratic energy landscape likes
1219000	1223000	pulse them back in.
1223000	1229000	Okay, so this is going to be the mathematical high water part our watermark probably.
1229000	1241000	So how do we train these things. We're going to do it using using a variational bound that's essentially identical to that in in hierarchical days.
1241000	1253000	So the probability that the generative model assigns to a data point can be found by integrating over all trajectories that end at that data point.
1253000	1264000	This integral is intractable to compute, but we can borrow a technique called called an important sampling to to
1264000	1277000	multiply and divide by the probability of the four diffusion trajectory, which which is Q of x one the capital T given X zero
1277000	1288000	P X zero is now an expectation over the ratio of the four in reverse trajectory probabilities averaged over for trajectories.
1288000	1297000	We want to train our model by maximizing the log likelihood of the data under the model.
1297000	1303000	And this this corresponds to taking the average over the data distribution Q X zero.
1304000	1316000	This up after the data distribution Q X zero of the log of P X zero and here I just substituted in this form up here into the log of P X zero.
1316000	1320000	Intervals inside logs are pain in the ass.
1320000	1333000	So we use Jensen's inequality to lower bound the log likelihood and and bring the integral outside the log.
1333000	1338000	If the forward and reverse distributions over trajectories exactly overlap.
1338000	1348000	So if the P and Q distributions describe exactly the same trajectory, then distribution of trajectories in this lower bound becomes becomes type.
1348000	1359000	This everything we've just done is also equivalent to writing down the variational bound for like a very, very, very deep variational encoder.
1359000	1365000	We're each time step here corresponds to a layer of the variational encoder.
1365000	1374000	And and where the inference distribution Q is fixed and we're only learning the general distribution P.
1374000	1381000	Yeah, Q is the the, let me go back a second.
1381000	1398000	Q is the forward diffusion process Q is the distribution over over X at every time step that starts from your data and injects a little bit of Gaussian noise at every time step until until you get to the model.
1398000	1413000	I'm sorry until you get to the prior until you get to like the isotropic Gaussian.
1413000	1417000	Okay, where worry.
1417000	1421000	So, if we do a little bit more algebra on this.
1421000	1438000	You can rearrange this into a some over kale divergences between the, the posterior from the forward trajectory, which is that first term inside the kale.
1438000	1449000	And the reverse trajectory, which is that second term inside inside the kale.
1449000	1459000	And this is just a sum over this across across every time step. And the beautiful thing about this is that both of these distributions are Gaussian.
1459000	1472000	The second one is Gaussian because like the entire forward diffusion process conditioned on the data sample is Gaussian. And so this is just a conditional distribution of that big joint Gaussian distribution, which is also a Gaussian.
1472000	1490000	And the second one is Gaussian, because we know it has the same functional form, the reverse process of the same functional form and supported process. And just as reminder, this is the functional form of the reverse diffusion process.
1490000	1515000	So we can write down our training objective. And our training objective is to minimize an expectation over training data and over time steps of this kale divergence between the forward posterior and reverse distribution for a single for a single step.
1515000	1526000	And the kale divergence between two oceans has a super simple functional form, which basically just reduces to to regression.
1526000	1543000	So, so we've transformed our like unstructured unsupervised learning problem into into a supervised regression problem. And, and we know how to, we know how to solve those.
1543000	1561000	So this is the hardest part in the whole talk. So I'm going to pause here for like, like 15 seconds.
1561000	1566000	Could you give a short refresher on the kale distance.
1567000	1580000	The kale distance between two distributions is a information theoretic measurement of how similar the two distributions are to each other.
1580000	1585000	It has some some nice properties.
1585000	1588000	One of those properties is
1589000	1616000	So one interpretation of the kale between like Q and P is it tells you how many bits it would, how many, how inefficient, how many bits you would lose if you tried to describe distribution P, but thought it was distribution Q.
1616000	1624000	So it tells you like by how many bits your model is like an efficient inefficient.
1624000	1638000	It also is like closely connected to log likelihood in that if you take the kale divergence between the data distribution, the model distribution. This is equal to
1638000	1644000	a constant minus the log likelihood of the model.
1644000	1655000	But I think just in general you should think of KL as being a measure of distance between two probability distributions.
1655000	1674000	So you mentioned the, I guess, beautiful property of the kale distance of two Gaussians can simplify the problem. So what if, you know, there'll be let's say a different type of noise, then I guess it wouldn't necessarily simplify.
1674000	1688000	Yeah, yeah, if you had if you had different types of noise, you would, depending on type of noise you very likely would not be able to just like analytically write down the form, you would still be able to optimize it.
1688000	1695000	You would just have to use
1695000	1703000	the thing that you can do analytically here is we can marginalize over over X of t minus one
1703000	1717000	in in this expression and this this I haven't I haven't written down the order of this but but the reason that the calibrating two Gaussians is really nice is because you've been just like marginalized out the X t minus one and that gives you a much lower variance estimate
1717000	1735000	of the loss in the radium. If you use a different form for the noise, then you would probably have to sample X of t minus one, and that would probably be a much higher variance estimate for for your learning signal, but but you could probably
1735000	1737000	still do it.
1737000	1741000	And something like heavy tail noise might be might be really interesting.
1741000	1747000	There's a question for why we do KLQP instead of KLPQ.
1747000	1751000	So,
1751000	1756000	in general, we tend to do KL from the data to the model.
1756000	1763000	And the reason for that is probably because of the connection between KL divergence and log likelihood.
1763000	1783000	What we're often interested in is the log probability of the data points under model, and that means you have to take an expectation over over the data. So you want to like average over your training data of the difference between the two.
1783000	1794000	I think also, it can be very difficult to compute the other way around, because we don't know what the log like we're trying to fit the log probability of the training data.
1794000	1811000	And if you flip the KL around, then you have terms that look like samples from the model of the log of the data distribution, and we don't know how to evaluate those in general, which is another reason that we usually go from from Q to P using our formulation
1811000	1814000	here.
1814000	1830000	Yeah, so this optimization process, or at least the specific loss that we get depends on us having defined the noise like we chose the noise right like we we chose that the noise is is a bunch of like small Gaussian
1830000	1851000	perturbations. And, and that's what makes the specific form possible is if you use this for your noise than the entire forward trajectory. So like Q of X of one to X capital T given X zero is just one big joint Gaussian, and a lot of things become easier once once your entire forward
1851000	1864000	trajectory is one big joint Gaussian.
1864000	1871000	Cool. Alright, so now I'm going to connect this to stochastic differential equations.
1871000	1876000	So I just presented this in in discrete time.
1876000	1890000	But if we take the step sizes to be smaller and smaller and smaller, then we can turn this discrete diffusion process into a limiting stochastic differential equation.
1890000	1905000	It turns out to be extremely useful and to have some some very nice properties as as before, we're going to gradually mix noise into our data distribution until it turns into Gaussian.
1905000	1913000	And, and as I just said, this is the continuous time limit of the discrete diffusion process I saw the moment ago.
1913000	1921000	So here our data distribution is P sub zero. This is a slight change in notation, not a big one.
1921000	1939000	And P sub T is the intermediate distribution from running this stochastic process for a time interval T, and then P capital T is the final final distribution which should look like just noise.
1939000	1951000	So and little T here is between zero and big T. And so an SDE is a generalization of ordinary differential equations.
1951000	1959000	And so we can write it down like this. And here the green term is what you would normally have in an ODE.
1959000	1964000	And it governs the deterministic properties of the stochastic process select the drift.
1964000	1973000	And the red term is the noise that the red term controls like the stochastic fluctuations of the process.
1973000	1984000	So here you should think of DW as being infinitesimal Gaussian noise or like Brownian motion.
1984000	1992000	So we've now replaced the forward process with its continuous time limit, which is stochastic differential equation.
1992000	1996000	And we can do the same thing with the reverse process.
1996000	2010000	One really surprising aspect of stochastic differential equations is that given their equation forward of time and given the marginal distribution PT at time T,
