start	end	text
1397220	1400300	about stuff that was occluded by the trees like what's going on
1400300	1404660	behind there. And so this image generator is actually it's got
1404700	1407940	this latent model that has an understanding of what the scene
1407940	1411340	is. And so, and even has an understanding of things that is
1411340	1415100	not explicitly drawing. So if you remove the trees from the scene,
1415380	1419220	then it'll come up with a reasonable looking, you know,
1419460	1424340	image to draw what was behind the trees, or you can do the
1424340	1429340	opposite. Which is you can take neurons that were not originally
1429340	1433780	on in a generated scene and turn them on. So if I take a set of
1433780	1436660	neurons that correlate with doors, and I turn them on in a
1436660	1439540	certain location, and you can see what happens in the generated
1439540	1442380	image, you know, I'll get this door in the scene, not only
1442380	1445900	will it just be a door, but it'll be it'll have like an
1445900	1451220	appropriate size and your orientation and style for for
1451220	1453940	the building that it's in. So if I take exactly the same neurons,
1454460	1457820	and I activate them in a different location like here in
1457820	1461140	this building, then even though it's exactly the same neurons
1461140	1464740	exactly the same activation that I've done, I get a different
1464740	1468100	door that is like a much smaller has a different style and so on.
1468100	1471660	It's appropriate to the building that it's in. If I if I try to
1471660	1475140	put a door in a place that would make sense, like by turning on
1475140	1479820	neurons up in the sky, then it like will like not do anything.
1480860	1484300	This is this is the actual output of what happens if I turn on
1484300	1488180	the exact same neurons up in this location. So there's a lot of
1488220	1492340	interesting context sensitivity that you can measure. But one of
1492340	1494380	the cool things that you can do is you can actually hook this up
1494380	1499900	to a paintbrush user interface, like I can find neurons that
1499900	1503700	correlate with domes or doors or things. And if I want to add
1503700	1506300	doors to a building, I can just sort of paint them on. And the
1506300	1509380	doors will show up and you can see the orientation of the doors
1509380	1512980	is appropriate to the wall that you put them in. If I just say I
1512980	1516780	want trees, it'll put trunks and leaves, you know, in the right
1516780	1519100	place in the trees or plants with a plant, plant them on the
1519100	1522700	ground. If I take grass and I can turn the grass neurons off and
1522700	1526180	remove grass from the scene and it'll come up with what the
1526180	1529260	scene should look like instead. And so I can kind of do these
1530220	1533900	semantic manipulations directly. Oh, here we're turning on domes
1533900	1540220	and you can see it will turn the top of the the church from a
1540220	1544140	spiral to a dome, but it also sort of stitched the dome into
1544140	1547740	place to make it look good here. I'm removing grass again. We
1547740	1553020	can like put a door in the scene. And if I if I put you know,
1553020	1556540	sort of put a door in the wall, then it'll it'll come up with
1556540	1559900	like the appropriate location and style orientation for the door
1559900	1564940	even if I draw very roughly. So when I'm drawing, every time I
1564940	1567900	touch the surface here, what I'm really doing is I'm just turning
1567900	1573140	on a few neurons. And and I'm letting the the math of the
1573140	1579780	GAN generator deal with all of the the details of how to arrange
1579780	1582180	the actual pixel. So does that does that sort of give you a
1582180	1585260	sense? Does that answer your question for like, you know,
1585260	1588340	what kinds of things you can do with this by understanding what's
1588340	1591300	going on in the interior of the model? Maybe now I should stop
1591300	1596060	it. Oh, yes, go ahead. Are these different neurons for like
1596060	1601060	doors in different areas? No, no. So when I when you click on the
1601060	1607780	door button on the left, I am picking 20 neurons that are
1607780	1611540	the door neurons. So by doing the statistical analysis ahead of
1611540	1615340	time that I showed you earlier, I've identified 20 neurons that
1615340	1619860	correlate very strongly with the presence of doors. And when you
1620020	1624020	click on the button on the left, I am picking those neurons. Now,
1624220	1626540	it's a convolutional network. So there's this translation
1626540	1631460	and depends those neurons appear at every pixel. And so what you
1631460	1634660	can do is you can just turn on those neurons in random pixels
1634660	1635460	that you touch.
1636980	1639180	Changing where the neurons are, that was what I didn't
1639180	1641860	understand. Does that make sense? So, so because it's a
1641860	1644900	convolutional network, so it's actually it's it's like the neural
1644900	1649020	network is cloned at every location. It's the same neural
1649020	1652820	network that's being used to process every, you know, patch
1652820	1657700	or patch of pixels in the image. And, and so if I asked for a
1657700	1660300	door in a place that wouldn't really make sense, then it
1660300	1663180	won't put a door there. If I asked for a door in a place that
1663180	1665420	makes sense, it'll make a big intervention, it'll stick a big
1665420	1668500	door there, which you can see. So I could be very rough about
1668500	1673660	where I put a door and it'll like put it in the right place. So
1673660	1679100	that's that's the idea. So let me let me zoom around here, I'll
1679100	1684220	show you a couple other things that you can do. So now there's
1684220	1687340	some limitations to this. And I'll just show you some of the
1687340	1689300	techniques that you can use to get around the limitation. So one
1689300	1692100	of the problems is that, you know, we can do all this cool
1692100	1695900	editing, but we can do this editing of a randomly generated
1695900	1701220	image. And, and so, so when I posted this demo on on the web,
1701260	1703660	you know, an artist called me and said, Hey, you know, I love
1703660	1707060	how you can edit images, I can edit this image of a kitchen
1707060	1710780	here. But that's not the kitchen I want to edit, I want to edit
1710780	1716100	my own kitchen, right? Like here's a photo of my kitchen. And I
1716100	1721740	want to edit that one. And I had to explain to them, you know,
1721740	1725660	they said, Oh, can you just load into your demo? My my kitchen
1725660	1729340	instead of yours. And I had to explain, no, no, no, that's not
1729340	1733460	how GANs work. They're unconditional generators. You
1733460	1739540	know, you give it a random vector of 512 numbers. And it
1739540	1743900	decides what image to make. And then once it decides what image
1743900	1746780	to make, then you can edit it. And so I'm sorry, I can't edit
1746780	1749980	your kitchen. And so they were very disappointed by that
1749980	1752140	because they had all sorts of ideas of things they wanted to
1752140	1758260	do. And so now the problem is that, you know, the problem
1758260	1762380	could be solved if we could find the random vector, some random
1762420	1766420	vector that that output the kitchen image or the specific
1766420	1771380	real photo that I wanted. The problem is how do I find it 512
1771380	1776860	dimensional vectors as pretty big vector space. And and so I
1776860	1780700	don't know if my GAN can actually generate this image or not. So
1780700	1784260	one of the things you can do is you can just treat this as a as
1784260	1787500	an inversion problem. You can take the neural network and you
1787500	1791900	can learn how to run it backwards. Basically, you know,
1792300	1795340	think of the neural network as a function G, and you want to
1795340	1798300	learn G inverse. So you can treat that as another training
1798300	1800580	problem. And there's a bunch of tricks and I won't go into all
1800580	1804740	the tricks here. But but basically, the idea is that you
1804740	1808140	can actually find a Z that comes closest to generating your image
1808140	1813580	by by training and doing a couple other tricks. And you can
1813580	1818660	actually get a Z that will generate your image pretty
1818660	1823460	closely. But the thing that's a little bit sad is it also
1823460	1827860	reveals things that the network cannot do. So so this network
1828740	1831660	is capable of generating this image that I'm showing you here.
1832220	1835340	But the original kitchen that I started with look like this. So
1835340	1837420	you can see what the differences are. I've lost a lot of
1837420	1842700	stuff. Right. So, you know, I can use the GAN to edit this
1842700	1846940	image. But this image is not exactly what I started with. And
1846940	1853980	so. So one of the pieces of science that that I did is I
1853980	1858260	asked a question, you know, is there some way that we can
1858260	1861500	actually make this work? Can we actually, you know, get the
1861500	1866620	network to output a real photo that that the user gave us? We
1866620	1870060	get the network to output this sort of simplified version of
1870060	1875060	it. It turns out that if I modify the weights of the
1875060	1881460	network, I can actually fine tune the network to get it so that
1881460	1884900	a very, very nearby network with weights that are almost the
1884900	1891060	same as the original actually hits this target image. Exactly.
1891820	1896900	And so so there's a bunch of details in the right way of
1896900	1899620	doing this. But it turns out that, you know, you don't actually
1899620	1902780	have to change much if you change the fine grained weights
1902900	1907300	of a network. You can you can change a lot of the details of
1908340	1912500	what images actually get generated. And and and if you
1912540	1917180	are given a target image to get you can actually tweak tweak any
1917180	1921740	network to generate exactly that target image if we want. And
1921740	1922100	so
1924100	1927700	so you know, so yeah, we can get all the objects back. But the
1927700	1929820	new thing is we haven't really changed the network much. So we
1929820	1933300	can still do editing. So like if we take the window correlated
1933300	1936340	neurons, we can take our modified network, we can turn them
1936340	1942180	on. And and now we can like add a window. Let's see if we show
1942180	1944380	that. Yeah, so this here's outlook. So we get this nice
1944380	1948900	window here. And the scene is began is doing its cool tricks of
1948900	1951860	orienting the window properly, doing some reasonable things. And
1951860	1955620	it has some really interesting effects that are non trivial
1955620	1958820	here. Some of them are good and some are bad. So for example,
1958860	1961740	all I did was turn on the neurons in this location saying I
1961740	1967460	want windows. And it did it. But look what else it did. It also
1967460	1970020	added these reflections right here on the counter. And so this
1970340	1974140	this kitchen guy does this a lot like adds adds non local
1974140	1976660	reflections where it thinks that there's a shiny table. And so
1976660	1979300	the cool thing here is that after I did all the inversion and
1979300	1982340	stuff, this guy actually thinks that there's a shiny table here
1982340	1984860	and it's right. And it thinks that if I add a window here,
1984860	1987340	they should add reflection. That's right. Also, but look
1987340	1990860	what else happened up here. See this lamp up here. When I first
1990860	1992980	lifted this in low resolution, I thought, Oh, maybe it turned off
1992980	1995060	the lamp because once you have windows, you don't need the light
1995060	1998700	on. But no, it didn't do that. It just messed up the lamp. It's
1998700	2002820	just total it took this whole area up here and just and just
2002820	2007580	distorted it badly. And so so that that's a little dissatisfying.
2007580	2012020	It means that this fine tuning thing, where we get again to,
2013020	2017660	you know, target a specific user image, when I do when I try to
2017660	2020580	teach it all the details, I'm not really teaching it what the lamp
2020580	2024620	was, I was just sort of showing it how to arrange the pixels. And
2024620	2029540	again, made its best guess on how to generalize how the image
2029540	2032180	should look differently. If I change something like out of
2032180	2035340	window, but with only one example of a lamp that looks like
2035340	2037860	this, it generalized wrong, it has no idea what should happen to
2037860	2040940	that lamp when I when I add a window. So this is this question
2040980	2045340	of like how to make changes in a network with with with
2045340	2050260	achieving good generalization is, which is a good question. And
2050300	2053820	it was, there was something that puzzled me for a year after
2053820	2057380	doing this work. But but the work is still pretty cool, you can
2057380	2061460	still use it for modifying real photos. So here's like a photo of
2062020	2066700	I got off of Wikipedia of like some real locations. And you can
2066740	2069860	you can edit them, I can add grass, I can add doors, I can add
2069860	2073860	domes, you know, just like, just like the the the other
2073860	2076380	campaign app, except I can actually start with a real photo
2076380	2078980	that you give me. And I can invert that photo through the
2078980	2081820	network, get a good starting image, fine tune the network to
2081860	2085540	make it make it output, you know, the target image and edit that
2085540	2088540	image, add bigger domes, and it'll sort of match the
2088540	2092780	architectural style. And, and, and, you know, do different things
2092780	2095700	like that, I can add domes, remove domes, add doors, you
2095700	2098900	know, things like that. Let me see if I can get this video here
2098940	2104140	to show. So this is the status center. Let's add some doors
2104140	2108380	here. So you get the idea, I'm doing exactly the same
2108380	2111820	intervention that I did before. And it's it's opinion just like
2111820	2115260	before, it will not add doors in places that it doesn't think are
2115300	2117900	not good places for a door, it has some opinions about where
2117900	2120740	doors are allowed, it likes to put them in brick walls. It
2120740	2125780	thinks it's okay to put a door in a tower, like that architectural
2125780	2128880	detail. Oh, I put domes here. It's happy to put domes on top of
2128880	2131560	buildings. It's not happy to put a dome like in the middle of the
2131560	2135520	sky. It's not happy to put a door in the middle of the sky. But
2135520	2140760	you know, it put trees in different places. And, and so
2140760	2142160	there are things that it understands, there are things
2142160	2144320	that it doesn't understand very well, it's sort of making a
2144320	2147160	guess of what the structure of the image is. It doesn't know what
2147160	2150480	to make of my advisor, you know, sort of planting grass in front
2150480	2153920	of him. And that's not very realistic. But you kind of get
2153920	2157280	a feel for what the structure and knowledge of the model is by
2157280	2159560	doing these kind of interventions. So this was really
2159560	2162840	cool. I think it got a lot of people's attention. Adobe
2162840	2167080	noticed this stuff, and has been busy trying to make different
2167080	2172280	painting applications using, you know, GAN technology that are
2172320	2177160	I think partially inspired by by by this kind of discovery. So
2177440	2182920	David, I have a question. Yep. This is really cool. Question is,
2183280	2188240	when you modify, for instance, churches, I assume you have
2188600	2193800	trained your GAN on a church data set. Yes, that's correct.
2193840	2197680	What about when you do it on the real images, for instance, in
2197680	2202920	this case, you know, your advisor? Yes. So actually, both of
2202920	2205880	these are using the church data set as well. So the church
2205880	2206400	data set,
2206440	2210760	interesting that even you have trained again on church, you
2210760	2212480	can depict a person.
2213280	2218320	Yes. So this is so the GAN. Now, you have to keep in mind that
2218320	2222480	what I've done here is I fine tuned the GAN. So you can
2222480	2225280	actually, you know, you can actually get you can actually
2225280	2231160	get a GAN to do a lot of things by fine tuning it. So I've I've
2231160	2236240	told the GAN, please basically overfit on this target image. So
2236240	2243880	the GAN, you know, has 30 million parameters. And, and you
2243880	2247200	know, an image only has, you know, 10,000 pixels, and it has
2247200	2251520	plenty of excess capacity to memorize the details that I
2251520	2256320	might want to do. And so what I've done is this as I've taken
2256320	2260400	the image, I've asked again, through my inversion techniques,
2260440	2264880	what is the closest church image that you can generate that
2264880	2268000	looks like my thing. And you get a different image. I don't
2268000	2271240	have the image to show you here, but you get an image that looks
2271240	2273800	kind of more church like it's a little bit, it'll be
2273800	2276800	architectural have the right kind of shape, the kind of right
2276800	2280280	textures. But you know, it won't show my advisor here and
2280280	2283720	things like that. It'll be, it'll be this rough approximation
2284240	2290040	for that my my image, but that is in the domain of what the GAN
2290040	2294280	can actually generate. Then I say, Okay, that's not what I
2294280	2297560	want to do. I want to actually edit this photo. So let's fine
2297560	2304680	tune that network so that so that given that same Z instead of
2304680	2307400	generating the church that you would normally generate, I want
2307400	2311560	you to generate this image, change the weight slightly, get it
2311560	2316520	so that that Z targets this. And, and so that's what I've done
2316520	2319320	here. But I've tried I've done that in a way where I try not to
2319320	2322240	change the weights too much. I just try to change the weights. I
2322280	2324800	change the fine grained layers. And I don't change the coarse
2324800	2328320	grain layers. And I, and I have a regularizer to make sure the
2328320	2333760	weights don't change too much. And that you are changing the
2333800	2339440	pre trained weights, or you are putting some extra weights, and
2339440	2343960	then you place them. Oh, here, I'm actually changing the pre
2343960	2348640	trained weights. So the network has 15 layers. I'm actually
2348640	2352480	going and I'm changing some of those layers. I'm not adding
2352480	2356920	anything new to the network. I'm just changing the weights in
2356920	2361480	the network itself. Now, now what I've done here is I've
2361480	2365720	overfit the network to this one image. The network is not
2365800	2370040	generalizing this knowledge. So for example, you can draw
2370040	2374720	Antonio in this one image. But if I look in the network, if I
2374720	2377840	probe it a lot and see, can it ever generate Antonio in a
2377840	2381960	different setting in a different image? It cannot. In
2381960	2386640	fact, you know, as much as we probe things, it really doesn't
2386640	2389160	look like we've changed the output of the network in any
2389160	2393720	meaningful way for any image, except for this one. It's almost
2393720	2397480	like, you know, the network generates this really complicated
2397480	2401520	manifold of realistic images. And we've told we've picked up one
2401520	2404680	point of the manifold, and we've dragged it over to pass to
2404680	2408160	this point. But we've done it in a very local way. So it's
2408160	2411280	really not affected any other points of what the GAN is
2411280	2418200	generating. And so so but but for the purposes of doing this
2418200	2420120	kind of application, it doesn't matter that it's not
2420120	2422600	generalizing because the user doesn't care about a different
2422600	2425000	photo, they just care about their own photo. So it's a pretty
2425000	2429040	cool. It's pretty cool technique anyway, even though it's sort
2429040	2432920	of not the classical goal of machine learning. Does that make
2432960	2437840	sense? Yeah, it does. And I wonder if the user has more
2437840	2443760	images of themselves with that over time, and make the network
2443800	2445640	even better in generation?
2447440	2450480	Yes, this is the big question. And I played with this for many
2450480	2452720	months, and I haven't got it to work. And if anybody can figure
2452720	2454760	out how to get to work, I feel like it's one of the holy grails
2455160	2458160	of like how to add a new thing to a generator. So like, the
2458160	2461120	generator knows about all these things that knows about trees
2461120	2466400	and knows about all these architectural pieces, you know. But
2466400	2468880	what if I came along with something new? What if I was
2470680	2474360	what if my what if I what if I work for GM and I want to sell
2474360	2477040	Cadillacs, then I then I might come to one of these models and
2477040	2479640	say, you know what, you should draw cars. In fact, I want you to
2479640	2482680	draw specific cars. I want you to draw Cadillacs in front of all
2482680	2487760	these buildings. How would I add Cadillacs to my model or add
2487760	2491120	Antonio to my model or something like that? And we don't know how
2491120	2493400	to do that yet. Although I'm going to show you a little bit of
2493400	2498200	work, where we can do something that's very similar. And if I
2498200	2501120	don't know if I have time to, to go over this, but I'm going to
2501160	2503440	I'm going to zoom through this because I'm so excited by this
2503440	2510680	work. So, so, so it's motivated by this, this sort of question,
2510720	2515640	which is, you know, we have a model of like drawing towers,
2515640	2519400	let's say, right? But there are things in the world that we might
2519400	2523400	want to model that we don't have a data set for. For example, you
2523400	2527080	know, in in in Decatur County, Illinois, there's this courthouse
2527080	2529880	that has a tree growing out the top of the tower. It started
2529880	2532800	growing out there by accident, but the people in the town love
2532800	2536240	it. And so but it's but there's no so like if I want to get a
2536240	2540360	generative model to draw trees growing out of tops of towers, I
2540360	2544240	can't do that in a classical way because I can't create a big
2544240	2547840	data set of a million buildings that have trees growing on the
2547840	2550520	top of the towers, because they don't exist. It's just this one.
2551360	2556640	And so now if if the point is I want to generate images of this
2556640	2560840	type, you know, well, I could use a regular image editor, I
2560840	2563200	can take any building of a tower, and of course, I can stick a
2563200	2567000	tree on it, right? I could use my, you know, again, painting
2567000	2570080	method to, you know, activate tree neurons or something like
2570080	2573280	that. But no, no, that's not what I'm asking. I'm asking this
2573280	2577240	other question of like, how can we stick tree towers into my
2577240	2581160	model? How do I modify the model to have this new concept in it?
2581480	2583880	Like I start with this model that has all these weights that
2583920	2586800	encode all these rules for how buildings look and things like
2586800	2591080	that. And I want to create a new model that has new weights that
2591080	2594120	encode new rules. So for example, the old model could generate
2594120	2597200	all these buildings that of towers that look normal have
2597200	2600880	spires, you know, pointy tops. And I want to make a new model
2600880	2604560	that has weights, they encode a different rule, so that like,
2604680	2608200	they have trees growing out the top, right, or any rule that I
2608200	2612800	choose, right? And it turns out that this is actually possible.
2612800	2616160	So this is different from the technique that I showed you
2616160	2619080	before, because in this technique, it's actually
2619080	2623240	generalizing. This is, you know, if you use this technique, not
2623240	2628120	only you change the output of one image of the GAN to have like
2628120	2633480	some effect, but we can actually change the outputs for a whole
2633480	2638360	class of, you know, a large subset of the outputs of the GANs to
2638360	2644000	follow a different rule, like any pointy tower output will have
2644040	2648000	trees instead of pointy towers. And so so I'll just show you a
2648000	2650360	little bit of like the interaction here of what it
2650360	2655280	looks like when you get our method into an application. So I
2656200	2658680	let's see if I can get this to work. So here, what I'm showing
2658680	2662840	you is the output of a style GAN be to generating churches, you
2662840	2666680	can kind of, and there are three parts of this UI, there's an
2666680	2670920	image viewer, then what you do is you can select a rule that you
2670920	2673440	want to change, and then you can specify how you want to change
2673440	2675800	your rule. So there's three parts of this little user
2675800	2679040	interface. And I'll just show you sort of how how the effect
2679040	2683520	looks by showing you one of the interactions. So you can kind of
2683520	2688560	use the image viewer to scroll through lots of examples of of
2688560	2692400	what the the generator is capable of generating. And then we
2692400	2694800	can go to these examples and we can say, Hey, you know what I'm
