start	end	text
4225680	4231680	direction filling and emptying the closets and what if we tried a different category what if I
4231680	4238800	wanted to turn a medina into a full closet right what is the type of fullness that's relevant to
4238800	4244080	a medina oh well it's adding people instead of adding clothes suggesting that what's been learned
4244080	4250960	there that direction in latent space is abstracting generalizable enough to capture some visually
4250960	4256880	recognizable dimension of fullness that's meaningful to us in different scenes right and the model's
4256880	4262400	able to to generalize it in a way that's not totally dependent on the types of objects it saw
4262400	4268400	in one scene so it knows in a sense that clothes make a closet full but to make a market full
4268400	4273680	we're not adding clothes we're adding people and so the fullness direction is something that adds
4273680	4278720	more of whatever would make that scene full um to any scene that we're selecting in the model
4278720	4285200	right and trained on so few examples of course this this is really quite imperfect but it's a
4285200	4290640	good proof of concept of a way that users can interact super flexibly and really visually
4291600	4297600	with dimensions of interest and use that to kind of explore and surf the latent space of a model
4298480	4303920	by producing replicable repeatable directions that others can explore without having to use language
4304480	4309040	that's kind of a different way of carving up the puzzle of how to explore and assign meaning to
4309120	4315520	directions that we that we find in latent space okay that's at latentcompass.com
4315520	4323040	and we'll be back up next week I think bad timing okay so to return to our frame here
4323920	4330160	we've been digging a bit into this intersection between art neuroscience and machine learning
4330160	4335600	ways to explore models that have been trained on human creation right at different scales
4335600	4341520	to create a new to iterate and interpolate upon archives and then also to start to understand
4341520	4347200	what these models are representing and if our ways of interpreting dimensions inside models
4347200	4353440	can also teach us something about human perception or allow us to start to build models of aspects of
4353440	4359440	human vision that are otherwise pretty intractable because it's difficult to formalize what dimensions
4359440	4364240	underlie them where I could write down what dimensions under life physical scene understanding
4364240	4370720	because I know Newton's laws I couldn't write down what dimensions underlie aesthetic perception of
4370720	4377520	North African marketplaces or Babylonian tablets because I don't know what a large swath of people
4377520	4384160	would find perceptually interesting in a bunch of marketplaces I know from cognitive science
4384160	4390960	research certain heuristics to look for but that wouldn't give us a full set of what a diversity
4391040	4394880	of humans might appreciate when looking at some scene especially things like its mood
4395760	4400560	so we can turn here to these kinds of large unstructured generative models that learn
4401440	4407040	entirely from data entirely from images and turn to them as like a fertile ground so to speak for
4407040	4414000	starting to probe and represent human perceptual experiences inside their latent space and think
4414000	4420480	of latent space that way right as a screen as I said before onto which we can project human experience
4420480	4425280	and then once we have those projections we can rerun them and interact with them and collaborate
4425280	4430960	with them to create outputs of deep generative models that are particularly exquisite and that
4430960	4437680	represents some kind of collaboration between us and models of our our creation that are operating
4437680	4444880	in parallel so that's where I will leave us my emails here I'm very discoverable online
4444880	4452000	but you're welcome to write me questions anytime and I will wrap here and we can have a more
4452880	4458080	casual discussion unless anybody has any last questions for this part
4458480	4479120	Thank you so much sir this was really interesting and inspiring with all the
4479360	4488640	acidic decreasing slides and every moment of that was really full of thoughts I think that
4490560	4504240	you open a window to semantically and qualitatively looking at these latent spaces and
4505200	4508560	sort of our imagination and
4511360	4519680	where we dream and where these models that we create dream so I really appreciate that
4521840	4526480	I'm going to stop recording and then see if there are more questions
