start	end	text
2010000	2017000	the time reversal of the SDE has a very simple analytic form.
2017000	2026000	In reverse SDE, here DT is going to be an infinitesimal negative time step.
2026000	2031000	And DT is going to be an infinitesimal negative time step.
2031000	2041000	And DW is still Brownian motion or DW is still Brownian motion or like little Gaussian perturbations.
2041000	2056000	And if we know the gradient of log PFT with respect to X, then that's all the information we need to like define the reverse SDE, the time reversal of the SDE.
2056000	2065000	And here the gradient of log PFT is the quantity which is often known as the score function.
2065000	2074000	And so we can train an approximation S of theta to this score function.
2074000	2087000	And the way in which you train this is using the continuous time limit of the same variational down to the log likelihood I showed like in the previous section.
2087000	2097000	So basically you can train this thing exactly the same way that you train the discrete time version.
2097000	2103000	There's also connection to denoising score matching, but I don't think it really matters here.
2103000	2113000	You can train this using the same way.
2113000	2122000	So okay, so this is just the continuous time limit of the discrete time diffusion for that version before.
2122000	2136000	And maybe the thing that's really neat about it is we can now link these like drift terms that we were estimating to this thing called a score function,
2136000	2146000	which is like a simple and known property of the distribution PFT.
2146000	2151000	Okay, and so now we've defined the model two different ways.
2151000	2153000	And we've talked about how to train the model.
2153000	2156000	So let's talk about how to sample.
2156000	2164000	And then let's look at some some pretty samples.
2164000	2170000	So after training our model, I mean the sweet timer score base, I'm going to show you a score base here.
2170000	2178000	So score base, we generate samples by, by just numerically integrating the reverse SD.
2178000	2186000	So, so mind you, we've approximated grading of log PFT with our function s.
2186000	2192000	And you can use any off the shelf SD integrator to solve this.
2192000	2200000	The simplest of these is, is called the Euler-Mariama solver.
2200000	2212000	And this is just the, the discrete time discretization of this SD, which actually maps us back to the discrete time diffusion process,
2212000	2227000	where at every, at every time step, you like change X, you change your sample by that looks like this term times a finite changing T.
2227000	2235000	And then you add a little noise with variance proportional to delta T.
2235000	2244000	And you just run this over and over and over again, until you get back a sample.
2244000	2253000	So this is, this is the, maybe the most naive discretization of the SD.
2253000	2257000	Okay.
2258000	2274000	If you maybe went at the sample generation procedure the right way, then, then we're actually training and generating samples with a neural network, which is like thousands of layers deep, where each layer is like a time step into the diffusion process.
2274000	2281000	And, and so this can be interpreted as like an extraordinarily deep general model.
2281000	2295000	If you squint that at a slightly different length, then we're proposing a general model, which has like thousands of times the compute cost of most general models, which is maybe not quite as exciting as saying thousands of layers deep.
2295000	2302000	But, but it will turn out there are ways to make, to make the sampling process more efficient.
2302000	2306000	And I'm going to show you one of them in the talk.
2306000	2310000	Okay, so, so what can you do with this thing?
2310000	2314000	Well, here are some example samples.
2314000	2321000	These are samples from a diffusion model that we built trained on celebe HQ.
2321000	2325000	These are 1024 by 1024 images.
2325000	2332000	I don't know how high resolution they are after after some to me, these are like in this English full from from real human beings.
2332000	2339000	So, so, so we've like crossed over the uncanny valley.
2339000	2348000	So, numerically, this class of models currently beats autoregressive models.
2348000	2357000	In terms of log likelihood where autoregressive models were the winners. This is not my work. This is a paper of dirt King was in Tim Solomon's.
2357000	2368000	They also began in terms of like at by the inception score on some data sets. So, for instance, image that five full by five fall, again, not my work.
2368000	2377000	So these things seem to be remarkably good generative models of images.
2377000	2386000	They also enable you to do some cool things that you can't do with with other other techniques.
2386000	2389000	Let me actually just to time this.
2389000	2397000	Should I expect to end sharply attend or should I expect to take them extra like.
2397000	2399000	Yeah, take your time.
2399000	2414000	You know, as much as you would like because typically we end this course, even after you are done with your lecture, we may stay a little more and chat about things.
2415000	2424000	Okay, cool. I will not take forever, but I will I will not try to do to the last last slides in four minutes as well.
2424000	2441000	I'm actually it's probably really good time for me to pause for a second and see if there are any questions. So,
2441000	2449000	Okay, I'm going to keep on going. I'm going to tell you about these stuff.
2449000	2464000	One really cool thing is that any SD can be transformed into a corresponding ordinary differential equations non stochastic differential equation.
2464000	2477000	Without changing the marginal distributions pt of x, that is, there is an ODE, which has the same distribution over x at all times t.
2477000	2485000	And so this corresponding ODE would allow us to sample from the same distribution starting from the same prior distribution.
2485000	2492000	But by solving ODE instead of an SD, this is this is here is what the ODE looks like.
2492000	2503000	We show the SDH trajectories in red, and the ODE trajectories in, in white, and they both the SD and the ODE are starting from the same points.
2503000	2515000	And you can see that the SD is a stochastic trajectory that converts the starting distribution final distribution easy the ODE.
2515000	2532000	Similarly, trace has the same marginal distribution at every time point, so it starts from the same distribution, and then it ends up the same distribution, but it does this in a deterministic way.
2532000	2542000	Given the SDE, the corresponding ODE, this is just the general general relationship between SDEs and ODE's.
2542000	2557000	Given the SDE, the corresponding ODE, like once again only depends on the score function of pt, for which we already learned, we've already learned the estimator for the score functions.
2557000	2578000	So, so this is just S of, S of theta. So, if we want to generate samples, we can generate samples by integrating this ODE instead of by integrating the SDE.
2578000	2586000	This kind of blew my, so Yang is the one who realized you could do this, and this kind of completely blew my mind when he shared that we could do this.
2586000	2607000	So, so I hope, I hope at least some fraction of you are similarly like scandalized that you can turn SDEs and ODE's like this.
2607000	2626000	So, the question is, are there benefits to modeling with an SDE if there is an ODE equivalent, and the, the two parts to, to the answer.
2627000	2639000	Part number one is the SDE formulation is what allows us to train it. So, so we have to at least like conceptually go through, through SDE space in order to train it.
2639000	2657000	Part number two is that we're training this function S theta to match the score function, but in practice, this function S of theta probably does not correspond to the gradient of any well defined like log probability distribution.
2657000	2668000	Like if we were to train S of theta perfectly, then we would have S of theta is equal to like gradient of X of log P of t, but in actuality S of theta, it's just like a vector.
2668000	2675000	And it probably is not a vector that actually corresponds to the gradient of the log probability.
2676000	2692000	And, and because of that inconsistency in the definition of S of theta, you actually get slightly different distributions if you integrate the ODE and integrate the SDE.
2692000	2698000	And visually, if you integrate the SDE, the samples tend to look just a tiny bit better.
2699000	2715000	But, but I think we don't, we don't fully understand why, but the, the reason distributions are a little bit different is because we're violating this assumption that like S of theta is actually the, the gradient of, of the log marginal density.
2722000	2736000	Okay, so we have this ODE. If you've heard of neural ODE, you can think of this as being like a specific example of a neural ODE, because like S of theta is a super complicated neural network.
2737000	2750000	What's really cool is once you have an ODE, you can use just like off the shelf ODE solvers to, to generate samples and like ODE solvers are like really remarkably good.
2750000	2763000	I didn't, I didn't realize quite how good they were in that they can like just off the shelf ones can just like generate like a few million dimensional like samples from a super high dimensional ODE.
2764000	2776000	So here, for instance, is the samples you get from running the an adaptive ODE sampler with a different allowed number of samples.
2776000	2792000	And you can see that after maybe like 86 this samples from the ODE solvers, so allowing the ODE solver to evaluate the, the ODE equation at like 86 time points.
2792000	2798000	You get what's a pretty high quality image, whereas it takes like thousands for, for the SDE.
2798000	2814000	The other thing you can do with ODE is you can compute an exact log probability for four data points, which means that you can get exactly like this.
2814000	2817000	We can, I can show you a table of performance.
2818000	2823000	Our numbers are bold. This table is now like almost a year old because our paper is now almost a year old.
2823000	2836000	But, but take home message is this class of techniques works like surprising the well both in terms of log likelihood and in terms of measures of perceptual performance like like FID.
2836000	2845000	And I want to tell you about one more thing before, before I break, but maybe this is another good place to pause for a second.
2845000	2847000	If there are any questions about the ODE.
2847000	2876000	Okay, cool. Let me tell you about one more thing, which may actually be one of the most relevant things if you want to use this class of models for, for like creative applications, which is that there is a very well motivated way to control generation under under this class of models.
2878000	2885000	So, just to back up a second.
2885000	2895000	At training time, we return our data sample X zero by running our SDE and we get a noise sample.
2895000	2900000	We want to perform control generation at test time.
2900000	2907000	So we want to be given, we're going to be given a control signal, which I'm going to know is why here.
2907000	2913000	So, for instance, why might be a class label.
2913000	2923000	And so the forward diffusion process will then perturb a conditional data sample X zero given why to complete noise.
2924000	2928000	And by reversing this procedure.
2928000	2949000	We should be able to start from isotropic Gaussian noise ball and obtain a sample X zero given why the reverse time procedure condition and why can be given by the following conditional reverse time SDE.
2949000	2960000	So here, all we've done is we've just replaced the score function of PT with the score function of PT of X, given why.
2960000	2962000	So this is nice.
2962000	2973000	But at first sight, this seems like you have to train a whole bunch of like an entirely new model, because the conditional distribution is function of T is unknown.
2973000	2978000	But what we can do is we can apply basis rule to this.
2978000	2985000	So the first term is just the unconditional score function.
2985000	2996000	And is what we like already spent the rest of the talk talking about how to train exactly the same as what we were training before.
2996000	3002000	The second term can be trained completely separately.
3002000	3009000	From the score base model, or even sometimes can just be like written down in in close form using using the main knowledge.
3009000	3021000	And so, and so the product of these two terms plus the constant is equal to to the log P of T of X given why.
3021000	3026000	And I'm sorry, because these are logs, I should have said that some of these two terms.
3026000	3033000	This is just this. This is just base rule applied to PT of X given why.
3033000	3046000	And so, this is a particularly cool capability, because it's not something you can do at test time for like gams or VES or autoregressive models or any of these.
3046000	3055000	Here we can train a ginormous like unsupervised model images, and then we can train a little classifier like PT of Y given X later.
3055000	3061000	And we can use that little classifier to like guide our image generation.
3061000	3072000	So one example of this is here we have a here we're making PT we're making why the actual class.
3072000	3084000	And so we can use this to do like post hoc sampling of CFR 10 images that come from the class bird on the left or come from the class deer on the right.
3084000	3086000	You can also do this for in painting.
3086000	3099000	So here, why is the part of the image that you know, and you want to generate the entire image like conditioned on the part of the image that you actually know.
3099000	3103000	And so here are the first column is the true image, the ground truth image.
3103000	3110000	The second column, we've thrown away all but the part of the image that you can actually see.
3110000	3115000	So you've thrown away all we've thrown away the surround or the center.
3115000	3124000	And then in the remaining columns, we're showing independent samples of in painting all the missing content in in these images.
3124000	3135000	And you can see that an off the shelf diffusion model not trained to do in painting can can still do a good job in painting.
3135000	3139000	You can also see that there's like diversity in the images that it generates.
3139000	3153000	It doesn't generate same bedroom over and over and over again it generates like a sequence of plausible in paintings of missing information.
3154000	3160000	We can do this for colorization.
3160000	3166000	So we can take an image we can make grayscale and then we can infer infer the colors.
3166000	3170000	Cool.
3170000	3175000	This also let me just actually jump way back to being talking again.
3175000	3181000	This is also the same technique essentially that's used to generate these these art examples.
3181000	3188000	So they're rather than using some pt of y given X as a guiding signal.
3188000	3194000	They're using the output of like the clip classifier as the guiding signal and they're like multiply by some scalar.
3194000	3203000	But but they are guiding the diffusion generation in the same way as as I just showed.
3203000	3210000	And then using it to create novel artistic creations.
3210000	3216000	Cool. Okay, so to summarize.
3216000	3220000	I have shown you a general model based on diffusion processes.
3220000	3224000	We first corrupt data to a known noise distribution using diffusion.
3224000	3231000	And then we learn the time reversal of this diffusion process in either discrete or continuous time.
3231000	3239000	And we can then generate samples by drawing a random noise vector and simulating the reverse diffusion process.
3239000	3243000	There are some advantages of our framework.
3243000	3248000	First, image quality is super duper high.
3248000	3259000	Second, there's equivalence to neural OVs or flow models, which allows us to do things like like exact likelihood computation.
3259000	3267000	I didn't get a chance to talk about this, but but I actually talked about it very briefly before before the talk proper, but
3267000	3275000	our encoding is also uniquely identifiable, meaning that every well trained model will have identical latent codes for identical input data points.
3275000	3281000	This is either a positive or negative depending on how you look at it, but it is a unique property of this class of models.
3281000	3287000	And finally, we can do controllable generation without without retraining the model.
3287000	3291000	Examples like include like class conditional generation.
3291000	3299000	Including some of LA clip guided diffusion measure at the beginning.
3299000	3301000	Yeah.
3301000	3305000	Okay, that's what I got. Thank you so much for listening.
3305000	3308000	Thank you so much. This was awesome.
3308000	3312000	Really helpful.
3312000	3327000	Seems that this controllable generation is really cool because once you have the sort of probability of X and then you can.
3327000	3344000	So that is sort of task agnostic in a way and then whatever task you want, learn it and then use that sort of backbone that you have already trained will learn from the data.
3344000	3346000	This is, this is really cool.
3346000	3374000	And then I think that this fact that you can identify encoding or do the reverse process is also very cool because there is a great deal of how to, for instance, take my image and then map it to the latent space of again, so that I can modify it.
3374000	3377000	Yeah.
3377000	3383000	People have been trying to train inverters.
3383000	3391000	They are getting better and better, but it seems that in this case, the inverter comes for free.
3391000	3394000	Yeah, yeah.
3394000	3401000	That's very cool. So are there questions?
3401000	3425000	I think more on a high level. I mean, what, I guess, having a physics background clearly probably helped come with an idea that is, let's say, kind of, I mean, yeah, based on physical intuition, but it's so different from I guess the GAN architecture.
3425000	3448000	So like, in terms of more like human creativity, like how do we have to look more into the nature to find more inspiration for those, maybe even other models that or other paradigms or what is your suggestion for people who are interested in this field?
3448000	3453000	Yeah, you mean like in machine learning, how do you come up with creative different ideas?
3453000	3454000	Yeah.
3454000	3475000	Yeah, I mean, so definitely, I mean, I'm biased on my own background, so my answer is going to be be like me, which is not really a good answer. But no, one thing I do think is really actually good, though, is I think it's good to have, I think it's good to have a background, which is not the straight machine learning background.
3475000	3482000	I think having exposure to ideas and having a novel perspective like definitely helps.
3482000	3504000	I think probably even more important than that is like talking with and collaborating with people with different ideas than you. Like whatever your background is, if you can like work on a team and work closely and talk closely with people that have a very different background, then you're going to come up with ideas that no one else is going to come up with.
3504000	3511000	And so I think, yeah.
3511000	3514000	Very cool. I think there are questions on the chat.
3514000	3518000	Yeah, I just say, yeah, I think I just saw that as well.
3518000	3536000	Okay, so one question is like just out of curiosity, what happens if the initial input X zero is out of distribution. And so before the fusion process, the process that takes X zero and turns it in the noise is a is a fixed process.
3536000	3542000	So it will take an action. Maybe let me open up for a second.
3542000	3547000	So, um,
3547000	3552000	Yeah, so just to be the
3552000	3555000	Good thing.
3555000	3567000	Okay, so the forward process is is a fixed process. So any sample X zero on the left here is going to get turned into a sample from an unimole calcium.
3567000	3576000	And I should I should one subtle to cure which is pretty important is that every sample on the left gets mapped to the entire distribution on the right.
3576000	3586000	So if you were to start from the same same sample on the left over and over and over again and run the diffusion process again, like every time you ran the diffusion process, you would get a different trajectory, and you would get a different sample on the right.
3586000	3598000	So the forward process maps every single like possible input sample to the entire like PT like like isotropic calcium prior sample.
3598000	3609000	And the reverse is also true. If you start with a sample on the right and you run the SD then you will get a sample from your model of the distribution.
3609000	3617000	But if you run if you were to start from the same sample on the right over and over and over again. Every time you did that you get a different sample from your distribution.
3617000	3624000	And so every sample from the prior is actually also mapped to the entire distribution.
3624000	3636000	And so it's not like there, unless you're using OD formalism, there's not like the one to one correspondence between the image space and the latent space.
3636000	3648000	And so and so you would turn X zero into the same sample from the same latent distribution and then when you came back to the image, you wouldn't know anything X zero anymore.
3648000	3656000	There's another question here. Is it possible to work with multiple classes within one diffusion probabilistic model.
3656000	3672000	And I mean the answer is, so you can train your diffusion model on any distribution that you want to train on, I guess, so so I think the answer is yes, I think, I think the more precise answer would depend on exactly what you wanted to do.
3672000	3683000	But, but there's no reason that multiple classes should be harder than one class.
3683000	3685000	Okay, great.
3685000	3692000	Maybe I can stop there recording here and if there are more questions, you can ask.
