start	end	text
4719420	4724880	brain. It's just you don't worry about those nested subsystems.
4725180	4729520	They are processing your cognition. But you're the only one
4729520	4733500	who's home. You're the only one that's conscious in your body.
4733540	4736900	Alternatively, there is a emergent hierarchical
4736900	4741940	consciousness, some threshold, where above this line, all of
4741940	4745980	these observer windows are conscious beings, your nested
4745980	4749440	observer windows are conscious, they have independent
4749440	4752580	experience from you, not fully independent, right? Because
4752580	4755980	there's some interaction, but they are conscious in and of
4755980	4760220	themselves. And then finally, there's some sort of panpsychic
4760220	4764140	hierarchical consciousness possibility, where every observer
4764140	4769340	window is a conscious being, period, full stop. However, you
4769340	4772780	know, the observer window requires synchrony. So there's
4772780	4776860	some threshold, some mechanism that needs to be at play to
4776860	4780140	create an observer window to create a conscious being. So
4780140	4782540	it's not that it like spontaneously consciousness can
4782540	4786820	just be everywhere. But you know, this still kind of holds some
4786820	4790100	sort of boundaries, some sort of condition for consciousness to
4790740	4794720	to be present. Alright, so I just want to end with a reference
4794720	4799360	to Daniel Dennett, who sadly recently passed away. He had
4799360	4803760	this idea called the Cartesian theater. And it's the idea that
4803760	4807800	you know, your naive sense of consciousness is that there is a
4807800	4811440	little little man in your head that's perceiving everything,
4811440	4814880	hearing everything, smelling everything, pulling the levers
4814880	4818880	moving the body around, he points out the confusion in this
4818880	4821880	that okay, if there is a little conscious being inside of your
4821880	4826840	body, wouldn't there need to be a smaller little conscious being
4826840	4830000	inside of that person's body? And then wouldn't there be an
4830000	4833200	even smaller conscious being inside of that person's body? And
4833200	4837080	there's an infinite regression of smaller and smaller people
4837080	4841080	inside of your mind. And so this is completely preposterous when
4841080	4844800	you need to do away with this simple notion of a theater of
4844800	4849040	experience. And he called this the homunculus problem, the
4849040	4853760	problem of having nested infinite consciousnesses. Well, the now
4853760	4858440	model right is very at odds with this. And so we you know,
4858440	4862800	think what if this is a homunculus solution? What if
4862800	4866920	there is a Cartesian multiplex? Instead of it having a
4866960	4870320	Cartesian single theater, there's only one show that's
4870320	4875600	playing. What if there are many shows, a multiplex or a
4875640	4880360	synaplex, a, a theatrical establishment with many movies
4880360	4884440	going on inside of your brain, the nested observer windows model
4884440	4889920	says there are many experiences internally. And you maybe are a
4889920	4893640	bit of a moviegoer popping between the many diverse
4893640	4898000	experiences happening inside of you. And there is maybe this
4898800	4904760	near infinite fractal of smaller beings nested inside of you. And
4904800	4908840	in that sense, it really would be turtles all the way down. Maybe
4908840	4912560	there's some floor, maybe it keeps going. And I think an
4912560	4915760	important question is, you know, could there be something bigger
4915760	4920520	than us, something larger than us going in the other direction?
4920880	4925040	Is there an observer window greater than the individual? And
4925040	4928800	at one point, I will have a couple episodes probably on the
4928800	4932640	concept of collective consciousness. Is there any
4932640	4937400	substance to the idea of a shared or collective experience? So
4937400	4943560	with that, wrapping up with the now model, check out the paper
4943560	4946520	for yourself. I think it's a really cool, exciting new
4946520	4950360	theory. Obviously, I do because I've, you know, poured a lot of
4950360	4953280	time and energy into this. I'm also want to, you know, point
4953280	4956720	out Jonathan Schueler is really a core contributor to these
4956720	4960480	ideas and to this model. And we're now looking at different
4960480	4964000	ways to test these theories in people with dissociative identity
4964000	4969040	disorder in people with tulpas in split brain patients, looking
4969040	4972480	at these low frequency integrations that are occurring
4972480	4977360	within your experience. So a lot of new research on the horizon.
4977680	4980520	And I will talk to you again very soon. Goodbye.
