start	end	text
1566300	1572420	fluctuating is correlated with your flicker fusion rate. So the
1572460	1578060	time at which you shift from a flicker into a fusion is related
1578060	1581500	to the ongoing electrical fluctuations in your visual
1581500	1586220	cortex. So what this means is there's basically a one to one
1586220	1591980	correspondence between visual awareness, refreshes, and the
1591980	1596700	electrical activity in your brain. If the flashes show up in
1596700	1600460	different refreshes, then you have the experience of two
1600460	1604540	separate flashes. But if both flashes end up in one electrical
1604540	1607780	fluctuation in your visual cortex, then you just have the
1607780	1612900	experience of a single flash fused together. So this is quite
1612900	1616620	wild, right? I mean, this is basically saying that your visual
1616620	1620540	awareness, the perception that you're having right now of
1620540	1625660	visual information is actually flickering and updating. And we're
1625660	1630380	maybe not aware of this update in our experience. And you know,
1630380	1632620	I would argue that maybe it's because you're a little bit
1632620	1638540	slower up at the apex, but more on that a little bit later. And
1638540	1644060	this is directly related to the cognitive processing within your
1644060	1648620	system, right? So to be reductive and say, Well, who cares
1648620	1651100	about these electric field fluctuations, we got to dive into
1651100	1655100	the neurons because the neurons are all that matters. Well, we
1655100	1658860	have a very strong tight correlation between the electric
1658860	1664940	fields in this large brain structure and your experience. So
1664940	1670140	what evidence can we make that there is a strong correspondence
1670380	1674260	more so than just correlation, right? Because just because we
1674260	1677180	can measure something and just because something is correlated
1677460	1683100	doesn't mean that it's really or causally related to the thing
1683100	1687500	itself. So electrical activity happens, cognition happens as
1687500	1692340	well, these two phenomenon or correlated to each other. And so
1692340	1697100	the way that we can test this in the laboratory, and my lab
1697140	1701660	does, you know, exactly this, we will deliver what's called
1701660	1706020	noninvasive brain stimulation, and we can do this in humans,
1706940	1711620	where we can deliver a brief magnetic pulse to the brain. And
1711620	1716340	that causes a brief electric current to arise within a part
1716340	1721740	of cortex. And if we apply these brief pulses at a certain
1721940	1728140	spacing, right, then what we find is that we can very
1728140	1732380	selectively drive these electric field fluctuations in the
1732380	1736900	brain, where the repeated application of multiple pulses
1737140	1741220	will start to build up and ramp up an electric field
1741220	1746180	fluctuation. So here I'm including a image of you know,
1746180	1750260	some data that was recently published from my group, where
1750260	1754100	we essentially show just this that if you're delivering brief
1754140	1757380	magnetic pulses to the brain, and you're recording the electrical
1757380	1760980	activity in the brain region that you're targeting, you can see
1760980	1764620	a ramp up in these electric fields. And what's really
1764620	1768500	interesting is then we can actually change and shift
1768500	1773420	cognition as a function of just the frequency that we're
1773420	1778580	targeting in the brain. And you know, in my day job, I'm a
1778580	1783100	cognitive neuroscientist and a lot of my work is delivering
1783100	1787220	frequency specific brain stimulation in human participants
1787540	1792380	in order to alter or change their cognition. And the idea is
1792380	1796660	that this is a way of building causal evidence for these
1796660	1801020	macroscopic electric fields in the brain. It's not just
1801020	1805220	reducible to neurons, but by changing these electric fields,
1805460	1810580	we change cognition. So this is building much stronger evidence
1810820	1814820	that these electric fields are directly related to the cognitive
1814820	1819580	processing within the brain. So my work and that of others is
1819580	1824460	really trying to validate this highest level or one of the top
1824460	1829260	levels within the biological hierarchy, the level of functional
1829260	1833540	brain regions of electric field fluctuations roughly between 10
1833540	1838940	Hertz and two Hertz, this low frequency range in the brain
1839340	1844900	really is real. It's doing something for cognition. It is
1844900	1850060	a part of the engine of the brain. It is not just the steam
1850060	1854860	emanating from the brain, but it is really doing something for
1854860	1858300	cognition for our experience. And I think what is really
1858300	1864140	exciting about this work is that, you know, we have a very slow
1864180	1868300	reality, we're thinking our thoughts, we're pondering things,
1868740	1872820	our thoughts occur at the scale of multiple seconds, we're
1872820	1877460	perceiving things at the scale of sub seconds, doing analyses
1877460	1880500	like these and doing experiments like these really
1880500	1884300	build evidence that that low frequency electrical activity in
1884300	1889340	the brain is meaningfully related to cognition is meaningfully
1889340	1894620	related to the processing of the brain. And it one to one
1894620	1899700	relates to our experience of being a human being inside of
1899700	1904140	our brains. So the next question here is, is there a way to
1904140	1908900	communicate from one scale to another scale? And this is where
1908900	1913980	the concept of cross frequency coupling comes in. So cross
1913980	1917460	frequency coupling is saying that there's coupling between two
1917460	1923020	different frequencies across those frequencies. And this was
1923020	1927820	first observed in rodents with invasive recordings of the
1927820	1931460	hippocampus, which is a part of the brain involved in spatial
1931460	1936860	navigation. And what was found was that there are these big
1936860	1941540	electric field fluctuations in the hippocampus, as rats are
1941540	1946700	navigating mazes, and simultaneous to those big theta
1946700	1950780	frequency electric field fluctuations, you also have
1950780	1956940	neurons that are coding for individual locations in space. So
1956940	1960540	these are called place cells. And so you'll have, for example,
1960540	1965740	neuron A fires when you're in location A, you have neuron B
1965740	1970380	that fires when you're in location B, neuron C in location
1970380	1974780	C, neuron D in location D. And what you find is that in the
1974780	1980180	hippocampus, there is a sequential activation neuron A,
1980180	1984380	the neuron B, the neuron C, the neuron D, as the rat is sitting
1984380	1988860	at location A and thinking about the future of their movement
1989060	1992220	through location A and to B and to C and to D. And there's a
1992220	1998100	sequential activation of these neurons firing. And the sequence
1998100	2003500	of firing is occurring within a theta rhythm. So it says if the
2003500	2010780	brain is going ABCD, ABCD, ABCD, ABCD, there's a rhythmic
2010780	2015300	activation of these place cells being activated through time.
2015700	2020980	And so this is the first observation of cross frequency
2020980	2025660	coupling between the scale of neurons and the scale of the
2025660	2032740	hippocampus. And the neurons are inside of the hippocampus. But
2032980	2039100	you can now decode a trajectory of motion, a movement of the
2039100	2044340	animal from the electric field activity on its own. And
2044380	2047620	granted, you know, all these neurons are coding for
2047620	2052260	information and building and, you know, projecting information
2052260	2056540	into these electric fields. And then the electric field is
2056540	2061180	sort of an abstract representation of all that
2061180	2065220	information at the lower level. So I think what's really
2065220	2070620	interesting here is that you've built a trajectory of motion
2070620	2076820	from locations, right? This is not a more complex location. This
2076820	2084380	is a abstraction away from location into movement. Movement
2084380	2090140	is like a higher concept than a location. And so we have the
2090140	2095180	construction of a higher order abstract concept from lower
2095180	2101500	order information. And maybe cross frequency coupling, the
2101500	2106020	co occurrence of fast neuron activity nested within low
2106020	2109940	frequency electric field activity, and the coupling the
2109940	2115220	systematic relationship between these levels. This is evidence
2115500	2120140	of some sort of mechanism, some sort of means of information
2120140	2126300	transfer between nested systems one within the other. This
2126300	2129660	example that I've shown you is called phase amplitude
2129660	2134100	coupling, where the phase of the theta frequency basically where
2134100	2139060	you are in a single cycle is related to the amplitude, the
2139060	2143960	activation of these neurons. And it says if the low frequency
2143960	2148820	signal is kind of sequencing the higher frequency signal. And
2148820	2152820	there's been a lot of work since this original rodent work on
2152820	2157380	the hippocampus finding cross frequency coupling in memory
2157380	2162300	processing, working memory, long term memory, attention,
2162500	2165860	decision making, there's many, many examples that we've now
2165860	2171060	observed of these big, low frequency, entire brain regions,
2171060	2174300	entire networks of brain regions, coupling to more
2174300	2179420	microscopic scales. So the next question is, you know, okay, we
2179420	2183340	can measure these correlations, but is it quote unquote, real?
2183660	2188380	Do we have causal evidence for cross frequency coupling? We can
2188380	2190540	use the same magnetic stimulation approach that I
2190540	2193980	told you about just previously. But we can also use what's
2193980	2198500	called transcranial electrical stimulation. And this is
2198500	2202380	something that my lab also uses actively. And there's been many
2202380	2205740	people, you know, using this tool. But essentially, you can
2205740	2209900	deliver electric current to the brain that's designed to mimic
2210140	2213140	these endogenous coupling patterns that you observe in the
2213140	2218460	brain. So one example that I'll show for you right now is we
2218460	2222620	can observe cross frequency coupling between one signal and
2222620	2227080	another signal, we can extract the peak frequency of that
2227080	2232220	coupling in a human participant using EEG. And then we
2232220	2238060	can derive a electrical stimulation waveform based on
2238060	2242780	our observation in EEG, and then deliver electrical
2242780	2248820	stimulation back into the brain to then change and enhance the
2248820	2252660	endogenous cross frequency coupling, and then change
2252660	2257940	people's cognition. So the example I'm showing you here, you
2257940	2261380	can go check out the papers if you're interested. But this was
2261380	2264860	a cognitive control tasks where people had to, you know,
2264860	2268820	memorize a bunch of different rules and use context. And
2268820	2272140	there was sort of a multi stage decision making process that
2272140	2276260	they had to engage with. And there were numerous cross
2276260	2279140	frequency coupling signals emerging from the brain. There
2279140	2284180	was a perception control signal and action control signal. And
2284180	2288620	we differentially targeted either the perceptual control
2288620	2291300	cross frequency coupling signal or that motor control
2291300	2295940	signal. And we could change behavior in a very systematic
2295940	2300500	way based on what frequency we were targeting, either that
2300500	2304340	motor control frequency or that perception control frequency.
2304420	2309740	Alright, so we have causal evidence for cross frequency
2309740	2313900	coupling for these interactions between many different stages
2313900	2318260	or scales in the brain. And so the question now is what does
2318260	2321700	this mean for consciousness? So in the nested observer
2321700	2327220	windows model, at the core of this model, is this idea of a
2327220	2332780	nested hierarchy? And this is directly motivated by cross
2332780	2337620	frequency coupling. And so the primary question in hierarchical
2337620	2341860	consciousness is what does it mean if we were to take cross
2341860	2346980	frequency coupling very, very seriously, right? Cross frequency
2347020	2352380	coupling is not only real, but it is a fundamental property of
2352380	2356100	what it means to be a conscious being. So what if cross
2356100	2360660	frequency coupling was very, very, very much real? And what
2360660	2364740	that would imply is that there is information processing
2364740	2370180	occurring at a slow, big scale, and information processing
2370180	2374340	happening at a faster, smaller scale, and these systems are
2374340	2379100	nested within each other. So the metaphor we use to describe
2379100	2384380	this is mosaic tiling. So in mosaic tiling, you have an image
2384380	2388620	that is made out of mosaic tiles. These are different smaller
2388620	2393180	tiles, and the collage of all these tiles together produces an
2393180	2400020	image, a mosaic image. And what we suggest is what if there is a
2400020	2406060	recursively nested mosaic tiling, where every image is made
2406100	2411460	out of images, where those images are then mosaic tiles of
2411460	2417180	even smaller images, and the pattern repeats recursively as
2417180	2422220	you zoom into an image. So what this means is that your
2422220	2428820	cognitive system, your experience is a collage of all of
2428820	2433060	these different cognitive systems within you. And all these
2433060	2437300	cognitive systems are bubbling up into your experience. And
2437300	2443940	collectively, they form you as this collage of cognition. But
2443940	2449220	if you were to dive into any one of these cognitive threads, you
2449220	2453900	would find that that is in and of itself, a collage of more
2453900	2459140	microscopic cognitive sub processes, and so on and so forth
2459140	2463500	as you zoom into smaller and smaller systems. So the nested
2463500	2469500	observer windows model is basically saying that you are an
2469500	2475900	observer window, you are a bounded space of cognition. And
2475900	2481020	within you are nested sub windows. And within those are more
2481020	2485300	sub windows. And there's a recursive process of nesting
2485620	2490540	motivated by the observations from modern cognitive neuroscience
2490740	2495020	for a role of cross frequency coupling in cognition. So the
2495020	2499260	now model in order to get to the point where we can talk about
2499260	2504420	these nested systems, we need a couple other metaphors, a couple
2504460	2508340	other mechanisms to kind of flesh out the model to be
2508340	2512340	complete. So the first metaphor is mosaic tiling. This is what
2512340	2517100	I already spelled out for you. The next metaphor is a theater.
2517420	2524140	We need a boundary around a cognitive system. And we use the
2524140	2529060	metaphor of a theater. And we call this an observer window. This
2529060	2535780	is a spatio temporally bounded system. And within it, there is
2535780	2541220	a holistic gestalt representation. There is sort of a
2541220	2546940	wholeness to what it is like to be an observer window. And
2546940	2552140	there's some boundary around the system that excludes the rest
2552460	2556780	of reality to say that either you're in the window or you're
2556780	2561100	not. And if you're in the window, you are bound together into a
2561100	2566180	single observer, a single frame of reference. Now, because there
2566180	2573540	is this nesting structure, what this really needs also to have
2574380	2579980	is a mechanism for dialogue or communication between observer
2579980	2585540	windows that are within the same scale. So it might be that you
2585540	2589700	at the apex, you're at the top, you're the the head honcho
2589740	2593420	observer window. As you zoom in, there's a bunch of cognitive
2593420	2598780	systems coexisting. But more so those cognitive systems, they
2598780	2602940	can communicate up to you to the observer window. But they also
2602940	2608380	need to communicate laterally to each other. And this requires a
2608380	2611780	different mechanism than just communicating up to the top
2611780	2615340	observer window or down to a sub observer window. You're
2615340	2619420	talking to your peers. And this we use the metaphor of
2619420	2623620	dialogue. And so there are three mechanisms that we propose in
2623620	2627500	the nested observer windows model. The first mechanism I
2627500	2630100	already talked to you about this is cross frequency
2630100	2634220	coupling. This is a means of transferring information up and
2634220	2638660	down the nested hierarchy. You can have a emergence of
2638660	2642780	information from the lower order into the higher order. You
2642780	2646940	can also have a submergence of information from you or from a
2646940	2652780	sub window down into the smaller faster windows. And this is a
2652780	2657500	means of sending control signals down into your sub
2657500	2663620	structures. Now the formation of an observer window, we use a
2663620	2668580	mechanism called synchrony. This is a zero phase lag
2668580	2673380	connection between all the components of a system. Very
2673380	2676700	simply put, it means that everything within an observer
2676700	2682300	window is perfectly synchronized. There is a zero lag
2682300	2687140	synchronization, where all the sub components form the whole
2687140	2690220	component. And this is something that we kind of
2690220	2696060	intuitively assume is the case. When you call a thing a thing,
2696500	2699580	you kind of assume that everything in that thing is
2699740	2703940	synchronized and acting as if it was one thing. Here, we're
2703940	2708900	kind of formalizing that and saying that synchrony is the
2708900	2712780	foundation for creating one of these observer windows. This is
2712780	2717860	very similar to wolf singers, binding by synchronization, the
2717860	2721820	idea that you can create a gestalt representation, a single
2722100	2726260	meaningful construct through synchrony, through
2726260	2729900	synchronization. So we're really just building off of and
2729900	2735660	using wolf singers mechanism here. And then finally, we have
2735660	2740620	coherence. Coherence is the mechanism for dialogue or
2740620	2745300	communication. This is very much akin to Pascal freezes,
2745500	2749580	neuronal communication through neuronal coherence. The idea is
2749580	2753700	that two systems that are fluctuating will will communicate
2753700	2756900	to each other. This isn't that they're so synchronized that
2756900	2761620	they fuse and become one thing. But there is a non zero phase
2761620	2765540	lag between the two systems, where one is kind of talking
2765540	2769820	while the other listens and vice versa, they're coordinating
2769860	2774100	their processing through time, their dynamics. But they are not
2774100	2778380	fully synchronizing and fusing into into one another. So we
2778380	2781940	updated communication through coherence to use the word
2781940	2786060	dialogue through coherence. It really is the same as Pascal
2786060	2790920	freezes method or his mechanism. However, we think dialogue
2790920	2793900	kind of preserves a little bit more of the autonomy of the
2793900	2797700	individuals, instead of viewing these as like switchboards in a
2797700	2802100	in a circuit diagram. Instead, they're kind of autonomous
2802100	2806340	beings or autonomous cognitive systems that are like talking to
2806340	2810620	each other, rather than fusing with some sort of direct wire
2810620	2814500	connection. All right, an important caveat slash question
2814500	2821060	here is, you know, we propose synchrony, coherence, cross
2821060	2825900	frequency coupling as the core mechanisms in the now model.
2826300	2831380	However, we want to kind of caution that we don't really
2831380	2836940	think that these mechanisms are sufficient to create
2836940	2841700	consciousness. We think that these are necessary mechanisms
2841700	2845300	for communication across scales for the formation of an
2845300	2848340	observer window for communication between observer
2848340	2851940	windows. However, just because you have stuff that is
2851940	2856180	synchronized, we don't think you're spontaneously just gonna
2856380	2859780	have consciousness anywhere that you have an electric field.
2861580	2865780	There's probably a little bit more to it than that. If you've
2865780	2869580	been watching my YouTube channel, then you'll know that I am
2869580	2873380	very much fascinated and interested in theories of
2873380	2877220	quantum consciousness, the idea that quantum computers might be
2877220	2881900	somehow core to the nature of reality and to the nature of
2881900	2886340	consciousness fundamentally. So I'm kind of holding out that
2886340	2890380	there are, you know, more mechanisms that we will discover
2890380	2894300	to be really at the core of what it means to be a conscious
2894300	2900060	being. However, in the meantime, we got to go out there and do
2900060	2903580	some cognitive neuroscience. And there's a lot of tools and
2903580	2907660	methods we can use from cognitive neuroscience like
2907660	2911380	non-invasive brain stimulation, like the observations made
2911380	2915140	with EEG or fMRI or invasive recordings, optogenetics, you
2915140	2917780	know, there's a lot of great tools out there. So we think
2917780	2921540	that, you know, there's a lot of work to be done just by viewing
2921540	2926980	these as necessary signals related to consciousness, even if
2926980	2931660	they're not sufficient to create consciousness outright in a
2931660	2936220	sort of generative way. But I think it's a really honest
2936220	2941100	portrayal of where the value of the theory is. There's a lot to
2941100	2944500	be done in this moment right now with the tools that we have.
2944780	2949900	And there's room in the future to incorporate new ideas that
2949900	2954420	inevitably will be emerging from advancements in technology and
2954420	2957580	in science. Alright, so let's dive a little bit more into the
2957580	2962700	phenomenology. What is it like to live at the apex of a
2962700	2968260	hierarchical consciousness system? So one way in which it is
2968260	2972740	like to be the top of this nested observer window hierarchy is
2972740	2978060	that ideas will just pop into your mind fully formed. This is a
2978060	2981860	pattern of emergence. So what does it mean to receive
2981860	2986820	information via cross frequency coupling? Maybe it would feel
2987180	2991500	like a light bulb going off in your head. Bam, there's an idea.
2991620	2995820	There's a fully formed, fully fleshed out concept right there
2995820	3000340	in front of you, right? The emergence process would kind of
3000580	3007020	abstract away the lower levels. You are really only aware of
3007020	3012300	maybe one layer deep into your brain, maybe two layers deep
3012300	3016140	into your brain. But once you get to three layers deep or even
3016140	3021220	two layers deep, probably it gets a lot more murky to kind of
3021220	3025300	see the origin of all this information. Another way that
3025300	3031220	it's like to be at the apex is we initiate a very cartoon image
3031540	3035380	of what we want to do. So let's imagine you're playing tennis
3035620	3038220	and you got to run to the other side of the court, swing your
3038220	3043540	racket. How aware are you of all the muscle activations of all
3043540	3047860	the groups in your in your hand, in your legs? We are
3047860	3051980	initiating cartoons in our minds. You know, and I think
3051980	3056620	cartoons are a very apt way of kind of thinking about apex
3056620	3061020	life. You know, your apex is a cartoon diagram. It exists at a
3061020	3067260	very abstract level. And yet it has access to all the details.
3068060	3074460	So we perceive HD reality, we perceive fast, high detail
3074460	3080340	information, and we generate very complex movements. However, we
3080340	3083860	experience these at a very abstract level. So one of the
3083860	3087860	beautiful things about the now model is that you can kind of
3087980	3092220	have your cake and eat it to in the sense that you are very
3092220	3098420	slow. And yet the data within your mind is very fast. So we get
3098460	3103180	all of the rich details of all the brain regions, all of the
3103180	3107140	neurons, all the proteins, all that information processing
3107140	3111740	that's bubbling up the hierarchy, you get access to it, you get
3112020	3116500	all of that information. And it's very fast, except you are
3116500	3120660	very slow. And there's no contradiction here, right? This
3120660	3123380	is a way of integrating information across very
3123380	3127900	different time scales. And you can think and act very slowly.
3128180	3132260	And yet you can propagate that down into the lower levels.
3132300	3135540	Another example of what it's like to be at the apex, we have
3135540	3139140	somewhat limited control over these lower levels. And there's
3139140	3142940	a few examples that I think really showcase or highlight that
3142940	3147620	limitation. So one of them is optical illusions. So you know,
