start	end	text
0	3160	Welcome back to the show that tells you you are a quantum
3160	7120	computer with free will supervising a vast hierarchy of
7120	10920	cognitive systems. My name is Justin Riddle. And this is
10920	15180	episode 40 of the quantum consciousness series. In today's
15180	18560	episode, I'll be giving you an update of the nested observer
18560	23360	Windows model and recapping a lecture I gave at the science
23360	27960	of consciousness conference in April of 2024. By the end of
27960	32000	today's episode, we'll ask the question, what is it like to be
32000	37360	at the apex of a hierarchical consciousness? This episode is
37360	40960	available on YouTube and an audio only version is available on
40960	44480	Spotify and Apple podcast. If you like what you hear today,
44480	47680	then please like this video, subscribe to this channel, leave
47680	50360	a comment below or for the audio listener write a review.
58120	75760	So today, I'm going to be basically recapping and giving
75760	79400	you the same lecture that I gave at the science of consciousness
79400	84200	conference in April of 2024. But I'll be giving it a little bit
84200	90560	of an expanded version. You can find the original recording on
91120	95240	on the internet, I'll provide a link that you can go look, you
95240	99800	know, at the original version if you so desire. But essentially,
99800	105000	this is a update to a previous episode on this channel that I
105000	110800	gave. However, the manuscript is now published in the neuroscience
110800	114720	of consciousness journal. I will also give a link to that
114720	118680	paper it is open access so free to download and read for
118680	121760	yourself. And this is work that I've done with Jonathan
121760	125040	Schuehler. He's a professor at the University of California,
125040	130120	Santa Barbara. So all of this work is collaborative with him. So
130120	134440	without further ado, let's hop right into it. So the title of
134440	138640	the paper is hierarchical consciousness, the nested observer
138640	143640	windows model, or the now model for short. So to introduce this
143640	147760	idea of hierarchical consciousness, because it is not,
147920	151840	you know, usually a typical way that people imagine that the
151840	155480	brain or the mind is organized. So I'll give you a quick
155480	160960	example here. So when driving, you start to mind wander, pondering
160960	164320	the nature of consciousness. Without warning, you suddenly
164320	167560	realize you were almost at your destination. You wonder where
167560	171560	the time went. Now your attention is focused on navigating
171600	175400	the which freeway exit to get off, and on what side street to
175400	179520	turn. You are acutely aware of the lack of awareness paid to
179520	183480	driving. But you do not notice that the wandering mind kept
183480	186160	wandering while you were focused on navigating the side
186160	190600	streets. When parking your car, you revisit the wandering mind.
191020	194560	There is a fresh batch of theories and models that seem to
194560	199080	have materialized. You diligently proceed to review those new
199080	204000	ideas, as you absentmindedly walk up the driveway. So this
204000	207760	example is meant to sort of showcase a couple different
207760	213080	ways in which we are not fully aware of all of the cognitive
213080	217880	processes that are ongoing within our own mind. And it appears
217880	221400	that there are many cognitive systems coexisting
221440	225360	simultaneously in your mind. And you usually can only pay
225360	229040	attention to one or a subset of these different cognitive
229040	233800	systems. So a very common example is driving. A lot of the
233800	238600	times we're flying down the freeway at 70 miles per hour. And
238600	243080	we're barely paying attention to what we're doing. But this is
243080	247240	kind of alarming, right? I mean, you could almost die at any
247240	251840	moment if you lost control of your vehicle. And yet we consume
251840	256720	our mind with fanciful ideas and and fun thought processes as
256720	260520	we are driving. And it's very second nature to just kind of
260520	265560	let your body take over the act of driving. And then at certain
265560	270520	moments, you need to interrupt your mind wandering and pay
270520	273760	attention to driving, you know, once again, and there's a way
273760	277220	that your mind can get your attention gets you reengaged
277220	281860	with the act of driving. And, you know, in the absence of
281860	286580	that call to pay attention, you can freely wander your mind
286580	293820	around. And in this example, we give kind of an additional way
293820	298380	that your mind could be operating autonomously. And that is
298380	303780	mind wandering itself. Could it be that there is a part of your
303780	309300	mind that is maybe always wandering, always engaged in
309300	313340	abstract thought. And when you pay attention to driving, let's
313340	316180	say you need to navigate some side streets as you're going to
316180	319460	your friend's house, you really need to pay attention to
319460	323460	everything that you're doing. And then you revisit the wandering
323460	328420	mind. And could it be that the wandering mind kept going when
328420	333060	you were paying attention to driving? This is something that
333060	338540	we much less often kind of attribute to what can be
338540	343780	performed autonomously in our brains in our minds. However,
344100	348380	why not? And I think if you were to introspect on your
348380	352040	conscious experience, you'd probably be able to recognize
352040	356020	many instances where there appears to be fully formed
356020	359820	ideas that are, you know, springing into your mind
359820	363260	springing into your attention. And you say, Hey, that was a
363260	367020	great idea. I just had. But where did that idea really come
367020	371820	from? Were you aware of the creation of that idea kind of
371820	376780	from the ground up? Okay, so hierarchical consciousness is a
376780	380820	very novel way of really thinking about you and your
380820	388100	mind. So you are at the top, you are the apex of a hierarchical
388100	392700	system. This means that there are systems nested within you.
392980	396980	And within those systems, there are further subsystems nested
396980	401460	within those. So what are some of the implications of
401500	406180	hierarchical consciousness? And what is it like to be at the apex
406180	410900	of a hierarchically consciousness system? So we often
410940	416220	kind of naively conceptualize the mind as a monologue. There's a
416220	420660	narrative stream, the story I'm telling myself as I go through
420660	425140	my day. And while there's a lot of validity to the idea of a
425140	430100	narrative monologue, there's also a lot of moments where our
430100	435060	mind is more like a dialogue, right? When you're in your
435060	439460	thoughts, and you're simulating these different ideas, you can
439460	443820	go for minutes and minutes and minutes at a time, debating
443820	448900	different positions, different ideas. And a lot of times we talk
448900	453580	to ourselves, you are talking through some idea, hearing your
453580	457340	own counterpoints to that idea. And it's as if there is a
457340	463140	dialogue of multiple competing interests within us. It says if
463140	467260	we have many different personalities, drives, views,
467500	471180	ways of conceptualizing the world around us, and they're not
471180	474860	necessarily compatible. And we're faced with a lot of
474860	482180	conflict, inner conflict as we navigate new situations. What
482180	485940	should we do here? What should we do there? Do we view this as
485940	489180	you know, viewpoint A or viewpoint B? And there's a
489180	496260	rich dialogue occurring internally. Another implication is
496260	499900	that we often kind of have this idea that we're creating our
499940	503500	thoughts. I thought this thought, this is my thought, we
503500	508580	claim ownership over our thinking. You are building and
508820	512940	constructing ideas. And once you have an idea, you proudly, you
512940	515900	know, tell the world, ah, look at my idea, I've created this
515900	520020	wonderful new product of my mind. And this is my product.
520780	524900	However, there are many examples, if we're kind of honest
524900	529700	with ourselves, where we just have an idea, and it seems to
529700	534660	spring out of nowhere. There's no experience of creating the
534660	538820	idea. It's like an epiphany moment, an idea is thrown into
538820	544860	your mind. Could this be some sort of nested substructure,
544860	549140	some cognitive system within you, that created and constructed
549140	552340	and did a lot of the hard work, and then just presented you
552340	558020	with an idea at the apex level. You still claim ownership over
558020	562020	that idea. However, you weren't really a part of the creation
562020	568220	process per se. Even more extreme, there are intrusive
568220	571740	thoughts. Sometimes we have a thought and we say, Oh, I did
571740	576500	not think that thought that was not me, my brain just generated
576500	580260	this thought and I am not responsible for that thought
580260	584500	whatsoever. This idea, this thought just occurred. But that,
584540	588340	you know, that's not me. I delete that I will willingly
588340	593300	suppress and remove that thought from my mind. And I also
593580	598140	reject ownership. I am not an owner of this thought. It was
598140	601660	something my brain generated. So this is also a very common
601660	605220	place example that, you know, if you introspect, you'll you'll
605220	609380	have many moments where you might not want to claim
609380	613020	responsibility over your own thinking. And we also have this
613060	617660	idea that we are in control of our bodies. You know, I choose
617660	621340	to move around and I'm making this hand gesture with my hands.
621620	626860	This is me controlling my body. However, I'm not really aware of
626860	631340	what my hands are actually doing. I am initiating a cartoon
631340	636380	version of what I want to happen. And then a very complex
636420	641700	intricate muscle activation pattern then arises. And so I am,
641860	647060	you know, in control of that to some degree. But I really don't
647060	650740	understand any of the details of what my body is actually doing.
651020	654500	And so on some level, you know, you're in control, but you're
654500	659500	not as in control as you might think that you are. And if you
659500	662580	really pay attention to what your body is doing, you will
662580	667860	sometimes find these sort of automated or seemingly unconscious
667860	671780	movements that your body is performing. And could it be that
671780	675620	there are nested systems within you that are potentially kind
675620	680180	of mediating your connection to the body. And when they act
680220	684220	semi autonomously from your will, when you're, you know, not
684220	689100	paying attention, there's some evidence of cognition or some
689100	694260	sort of will or form in your body's movements, even if you're
694260	700020	not fully consciously aware of what is occurring. So at the
700020	703340	core of hierarchical consciousness is the idea that
703380	707140	yes, you are a cognitive system. Yes, you are thinking. But
707140	711100	within you are thinking cognitive systems. And they are
711100	713980	providing you with this information with these
713980	718180	cognitive streams. And you are supervising a bit of a
718180	723900	corporation of subsystems within you. And this gives a very
723940	729340	rich landscape to our internal experience. There are so many
729340	733820	cognitive structures inside of you. And they all are acting in
733820	738500	these very complex nuanced ways. And this sort of increases the
738500	744180	richness, the variety of our inner life. And it gives a way of
744180	750180	kind of understanding biology from a from a new lens. So now I'm
750180	754860	going to dive into that kind of biological motivation. Alright,
754860	759780	so where did this hierarchical consciousness idea come from? On
759780	763860	some level, it came from introspection. But in another way,
764220	768180	there is a really strong motivation for hierarchical
768180	774260	consciousness that arises from our observations in biology and in
774260	781380	neuroscience. Okay, so if we ask the question, where in the
781380	785860	brain should we study consciousness, right? There are
785860	789940	many different people that are neuroscientists. And yet they
789940	793300	use very different tools, different systems that they're
793300	798940	studying. And so, you know, we might make this kind of pitch
799020	807220	of reductionism. Every system is reducible to a subsystem. Okay,
807660	812860	a brain region is made out of neurons. A neuron is made out of
812860	817820	synapses. Synapses are made out of proteins and proteins are made
817820	822500	out of atoms and atoms are made out of quarks and the forces of
822500	826940	particle physics. And so to understand a brain region, you
826940	828900	shouldn't study the brain region. It's actually just
828900	831700	neurons. You need to go study neurons. But you know, you
831700	835180	can't really study neurons because they're just too big. And
835220	838580	you know, they're not really real. Neurons are really just a
838580	841420	bunch of synapses and electrical potentials. But to
841420	844580	understand the electric potentials, you got to go study
844580	848620	the synapses. But you know, synapses are really not real
848620	851780	either. They're just made out of different proteins, different
851780	856860	receptors. And the synapse really just emerges from the mass
856860	862140	action of many, many protein receptors. So forget about the
862140	866180	synapse, we got to go study proteins. And then proteins are
866180	869500	really just emerging phenomenon of all these amino acids. And
869500	873180	those are really constrained by these, you know, more atomic
873180	878260	style chemical forces of organic chemistry. And then, you know,
878260	881980	it's an infinite reduction, maybe down until you hit
881980	884940	mathematics, or something like that. But then, oh, you know,
884940	889580	math is just a construct of humans and human society. So
889740	894380	really, there's this strong reductionist bias. And I would
894380	898940	make the argument that this is sort of a naive thought to say
898940	901780	that, you know, to study something, we have to go study
901780	905460	the parts. Because eventually, we're all just particle
905460	908580	physicists. And we're all going to our nearest, you know,
908580	913140	particle accelerator. And no one is doing neuroscience, right?
913420	915500	Then it's completely inappropriate to study the
915500	918740	brain at all, because we should all just be particle
918740	922300	physicists, right? So if you take reductionism to the ultimate
922300	928300	extreme, it gets a little ridiculous. So right now, the
928300	933340	status quo is that to study consciousness, you have to study
933340	938220	neurons. And in a weird way, this is like a an assumption that
938220	941780	people don't even admit that they have, right, there is a
941780	947020	strong bias to say the brain is neurons. And you have to study
947020	951020	neurons, right? But for the same reasons I just laid out with
951020	957100	reductionism. Why study neurons? Why not study synapses and
957100	961340	proteins? What is it that makes the neuron special? Well, you
961340	965180	could say, Well, the neuron has the capacity for action
965180	968700	potentials for these meaningful electrical potentials. It's that
968780	973340	electrical property, which is so meaningful. However, there are
973380	977300	very profound electrical properties at the level of
977300	982220	functional brain regions of entire brain nuclei. Why in the
982220	987300	world would you not be allowed to study brain nuclei? Why is it
987300	990820	inappropriate to study brain nuclei? And yet it is completely
990820	995020	appropriate to study neurons themselves, right? So moving in
995020	999340	either direction, you can construct some rationality for
999340	1005100	that movement. However, all theories out there, you know, in
1005460	1011260	status quo, typical neuroscience of consciousness are these kind of
1011260	1015740	toy cartoon neurons. And so hierarchical consciousness is
1015740	1020620	really making the pitch, you know, what if all of these levels
1020620	1024700	were meaningfully contributing to conscious experience to the
1024700	1028860	information processing of the brain? You can study brain nuclei,
1029260	1033020	and you can study neurons, and you can study proteins. And more
1033020	1038460	so, what if there was some system that actually allowed for
1038480	1043660	information transfer between all these different levels? If you
1043660	1048020	could transfer information across these levels, then perhaps
1048020	1052420	there is genuine information processing happening at these
1052420	1057140	different scales. And it might be different information that is
1057140	1061380	being processed, right? As you move from these orders of
1061380	1067340	magnitude of difference, there could be unique channels of
1067340	1071140	information being processed at these different scales, and then
1071140	1075540	some sort of meaningful exchange across levels. And so I
1075540	1079300	think there's a pretty good motivation to say that this is
1079300	1084740	happening in the brain. And then the follow up question would
1084740	1088700	be, what does this mean for consciousness? What if there's a
1088700	1093620	hierarchical biological system at play? How do we shove
1093620	1097500	consciousness or how do we make sense of consciousness within
1097500	1101300	that system? Could it be that there was some sort of
1101300	1106180	cognition, esch processing occurring at all these different
1106180	1111060	levels? And maybe there is even consciousness at multiple
1111060	1115220	levels within the brain. Alright, so to kind of motivate a
1115220	1120740	little bit of this theory of the evidence for it, I'm going to
1120740	1126100	pivot a little bit to say, you know, what is the evidence that
1126100	1131900	these large scale brain nuclei are real? Because in a strange
1131900	1134660	way, or maybe it's not so strange, it might align with
1134660	1139700	like just human bias of where the status quo is at. We are much
1139700	1146300	more hesitant as a field to say that brain nuclei functional
1146300	1153300	brain regions are real. Those get the label of epiphenomenal much
1153300	1156740	more often than a neuron. There are very few people walking
1156740	1159780	around saying neurons aren't real, they're just epiphenomenal.
1159980	1163100	However, there's many people walking around saying functional
1163100	1166060	brain regions aren't real, they just, you know, are kind of a
1166060	1171380	circle we draw around the brain in one way or another. But
1171380	1175260	really, we should all be studying neurons. So I like to give
1175260	1180580	the example of a train. So if we were to imagine the brain as an
1180580	1185740	engine as a train, what is it that pushes the brain train
1185740	1192540	forward through time? What is the engine of the system? And status
1192580	1196260	quo would say that the engine is neurons, there's a bunch of
1196260	1198900	neurons, and they have electrical potentials, the
1198900	1202980	spiking activities that are occurring, they release chemicals
1202980	1208780	from one onto another, and then they react and activate based on
1208780	1215180	this chemical signaling. However, if you put a recording device
1215260	1220380	inside of the brain, you observe these large electrical
1220420	1226220	fluctuations at the scale of entire populations of neurons.
1226740	1231340	And what we used to think as a field is that these electrical
1231340	1235180	fluctuations were just kind of the steam off of the brain
1235180	1241020	train. These are epiphenomenal. They're not real signals. Well,
1241020	1243820	there's signals in the sense that you can measure them, but
1243820	1247060	they're not really doing anything, right? It's not
1247100	1253540	contributing to the function of the brain. However, we now
1253580	1258500	realize after some experimental work and after some theoretical
1258500	1263300	work, that there might be a bit of a circular causation here
1263300	1267580	where even if these electric fields at the scale of hundreds
1267580	1271140	of thousands to millions of neurons, even if that's
1271140	1276460	generated from the activity of smaller, you know, neurons
1276460	1279780	themselves, and the mass collective action of these
1279780	1284020	neurons, once the electric field has been generated, once it
1284020	1289700	exists, it then exists independently of the individual
1289700	1294780	neurons, and that electric field can then change and constrain
1294780	1298540	the activity of neurons. And there's a little bit of a
1298540	1303580	circular causation here. Neurons can cause electric fields.
1303780	1307380	These electric fields can then change neurons. And it's not
1307380	1311220	saying that one is primary, although maybe you could make
1311220	1313980	the argument that you wouldn't have the electric field without
1314020	1320180	the neurons. And that is, you know, likely true. However,
1320220	1325260	they're, you know, they both are contributing meaningful to the
1325260	1329460	processing of these systems. And there has been a lot of work
1329460	1335820	lately, really diving into what do neural oscillations do for the
1335820	1339380	brain and for cognition, and we're getting more and more
1339380	1342540	evidence that they appear to be meaningfully related to
1342540	1346500	cognition. So what I would make an argument to you, why should
1346500	1348820	we care about these electric fields about these neural
1348820	1352940	oscillations? Well, these neural oscillations are really the
1352940	1357860	closest correlate that we have to cognition. So I'll give you a
1357860	1363580	couple examples here. So one example is the theta oscillation
1363580	1368980	that you can witness in sound waves. So as I am talking to
1368980	1373340	you, if you were to record the words coming out of my mouth,
1373780	1378580	you take that sound wave recording, and you break down
1378580	1382380	the frequency domain, the frequency components of my
1382380	1386540	speech, you'll see that there's a lot of rhythmic structure to
1386540	1391820	the way that we talk to each other. And more so, if you zoom
1391820	1396060	into individual words that I'm saying, there are different
1396060	1401660	sound chunks in each of my words. And those sound chunks are
1401660	1406900	coming at a very rhythmic rate across all different cultures
1406900	1411740	that we've measured. People tend to speak at a very canonical
1411740	1416980	rate. And there's a prominent theta frequency oscillation
1417220	1421820	roughly between four and eight hertz across all these different
1421820	1427420	languages that we can record from. And that rhythm is a very
1427420	1431300	prominent rhythm in the sound waves. And we can find that
1431300	1435180	rhythm from the sound waves in the electrical activity of the
1435180	1439780	brain. And if we look at auditory cortex, for example, as I'm
1439780	1442920	talking to you, your auditory cortex is rhythmically
1442920	1447900	fluctuating in sync to the words that I am saying. So this is a
1447900	1453180	really profound electrical property within the brain. And
1453180	1458340	it really closely correlates to the type of information that is
1458340	1463140	being processed in the world around us. And is it a
1463180	1467700	coincidence that we all speak at a certain rhythm? And this
1467700	1471900	rhythm is found all throughout the brain with various protein
1472500	1476540	constituents that give rise to this rhythm. There's a really
1476540	1481660	tight correspondence in frequency domain between our
1481660	1485260	behaviors and the electrical properties of our brains
1485260	1489420	themselves, which might suggest that, you know, our brains are
1489420	1493020	helping us produce language. There's some electrical
1493020	1497540	determinants, some biological brain determinants for our
1497540	1501660	speech. And then, you know, we're tuned into these rhythms in
1501660	1505300	our environment. Another example comes from the visual
1505300	1509360	cortex. So in the back of your brain, there is a electrical
1509360	1513380	rhythm called the alpha oscillation. This is occurring
1513380	1517540	roughly around 10 times per second, 10 hertz. And if you
1517540	1520620	measure visual cortex, you'll find this big prominent
1520620	1524300	electrical wave traveling through your visual cortex. And
1524300	1527660	what people have found in one example experiment is that if
1527660	1531900	you flash a light really quickly, there's a certain rate at
1531900	1535140	which if I flash the light really quickly, you will
1535140	1538820	perceive it as a single flash, versus if it's a little bit
1538820	1543260	slower, you perceive it as two separate flashes. And there's a
1543260	1547460	certain time point at which it crosses over from being
1547460	1551820	two flashes into getting fused into a single flash. And this
1551820	1557300	is the flicker into fusion rate. And this is roughly around
1557300	1562060	100 milliseconds in the average individual. And what people
1562060	1566300	have found is that the rate at which your visual cortex is
