start	end	text
0	6120	Hello everyone and welcome to the Mindscape podcast. I'm your host Sean Carroll. Here's a classic question
6480	12400	What is the use of education? What is the value of being educated?
12400	18520	I'm thinking particularly here of post secondary post high school education college university
18800	24440	Even graduate school and so on. Why do this? Why get that much schooling into you?
24760	27120	There are you know lofty
27520	31400	Answers to this question about becoming a more well-rounded human being
31960	37920	Understanding the human condition picking up reasoning skills and learning skills. There's also
38640	43240	Socialization issues right meeting people getting to know the world in a certain way
43240	46480	That's absolutely an important function of going to college
46720	51440	But there's also a lot of down-to-earth practical issues, right? You're being trained
52240	57480	Perhaps for a trade for a job to become employable. That's an absolutely valid
58200	66160	reason to get an education in the modern world, especially we point toward science and technology as
67080	73160	Skills or fields for which we would like it if people had good training in these fields, right?
73160	75800	We invent the acronym of STEM
76400	83120	Science technology engineering and mathematics. This is government speak or education speak for
83520	87880	the kinds of sciencey techy kinds of areas that
88320	94400	Both governments and also employers place a lot of emphasis on so if you're not within academia right now
94400	100880	You might not know that there's a lot of hand-wringing and angst about the decline of the humanities and you know the more
101480	109640	classic parts of the broad-based humanistic education that we purport to care about and too much emphasis maybe is being put on
110160	112160	science degrees and
112160	115920	Related areas, but there are good reasons economic reasons
115920	120960	You know you want people to get a good job that's able to pay them and you give them a fulfilling life after
121280	126220	College so maybe it's fine to have a bunch of people specializing in STEM areas
126700	133460	Today's guest is John Screntany. He's a sociologist at UC San Diego and actually someone I've known for a long time
133460	140460	We went to graduate school at the same time together and used to play basketball together as you'll find out if you hang out for the very end here
140660	146940	But he's written an interesting book called wasted education how we fail our graduates in science technology
147500	150940	engineering and math the idea behind John's book is
151780	155460	sure employers and governments want
156220	158900	healthy and rapidly growing
160140	168940	Scientifically and technologically educated workforce, but does that mean that once created that workforce is actually fulfilled?
168940	176020	Is are they happy do you get a science degree and are you there for able to get a good job that keeps you?
176740	178740	Having a good kind of life and the answer
179140	183780	Not always certainly, but in a growing number of cases the answer is no
184300	187140	So it's a it's a very interesting argument
187140	192420	I mean we have to say over and over again and John will say very explicitly in the podcast of course
192940	194580	certain individuals
194580	197660	Get very rewarding careers out of science education
198420	204940	But we also have to take into account those that don't and we're not primarily talking here about people who go into academia
204940	207980	We even want to go into academia. We're talking about tech workers
207980	214420	Which is a huge fraction of the people who go from STEM degrees into the workforce. They work for
215140	216500	computing
216500	218740	technology software engineering kind of
219820	221300	corporations and
221300	224140	It can be a tough road to hoe as a matter of fact
225060	229180	For one thing novelty and innovation is of course
230060	235740	valued it turns out for various reasons that we'll discuss that it can be easier to just
236220	239380	Get rid of your workers and hire newer younger ones
239980	245860	Rather than retraining the existing workers the new workers already have the skills, right?
245860	250460	They just learn them they're fresh in their minds that they're cheaper and then a decade or two later
250500	255760	They can be fired and they can be replaced. It might not actually be a
256260	262060	Sustainable way to think about our workforce or what it means to be a scientist or what it means for
262460	268740	Colleges and universities to do their students a good service by providing them with an education
269380	274940	Harder to come up with solutions to this issue than to diagnose it
275540	282420	Certainly very deep features of capitalism and our economic and political system are involved here
282420	285820	But it's an important issue to highlight one way or the other
285820	288860	We need to know what we're doing when we're training people in these
289540	292460	Different areas that I personally value very much
292700	298980	But we have to be explicit what to be conscious of what's happening. We can't just say oh science is good
298980	302780	Therefore do it we have to look into what happens when we try to do that
302780	307620	So I think it's not exactly what we usually talk about here on Minescape. It's sociology
307620	311940	It's an important part of the liberal arts spectrum. So let's go
315820	317820	I
329780	331780	Don scrappney welcome to the Minescape podcast
332540	336980	Happy to be here. I'm excited to talk to you Sean, you know since we're old friends
336980	341180	I thought I would start you off with a couple of soft balls to get the ball rolling here as it were
341700	345820	So what is this stem acronym and why is it a terrible acronym?
348220	352600	Actually compared to the alternatives, it's it's pretty awesome
353100	360100	So do you prefer stem over smet? I prefer not using an acronym. Oh, okay
360100	366140	Well, I gotta tell you the government has been searching for an acronym for quite a while
366300	372380	And and that's because they've been trying to count people in these fields for quite a while
373140	377540	Really since the Cold War. Yeah, I in the book. I include a
378900	383260	A New York Times story in which there's this panicky headline in the New York Times
383860	388860	About how the United States is falling behind the Soviet Union in the number of technicians
389780	395020	Would you would you prefer that probably not probably not they were talking about scientists and engineers
395380	403820	The National Science Foundation has scientists and engineers or s and e s ampersand e so not exactly that
404740	406740	that
406860	407660	Euphonious
407660	409860	one might say but it appears so often in the
410500	414980	Educational context and like no one majors in technology. That's not a thing, right?
414980	418340	You can major in science engineering or math. They're very different from each other
418340	424460	So I don't like lumping right together. So I kind of like using words rather than acronyms. Yeah. Yeah, so the technology
425020	429940	I saw a government report that used the acronym set science engineering and technology
429940	437300	So people really like technology. Sorry. They might know that and then there was and then there was some use of smet science math
438140	445140	Engineering and technology and that had a rationale to it where science and math are the foundations of engineering and technology
445260	447820	so it you know by putting them first that's sort of
448140	449420	kind of a
449420	454420	Temporal ordering of what comes first you do the basic science you understand the math and then you develop
454460	460660	The technology, but smet sounds like not I'm on a Pia, right? Yes, it's not bad
461660	464180	Yeah, oh my god a smet
464700	468180	so it didn't really catch on and then a
469620	475260	Judith Romley is her name. She was one of the higher-ups at the National Science Foundation
476060	480100	She apparently is the one who coined the stem acronym
480700	484220	just changing the order a little bit making it sound a little bit better and
485340	491860	Then it just took off. I I had a graduate student kind of look who's doing research assistance for me and
492380	498100	She looked at the rise of the stem acronym and it just started to appear in
499300	506020	bills in Congress and it just took off and so you may not like stem but a
506500	508620	lot of other people like it that is and
509380	512700	It's a much more detailed and serious answer than I was hoping for so
513380	516300	we're kind of stuck with it and and
516980	524580	What exactly it means? That's it. That's a different question, but but stem seems to have taken off internationally people use that acronym
524580	527220	They seem to understand when I talk to them about stem
527700	532540	So it's stem seems to be here to stay does it include the social sciences
533340	535340	That's a good question
535460	541260	The National Science Foundation officially includes social scientists in its
541900	547580	understandings of SNE science and engineering and then they also talk about stem we could go down a very tedious
548220	550460	rabbit hole about some of this but they
551300	558820	idiosyncratically I would say include social scientists because when most of the government policy makers are talking about
559820	564020	Stem they're not thinking about me. Yeah, they're thinking about you
564260	573100	They're thinking about a lot of other folks and and I can explain why that is and and people might protest that that
574300	577500	Sociologists economists demographers can be highly quantitative
578500	580500	political scientists as well and
580660	585220	You know really use advanced statistical computational methods
585220	588980	So why aren't they included in stem and I think that I
589860	593940	Think that that has a lot to do with what the government wants with its
594460	602540	Investments in stem education and they don't really want more of me. I arguably don't be offended. They probably don't want more cosmologists. Oh my god
606700	613620	Experts on general relativity, they're not saying we need more of those give us more of those they are looking for people to
614620	621140	You first of all fulfill employers demands and and these employers have been crying shortages
621660	629140	For quite a while. They want people to innovate. They want people, you know that technology that T that you were so skeptical of that's really what
629140	633340	That's what they care. Oh, I know that's yes, I think they're riding on my coattails. Honestly
634260	639620	they are they are and and they they have this hope that
640420	646940	By cranking out more experts in stem fields, they will innovate and
647740	653980	They will create new technologies that will boost American competitiveness and boost American national security
654260	658300	And grow the economy and provide jobs for everybody. I
658940	660420	wrote this
660420	665380	book chapter a few years ago in which I kind of traced the
666420	668420	the history of
668820	671300	American policymakers and what they wanted
671700	676060	I'm using the acronym anachronistically now what they wanted stem workers to do
676540	680900	Obviously, they weren't talking they weren't using the stem acronym during the progressive era
681420	686540	But during the progressive era is really when you saw the government trying to think about hey
686540	691980	We've got these experts in these science and engineering fields. We should deploy their expertise
692140	698380	And so the interesting thing about the progressive era was that they wanted to deploy the
699220	704660	Existing expertise if we can use existing in relation to expertise what people already knew
704660	708460	Uh-huh and and so like pure food the pure food act
709020	714620	Wow, we know why food spoils now. We know how to prevent food from spoiling. We know how to keep
715500	716860	Meat safe
716860	722820	Let's keep those let's use let's deploy that expertise and make sure that we can make food better
723580	730860	Progressives were real excited about, you know, all the new knowledge being generated and and they wanted to just deploy
730860	732860	to strategically as possible
733020	735020	then you had a
736260	742020	Sort of a change that happened during World War two which I'm sure you're familiar with with you know
742020	746420	the Manhattan Project and developing the nuclear bomb developing radar and
747500	752780	That was a little bit different in the sense that the government really wanted to deploy
753620	759180	Scientific and engineering expertise to create specific technologies that they really wanted
759460	766380	So they brought together a lot of experts and said hey, we want you to develop a system that can detect enemy aircraft
766380	769860	Or hey, we want you to come and develop a system that can produce a
770620	773700	Weapon that could potentially end this war the nuclear bomb
774060	778380	So it was very targeted use of expertise even though they didn't yet have the expertise
778500	781140	So you can see we're one step away from the progressive era
781300	784660	but by the Cold War we started to get into a
785500	791780	phrase that I I kind of called it alchemy because it suggested this sort of this hope that by putting stuff together
791900	795500	Something amazing would happen. It wasn't as rational and
796220	802540	And they didn't the government really didn't even have an idea of which fields we're gonna create the most innovations or the most
803060	810140	The most innovations that would create the most jobs or the innovations that would boost national competitiveness the most economic competitiveness
810140	815020	I'm talking about here. It was just the sense that by creating more people with STEM
815260	816460	educations
816460	818460	amazing things were gonna happen and
818660	820180	We don't know what
820180	823860	But amazing things are gonna happen just get them together kind of like Bell Labs
823900	828140	Maybe it was a little bit like that bring them together and amazing things are gonna happen and
829020	831020	in this in this
832460	837260	This kind of understanding of STEM education and STEM expertise it was
837780	841580	There was a lot of hope and faith kind of the faith and I like that
842220	847580	Use of the word faith. We normally connect that with religion, but it was almost like that
847580	849780	it was like wow these people are gonna save us and
850540	855380	Let's invest in them and let's make them go so techno optimism at an early
855900	860840	Yeah, yeah, that's yeah, that's a phrase that that's that's bounced around a lot in this
861660	866420	So so you've already implicitly answered this question a little bit
866420	870860	But I'm wondering since we're gonna be talking about STEM education and what happens to people who get STEM degrees
871500	878400	It to in what sense is this a job for sociologists to think about we haven't had that many
878600	883720	Sociologists on the show. We had a great talk with brokerington about offshore wealth management
883840	890360	But you know, we haven't really gone into you know enough to for the listeners who you know
890360	895440	I assume listen to nothing but the Minescape podcast to really get an idea about what sociologists do
895440	900080	So is this is are you doing mainstream sociology? Are you kind of branching out a little bit with this topic?
901520	903520	That's a great question
904240	908480	One of the reasons I went into sociology was that I see it as
909680	914440	The big picture social science. I I think that
915200	920040	Economists produce a lot of great knowledge. I think political scientists produce a lot of great knowledge
920680	922680	but I tend to
922840	931080	Think of the knowledge they produce especially economists as kind of looking through the world through a rolled-up piece of paper
931120	932360	You know, yeah
932360	939760	Creating that right now in my with my with my hands here and and you can see something you can focus on something really clearly
940560	942560	but you
942600	949640	Don't necessarily see all the different things that might be connected to that thing that you're really really focusing on right so
949840	951320	economists can
951320	959960	Can lead us astray sometimes in ways that I think if sociologists will more inclined to study some of the issues that economists focus on
961120	963280	You know, they might have provided a little bit of a corrective
963280	964640	so for example
964640	972320	The world is is filled right now with a lot of folks who are upset about free trade and how free trade
973040	979440	Produced a lot of economic dislocation people running losing their jobs people who used to work in manufacturing
979760	983440	Not having those jobs anymore those jobs have gone abroad
986200	990840	This should have been obvious and and and I think that the
991320	996640	Economists tend toward and sorry for any in the audience. I think they tend toward a kind of
997360	1003720	really basic sort of utilitarianism and so, you know, they might think well, we might lose some
1004520	1009420	Manufacturing jobs, but overall we're gonna be happier because you can produce
1010080	1015280	televisions more cheaply in Mexico or China now these are gonna be cheaper for us to buy and
1015800	1018320	And and these workers can move like water
1018320	1023800	They'll just flow around to the places where the economic opportunities are and everyone's gonna be better off
1024720	1030920	But what they don't understand is that people have identities their identities are often linked to their jobs and
1031680	1033360	and so
1033360	1034440	they
1034440	1036720	They struggle with economic dislocation
1037640	1039040	so
1039040	1044640	Sociologists, I think can look at this big picture see all these things going on and that's kind of what I
1044880	1051880	Love to do. I often think of the knowledge that I do compared to the knowledge that you do or that you generate
1051880	1059640	I think of the kind of science that you do Sean is like vertically integrated like it's really really
1060280	1062280	deep and
1062280	1067920	And like if you are focused on a problem of general relativity, I just keep reading that up because I know you wrote the textbook on it
1068800	1072600	But and someone knocks on the door and like Sean we got to talk to you
1072880	1074880	Like you lose your concentration
1075480	1080040	The whole thing falls down. You're annoying and and then you got to get back into it
1080600	1086120	Whereas the stuff that I do and why it's hard to do this podcast just to give you a heads up
1086640	1093680	It's like horizontally integrated knowledge. It's a lot of stuff at a more superficial level, but really broad, right?
1093960	1097920	so I'm trying to understand, you know, investments and
1098840	1101600	education and what what employers in
1102560	1110880	Software and oil and gas and chemicals and biopharmaceuticals like all this stuff. It's just it's kind of at a superficial level
1111800	1115480	But there's a lot of it. Yeah, and and I I love that though
1115480	1118880	And I think it fits more with my undiagnosed
1119280	1124480	ADD, you know that it's easier for me to get back into it if someone knocks on the door because you know
1124480	1127800	There's a lot of different footholds I can grab on to rather than that really narrow one
1127880	1131880	Does that make sense to you and I'm talking about we did have herp gintis on the podcast
1131880	1137160	I don't know if you know his work. Yeah, it reminds me very much of that even though he self-identified as an economist
1137160	1141200	But game theory evolution physics it all came in and I absolutely
1141880	1146760	See the appeal of that. That's why I do a podcast rather than just sitting in my office writing papers
1147280	1151920	Right, right, right exactly. So the sociology when I when I when I looked at this issue
1151920	1156560	I got a little pushback from some some STEM workers themselves like who are you?
1156600	1159280	What are you doing? You're a sociologist. Why are you looking at this? I?
1160200	1164240	Would like to think I'm the guy yeah who can look at the big picture here
1164240	1168520	I can see things that you can't see I can bring together different
1169360	1175480	Different ideas different systems of thought that maybe you're not aware of and use those things to illuminate social reality
1175920	1180600	In in a unique way that actually adds some value that makes a contribution. All right
1180600	1182600	Well, we'll see over the next hour whether we do that
1183520	1185520	I
1186080	1190760	Put a lot of pressure on yeah, I know you really just set yourself up there better be amazing
1191520	1198040	So let's for people who are not professional sociologists are hanging out there with let's set the stage
1198040	1203320	You know we have people who get degrees in the stem and I guess the two questions
1203320	1205600	I want to ask you can address them in whatever order is
1206280	1207520	one
1207520	1211640	What kinds of jobs do they go into right like you know within academia?
1211640	1215760	We love it when people go into academic jobs and we imagine getting a PhD becoming professor
1215760	1220320	But you and I also know that's a small fraction of all the people who get degrees in these fields
1220320	1222800	And the other is you know, how does that compare to all the other?
1223160	1228840	Jobs like how what is a fraction of people when they go in the jobs? They say oh, this is a stem job versus
1229400	1231160	What management?
1231160	1233160	Factory jobs. I don't even know what the categories are
1233760	1239960	Right, so that's a good question the government talks about the policymakers in the US government
1239960	1246120	I know your audience is international talks about stem and non-stem as a binary, okay?
1246120	1248120	it's one or the other and
1249560	1255720	There's a few people who go beyond that but in general they talk about stem and non-stem jobs
1255720	1263160	And they do that because of that what I talked about before this this hope that by putting people into these stem occupations
1263880	1273680	The sort of traditional stem occupations software developer chemist biologists, you know things that you knew in high school as as science and
1274560	1277400	engineering electrical engineering mechanical engineering
1278640	1284680	That by by getting people into those occupations these amazing things are going to happen
1285000	1291360	In reality as I'm sure a lot of your listeners know stem and non-stem is more of a continuum
1292240	1298080	I spent a lot of time thinking about that it ended up getting cut from the book for various reasons
1298480	1306840	But it's definitely the case that there's a lot of there are a lot of jobs that in which stem expertise
1307600	1310580	College level stem expertise is very very helpful
1311080	1315280	So if you any of your listeners or listeners or software developers
1315480	1320800	They would almost certainly prefer a manager who understands software development
1322080	1324080	And so there's
1324640	1327360	A lot of people who get stem degrees do go into management
1329120	1333040	A lot of people who get stem degrees go into practicing medicine
1333600	1335600	Now the government does not
1335680	1342400	Consider practicing medicine to be a stem job. Really people might think yeah, they might think why is that what's going on?
1343360	1348480	It's because of this thing about trying to create innovation. Okay, and practicing medicine
1349440	1352800	Is does a lot of great things for people as obvious
1353440	1356000	Obvious for anyone who's ever been to a competent physician
1356560	1361360	But they typically do not innovate and create patents and jobs and things like that
1361440	1368240	We've got stem we got md phd's who might do that for the most part practicing medicine is it's about deploying existing expertise
1369520	1378000	And another area where where stem people with stem degrees will go that are not the traditional stem occupations is finance of various kinds
1378240	1380880	Very much. Yeah. No, we're we're we are
1381600	1383200	I know you're aware of
1383200	1387760	People in physics who went into quantitative finance and do some very high powered things there
1389440	1395520	The national science foundation data the national science foundation runs this great survey called the national survey of college graduates
1395520	1397520	And I relied on it a lot for this book
1398240	1401600	It shows that people go into this category of
1402320	1404320	Of you know accountants
1404960	1410320	Auditors financial specialists it tends to group them together. We don't know exactly what those folks are doing
1410560	1417040	It's probably not a lot of black souls equations and some of the stuff that our friends in on wall street do
1417840	1424160	But but so that's another area where folks go and then a lot of folks go into jobs that don't use stem expertise at all
1424960	1428240	And there's just too many to mention. It's hard to make generalizations
1429120	1435040	That it's a it's a very wide variety of potential occupations for people with with stem expertise
1435680	1442320	But I want to emphasize and I do in the book that when the government invests in stem occupy in stem education
1443040	1445040	They want people to go into
1445760	1447760	stem occupations
1447920	1450400	And I should say at the outset right here
1451040	1452080	that
1452080	1454960	About 50 percent of all stem workers in the united states
1455840	1462240	Are in computers in some way right like that. That's like that's like the 800 pound gorilla of stem
