start	end	text
2833520	2837440	I don't want to pay them more than this. That's a sociological kind of dynamic
2837440	2840080	It's called it's you know isomorphism is the jargony thing
2840080	2842720	But you know, we want to look like we're doing what other folks are doing
2842720	2846800	We don't want to be someone who pays their user experience designer too much
2847680	2849040	this this
2849040	2854240	This uh, this guy decided I can't find people here to do it. I'm going to outsource this job
2855360	2857360	So he went around the world
2857760	2860160	Eastern Europe, China, Mexico
2860960	2864560	India looking for cheaper user experience designers
2865520	2869520	Until he found some that he thought were competent and he could pay them less so
2871360	2873840	And then that's you know, the more that kind of thing takes off the
2874480	2879840	The less you incentivize people to move into that field in the united states and the more you become dependent on outsourcing that thing
2879840	2883280	but but a big argument that I make in the book is that
2884480	2892800	There's a lot of self-inflicted wounds here if indeed there is there is scarcity and the decision to pay your stem workers less than their managers
2893760	2898560	And to incentivize movements out of stem which not every firm does but it's very common
2899440	2901680	It's one of it's one of the problems in this area
2902560	2903680	well and
2903680	2905680	there is also the idea that
2907040	2911520	Because there truly are so many stem graduates that these employers can hire
2911920	2917520	That they can kind of abuse them once they're there, right that they can kind of give them overtime. Uh, there's these
2918160	2922000	Schedules that are invented to hit targets and really crush people
2922320	2928480	And it can be it can be kind of uh, soul-destroying to just toil away this job for a few years before you get outdated
2929600	2934320	I I think that that's exactly right. Sean and I I rely
2935120	2937120	pretty heavily on
2937360	2939360	to kind of explore the detail of this a
2940240	2943680	ethnography an ethnography by a sociologist named ofer charon
2943760	2948480	I want to give him a shout out because I think he did such great work where he spent some time at a
2949920	2951840	big tech company he had to keep it anonymous
2951920	2955840	but it's a it's a major tech company that that folks know and that is
2956720	2960080	you know has deep pockets it has a lot of money and
2961360	2967040	Boy, they work their workers really hard and and he he kind of captured this thing and I
2967360	2972240	I actually use this for my in my intro to sociology class to kind of in my sociology of work to talk about
2973040	2976000	Again, the sort of social scientists making everything seem bad
2976080	2981200	But even these jobs that are supposedly great even these jobs that looks that look fun
2981680	2984080	And the media image of some of these STEM jobs is
2984640	2988720	people playing foosball people playing ping pong
2989360	2994080	There was a STEM employer here in san diego that had this big swirly slide in the atrium
2994720	2996720	of their of their workplace
2997440	2999440	Uh
2999760	3004560	This ofer charon went to this company and saw that people didn't really use this stuff
3005360	3012160	That it looked like a lot of fun stuff was around but people didn't use it and that was because for much of the year
3012960	3016160	These workers were in what they call crunch mode or crunch time
3016880	3021680	And that is the time when they're racing to deliver a product that has been
3022240	3026400	promised at a for for a delivery date at a particular time
3027120	3029440	And they've got to make sure that it works
3030080	3031840	and they've
3031840	3033840	They've start working
3033840	3037120	He found workers worked an average of 67 hours a week
3037680	3039680	That's a long time. Yeah
3039840	3041840	And and they and they did it
3042480	3047680	Sort of voluntarily the the managers have these clever ways of managing workers to
3048080	3054560	If they didn't come with the passion to sort of coax the passion out of them or make them behave as if they're passionate
3055840	3058960	It's these pretty bruising performance reviews
3059520	3064640	Where every worker is ranked. It's it's called stacked ranking or forced ranking
3065520	3066960	Sometimes it's called
3066960	3068960	cynically rank and yank
3068960	3074000	Where you rank up the workers and you yank out the ones that are ranked in a low in a low position
3074720	3079360	But the workers themselves choose their hours and they choose the hours
3080080	3082800	Based on this idea that they want to impress their manager
3083360	3089760	So the manager might go to them and say hey, we got us this product. We want to deliver. We want it to have this and that capability
3090960	3094560	We need someone to do this particular aspect of this software for example
3095440	3096480	and
3096480	3099600	Do you think you could do it and how long do you think it'll take you?
3100400	3104800	And they want a high ranking. They want a high evaluation for their performance evaluation
3105440	3111040	So they kind of over promise or they certainly promise very ambitiously
3112640	3116240	Because if they say uh, that looks hard. Oh, I don't know about that
3116720	3118720	Maybe you should dial down your expectations
3120000	3122640	That manager is going to think I don't know if I want this guy
3122720	3128160	I mean the obvious analogies to graduate school cannot have missed your notice
3129120	3131120	Yes, yeah, there's
3131200	3132400	There's
3132400	3137040	There's definitely a lot of analogies to to graduate school. You were absolutely right
3137680	3141840	My mind is racing right now with some of them, but trying to stay focused here. So
3142480	3144480	So what you have is workers
3145120	3150080	seemingly voluntarily taking on these excessive hours and then
3151600	3153840	Working themselves very very hard
3154720	3158320	One one software developer compared it to drinking out of a fire hose
3158400	3160880	Just trying to keep up with all the stuff that's going on
3161680	3164560	And and developing the skills that they need
3165200	3168480	Maybe they promise something that involves a skill that they don't have yet
3168880	3174160	So they got to work to develop that and and that stuff is very difficult and one of the things that
3174800	3180560	Maybe some of your listeners are familiar with. I know some of the some of the stem workers with whom I've spoken are familiar with this
3180800	3188320	It's often a young person's game and and part of that there's there's reasons for that one of them is that
3189920	3194480	Some young people kind of realize wow, I'm going to have to keep my skills up to date all the time
3194560	3197440	That's going to be hard and I can do this for a little while
3197520	3200160	But I kind of burn out and then I move on to something else
3201120	3206560	The other thing is that older workers often have families and if you have families
3207440	3209440	They take time unfortunately
3210720	3213840	Maybe that's fortunate. That's okay. It's not it's not
3214880	3218000	It's it's something it's a job that you have to do
3218720	3219600	and
3219600	3222240	And it doesn't go away and and these workers
3223360	3225360	They have a they have a second shift at home
3226080	3228640	if they're not shunting that off onto a spouse
3229360	3233600	And and it gets harder and harder to self-train in your in your in your own
3234480	3237840	Your own time and so it just create it creates more and more stress
3238560	3246320	So these these deadlines happen and and and it does put a lot of pressure on on workers. And again, this might sound very
3247440	3251520	Softwarey very tech focused, but but those are the employers who
3252400	3258800	Say their shortages those are the employers who often are the richest those are the employers getting all this investment from investors
3259280	3263360	And if there's any place where we would expect STEM workers to be treated really great
3264000	3270960	It should be these employers and and I don't think we see that and there is there's a point you make in the book
3271040	3273040	and I wasn't sure whether this was
3273120	3276080	in your mind more aspirational or factual but the
3276720	3281280	Idea that a lot of there's some idealism in the young STEM workers
3281360	3284000	They want to or they should want to I'm not sure
3284560	3286560	make the world a better place and
3286720	3292160	That turns out not to be the most lucrative job opportunity the making a world a better place kind of fields
3293520	3295920	Yeah, so this is where I was able to
3296800	3301120	Explore some of the issues. I was a double major in sociology and philosophy
3301520	3306640	And I've always been interested like you in the meaning of life. What is this all for?
3307360	3309360	I don't get much
3309600	3313040	Opportunity to really study that but in the last chapter of the book
3313120	3317280	I wanted to really explore this question of STEM education for what?
3317920	3319360	what are we
3319360	3321360	what are we
3321760	3327200	What are we as a society hoping to get with these innovations that STEM workers are producing
3328240	3332880	And I think that some STEM workers and and I want to be really clear about this
3332960	3336800	I'm sure there's some very very happy STEM workers who are listening to this right now
3336880	3342560	I hope they're still listening and they're thinking I love my job. I'm not working 70 hours a week
3343040	3348800	This is fantastic. I'm making tons of money. I can retire early. There are those folks. I'm talking about the aggregate
3349760	3355360	And there are folks who are really excited to be working on interesting STEM problems
3356000	3358000	Regardless of what it is
3358320	3360320	Some some STEM workers are
3361200	3364560	And I admire them. They're kind of pure scientists in a way. They love
3365200	3370080	particular ways of thinking and so they could move from
3371040	3377520	cosmology or astrophysics into data science and predictive algorithms and things like that thinking
3377920	3379520	I
3379520	3381920	There's a guy I I don't know if he ended up in the book
3382000	3383120	I may have
3383120	3385040	I may have had him in there. I may have cut him out
3385120	3390400	But he was an astrophysics major who couldn't get a job or decided not to get a job in academia
3390800	3392960	And then he worked for a clothing retailer
3394320	3400960	That needed experts in AI and machine learning and that sort of thing so that they could
3401680	3403040	Give
3403040	3404560	customers
3404560	3406560	Suggestions of new clothes to buy
3407360	3410000	Okay, now very I would find that to be
3410560	3418160	Kind of soul-destroying to go from thinking about general relativity to be thinking about how can I get someone to buy things that they don't need
3419120	3424000	Yeah, but but from a pure science standpoint from the pure complexity of problem standpoint
3424400	3426400	Some folks can make that transition
3427360	3430800	But not everybody right and so there's a literature in
3431680	3434000	sociology and management and psychology
3434560	3440000	About how some jobs can produce moral stresses or even moral injuries
3440880	3444720	Anyone who's seen at at their workplace workplace bullying
3445280	3447280	That you know, they might have felt a moral stress
3447760	3453600	If they've known that their employer is someone at their job is embezzling that could create create a moral stress
3454320	3458880	But what I was interested in the last chapter of the book asking stem education for what?
3459840	3463520	Are the stem workers who are uncomfortable morally?
3464080	3467360	with the business model of their of their firm
3468320	3471280	And it's it's easy to pick on social media
3471360	3478000	But it's easy to pick on social media because there's a lot of evidence that social media produces a lot of social harms
3479120	3484240	And so I quote some workers at at facebook
3485040	3487360	Who've said facebook is hurting?
3488080	3490080	people at scale
3490320	3492880	another worker another worker more
3494320	3495440	more
3495440	3499040	Graphically said I feel like I have blood on my hands
3499760	3507200	For facebook's role in promoting disinformation and promoting political conflict in societies other than the united states
3507760	3511200	Other people have said well to actually promote conflict in the united states
3512000	3514000	there's new research coming out
3514160	3515440	about
3515440	3520560	Rises in depression, especially teen depression, especially teen girls pretty effective and
3521360	3523360	And there's studies are convincing. Yeah
3524000	3526000	there's there's evidence that
3526080	3527440	suggests
3527440	3531600	Hard to prove these things definitively causal inferences are very difficult in social science
3532080	3536320	But there's evidence that suggests social media use is part of the reason we're seeing
3537920	3540880	Very alarming rises in teen depression
3542000	3546400	So, you know, some stem workers can think oh, we're doing interesting things
3547120	3552400	Analytically these are exciting problems to solve. I'm working with smart people. They can get really jazzed about that
3553120	3555120	Other workers can kind of think
3555440	3561120	When I go home at night, I don't feel good about what I'm doing here. Yeah, um, you know, they're even like
3562560	3564320	I don't know if any
3564320	3569120	I don't know if any of your you or any of your listeners have kind of gone on these youtube rabbit holes
3569120	3573040	Where you start watching a video and then youtube saying what about this one? What about this one?
3573040	3575520	How about that one you like that check out this one?
3576320	3578640	and they they tend to
3579600	3583360	Lead you into more extreme content or more
3584000	3586000	shocking or emotionally
3586560	3588400	provocative content
3588400	3590400	there's a phrase
3590960	3596400	Engagement equals enragment or maybe you could reverse it enragment equals engagement, but the idea is
3597200	3600720	getting this emotional hook into the users by
3601600	3603200	outraging them
3603200	3605600	Is a way to get them to use the app longer?
3606320	3608080	and so
3608160	3609440	you know
3609440	3611440	Google the google owns
3611760	3613920	Alphabet owns google google owns youtube
3614640	3616640	They're involved in this stuff as well
3616640	3620480	Very rich company using using different technologies to get people
3621040	3626240	Very upset and you could imagine workers not being happy with this. Well before you
3627120	3633280	Defended capitalism a little bit saying that there's a particular type of capitalism which we've evolved to and and I
3633360	3639200	I appreciate the benefits of capitalism in in certain circumstances markets are good at solving certain problems
3639680	3642240	But a lot of what you're describing really just sounds like
3643120	3646400	Capitalism that's gotten better at being efficiently
3647520	3653280	Capitalistic because of faster information flows and faster decisions and more scales and
3653920	3656880	wider labor markets and things like that whereas
3658160	3663200	As a globe as a species we produce a lot. We produce abundance
3663440	3666640	And and do we need to think radically it's late in the podcast
3666720	3668880	This is where we let to you know get to speculate a little bit
3668960	3673120	So do we need to think more radically about the system that lets this all happen?
3675040	3678720	I actually don't think we need to think more radically about it. I think that
3679360	3682320	we have the tools available now to
3683440	3687600	Get more out of our investments in STEM education than we are getting now
3688400	3693120	One of the things we could do is create more incentives for
3694960	3697360	Innovators in the fields that we desperately need
3698160	3704000	I often think, you know, if if we're all made extinct by climate change or something like that
3705520	3708720	And you know when alien civilization comes down and they look at us and they think well
3708720	3710720	What were you guys investing in
3710720	3715680	When the planet was falling apart and there were pandemics and the signs were all around you that you were in big trouble
3716080	3718800	And if we say cryptocurrency blockchain AI
3719600	3721600	surveillance economy, you know
3722480	3724480	It's going to look a little silly
3724560	3725920	so
3725920	3728720	I think some intervention is needed, but not a radical change
3728800	3734480	So one of the things we could do is create more government incentives in investment in clean energy
3735760	3737760	Better plastics that don't
3738000	3742560	To don't create micro nanoplastics that are in our bodies and human breast milk
3743120	3744560	incredibly
3744560	3748320	Forever chemicals that we don't know what are doing with us. We can create
3749200	3751680	We can create incentives through tax
3752240	3757600	rebates or tax incentives to make these movements happen the inflation reduction act
3757680	3764560	Which is a very general name for a very big bill did create these incentives and it's created stakeholders who are are
3765200	3770480	Moving into the clean energy space. So one thing you can do is create incentives for more of the investments we need
3770880	3776080	That'll produce more opportunities for stem workers to deploy their skills in ways that might feel morally
3776720	3778720	resonant with them
3778960	3781200	And another thing you can do is simply
3782400	3784240	Make illegal
3784240	3790800	Some uses of stem skills. There's there's a lot of debate in among legal experts about whether
3791600	3793840	Targeted advertising should just be banned
3794400	3799760	So that you remove the incentive for these companies to endlessly find ways to
3800320	3806160	To surveil their all of us on the internet because if they can't do this targeted advertising
3806240	3810640	Then they don't have an incentive to do that anymore. So you can legislate things away
3811440	3813120	and then
3813120	3815120	another thing you could do is just think about
3816960	3821440	Moral limits on investors and and business models, you know
3822480	3826160	Cannabis is legal in my state of cal of california
3826880	3833680	But my understanding is the cannabis business is a little shaky because banks are a little nervous working with those folks
3834400	3839600	There's there's this kind of sense that they're sort of cordoned off like whoa, you guys are a little bit different
3840400	3841600	um
3841600	3846000	I hesitate to use this word, but pornography is a very lucrative field
3846000	3851600	That's also kind of like, whoa, we don't want to invest in that, you know, we don't really want to be a part of that
3852560	3859920	So we already have moral limits that shape investor behavior and and what people are willing to
3860800	3864720	spend their time on in terms of business practices and investing
3865520	3867360	but for some reason
3867360	3869360	it's okay to
3870560	3876080	Take away people's privacy to stoke division and conflict to encourage
3877760	3880560	Disinformation the spread of disinformation in society
3881360	3884880	A lot of things that you might argue are more harmful than cannabis
3886160	3892160	You know are okay for investors to invest in you know mass layoffs, which disrupt families
3892560	3894960	There's a lot of things that investors tolerate right now
3895760	3900000	Which perhaps they shouldn't perhaps a little more moral education
3901040	3907280	Could could go a ways here as well, you know, I'm not a cannabis guy, but I was an online poker player
3907760	3915920	And uh, it it used to be done by many many people and the government swooped in one friday and seized all their assets
3916480	3919120	And uh, really basically can't play poker online now
3919680	3923360	Certain states you can but it used to just be all over and and I agree
3923440	3926400	That's a lot less harmful than some of the things you just mentioned
3927600	3930240	Yeah, so there's there's research that suggests that
3931200	3932160	you can
3932160	3937920	You can tweak capitalism. You can you can fix it and which in ways that will generate
3938640	3945520	The productive energies the innovation the riches the capitalism that can produce and minimize some of the harms that we that we see
3946080	3948640	Well, I don't quite so the thing that I'm still missing though is
3949200	3951200	The innovation disrupting
3952000	3958000	The kinds of jobs that people grew up having you know if if if as is plausible
3958400	3961760	The rate of innovation and and which skills are relevant is
3962560	3964560	Increasing the rate so it's faster now
3964880	3972000	We're always going to have a an issue where people who hit 50 are no longer valued and that that does seem a bit harder to solve
3972000	3974000	I'm not quite sure how to do it
3974000	3975600	Yeah, so
3975600	3982080	The the national survey of college graduates. They they asked this broad range of of of college graduates
3983120	3987440	Did they take skills related training in the past year or two and
3988240	3989360	and
3989360	3995920	We looked at the time since their degree and about 60 percent have taken skills related training in stem
3996880	3998880	Up to 30 years after their degree
3999600	4004320	So we're getting into the 50s. It starts to go down when we're getting into getting into people's 60s
4004720	4009440	So you're absolutely right that that is an issue. So one of the things that we need to do is
4011760	4015120	I don't like this phrase Sean because it sounds so 1970s
4016080	4020240	The lifelong learning we we have this model of education
4020880	4022880	That you graduate
4023280	4025360	in your early 20s, and then you're gone
4026320	4027920	and
4027920	4032560	And I really think we need to change that we're in a different era now
4033200	4038800	And we need a model where we think of college as a place you return to
4039520	4041040	periodically
4041040	4043040	for skills updating or
4043600	4048480	A rescaling something in a different area altogether when your skills become obsolete
4049680	4054480	Maybe something like a subscription model or something where you can go back to your alma mater or a different university
4054960	4061040	But this expectation that we have of college is something you do when you're young and then you move on
4062000	4064080	Maybe needs to be changed a little bit
4064720	4068880	I I still think that college education is absolutely essential for creating
4069280	4074800	But I would I like to think of as foundational skills the basic skills that a college graduate has
4075280	4077280	One of the things is to learn how to learn
4078400	4080640	PhD training really makes you good at that
4081120	4085440	But even with the bachelor's you kind of learn how to learn you can discern good knowledge from bad knowledge
4085440	4087440	You learn how to sort of sort through
4087520	4089760	what's what's good and bad and in in
4090560	4093040	Trying to find the skills that you might need or the knowledge you might need
4094000	4096000	But you'll have that core foundation
4096560	4101760	But then on top of that the skills that you actually deploy at work might change many times throughout your career
4102560	4106160	So I would argue and I'm working on a book on this with a colleague right now
4106800	4108800	College education is great for that foundation
4109280	4111280	But circling back to
4111600	4114560	College to get a skills updating not for another degree
4115440	4117440	but kind of a short-term certificate
4118080	4119120	kind of
4119120	4124480	Very specific narrow kind of skill that can be deployed now might be something that many people will have to do
4124800	4130880	Repeatedly throughout their careers. I mean I am course of course. I'm very much in favor of lifelong learning
4130960	4133840	I do wonder though about the model because
4134640	4140400	What is that a very different life stage at age 40 than age 20 right when you're 20 not only you're learning it for the first time
4140560	4145680	But there's a certain freedom to fail because your obligations are relatively low
4145760	4148560	But once you have a kid and mortgages and things like that
4149440	4155200	And also you've been happy for the last 20 years doing some job. I mean I I'm in favor of efficiency
4155680	4161600	But I feel the human cost of having to say I need to do something different than what I've been doing before
4162960	4166320	Yeah, I agree with that. But the reality is
4167040	4172240	The reality is upon us. You are gonna have to do something different. There was a great study that was done
4172720	4176960	You know, social scientists love a natural experiment where something happens and you can
4177680	4179440	Something happens that's rare and you could
4180000	4182480	examine how human beings respond to it
4183120	4185120	so Steve Jobs decided that the
4185920	4190800	iPhone was no longer going to support adobe flash software right said, you know what?
4190800	4193680	We're not going to do adobe flash anymore. We're going to use something else
4194240	4196240	And there were a lot of software experts
4196960	4201600	On adobe flash not necessarily employed by adobe, but that was what they did
4202400	4208400	Suddenly that was gone. Yeah, they had to respond. So that reality is already there
4208880	4210880	Where the where a skill that
4211840	4213840	Has maybe been developed over a few years
4215200	4217200	It's just no longer needed
4217280	4218880	and
4218880	4223440	So that reality is already there. So how are we as a society gonna gonna deal with the
4224320	4228480	the regular obsolescing of technical skills and
