start	end	text
4229200	4231200	You're right. It's definitely hard
4231760	4234080	People's identities get wrapped up in their jobs
4234720	4235920	and
4235920	4239040	And they their their skill sets get get, you know
4239520	4244560	More and more fine-tuned and then to lose that can be really tragic, especially as you say if they have a family
4244880	4246880	So that's going to be difficult. I think if
4247200	4252640	If shareholders don't punish companies for investing in the training of their workers, especially the richest companies
4253280	4256960	And for investing in their workers, that should be something that's encouraged and applauded
4257840	4260800	I got to tell you I don't want to go off the subject too much here
4261040	4265120	But google invests a lot of money in schools
4265760	4268560	They they give away chromebooks to students
4268640	4275200	They do a lot of things to get to train the next generation of software developers at that stage
4275920	4279200	But they could do more for their incumbent workers. Yeah
4279840	4282960	You know, that that's the odd thing and so social scientists
4283040	4288880	They they talk about corporate social responsibility and some things are done kind of as corporate branding, you know
4289040	4293840	Like look how good we are. We give away this money. Some of it's done to kind of create market share
4294160	4297520	Let's get a bunch of people using chromebooks and they're gonna love google
4298080	4300800	So there's there's money that's being spent in this area
4300800	4305680	But I would argue they could do more for their incumbent workers to manage these sometimes
4306240	4308240	Sometimes very difficult to navigate
4309200	4312960	Uh career changes or job skill changes later in life
4313280	4318080	Maybe maybe as a final thought we can be more idealistic ourselves because uh, of course
4318720	4320720	We want people to get
4321280	4322880	lucrative
4322880	4327120	Rewarding jobs that they can have in some level of security throughout their career
4327200	4329920	But that's not the only reason to get an education, right?
4330640	4334400	When people ask me about applying to graduate school in physics
4335120	4340960	My line is typically that you probably you will probably go in hoping to be a professor
4341120	4343440	You probably will not succeed at being a professor
4343760	4348240	But getting a phd in physics is actually an intrinsically good thing. You'll you'll be able to do something else
4348320	4349920	You'll learn a lot of skills, etc
4350560	4353680	I don't feel the same way about being a postdoc, but that's a different conversation
4353760	4356880	But you know, where does that fit in to this conversation?
4356880	4361840	Just the idea that getting a degree in STEM or related fields, you know has some value
4362400	4365040	Whatever your future life trajectory turns out to be
4366320	4369760	So I've seen that argument and
4370800	4375360	I appreciate your honesty when you tell people that the odds are
4376080	4379040	The odds are they will end up doing something different, right?
4379280	4381920	Then I think that's an important message to give them
4382400	4386240	Say yes, this is a great thing to do. You're going to get some very important skills
4386640	4389040	But keep an open mind for developing
4389680	4394480	Keep an open mind toward career trajectories that don't look like physics, right? So one of the
4395280	4401120	One of the disturbing findings I had in some research with a colleague when we looked at the national survey of college graduates
4401520	4405200	And we looked at people with STEM degrees who went into non-stem jobs
4406080	4411280	Is they were significantly less likely to report being satisfied with their jobs
4412080	4413200	overall
4413200	4415200	and interestingly
4415200	4421200	They were significantly less likely to be satisfied with the intellectual challenge of their jobs
4421440	4422800	interesting
4422800	4424800	so
4424880	4430720	A little bit less or they're less satisfied. They seem to be a little bit more likely to be bored
4431840	4433840	I don't feel so great about that
4434240	4435680	and
4435680	4436960	and so
4436960	4442400	You know being honest with people and telling them. Hey, there's a good chance. You'll be doing something else
4442800	4446720	I would encourage folks to develop a broad range of skills through
4447360	4453040	We've got this I call it STEM mania in the book at my university Sean University, California, San Diego
4453120	4458160	It's it's sort of like a public caltech. I always thought of it as that it's it's really STEM focused
4458640	4459840	It was born
4459840	4465360	It's it isn't send you because that's where the script since student oceanography was and that sort of stem tone
4466000	4468000	really kind of dominates the university
4468640	4474240	And the students who major in the humanities and social scientists are social sciences other than economics
4474800	4476960	regularly have to defend themselves to the
4477600	4483280	They're they're the stem the stem majors who are like, what are you going to do with that? What's wrong with you?
4483440	4485440	This is crazy
4485920	4487920	And so this will sound self-serving
4488000	4492000	But I tell my stem majors who do take sociology classes
4492160	4495840	It is important to get a broad range of skills skills related to
4496400	4501200	communication written oral critical thinking outside of technical skills
4501840	4503360	because
4503360	4508560	Chances are you're going to move into something outside of stem or sort of stem adjacent
4509120	4513840	And and and college is a time to really develop that that broad range of skills
4514160	4519920	I mean you always had that I mean you really always stood out your double major in philosophy and astronomy as I recall
4520080	4524480	Yeah, so you always had that message, but that's not typical
4525040	4531280	And so you could segue into this whole podcast thing and you know this this whole range of
4531840	4534640	Stuff that you do because of that undergraduate training
4535840	4538960	I'm trying to make a world of little miniature Sean Carroll's
4539680	4541680	So that they will have that
4542240	4547200	Flexibility to plug into different places in the economy stem expertise is great to have
4547200	4553840	I I would think the best thing that you could have to prepare yourself for the workplace of tomorrow is stem skills and
4554240	4558480	non-stem skills foundational sorts of skills like like like you have
4558800	4562240	Yeah, I mean you're not going to get any argument from me that the broad base is important
4562400	4566080	But if it's true that people who get stem degrees
4566800	4568320	report
4568320	4571120	dissatisfaction with their jobs once they get them
4572080	4575840	What are the data about humanities degrees or social science degrees?
4576880	4583440	No one cares about them. So I I didn't have a grant to look at them. I didn't really look at those folks
4584080	4587520	There are I I initially wanted to explore this there are
4588400	4590400	Pretty significant percentage
4590880	4597680	Different studies have different percentages, but a good 15 percent, you know of stem workers don't have stem degrees
4598560	4600560	and so you have folks
4600560	4601600	excuse me
4601600	4607520	You have folks who majored in humanities sort of subjects and they moved into technical fields
4608160	4612800	One of the great things about software development is it's a field that's pretty porous
4613280	4616800	You don't it's not like electrical engineering. It's hard to break into electrical engineering
4618880	4620880	Life sciences without those degrees
4621600	4629680	But software is is wonderfully porous you can you can be this sort of kid who worked on a computer in high school
4630320	4634720	Went and got I actually have a friend of mine who was a creative writing major
4634800	4639440	But he tinkered with computers in high school. He developed some some software
4640160	4643120	Sold it to a major software company did really well
4644000	4646000	Even though his major was creative writing
4646080	4649440	So software is is is really welcoming to people
4650160	4655280	You can do these boot camps where you get your foundational skills in writing and communication
4655680	4659200	Then you do a boot camp encoding or data data analytics or something
4659440	4662160	Then you can plug into the stem economy that way
4662480	4665920	So that's definitely something that that you that you can do
4666560	4671360	So I I applaud those folks, but for the most part people are not
4672320	4675200	Worried or valorizing our humanities majors
4675680	4676880	And so
4676880	4682720	And and I don't want to say we need to treat our stem majors and our stem our stem grads better than the other grads
4683520	4684560	but
4684560	4690320	If we say that there's shortages of stem grads if we say that stem grads are so important for the economy
4691280	4694320	We should at least treat these weeks these folks really well
4694880	4702160	And and hopefully treat everybody really well, but at least these folks who were constantly saying are so important and in such
4702480	4708880	Short supply. Well, okay. I like your final message, which is everyone should major in creative writing. I think that's a very
4710720	4715680	Wonderful world going forward. So it's John Scranton. Thanks so much for being on the mindscape podcast
4716240	4720160	Thanks, Sean. It was great to be here and you know, I just want to end with one thing
4720640	4724960	I've listened to podcasts before where people know the interviewer the host of the podcast
4725280	4728960	And they tediously kind of say, oh, we had also many great times in the past
4729440	4731360	You can cut this out my friend
4731360	4737360	But probably not many listeners know that you were a double threat on the basketball court
4737920	4742800	Not another no that you had an a sweet jump shot from the outside
4742880	4748480	I still remember the sound of the ball going through the net and nothing but the sound of that
4749120	4752160	And you had a you had a pretty good drive to the to the hoop as well
4752240	4756000	If someone covered you too close to the three-point line, you could blow by him
4756480	4759520	So not many not many of your listeners may know that about you
4759600	4765440	But that's definitely you were a multifaceted skilled guy and still are sorry to use the past tense
4765520	4770160	You must remember that that lefty hookshot was so annoying to everyone else yours
4770720	4777120	That like so many people, you know complained about it that you started complaining about them complaining about it because they weren't used to a lefty
4777840	4781920	That's that's right. But if everyone expects a right-handed jump shot
4782240	4788160	Then the left-handed hook is gonna is gonna is gonna keep me keep me going for quite a while something to remember
4788320	4790640	Thanks very much, John. Okay. Thanks, Sean
4800160	4802160	You
