start	end	text
1463600	1467840	And we're talking software developers. That's one of the most in-demand in-demand jobs
1468960	1473040	You know computer engineers of various types people web developers
1473200	1476160	There's just a whole range of occupations that involve computers
1476640	1482560	and one of the things that's really unique about that particular stem sector is that
1483520	1485520	Whereas
1485600	1488960	chemical firms like duPont hires chemists
1490800	1494800	Trucking companies or shipping companies probably don't hire chemists
1495680	1496960	but
1496960	1498960	computer experts of various types
1500000	1503760	They're their own silo where tech companies will hire these folks
1504160	1507520	But then they're also yeah like a band across the economy
1508080	1515440	Where just about everybody hires some computer experts to you know, do things run their payroll do their logistics
1515440	1518560	I always think of trucking because we don't think of trucking as being very high tech
1519040	1524320	But actually they hire a lot of data people and to manage this whole complicated system
1525040	1526240	so
1526240	1532480	That computer related fields information technology is a band across the whole economy retail
1533120	1536560	You know all kinds of occupations or all kinds of sectors will use that
1537440	1543600	Life sciences that'll be used in bio pharma. You know all that you know life science kinds of sectors
1544240	1545520	so
1545520	1548880	computer is really the 800 pound gorilla and and so
1549680	1551680	when we talk about stem workers
1551920	1554960	People have commented on the book a little bit like they're saying hey, man
1554960	1558320	This book seems to be really about tech and really about computer workers
1559280	1561280	And there's two reasons for that
1561520	1564400	One is what I just told you that so many workers go into that field
1564880	1567600	And the other reason is that those are the employers who
1568400	1570320	argue
1570320	1578080	And complain the loudest about shortages. They're the ones who are saying hey, man, we need more workers. Where are these workers?
1578800	1581520	Where what what's wrong with your universities?
1582080	1587760	What's wrong with you society for not giving us more more stem grads so that we can hire them?
1587920	1590320	Well, that's good because that's exactly where I wanted to go next because
1591040	1595760	Is the feeling that we get within academia that the humanities are on the decline?
1596800	1601680	And stem majors are kind of taking over is that accurate and nevertheless?
1601760	1604560	There's a lot of companies that are complaining. We don't produce enough stem majors
1605440	1610960	Yeah, so I should say at the outset that you know, the book is really about this puzzle
1611040	1616480	We we haven't we I've been talking for quite a while here already and I haven't even gotten to the puzzle
1616560	1623920	We'll get there my apologies the puzzle the puzzle is that there's all these claims of the shortage of stem grads and
1626000	1632080	Only according to some measures and this is the census bureau only 28 percent of stem grads work in stem jobs
1633280	1639920	There's different ways of counting and different datasets. My counting is about 40 percent of stem grads work in stem jobs
1640720	1642720	So it's a little bit higher, but still a minority
1642960	1646720	So the puzzle is there's all these complaints about shortages what's going on
1647040	1652480	You know, why aren't you producing enough and yet it's the data looks like we're producing a surplus
1652960	1654960	So that's that's kind of the puzzle there
1655200	1659200	And is that for that that figure those figures that you quote one way or the other are they sort of
1659680	1666800	Lifetime like sometime 20 years ago 50 years ago. I got a stem degree and now I am or am not or is it right out of college
1667440	1669440	so basically what they do
1670080	1677520	Is the national survey of college graduates comes it comes out every couple years and they ask a sample of college graduates
1677760	1680560	What did you get your degree in? What are you doing now?
1681360	1687600	So it's a slice of people so it includes people right out of college and people who have been out for a while
1687840	1692240	But that's a great question because I was really interested in whether people kind of
1693680	1698240	Go in massive numbers into stem early on and then move on to something else
1698800	1703760	But there's there's a lot of data that suggests even in high demand fields like electrical engineering
1704320	1705440	that
1705440	1708000	Some data suggests upwards is 50 percent
1708880	1714080	Right out of college say nah, I'm not gonna I'm not gonna go the stem route. I'm gonna go do something else
1714720	1720160	So really it's a it's a leaky pipeline. That's a metaphor that's often used. You've probably heard that metaphor
1720720	1724000	It's a leaky pipeline that leaks at all stages
1724960	1727920	If if we think about stem as something important
1728720	1731200	In elementary school people lose interest there
1731760	1737840	High school college and then right out of college and then throughout their work lives people can
1738560	1740560	Exit this the stem pipeline
1740720	1748400	That's one of the things I really wanted emphasizing this book is that too many people studying this focus on the stem pipeline is just about
1749200	1752320	education from k through 16 k through college
1753280	1755280	But really
1755440	1759680	People have to keep and we can talk about this later. People have to keep their stem skills up to date
1760560	1761680	and
1761680	1767200	And stem education if if you want to be successful in stem you got to keep your skills up to date
1767200	1771840	Your education doesn't end at college. It doesn't end at a phd. You got to constantly
1772960	1774960	Re-up you got to constantly
1776000	1780960	I call it the stem skills treadmill. I apologize for the transparent attempt to create jargon
1782560	1787360	But I really wanted to capture something here, which is the idea of moving while standing in place
1788320	1793760	Right stem workers really have to keep moving. They really have to keep learning just to be able to keep their job
1794720	1796720	And um, I feel like I'm getting off
1797600	1800240	No, this is what I mean that is ultimately where we want to go
1800320	1803760	But that's okay because we can go back and forth. But just to like just to drive it home
1803760	1806560	It's okay to get the point halfway through the podcast. Um,
1806880	1808000	I
1808000	1811200	One gets the impression that a successful
1811920	1816080	undergraduate majoring in a stem field is going to come out of college thinking of themselves as
1816720	1819120	elite and well-trained, etc
1819200	1826720	But one of the messages of your book is it's exactly those people who the employers think of as basically cheap and disposable
1826800	1828800	Right, they're going to use them for a little while
1828800	1832160	Until their skills are not quite as cutting edge anymore
1832480	1836160	And they're not going to really mind if they just fire them in higher new graduates
1836880	1841040	Right. I I talked to a CEO of a of a stem
1842240	1844080	an innovation economy
1844080	1846160	sort of company and
1846160	1848160	they hired a lot of stem workers and
1848800	1854640	This CEO used the phrase that I title a chapter of the book burn and churn
1855440	1861200	And it was striking. He he said just so matter of factly. Yeah, we burn and churn through them
1861760	1865600	They have a lot of enthusiasm and we take advantage of that
1866320	1870160	And when their skills fall out of date or when they get kind of burned out
1870400	1876720	Then we hire some more and we there's other studies that show stem employers like to get new blood. They like to get
1877360	1879840	New folks coming in there like they like this churn
1880720	1888080	And so that's seen as as a positive and there's not that much concern about what happens to people who get burned out
1888640	1891920	There's a lot of research. It's it's funny because for years
1892080	1894640	I've advised students and maybe you have as well
1895360	1896240	to
1896240	1901200	To major in the field that you're passionate about, you know to choose a career that you think you can be passionate about
1902800	1906480	But leave it to the social scientists to find something negative about that
1907840	1911040	And there's there's new research mainly from my field in sociology
1911520	1920000	About how employers exploit this passion. They think wow, we've got these workers who really love this and let's
1920880	1923760	You know get them to work 60 70 hours a week
1924160	1927040	We don't even have to pay them extra because they're so passionate
1927360	1932080	They've had great teachers and professors who've fired their excitement about this field
1932640	1933440	and
1933440	1940080	Let's ride that wave until it crashes or peters out or something and and and maybe we can then hire the next
1940640	1942400	group of passionate workers
1942400	1949200	So what leads these companies to complain about a shortage? Is it just that they want even more cheap workers just out of college?
1950160	1952160	so I
1952720	1956080	I kind of played dumb in the book a little bit. I'm like, all right employers
1956720	1959920	You say that there's a shortage. I'm going to take that at face value
1960560	1964160	If there really is a shortage, are you behaving like there's a shortage?
1964240	1971200	Are you acting like stem grads are scarce and valuable and can just produce magic that's going to benefit all of us
1971840	1974560	Or are you treating these folks as?
1975360	1976000	as
1976000	1977520	as disposable
1977520	1978640	I I
1978640	1980640	There's a lot of good metaphors Sean that work here
1980640	1984560	One of the ones I think about is squeezing an orange getting that juice out of it
1985360	1989120	In my la times op-ed. I suddenly thought about fast fashion
1989600	1992880	Something that kind of works or that's like really great for a short time
1993280	1995840	But you don't expect it to last you move through it
1996800	2003680	And so that's what they do and I just kept believing them pretending to believe them and saying, all right
2004160	2007040	Let's see if your actions match your words
2007680	2014080	And they just really it just really doesn't the new york times has a headline today
2015040	2018400	It's I don't know if I can mention the date in in this but
2019040	2020960	But it could be almost any day
2020960	2024800	There's a there's a new round of layoffs at major major tech companies
2025440	2030320	These are the firms they they created this lobbying group called forward us
2030880	2035920	That their whole their whole reason for being is the idea of a stem shortage
2036640	2038640	their whole reason for being is
2038640	2045120	Lobbying the government for both more stem grads more stem education and also more stem migrants to come
2046080	2050720	And a lot of these companies and it's part of the reason I talk about these tech companies
2051520	2053120	they
2053120	2056960	They're rich, you know, I mean some of these are are
2058320	2062400	Are all near monopolies. We're talking google. We're talking amazon. We're talking
2063280	2071280	Well alphabet, you know, google is tedious. They changed their names facebook's now meta, but huge, you know, two billion people have facebook
2071280	2073280	They own instagram
2073600	2076000	Apple has like a billion dollars in cash
2076480	2082480	They're they layoff workers. Yeah, they you know, they just we're done with you guys. We don't know. We hired too many
2082480	2084480	Sorry, we don't need you guys anymore
2085600	2089680	I I met a guy who was a former
2090400	2093040	HR expert at a major tech company
2093680	2098720	And he had a brilliant idea and I'm not going to give him credit because he actually wanted to remain anonymous
2099520	2104000	But he moved into the education field like elementary education and high school education
2104720	2109760	And in that field for students with learning disabilities, there's this thing called the IEP
2110480	2115600	Which stands for individual education program or individualized education
2116400	2118960	Plan something like that, but the idea is
2120000	2123840	You have a student with some kind of learning disability. You monitor their progress
2124080	2126880	You figure out what their strengths are you figure out what they need to know
2127760	2131760	And and he thought that was a great model for these really rich tech companies
2131760	2133760	That are constantly complaining about shortages
2134240	2141200	If if it looks like and who's going to know better than the employers themselves if it looks like some skills are about to be obsolete
2141920	2148480	Why not tell these workers? Hey, you've already got this great foundation in STEM education
2148960	2152000	Your specialty is kind of going
2152800	2157120	Going down. We need something new. This looks like it's going to be the new thing
2157920	2162800	We're going to put a little bit of money in there and we're going to train you and deploy you somewhere else in the firm
2164000	2166000	They they typically don't do that
2166560	2168560	They they let you go
2169280	2171680	Google, um, I think it was google was
2172400	2177520	Basically told companies are told employees. You've got this many months to figure out
2178400	2182000	What skill you want to develop you're on your own to figure that out. How do you know?
2182480	2184640	How do you know what's going to be the next in-demand skill?
2185440	2191680	And so they moved into that, you know, they they were given the opportunity to move into that but without guidance or without
2192000	2194640	Without paid training. So that that's really tough
2195360	2198880	I gotta lay another metaphor on you and this came from someone
2199840	2205440	A STEM worker an engineer who emailed me after my my la times op-ed came out
2205920	2210640	And I loved you know, I love to get the the voices from the field. It's so interesting to hear their stories
2211680	2216640	This engineer told me that he thought stem work was was something like
2217440	2220480	Prospect prospecting and mining in the 1800s
2221360	2225840	And you've got these people who chase the chase the latest gold rush
2226640	2229840	We're gonna go do that thing. It's gonna be really hot for a while
2230560	2234960	Maybe some people are gonna get rich. Maybe some, you know, stem workers are gonna stock options
2234960	2238880	There's gonna be a lot of stem people are gonna get rich, but then it's gonna peter out
2239840	2241840	And then those folks got to find the next big thing
2242800	2246480	And this engineer told me he didn't want his children to go into these fields because
2246960	2249760	He said it gets tiring chasing these gold rushes
2250240	2252240	Chasing these, you know, the the next
2252960	2257440	The next mine to be exploited and and and just really really
2258000	2262400	You know people really dig into it, you know, I can give your your readers can probably think of examples
2262400	2264880	But blockchain was really huge for a while
2266320	2268320	AI is now the huge one
2269120	2274880	You know, it it goes up and down if you're in oil and gas, you know, the if the price of oil is super high
2275040	2277760	They're like, wow, we need more look at we can pay them a lot
2278240	2281680	And then suddenly that price plummets and then that goes down
2282560	2286400	For people in the life sciences, there could be some promising new
2287680	2292080	Technologies in life sciences like right now MRNA is really big
2292400	2295600	Maybe there's gonna be some limitations there gene editing really big
2296320	2298960	Might be some limitations there. We'll see but
2299680	2301680	You get these fields that get super hot
2301920	2308480	And then they try they hire a lot of folks if they don't get fda approval if the clinical trials don't work out
2309040	2310240	See you later
2310240	2313760	And and and life sciences will lay off a bunch of workers as well
2314000	2321920	Is is it possible to oversimplify your argument by saying that there might possibly be downsides to capitalism?
2327040	2329040	I would say
2329600	2336640	That the problem isn't necessarily capitalism per se the problem really is
2338240	2345360	And this is where I really put on my sociologist hat and I'm but I'm borrowing from some ideas that come from from economists as well
2346080	2348080	There are cultural practices
2348960	2353440	That characterize american capitalism, especially american capitalism
2354400	2359680	Today and certainly over the last few decades, which are creating this problem
2361200	2362560	and
2362560	2364960	there's a lot of folks who've written about this but
2365440	2370160	There's expectations that investors have that they didn't used to have
2370800	2372800	And that is that they
2372800	2375520	It they call it maximizing short-term
2376480	2378480	shareholder value various
2378560	2381040	permutations of that phrase various versions of that phrase
2382000	2388640	But shareholders like there's there's a whole movement to create this thing that that that the stakeholders who really matter
2389120	2393120	For a corporation are the shareholders not the employees
2393840	2395840	The shareholders not the customers
2396160	2400480	Not the customers as anyone who's tried to do customer service in almost any field
2401120	2406080	Any sector not the people in the regional economy where the company might be based
2406400	2409440	It's the shareholders and they should expect
2409840	2413120	Value on their investment in the short term
2414240	2417120	And there's a lot of complicated stuff about how this came about
2417840	2419840	there used to be these massive
2420480	2422480	conglomerates that are all these
2422720	2424720	diverse sort of
2424880	2426880	companies under one roof
2426960	2428960	underwear and apple pie
2429360	2431360	Sarah Lee owned Haynes
2431920	2435280	The Sarah Lee company you know like under underwear company like all these crazy things
2435760	2437680	Put together and they were doing that to hedge them
2437840	2442880	You know kind of hedge their bets if the apple pie market collapsed at least they can make some money on t-shirts
2443600	2449680	So, uh, but shareholders were like no no no we want you to do what you do find your core competency do that thing
2450400	2454960	It was a massive redefinition of what corporations were really about
2455680	2460560	And there was a redefinition of what workers were and workers became costs
2461280	2463780	And investors began to applaud
2464880	2466880	corporations that shed workers
2467760	2472400	This was a big shift, you know, you would always have companies that would lay off workers when the economy was bad
2473120	2479440	But by the 1980s as we got to shift to this maximizing short term shareholder value kind of approach to corporations
2480240	2482720	You got companies that shed workers even in good times
2483680	2486320	And and the stock price would go up
2486880	2488320	I
2488320	2493760	I give the example of Sarah Lee because it's just such a it's such a great example and and the and the ceo complained
2493920	2500320	You know that like my god, you know what the investors just want us to get rid of workers. That's what they want and
2501040	2502400	you know
2502400	2504240	investors
2504240	2509600	They don't like training in the united states, especially the europeans are better at investing in training than the american
2510160	2512160	american corporations are why
2512720	2515280	You know sociologists like to talk about training as investing
2515920	2518480	But investors see that as spending money
2519120	2526240	And why are you spending money on that when you should be maybe doing stock buybacks or something to boost the value of your stock?
2526800	2531920	So I wouldn't say it's capitalism. I would say it's this version of capitalism that we have right now
2532880	2537680	We have similar kinds of short-term expectations among venture venture capitalists
2538400	2539920	Which I think are very important
2540000	2541680	It drives them
2541680	2547440	To put their money into software at the expense of other industries, which I think we need very badly
2547920	2552080	In the book. I'm very transparent about what I want staff workers to do
2552640	2558000	I want them to save the planet. I really want them to develop clean energy better plastics
2558720	2559680	of
2559680	2563520	Carbon capture technologies. There's so many things we badly need
2564160	2566160	But investors want software
2566720	2568720	They love software
2569120	2572720	You know instagram was worth a billion dollars when it had 11
2573360	2575360	employees
2575920	2582160	Instagram was was software. Yeah, and and the reason investors love software is because
2582880	2587200	That is a from the from the perspective of investor. That's a fantastic investment
2587680	2590480	You can easily demonstrate the technology works
2591120	2592400	unlike
2592400	2597200	New battery technologies unlike things that we badly need like fusion energy
2597280	2600800	You know, there's some startups doing fusion energy. But boy, when are we going to get that?
2600880	2602880	Can we really demonstrate that that works?
2603440	2606640	With software you can pretty much show that it works pretty quickly
2607600	2610800	You don't need a factory to create it
2611280	2616400	Which is a major advantage. Yeah, if you don't need a factory, you don't need employees
2617120	2619280	You just need a few people to do the software
2620800	2622480	and
2622480	2624480	and and so
2624480	2628560	And then you can make massive amounts of money that the return on software investments are like
2630960	2638080	10 times much percentage higher than returns on clean energy, which is which is what I think we badly need
2638720	2641680	And so investors, you know, if they just keep blockchain
2642640	2646320	ai's the new ones that I mentioned but any kind of software fintech, you know
2646720	2649840	technology related to to finance social media
2650560	2656400	The surveillance capitalism, which is another very, you know, there's a term coined by shoshana zuboff
2657200	2661440	You know tracking us on the internet. Wow, we can sell you more things
2662160	2665280	And and not necessarily have to produce things. So we don't need factories
2665360	2671120	We don't have what investors call the valley of death where you kind of go from the the innovation to the actual
2671760	2675440	Manufacturing phase which can take a while making sure the prototype works and all that kind of stuff
2676080	2678080	so that's a long way to say
2678560	2683200	Capitalism is not the problem. I think it's the version of capitalism that we have right now
2683600	2685280	Okay, and there's probably like a whole other podcast
2685280	2690800	We could devote to how that version of capitalism came to be but I'll we'll stay a little bit focused here
2691600	2694400	Uh, and I do want to give you a chance to mention that
2695040	2700400	The fear of becoming obsolete and then getting fired is not the only thing that is
2700960	2704080	Keeping STEM grads slightly unhappy. I mean, there's the
2704560	2705920	Overwork
2705920	2711440	aspect there's other things where the grass isn't quite as green as they hoped it would be once you've gotten your
2712000	2714800	bachelors in electrical engineering and enter the job market
2715840	2717840	Yeah, so I I tend to think
2718480	2724720	Again taking at face value these employers that there are these dire shortages and it's a crisis and those are the words that they use
2725120	2730640	Take that at face value. Well, what are they doing? How are they treating these these STEM workers?
2731040	2735200	And one of the things that they do is they incentivize movements out of STEM
2736080	2738080	and they do that by
2738080	2740080	paying their managers more
2740480	2744160	And I I know you're an NBA basketball fan. I know you love
2745120	2746560	you love
2746560	2750400	The Sixers you've got your passions there. Do you still love the Sixers?
2750400	2752480	We had Daryl Mori as a guest on the podcast
2753360	2755360	Okay
2756160	2757840	uh, so
2757840	2760400	It's interesting because in professional sports
2760960	2766080	The players who have these scarce skills are paid more than the managers, right?
2767120	2767840	in
2767840	2771120	In STEM the managers are typically not always
2771680	2776480	typically paid more than the folks who have the skills that are supposedly scarce. Yeah, and
2777440	2779040	and
2779040	2781040	employers control wages
2781360	2783600	they can
2783680	2786240	They decide how much to pay their workers
2786800	2790960	This is an area where I I think sociologists have done a little bit better than the economists the
2791520	2793040	the economists
2793040	2795040	they have some theories about wages, but
2795600	2796960	understanding
2796960	2800000	The starting point of the wage. I don't think they've been very good at
2800640	2806080	And I think sociologists are a little bit better at this. I talked to the co of a tech company
2806080	2808000	I'm using an anecdote here
2808000	2809600	And he was telling me
2809600	2815600	We need more we need more user experience designers the folks who design the interface of the software that we're using right now
2816400	2817840	and
2817840	2820080	And I don't want to pay them what they're demanding
2821280	2827280	And and he showed me there's these there's these services that kind of do surveys of how much people are paying
2827760	2833520	People in different fields including user experience designers and he's saying look at how much they make
