start	end	text
1373680	1380080	turns out that the features of relativity theory that connect space and time emerge from the kind
1380080	1385120	of large-scale properties of the system but they're not the intrinsic way to think about it so what
1385120	1390800	is time well time is this kind of process of computation just like in that rule 30 cellular
1390800	1396320	automaton we've got the series of steps those represent the progress of time and computational
1396320	1401520	irreducibility kind of tells us there's some kind of irreducible thing achieved by the passage of
1401520	1408160	time and so it is in the system instead of it being updating these cells with neighbors and so on
1408160	1415840	it's you say we've got this we've got this graph and we have these rules that just say whenever you
1415840	1420000	see a little piece of graph that looks like this rewrite it to a piece of graph that looks like
1420000	1424400	that and so you keep doing that over and over again and you build up more and more elaborate
1424400	1428800	kinds of graphs you get all kinds of complicated structures like this and one question is when
1428800	1433520	you do that enough times what is the what what you know when you have a graph that has 10 to
1433520	1437520	the 100 nodes or something in it you've built up this way what is the structure of that graph
1438240	1441440	well it's a similar question to asking the question if you have a bunch of molecules
1441440	1446800	bouncing around and they each interact according to some force law and so on what is the large-scale
1446800	1450800	behavior of a whole collection of molecules and the answer we know in that case is it's like fluid
1450800	1455040	dynamics that's what happens in something like water you've got these discrete molecules bouncing
1455040	1461200	around the emergent kind of behavior of the system follows the laws of fluid mechanics
1461200	1465840	okay so what's the analogous thing here well it's pretty neat because it turns out the analogous
1465840	1471520	thing here is the thing follows the Einstein equations which are the the the corresponding
1471520	1478080	laws for the structure of spacetime and so you can then derive from this very simple underlying
1478080	1483040	set of rules that are about the rewriting of networks the large-scale limits of that with a
1483040	1490240	bunch of footnotes that are a complicated story you can derive the fact that you get the structure
1490240	1495280	of spacetime that that we observe now actually one of the things that's tricky is this thing
1495280	1498720	doesn't have any space in it at the beginning it doesn't even know that it's in three dimensions
1498720	1503120	for instance dimension is something that's an emergent property of the system where you're
1503120	1507440	basically saying if you start from a given node in this in this graph and you say what how many
1507440	1511920	nodes do you get to by going a certain distance on the graph a certain number of steps in the
1511920	1517600	in the graph let's say you get to some number of nodes and that number of nodes grows like r
1517600	1523360	the distance to the power d then you can identify that d as the dimension the effective dimension
1523360	1527920	of the space so one of the consequences of this model is that space won't be precisely three
1527920	1531760	dimensional there'll actually be dimension fluctuations probably the the beginning of the
1531760	1536080	universe will be infinite dimensional gradually the universe kind of cools down to being the
1536080	1541200	three dimensions we observe today and they're probably dimension fluctuations left over from
1541200	1545760	the other universe and an interesting kind of current sort of can we figure out how this
1545760	1550560	works question is what actual experimental signatures there are from such a phenomenon
1551440	1557440	but anyway so so by the way let me just show you um see if I can find this uh yeah let me let me
1557440	1564080	just show you in this model um this is kind of the uh what the the a version of the beginning
1564080	1569760	of the universe in this kind of model where so we're we're seeing here the progressive rewriting
1569760	1577760	of uh kind of this network of atoms of space and uh this is the first very small amount of time
1577760	1583520	in at least one branch of the beginning of the universe um you have to keep going a long way
1583520	1587520	to get to our current universe and because of computational irreducibility that's not something
1587520	1597120	I'm going to be able to do on my laptop however the um uh the thing that um you can set things
1597120	1602240	up to kind of see what would it be like if you had a much bigger chunk of space and this is an
1602240	1609760	example yes okay so this is much later in the history of the universe these are two little
1609760	1615440	black holes and what you'll see here is the the uh that sort of the background here is the structure
1615440	1620160	of space and space is kind of knitted together by all these little rewrites that are happening if
1620160	1626240	it wasn't for all these rewrites space would fall apart the space the the fact that there is this
1626480	1631680	thing we can think of as space that is kind of it has extent is a consequence of the of the
1631680	1635360	progression through time of all these rewrites but anyway here are two little black holes and you
1635360	1640880	can see what they do the space is is wiggling around a lot these two little black holes actually
1640880	1646480	feel the force of gravity um that's just a consequence of these rewrites and then those
1646480	1652960	black holes merge well that's something that we observe in uh that's gravitational wave detectors
1652960	1657280	have observed the merger of black holes these are incredibly tiny black holes turns out very
1657280	1661280	conveniently the behavior of a very tiny black hole is pretty much the same as the behavior of a
1661280	1666400	very big black hole so we can actually start to see and when when these black holes merge and this
1666400	1671520	little simulation here um turns out they emit gravitational radiation and we can start seeing
1671520	1675840	the properties of their gravitational radiation and one of the current frontier questions is
1675840	1681440	whether there are features of that gravitational radiation that reveal the discreteness of space
1681440	1685120	and uh I think I think it's it's fairly promising that there are although
1685120	1689520	whether the magnitude of the the things is such that we can detect it now
1689520	1693760	versus a hundred years from now we don't know yet that yet but anyway that's kind of
1693760	1699920	how the the structure of space works in in these these kinds of models another thing to to mention
1700320	1711680	is uh another so I mentioned this um um the um the the question of um these sort of three big
1711680	1718160	theories of of 20th century physics statistical mechanics general relativity and quantum mechanics
1718160	1721840	so we've got what I've been describing is the derivation of general relativity people didn't
1721840	1726080	think general relativity was something you could derive from something lower level it looks like
1726080	1731360	it is so the another piece to this is quantum mechanics and sort of the big idea of quantum
1731360	1737200	mechanics is in classical physics you imagine that definite things happen in the world in
1737200	1741680	quantum mechanics the big idea is that you know you throw a ball and it doesn't just follow a
1741680	1746560	single trajectory it follows many possible trajectories and you just get to figure out
1746560	1752400	what the probability of different things happening is well in our models we actually have no choice
1752400	1757440	but to have quantum mechanics because what happens is that I talked about the rewriting of these
1757440	1762000	hypergraphs that represent the structure of the space and everything in it there are many possible
1762000	1766480	ways these rewritings can happen and the results of that is that you get what we call a multiway
1766480	1771280	graph that represents all the different possible paths of history there can be different rewritings
1771280	1776400	that happen there can be that can cause these paths of history to branch they can merge and so on
1776400	1781440	so kind of the the big thing that happens that you get these multiway graphs multiway graphs are
1781440	1786240	something pretty interesting that that sort of related to nondeterministic computation but in
1786240	1791280	nondeterministic computation you tend to just say we're going to pick the one winning branch
1791280	1795840	in multiway computation you're interested in sort of all the possible things that can happen
1795840	1800000	and so you know you can kind of think about lots of different kinds of problems in these
1800000	1805360	terms you know you've got a game like tic-tac-toe or something there are many possible paths you can
1805360	1812000	follow to in the in the doing of that game and you can kind of look at the complete graph that
1812000	1816800	you get let's see if I can just pull up a picture of that so you know a typical kind of thing would
1816800	1825120	be here we go it's kind of a multiway graph that just shows given that you're starting with a blank
1825120	1829840	tic-tac-toe simplified tic-tac-toe board you get this kind of graph of all these possibilities
1829920	1832960	you keep going somewhere here probably there's a picture of the actual
1833920	1839520	game and and what it takes to win the game and so on but that that's an example of a multiway
1839520	1846640	graph in that particular case for just a the game of tic-tac-toe but the the whole point is
1846640	1851440	there is also a multiway graph for the whole structure of our universe and the fact that
1851440	1856400	there are these different paths is is the reason that we get quantum mechanics since it's slightly
1856400	1861600	more complicated story we have when you when you kind of take a slice across all those paths
1861600	1866000	you form this kind of space we call it branch real space the space of quantum branches
1866000	1870720	which is kind of its own kind of space and just as you can think about kind of motion
1870720	1874000	and physical space you can also think about motion and branch real space
1874000	1879920	just as you can think about observing physical space we we notice that in physical space well
1879920	1887360	okay the the we we are at a scale much larger than the atoms of space and so we aggregate when we
1887360	1893440	observe what physical space is like what we're observing is this this vast aggregation of atoms
1893440	1899200	of space and that's why space seems to us continuous well something a bit similar happens in quantum
1899200	1905040	mechanics what happens is that just as we are extended in physical space we are also extended
1905040	1910640	in branch real space and so a rather strange thing it has to do with the fact that an observer
1910640	1916560	like us that has that is part of this universe that's branching emerging and so on the question
1916560	1922000	of quantum mechanics becomes how does a branching brain perceive a branching universe and turns
1922000	1927760	out that when you untangle those things the answer is quantum mechanics so okay just to
1927760	1935760	finish on this in this branch for a second the the thing so one of the one of the questions would
1935760	1940880	be okay so we've got this model for physics and we can say there's an underlying rule which if we
1940880	1946320	run it for long enough we'll make our universe so the next question is well why did we get that rule
1946320	1952160	and not another rule and that's it's sort of a you know that's a kind of the the Copernican thing
1952160	1957040	would be to think there can't be anything special about the rule we got we just have to have some
1957040	1962880	sort of very arbitrary rule well the the thing that I wondered about this for a while and then
1962880	1969680	we realized that actually here's what's going on the the structure I mentioned that given a
1969680	1974240	particular rule you apply to no possible ways and that's what gives you quantum mechanics
1974240	1979120	but why do you have just one particular rule what happens if you apply all possible rules
1979120	1984480	and you make something which is the result of taking all possible computational rules
1984480	1989040	and running them and you can see that different rules will produce different results but then
1989040	1993600	those results might converge again because when you run different rules again they'll converge to
1993600	1999440	the same results and so on you get this big complicated entangled mess that is the the result
1999440	2004080	of running all possible computations so you it's kind of you make this thing which is the
2004080	2009200	entangled limit of all possible computations it's the thing we call the rule ad and it's kind of the
2009200	2014080	it's an encapsulated object that represents everything that is computationally possible
2014640	2018560	and it's a it's a kind of an interesting object because it's a very it's a necessary object it's
2018560	2024720	not an object that you say oh it happens to exist in this way in that way it's just given the idea
2024720	2030160	of computation there is just a single object that is this rule ad that represents all possible
2030160	2035440	the entangled limit of all possible computations okay so so what so how do you make how do you take
2035440	2044240	that and understand sort of how we we perceive physics and things like this well the key thing
2044800	2049680	is this realization that we are a certain kind of observer of this rule ad we are it's a little
2049680	2054560	bit of a brain twisting kind of thing because we are embedded within this rule ad we are part
2054560	2061920	of this rule ad and we are observing what happens in the rule ad and turns out that there are we
2061920	2066480	might say well well what we observe to be happening in the rule ad depends on what we are like as
2066480	2071520	observers so the question is do we how much do we have to know about what we're like as observers
2071520	2076160	to conclude what about what we will perceive happens in the rule ad okay so it turns out
2076160	2081760	there are two key assumptions about us as observers both of which are pretty uncontroversial one is
2081760	2087840	that we are computationally bounded we we can only in our sort of finite minds we can only fit a
2087840	2093040	certain amount of computational effort it's point one point two is we believe we are persistent in
2093040	2098640	time even though at every moment in time we might be made of different atoms of space we believe
2098640	2104480	that we have a single thread of experience that continues throughout time so those are two assumptions
2104480	2108640	so it turns out this is sort of the big result of the last few years it turns out those two
2108640	2115760	assumptions are sufficient to derive the three big theories of 20th century physics so given this
2115760	2121200	idea of the rule ad if you say what does an observer with those characteristics perceive in this big
2121200	2126720	messy rule ad of all possible computations it turns out that an observer with those characteristics
2126720	2132080	necessarily perceives actually the second rule of thermodynamics general relativity and quantum
2132080	2138080	mechanics that's kind of a very interesting kind of I suppose philosophical moment that these are
2138080	2142400	things which seemed like they were just features of the universe that happen to be the way they are
2142400	2147920	but it isn't true that there instead there is this kind of necessary formal structure
2147920	2153680	which for observers like us if we were not like we are if we were some kind of alien observers
2153680	2159200	with different characteristics we would perceive a different physics but given that we are observers
2160000	2164400	of the kind that we are we necessarily perceive these features of the physical world
2164400	2171200	so that's that's kind of a that's a that's a sort of a big deal in in in thinking about physics
2171200	2175520	it also turns out to have implications about mathematics and the kind of nature of mathematics
2175520	2180400	and so on can talk about those but let me let me talk about some more practical kinds of things so
2180640	2187520	we we've kind of understood something about this idea of computation that ends up sort of going all
2187520	2192160	the way down it gives us the machine code for the universe it seems and it tells us things about
2192160	2198880	sort of the sort of the big picture of what's computationally possible well it's okay so here
2198880	2207200	we are as just humans hanging out in this rule ad and and and the question is how do we access
2207280	2213520	this kind of this the the how do we what can we access of computation and so then we have the kind
2213520	2219600	of interesting situation we are humans who think about things in certain ways and what do we you
2219600	2226160	know how can we make use of this kind of power of computation that sort of is the intrinsic thing
2226160	2231440	that runs the universe and so on and and what you start realizing is that you need some kind of bridge
2231440	2236640	between the way we think about things and the sort of ocean of computational possibilities
2237200	2242320	much of what's out there in the computational universe is stuff that is completely incomprehensible
2242320	2246960	to us it's stuff where we can run all these cellular automata they make all these patterns
2246960	2250800	we say we don't really know what the significance of this is they're not really connected to anything
2250800	2257840	we know about most of the computational universe is completely alien to us and so the the question
2257840	2263840	really becomes sort of how do we characterize the parts of the computational universe that we humans
2263840	2268640	can connect to his sort of perhaps an interesting experiment I can show you something here this
2268640	2278800	is looking with genitive AI um just looking at um the uh yeah this is um this is looking at um
2278800	2284800	sort of a very tiny slice of the rule ad that has been set up to be aligned with the way we humans
2284800	2290080	think about things because it's been it's a genitive AI trained on a few billion images
2290080	2294080	and so what we're asking is if we look out into that sort of space of possible
2295440	2300080	possible things that we can think of as a tiny slice of the rule yard what's out there and so we
2300080	2306800	we said okay let's let's make a we initially say we're going to look for a cat and a party hat
2307360	2315520	and um somewhere at the beginning there was um was a part of um of this uh of the space that
2315600	2321040	has a nice cat there the question is what else is out there in the space if you go away from the
2321040	2326240	cat and the party hat you go out um and you're you're going out into sort of this space of
2326240	2330640	computational possibilities and what you find is there's sort of a cat island where things are
2330640	2337840	sort of identifiably cat like but then most of sort of this space consists of things that
2337840	2341920	well there's some definite structure there but it's not clear what we humans would say about
2341920	2347520	that structure we don't really have a a way of thinking about that we think about so we can kind
2347520	2353760	of think about think about these sort of blobs of of possibility that are concepts of things we've
2353760	2359920	given human names to we've given words to their concepts we know about and then there's this vast
2359920	2365680	area of kind of inter concept space kind of analogous to interstellar space where it's something
2365680	2372320	that we haven't you know we humans have not conceived we don't have a way to that we brought
2372320	2378000	that into our kind of world and so you might ask well what fraction of space is inter concept space
2378000	2384480	in this very simple example that's a very sort of optimistic case one part and ten to the six
2384480	2391520	hundred of the space is space that we understand uh the rest of it is all inter concept space
2391520	2396640	concepts that we humans have not yet reached so you can kind of think about the the progress of
2396640	2402000	of our uh intellect and science and so on as being this kind of colonization of what we call
2402000	2408320	rural space of kind of gradually expanding in the domain of what we consider what we have concepts
2408320	2415040	to describe it's some uh kind of a okay to make a slightly bizarre comment but but one thing you
2415040	2419680	might wonder about is okay in the future of science and everything maybe the future of
2419680	2424480	science is we expand in in rural space and we we eventually expand so that we fill all of rural
2424480	2429360	space it turns out one should be careful what one wishes for because one feature of that
2429360	2435760	is that in in in a sense went by by the time you have a mind that is that big it is not a coherent
2435760	2441680	mind anymore and for it to coherently exist it has to be something that is limited in rural
2441680	2446880	space by the time it fills the whole rulliard in no meaningful sense does it coherently exist
2446880	2453840	so in a sense when you when you if you expand too far uh you you you no longer can can describe
2453840	2461680	yourself as as coherently existing so okay so so there's there's this um uh this is kind of what
2461680	2467920	what it looks like out in this sort of human aligned uh inter concept space this is this is
2467920	2474400	kind of what what it looks like just in sort of out in the rulliard looking at different possible
2474400	2480160	behaviors these are just cellular automata um but we can say well when we look at these things
2480160	2485360	what are these things how do we describe them are they things that are relevant to to us yet do we
2485360	2490720	yet have words for these things and the answer is typically no we've we've explored only this tiny
2490720	2496320	slice okay but so what can we do with the slice that we're exploring well the big thing that i've
2496320	2502640	spent much of my life actually doing is trying to build kind of a a a thing that is a bridge between
2502640	2508880	the way we think about things and what's computationally possible and the way that what we what we
2508880	2514000	need to do is to take the things that we care about that we think about and formalize them so we
2514000	2519200	represent them computationally so that we can make use of kind of the power that exists in this
2519200	2524400	computational universe and so that has been the the big effort to build what we call wolfman language
2525120	2532560	um and sort of the goal there is is to be able to represent sort of everything in the world
2532560	2537600	in a computational kind of way so i mean if i take um uh well let's just let's just say you
2537600	2544400	know i have um i don't know some uh let's let's say i make some graph uh we can we can represent
2544400	2550000	some random graph as as a computational kind of thing we could say i don't know let's work out
2550720	2555920	let's just do some computation on that and the um uh um
2557760	2562560	well we could take um uh we could take some let's see if i can um take an image here
2563600	2572560	ah what if i do that um let's see there we go well terrible image but um we could we could say
2572560	2579680	something like um uh well let's just say something like edge detect that image um or we could say
2580000	2586400	we want it to be a little bit more optimistic let's see um how about we do this how about we say
2589520	2591040	let's do this um
2593760	2599600	let's take that image and let's say we want to just say identify what's in that image but let's
2599600	2606480	let's run it this way so we're running some neural net we can look at um uh we may have to load in
2606480	2613200	oh what earth is that i have no idea what that is um it's the back it's the backdrop okay
2616560	2620960	okay let's see well let's let's see what happens if we say what's the word definition of that thing
2622560	2632960	ha okay the um but it's kind of interesting to um uh we can look here if we say uh well that that
2632960	2640000	thing will just be some neural net that um uh we can look at it's all the all the all the nasty
2640000	2646800	innards of it we could for example just say let's just take the first uh five levels of the neural
2646800	2656800	net or something and apply that to this picture um and uh and then maybe we can say uh make images
2656800	2662640	out of those okay so that's kind of the the uh inside the mind of the neural net um what it's
2662640	2668080	thinking about maybe we can just say let's let's just do this let's say make a feature space plot
2668080	2673440	of those let's see if we can not very exciting it just decided that there were two clumps of
2673440	2677280	things that was thinking about one seemed like they're mostly white one seems like they're mostly
2677280	2683840	black so it goes um but but anyway the kind of the concept here is to make a computational
2683840	2689760	language that can formalize the things we like to think about in computational terms
2689760	2695200	so that we can do things uh so that we can use sort of the power of computation to operate on
2695200	2700560	those kinds of things so for example there's the part of the the story is just knowing a lot about
2700560	2705440	the world so we might say you know that's there's a list of words in English maybe we can say let's
