start	end	text
4104080	4109120	you know the procession of a planet or something like this you know it allows us to make useful
4109120	4113600	predictions about the world and if we have a computational set of rules that allow us to
4113600	4122240	explain all of physics is there some way to go from those computational rules to mathematical
4122240	4127200	principles or other sorts of principles that allow us to make useful predictions about the world
4127200	4133840	that don't require running the computation and and how does that clash with this notion of
4133840	4138720	computational irreducibility that you mentioned good question okay so slightly complicated I mean
4138960	4143600	so first thing to say is sort of the main way that we validate that we know what we're talking
4143600	4148240	about is that we can derive the existing mathematical laws if it wasn't for the fact that we could
4148240	4153200	derive general relativity we wouldn't imagine that we have a good idea of what the sort of
4153200	4159040	low-level machine code of spacetime is okay so first thing to say second thing is there are for
4159040	4165600	example that black hole simulation that I showed actually is it's the method of going from this
4165680	4170960	underlying discrete spacetime to deduce what happens seems to be at best competitive with
4170960	4174880	and possibly much better than what people have done in the past which is to start from the
4174880	4179360	mathematical equations and then kind of discretize them so that they can put them on a computer
4179360	4184720	this is a you can think about it as a sort of an alternative way to by simulation figure out what's
4184720	4189600	going to happen in the world and because in fact when you do it sort of mathematically
4190480	4195440	when people work out black hole mergers they don't work out the pure algebraic math I mean they
4195440	4200960	typically use mathematical to do a big pile of reduction of the original mathematical structure
4200960	4204480	and then they turn it into something which is a bunch of partial differential equations
4204480	4208800	which they discretize and run on a computer so this is this is kind of going the other way
4208800	4214960	so that's that's one thing to say the the next thing is that the okay the a remarkable thing
4214960	4219840	about the universe is that anything in it is predictable what you might think is given computational
4219840	4224720	irreducibility the whole universe is going to be unpredictable one thing about computational
4224720	4229040	irreducibility is whenever there's computational irreducibility there is always there are always
4229040	4234160	an infinite number of slices of computational reducibility that exists so in other words
4234160	4239040	when the whole thing is computationally irreducible you can always find some sub-piece
4239040	4245360	that is computationally reducible and it's those sub-pieces that make up the laws that we find useful
4245360	4251040	to be narratives about how the world works and that we kind of exist in and so the really the
4251120	4255200	story of what's happened with our physics project is there's underlying computational
4255200	4262400	irreducibility and for observers like us we pick out certain slices of computational reducibility
4262400	4267360	those slices of computational reducibility correspond to the physical laws we know so one
4267360	4271920	interesting question would be will there be a time when we found all physical laws or when we've
4271920	4277280	made all inventions we figured out all of technology the answer is no and the the reason for that is
4277280	4282480	because of computational irreducibility that we found a particular slice but there will be an
4282480	4287440	infinite number of other slices and these are other views of the world other things we can say
4287440	4292560	about the world that aren't that that are different from what we've said so far and in fact you can
4292560	4298400	think of technology as being these little places where there's this whole amount of computational
4298400	4303040	irreducibility but there's this little place where we discovered this thing where we could jump ahead
4303040	4307600	this little little piece of reducibility and that's sort of a piece of technology in a sense that's
4307600	4312080	kind of the the economic value that we're providing it's kind of like you could take all the components
4312080	4317120	of an iPhone and they would have a certain value or you can put them all together into this iPhone
4317120	4321040	and you've got this thing that you can think of as sort of a little piece of computational
4321040	4328320	reducibility that that provides value economic or or sort of the ability to kind of do something
4328400	4333120	we wouldn't otherwise be able to do so so the thing to realize is there's this sort of infinite
4333120	4341200	set of possible laws to discover there's a and that's some that's the big question is which
4341200	4345840	things do we humans care about there's an infinite set of things out there that could be discovered
4345840	4351760	there's an infinite set of kind of things we can deduce about the world some of them we find useful
4351760	4357040	we turn into technology and so on and some we just sort of shrug our shoulders and say we don't know
4357040	4361760	what we're going to do with that like fluid turbulence is a good example of that for some
4361760	4367920	purposes at least it's like the fluid behaves randomly what do we do with this it's not so I
4367920	4375120	mean in terms of our so I mean I think our models provide some kind of almost philosophical framework
4375120	4380800	for thinking about this kind of this kind of interplay between computational reducibility
4380800	4386560	computational irreducibility the challenge right now with our models is there are things where they
4386560	4392880	reproduce existing physics and there are places where they don't there are places where maybe there's
4392880	4397680	a little corner where you see something that isn't existing physics and that's obviously really
4397680	4402880	interesting because you can do experiments and find out if that's really true or not and that's
4402880	4408160	that's it's a big it's it's a challenge because it's just a lot of technical detail of figuring
4408160	4412240	out okay a photon is propagating through a piece of fractional dimensional space what does that
4412240	4416960	actually do how does it affect this or that thing that you can measure but that's you know that's
4416960	4424960	the challenge and and you know I think the as I say the the way to compute things that we have
4424960	4428960	here it's a bit different from the existing way so for example in this case of general relativity
4428960	4433680	we're able to actually do a bit better than existing methods same with quantum circuit
4433680	4441520	optimization actually there's using our multiway system technology somebody who's been working on
4441760	4447520	project sort of takes quantum circuits compiles them into multiway systems does optimization
4447520	4452640	at that level and then turns them back into traditional quantum circuits and that won a
4452640	4456960	competition a few months ago for the best sort of quantum circuit optimization which was kind of fun
4458480	4464080	we actually Osama have a bunch of questions coming in from our virtual attendees so I will
4464240	4470960	alternate okay so let me and what you said basically I mean the an interesting observation you made
4470960	4475920	which is how interesting is that universe of computationally reducible things and how far
4475920	4484320	can we get but my question is let's get a bit more pedantic a bit so before Sam Altman had his
4485280	4493680	unfortunate incident with his board open AI was talking about a very near term big breakthrough
4493680	4499200	in AI whether that's truth or rumor or whatever it doesn't matter I would like to ask you do you
4499200	4506080	think there's an interesting kind of breakthrough class thing that could happen in the near term
4506080	4512880	for AI at least in your intuition well I mean okay so look at the history of the AI okay so we've
4512880	4517680	got you know McCulloch and Pitts wrote their paper in 1943 you know now we've got chat gbt it's
4517680	4521360	actually pretty similar in architecture to what McCulloch and Pitts I was just looking at the
4521360	4526080	McCulloch Pitts paper just a couple of days ago it's that they had this idea of what they called
4526080	4533280	psychons they didn't make it but a lot else in that paper did make it the psychons were units
4533280	4541200	of psychological activity basically the in any case the the you know I I personally have been a
4541200	4546720	little bit involved in this business since probably about 1980 I first sort of tried to make neural
4546720	4551760	nets do something around 1980 and I couldn't get them to do anything very interesting so and then
4552960	4558320	you know in this you know neural nets were always kind of a sideshow type thing oh there might be
4558320	4563600	models of brains we don't really know maybe brains don't work that way you know a neural net's useful
4563600	4568080	as algorithms well they've been used for OCR but you know not clear how useful they are for other
4568080	4574240	things they were always sort of a mysterious kind of sideshow type type thing and then 2011 kind of
4574240	4580640	the sort of deep learning breakthrough in image recognition happened almost by accident and there
4580640	4586160	was this jump in the ability to recognize not just the letters of the alphabet but also a few
4586160	4592000	thousand other kinds of things in the world of cats and dogs and things like this and you know if
4592000	4597280	you look at that time I think it reached like 85 percent success from that particular sort of jump
4597280	4603680	in capability in the in the years since then there's been sort of gradual incremental sort of
4603680	4608480	improvement in object recognition using neural nets you know the big breakthrough happened and then
4608480	4612640	there's gradual improvement same things happen in a bunch of other areas whether it's speech to text
4613520	4620320	other kinds of things the big breakthrough with LLMs that nobody expected was that one went from
4620400	4626400	language models to just babbled rather uninterestingly to language models that made essays that seemed
4626400	4631520	human like and that was a you know it's a big big breakthrough and I think we still don't understand
4631520	4638720	why that really happened how that happened and you know it probably well you can speculate on
4638720	4642960	on it's a science question it's a very interesting science question we've studied it a bit I can tell
4642960	4648080	you a few I think this field of LLMs science is a really important area it should be more
4648080	4653280	populated by physicists actually because that's the that's the domain that has a lot of the the
4653280	4658080	kind of relevant expertise I mean you know I've been I've been pointing out for a while you know
4658080	4662160	there's like you increase the temperature you know the chance that you pick a word that isn't the
4662160	4667760	the most highest probability word to come next increase the temperature it looks like some
4667760	4672400	student at our summer school this last year found there are two distinct phase transitions one where
4672400	4678800	the LLM you increase the temperature the LLM stops making sense second it stops making syntactic
4678800	4683120	sentences the two distinct transitions at definite temperatures why does that happen
4683920	4688080	there's got to be an answer to that and it has some combination of physics question
4688080	4691520	and a question about kind of the structure of knowledge and the structure of the way we think
4691520	4696400	about things it's a it's a it's a thing that's out there and sort of LLM science but anyway what
4696400	4701840	seems to have happened is there are these moments where there these kind of you know rapid you know
4701840	4706720	these breakthroughs where things things change and then it's kind of an incremental process and this
4706720	4713040	is typical of technology and science you know some methodology is you know is comes in some
4713040	4718160	some something happens the way I see what's what's happened right now with LLMs the you know
4718160	4723920	they have created the possibility of having rich linguistic interfaces to things and there are
4723920	4728480	many applications for that and the question of what will be successful and what will not
4728560	4734000	has to do with how you put a harness around that capability because it's like saying you know it's
4734000	4739760	it's um uh the the you know the raw capability kind of I think is what it is it will get
4739760	4743440	incrementally better but it is what it is and it's like a lot of things in machine learning people
4743440	4747200	say oh I'm going to use machine learning for this or that there's a very simple heuristic
4747200	4751440	machine learning is going to get you 80 percent maybe it's 90 percent maybe it's 93 percent you
4751440	4757680	know and Wolf Malfoy we've now got to 98 success and in recognizing our you know natural language
4757680	4763040	understanding but you know it's some percentage and some fraction of the time is going to fail
4763040	4769920	if you've got a use case where getting 85 success is a win like you're saying here are possible
4769920	4775440	search results are any of these what you're interested in then it's a win to have 85 success
4775440	4778880	if you're trying to you know launch a rocket to the moon and it's got to actually
4778880	4783520	go in the right trajectory 85 success is probably not going to be good enough yeah
4783520	4788800	and so it's a bad use case and this is the kind of interplay between what's sort of computational
4788800	4794080	and what's sort of LLM AI style and I think in terms of sort of the breakthroughs that will
4794080	4799600	happen I mean I think you know there is more to be done this kind of quantum LLM thing there's
4799600	4805680	more to be done with kind of where you can where you can go you know the planning aspects of sort
4805680	4810480	of interfacing what amounts to sort of theorem proving techniques with kind of LLM techniques
4810480	4816800	I'm not sure how well that's going to work the you know one of the lessons of kind of the
4816800	4822560	developments of neural nets particularly has been anytime you think you can be clever turns out you
4822560	4828240	it's not worthwhile and that's a it goes along with what I found in the computational universe
4828240	4832960	you say oh I know I've got this particular kind of system I know it can't do anything interesting
4832960	4838160	I can just foresee it can't do anything interesting you run the experiment my little statement to
4838160	4841920	myself and people who work with me is you know the computational animals are always smarter than
4841920	4847440	we are we you always it will do something that is completely unexpected and and that's been so
4847440	4852240	you know I'm not sure whether sort of you know carefully orchestrating these things is ultimately
4852240	4857920	going to make a difference as a practical matter you know video you know what we've done with text
4857920	4863040	will be doable with video you can learn a lot on video there's a large corpus of video there'll be a
4863040	4868080	bunch of there'll be a breakthrough as you know it manages to learn sort of intuitive physics
4868080	4872240	from videos and things like this certain amount of human behavior stuff from videos probably
4873120	4877600	and that will be you know that's another thing and and that's but I think what you'll see is
4877600	4883920	these set of discrete sort of jumps as as different things become possible and you know the training
4883920	4888480	data in the world is is you know we're kind of running out of that there's I mean there's a there's
4888560	4895600	about a hundred billion not yet tapped actually we're involved in in possibility of tapping
4895600	4902720	some more of that of other kinds of material that exists in textual form that hasn't yet been used
4902720	4906960	for training I don't know how useful that will be I don't know at what point you saturate in terms
4906960	4913040	of yes we know human language and yes we know common sense but my feeling is that the big value
4913040	4919600	is coming in the application of of LLMs and so on and figuring out how you put
4919600	4924960	the right harness around them to make them useful and and that's some and it's kind of in fact the
4924960	4928720	the kind of you know we built into our language now a bunch of LLM functions
4928720	4933600	where you can from the computational language you can access the LLM and that's a pretty useful
4933600	4939280	way to sort of understand and and set up kind of the harness around the LLM to make the LLM do
4939280	4945040	what it does well and then sort of the the computational structure go around that cool
4945680	4951760	shall we take a question from online sure so a few a couple hundred people are still here
4951760	4959040	with you till the very end I'm going to take a question from Michael Carell what's so great
4959040	4965840	about computation as a metaphor structuring principle for physics or cognition we've been
4965840	4972080	wrong about metaphors for cognition in the past parentheses the brain as watch telegraph switch
4972080	4979600	board or even metaphors within computational views what makes us think we've gotten the right one
4979600	4986080	this time okay so it's a good question I mean I think that the the thing that's interesting
4986800	4995920	is that this idea of rules for specifying things that idea is pretty much as oldest civilization
4996560	5001760	and it's you know the question of well is it this particular kind of rule is it the rule that
5001760	5007280	runs with you know that makes a watch work is it the rule that wakes you know integrals work and
5007280	5015120	so on those particulars yes those particulars are are specific possibilities the general idea
5015200	5022320	that something follows some set of rules seems to be a you know a pretty fundamental idea I mean
5022320	5026960	we're we're kind of stuck with that idea that's a that's a thing if we want to have a theory about
5026960	5033040	how the world works then the idea that there are rules that determine what happens is something
5033040	5040000	that we're pretty much stuck with but I think it's a it's a good you know did we did we finally make
5040000	5046000	it well you know if it turns out the experiments get done and this theory of physics that we built
5046000	5053360	is validated um it's you know frankly it's it it seems at this point to me at least quite impossible
5053360	5058960	that it could not be true because too much has fit together for it to you know for it to be off track
5058960	5064000	but if that happens then we can say well we reached you know in some direction we reached the end
5064000	5069040	we know our universe is set up this way we can know that we can so another thing to explain
5069680	5076560	whenever what is natural science you know natural science is this bridge between the universe as it is
5077200	5083200	and our attempt to have a narrative in our minds for how the universe works so in other words the
5083200	5089680	universe does what it does and the question is can we have a way of thinking about that that we
5089680	5096560	can understand and so there may be many ways of thinking about it that that that is more on us
5096560	5101200	than it is on the universe there may be many ways that aliens could understand the universe
5101200	5106320	that are not the ways we understand the universe but I think that this idea of of operating according
5106320	5112560	to rules is this thing that has been you know a feature of the way we have thought about things
5112560	5117760	from the beginning of our of our history and that that seems like a pretty solid thing if we're
5117760	5123280	trying to do this thing a bridging between the universe and and the way that the way that we
5123280	5128640	think about things I want to say one thing about cognition and LLMs okay so so people had wondered
5128640	5134160	for a long time how do brains work and people said well brains do things that are so sophisticated
5134160	5138400	that even the laws of physics as we know them aren't sufficient to cover what brains do there
5138400	5145040	must be some funky extra stuff quantum mechanics whatever else that's going on in brains LLMs
5145040	5149840	are a very good data point that isn't true because people had said you know in order to do all these
5149920	5153840	things that we do and all the language and everything like this we got to have all kinds of
5153840	5159280	stuff we don't understand turns out just this neural net this simple rule-based neural net
5159280	5164800	it pretty much does it and so you can and in fact what's happened in neuroscience for instances
5164800	5169440	back in the day my my friends in neuroscience always said well we got these neural nets
5169440	5173840	but they're not really models of brains they're really some idealization that may be useful for
5173840	5178880	technology etc etc etc now that neural nets clearly do things that are very brain-like
5178880	5184880	that that that narrative has reversed and now it's a question of well you know we've got we
5184880	5189920	know what the core mechanisms are now let's see how we map those into what we can see biologically
5192160	5198880	is your question quick all right so I don't know if you have a mic but you can I'll repeat your
5198880	5216400	question just stated for example if we want to learn new interesting structures how can we use
5216400	5221920	AI to discover them without you know doing simulation and then looking for patterns in those
5221920	5227280	can we actually use it to find out yeah that's a good question right so the question is using AI
5227280	5231920	go ahead yeah you know can AI solve science this is a there's a very current question
5231920	5238240	and that's not a short question but anyway actually we have a project right now that is
5238800	5244640	you know day by day is is making progress on this question so here's here's what we seem to be finding
5244640	5250960	not not this this thing hasn't fully landed yet so I don't know the full story but so a question is
5250960	5255360	what can you predict with another lamp what can another lamp predict I show it pictures of cellular
5255360	5260160	automata things like this can it you know can it just say this is what's going to happen
5260160	5266560	can it to what extent can it at least find the pockets of reducibility we don't know fully the
5266560	5270560	answer to this but there's clearly a boundary we can see there are cases where it just doesn't work
5270560	5275920	and there are cases where it definitely does work and so the you know this question of can it notice
5275920	5280960	patterns that we haven't noticed so in protein folding for example there's been a fair degree
5280960	5285920	of success a little bit less success perhaps than people sometimes imagine but there's been
5285920	5290720	some success in taking I mean when you if you feed a random sequence of amino acids and say how
5290720	5296000	does this fold the answer probably won't be right but in things that are at least somewhat close to
5296000	5300400	proteins that have already been but whose structure is already known there's there's a lot that can
5300400	5306640	be said and the question is why does that work and the general belief is that it works because
5306640	5312160	there are aspects of protein structure which are features that we humans have not noticed
5312720	5319440	that the that the system noticed okay and and so this idea that it's noticing things that we didn't
5319440	5324480	notice is is going to be a very common thing I mean even even an image identifier that's telling
5324480	5330080	cats from dogs how does it tell cats from dogs well it's found some feature of those pictures
5330080	5334480	maybe it's the pointiness of the ears or something it's found some feature that allows it to make
5334480	5339440	that distinction we don't you know that's not necessarily a feature that we know about it's
5339440	5344320	also very hard for us to tell what feature it found because we don't have a way to kind of
5344320	5350800	go inside its mind and convert its way of thinking about things to our ways of thinking about things
5350800	5357440	so you know in terms of of what can we learn about science so first question is can the LLM
5357440	5362320	when there is some sort of feature that allows prediction to happen can the LLM find that and
5362320	5366880	be able to make predictions my guess is that that will be generally somewhat successful
5366880	5373440	but I think computational irreducibility is kind of a big sort of you know it's a big monster
5374400	5378320	at the gates there that will prevent certain kinds of things from from being possible but
5378320	5384560	some things where a human could go and find these these rules yes the LLM might be able to do that
5384560	5392800	more efficiently more automatically first point so second point is um in well another point is
5392800	5397840	can the LLM invent something that is a way of explaining to us humans how something works
5398480	5406240	that's essentially the problem of the AI tutor can the can the system learn enough about us humans
5406240	5411840	that it can give us an explanation that is useful for us as humans and my guess is there'll be some
