start	end	text
1670200	1673880	It's been mostly forgotten, but there were real achievements.
1673880	1676680	Started mentioning some, there are many others.
1676680	1679040	I've done a fair amount of work on that.
1679040	1683120	The second cognitive revolution in the 1950s,
1683120	1687280	developed mainly in Cambridge mass
1687280	1690620	where I happened to be a grad student at the time.
1691340	1695020	If you look at what constituted it,
1695020	1698860	there were basically two things.
1698860	1703060	Jerry Fodor, late friend, important cognitive science
1703060	1707540	and philosopher, at once quipped that cognitive science
1707540	1712540	is the study of language and vision, not totally false.
1712860	1715380	Those are the fields that really developed
1715380	1719180	a lot of rich investigation of how visual perception
1719220	1723900	takes place, a lot of study of the nature of language.
1723900	1726780	And it was all integrated, we all know each other.
1726780	1731820	So Dave Maher is one of the founders of modern visual
1731820	1735420	science, we were friends and some of his work
1735420	1738100	was kind of modeled on some of the things
1738100	1739980	that were being done in language,
1739980	1743980	but a lot of integration.
1743980	1748220	So it's kind of understandable.
1748220	1753140	These are two topics that you sort of know how to study.
1753140	1756020	Other things are very hard to study,
1756020	1759100	like for example, the nature of concepts.
1759100	1762260	That's a tough one to try to figure out,
1762260	1764540	what is the nature of the concept,
1764540	1768820	tree, river, house, and so on.
1768820	1773580	Actually here the classical Greece had some answers,
1773580	1775300	which have been forgotten.
1775300	1779540	So Aristotle considered this question
1779540	1783620	in a different framework and his framework was metaphysical.
1783620	1787820	So not what's the meaning of house, but what is a house?
1787820	1790660	It was the cognitive revolution of the 17th century
1790660	1793500	that shifted that from metaphysics
1793500	1796980	to epistemology to cognition.
1796980	1801980	But in forgetting that Aristotle asks, what's a house?
1801980	1806900	He says it's a combination of matter and form.
1806900	1811700	The matter is the bricks, the timbers, and so on.
1811700	1817260	The form is the design, characteristic use,
1817260	1821580	the intention of the architect, all sorts of mental things.
1821580	1823020	And that's quite correct.
1823020	1827460	Something could look like a house, but not be a house at all.
1827460	1830580	It's used to store books, it's a library.
1830580	1834980	It's used to put courses in, it's a stable.
1834980	1838500	Could be a paperweight for a giant.
1838500	1840580	What it actually is, you can't tell,
1840580	1842740	but it's physical character.
1842740	1846140	I think all the terms that are used for us
1846140	1850020	when we talk about the world have that character.
1850020	1855500	What the thing is, is largely a mental construction.
1855500	1860340	And that brings us back to why the Gleitmann's crucial work.
1860340	1864900	All of these concepts must be basically innate,
1864900	1868420	or at least they're the elements that constitute them
1868420	1871940	must be innate, because a child acquires them
1871940	1874500	on virtually no evidence.
1874500	1878100	Actually, one of Leila's favorite examples
1878100	1884300	was a young child very early, says things like,
1884300	1885940	that's not fair.
1885940	1888500	Try to analyze that.
1888500	1891180	John Rawls has a huge book on it,
1891180	1893700	the Foundation of Modern Political Science,
1893700	1895620	just as his fairness.
1895620	1900260	The concept fair is extremely complex to describe,
1900260	1903380	but a young child has no trouble noticing
1903380	1906740	that things aren't fair.
1906740	1908660	Same with lots of other things.
1908660	1912260	When people talk about the history of modern computer
1912260	1916460	science, programming languages, compiler construction,
1916500	1921380	or automata theory, many give your linguistic work credit
1921380	1926380	for the conceptual ideas behind those concepts.
1926380	1929500	What is it about your work in linguistics
1929500	1936740	that has enabled programming to be as accurate as it is?
1936740	1937860	I wouldn't.
1937860	1940580	That's much too strong.
1940580	1944420	I did work on finite automata theory, which
1944460	1949660	had certain relationships to early programming languages.
1949660	1953020	And there were neutral investigations,
1953020	1956580	cooperative investigations, looking at these contexts.
1956580	1962860	But it's basically forms of formal languages,
1962860	1967220	properties somewhat similar to natural languages.
1967220	1972500	I worked on them in the early 50s around the period
1972500	1975500	that programming languages were being developed,
1975500	1979380	and the two interact in a number of ways.
1979380	1983380	So if you look at a textbook on programming,
1983380	1986940	you'll find things about, sometimes called
1986940	1990940	the Chomsky hierarchy, the hierarchy of possible formal
1990940	1996900	languages, which have various analogs in programming theory.
1996900	2000540	They capture some features of natural language,
2000540	2006580	but they also correspond to certain types of automata,
2006580	2010420	linear bounded automata, push down storage automata,
2010420	2015260	standard interrelate with formal systems that
2015260	2018100	capture some of the properties of language, which
2018100	2020020	is a topic of some interest.
2020020	2025460	But it didn't enable programming.
2025460	2030380	I want to mention some theories of incognitive science
2030380	2033500	and philosophy that you have attacked.
2033500	2036620	I don't know of a softer word to accurately describe it,
2036620	2038980	and want to just get your reflections on it.
2038980	2043020	After many decades of looking back,
2043020	2045820	first is behaviorism.
2045820	2050580	What was it about behaviorism that you found erroneous,
2050580	2055460	and how do you reflect now looking back over the decades?
2055460	2059500	In my view, behaviorism was a radical departure
2059500	2060900	from the sciences.
2060900	2063260	First of all, behaviorism varied.
2063260	2067180	But the form of behaviorism that was pretty much
2067180	2070620	dominant in the period of creation
2070620	2073900	of modern cognitive science was largely
2073900	2076220	skinnerian behaviorism.
2076220	2080100	It was picked up by Van Quine, one
2080100	2083260	of the most influential philosophers of language.
2084020	2089620	Work like Word and Object based very explicitly
2089620	2093620	on operant conditioning, skinnerian behaviorism.
2093620	2097220	And that was all the rage in Cambridge in the 1950s.
2097220	2099860	It was virtual dogma.
2099860	2102100	Skinners, William James Lectures,
2102100	2104540	came out in the late 40s.
2104540	2106460	The book itself, Herbal Behavior,
2106460	2108340	came out about a decade later.
2108340	2111340	But it was whatever it was doing.
2111380	2115020	Well, there were various chips in the armor
2115020	2116620	that began to develop.
2116620	2119980	Some of them were within psychology itself.
2119980	2122540	So George Miller, one of the founders
2122540	2126260	of cognitive psychology, a close friend,
2126260	2128060	worked closely with him for many years.
2128060	2129980	We published together.
2129980	2135460	Even before this started, he did some crucial experiments
2135460	2138100	which raised serious questions.
2138140	2139900	So for example, take the sentence,
2139900	2145300	and John went to the store from any sentence.
2145300	2148180	The standard theory of perception of speech
2148180	2153260	was you have a certain guess about the first word,
2153260	2155660	then you have a guess about the second word,
2155660	2158460	the probability that you're right both times decreases,
2158460	2160300	of course.
2160300	2162660	By the time you get to the last word,
2162660	2165980	it should be very hard to understand in a long sentence.
2165980	2168820	Well, George showed that it's the opposite.
2168820	2171060	You don't understand the early words
2171060	2173620	until you get to the last word, which
2173620	2176900	means that you're forming the thought in your mind.
2176900	2178820	And the thought in your mind is telling you
2178820	2181180	what those early noises were.
2181180	2183700	By now, there's lots of work on this.
2183700	2187180	Well, that just didn't fit at all with behaviorism.
2187180	2190740	There was very important work in neuroscience
2190740	2196660	by Carl Lashley, his work on serial behavior around 1950.
2196660	2199500	It just totally undercut behaviorism,
2199500	2202820	showed that there are overall patterns in behavior
2202820	2204580	that simply just don't work anything
2204580	2207180	like the waivers' models.
2207180	2210020	Nobody looked at that.
2210020	2214540	I found it in the early 50s because it was brought to my
2214540	2219260	attention by an art historian, Harsh Piro,
2220060	2222020	you might be interested in this.
2222020	2225620	Looked at it, so totally wiped out behaviorism.
2225620	2230260	There was other work going on in European, what's
2230260	2234500	called ethology, comparative biology,
2234500	2238860	the Lawrence, Timberg, and others,
2238860	2243700	which was foreign to the environment in which cognitive
2243700	2246180	science grew up.
2246180	2249460	But the main thing was the work on language
2249460	2253740	that I and others started doing in the early 50s
2253740	2259100	was completely inconsistent with all behaviorist assumptions.
2259100	2263860	And there was just no connection between them.
2263860	2265780	You couldn't relate them.
2265780	2271180	And then when Skinner's book appeared,
2271180	2273220	you could read through it, and you
2273220	2276980	could see that it's all hand-waving.
2276980	2279060	There's nothing there.
2279060	2281460	Incidentally, around that time, even
2281460	2285380	within the behaviorist framework,
2285380	2287820	there were cracks developing.
2287820	2291100	So there was work by some of Skinner's students,
2291100	2293660	incidentally important work, which
2293660	2296420	showed that animals just didn't behave
2296420	2298980	by these pattern paradigms.
2298980	2300900	That they seemed to be working only
2300900	2305940	if you picked experimental conditions that essentially
2305940	2308980	adapted instinctive behavior.
2308980	2313140	So you can teach a pigeon to play ping-pong
2313140	2316420	because pigeons peck.
2316420	2319140	So you can modify the pecking behavior.
2319140	2322780	But basically, it was all falling apart from many points
2322780	2323980	of view.
2323980	2328220	And my own view, as it was a bad mistake from the first place,
2328220	2331860	you don't study any subject by saying,
2331860	2335180	let's keep to the superficial manifestations
2335180	2338060	and not look at what's going on internally.
2338060	2339420	You want to understand it?
2339420	2342140	You're going to have to look at what's going on internally.
2342140	2343740	You don't see it.
2343740	2346260	You can't do experiments right on it.
2346260	2349220	You have to study it in indirect ways,
2349220	2351980	the way physics, chemistry, biology,
2351980	2353980	every other subject developed.
2353980	2358260	Linguistic relativity, the so-called Worf hypothesis,
2358260	2361900	where language determines thought in the strong version
2361900	2364620	or at least influences thought in the weak version,
2364620	2367540	that the structure of a language affects the speaker's
2367540	2369340	worldview or cognition.
2369340	2372660	And therefore, when people have different languages,
2372660	2377380	their perceptions are related to the languages they speak,
2377380	2383220	as opposed to a broad human capability.
2383300	2387860	That hypothesis, the superior Worf hypothesis,
2387860	2392500	has been around for 80 or so years.
2392500	2395220	Investigation of its series of investigation
2395220	2397540	began in the early 50s.
2397540	2402180	First person to study it was Eric Leneberg.
2402180	2405020	We were grad students together, personal friend.
2405020	2407860	He went on to found biology of language.
2407860	2410220	But his first work was actually as a student
2410220	2415500	on the Worf hypothesis, experimental work.
2415500	2416780	Couldn't find anything.
2416780	2419740	Everything you tried, you got some superficial results,
2419740	2420980	but nothing.
2420980	2424260	Well, it's now 75 years later.
2424260	2426700	There isn't a lot more to say.
2426700	2430140	There's some evidence.
2430140	2434500	Some of the Lila Gleitman, who I mentioned before,
2434500	2439020	carefully analyzed and did experimental work
2439020	2443540	on some of the alleged evidence that fell apart.
2443540	2447180	There's a few things around that seem possible,
2447180	2451540	but pickings are very slim.
2451540	2454220	I mean, there's some respects in which it's obviously true.
2454220	2460340	So as Leneberg pointed out, 75 you found, 75 years ago,
2460340	2468420	if you study a language that we have a distinction between red
2468420	2472180	and orange and pink, say, but their languages don't.
2472180	2474220	They haven't been studying Hopi.
2474220	2477100	Just use the same word for that spectrum.
2477100	2480220	So he found perfectly predictably
2480220	2484820	that if you use, say, memory texts, tests,
2484820	2485820	did you ever see that?
2485820	2490540	Did you see this shade of color a minute ago?
2490540	2494100	You'll do better if you have names.
2494100	2497260	So in a way, the language affects perception,
2497260	2501380	but in such a trivial way that it's of no interest.
2501380	2503900	And there isn't much more than that.
2503900	2509380	Logical positivism, which was the rage in the early 20th century
2509380	2512780	that said that really there are only two kinds of truths
2512780	2517900	and even only two kinds of intellectual activities
2517900	2520580	worth pursuing, those that are empirical
2520580	2522860	with a scientific method and those that are purely
2522860	2524660	logical with a deduction.
2524700	2528620	Everything else is basically non-stets.
2528620	2531740	Well, logical positivism was an important movement
2531740	2536620	in the 20s, early 30s.
2536620	2541940	By the late 30s, its major figures
2541940	2545100	were drifting away from it.
2545100	2552420	Karnap, Temple, others, Quine, just moving away from it.
2552460	2557900	And it became influential in linguistics and psychology
2557900	2563220	after it was declining philosophy and declining
2563220	2564140	for good reasons.
2564140	2566580	There were internal critiques.
2566580	2569820	But it did have a big influence on linguistics
2569820	2576100	through Leonard Bloomfield, who saw himself as a strict.
2576100	2579340	He was the major linguist in the early 20th century.
2579340	2582420	He did very good work in many areas.
2582420	2585940	But in this area, he was very much misled
2585940	2590940	by picking up an early form of logical positivism, which
2590940	2592660	was not viable.
2592660	2597220	But so I think it's an important, made important contributions,
2597220	2602100	important residue, developed sense in other directions.
2602100	2607980	So if you look at Quine, Copper, Karnap, major figures,
2608580	2612940	Wittgenstein was totally rejected.
2612940	2619700	Then it just is no longer a coherent viable movement.
2619700	2622660	What is your view of contemporary field
2622660	2627380	or subfield of philosophy of language, which subsumes
2627380	2630180	a great deal of what we're talking about and even more
2630180	2630820	than that?
2630820	2631980	What are the categories?
2631980	2633540	What are your reflections on it?
2633540	2637140	Well, I've been a pretty short critic of it.
2637140	2638820	I've been book after book.
2638820	2640940	I don't want to go through that.
2640940	2643460	I mean, there is important work.
2643460	2647460	But a lot of it, I think, is seriously misguided.
2647460	2651180	I could go into details if written about it.
2651180	2653220	So for example, take, say, Quine,
2653220	2656140	who was the Quine and Wittgenstein
2656140	2661100	to the leading figures of modern philosophy of language.
2661100	2664900	Both of them accepted for Quine, who
2664900	2666900	was a strict Schenarian.
2666900	2672180	Language, in his words, is a complex of dispositions
2672180	2676900	to respond to present stimuli.
2676900	2679060	There's nothing to do with language.
2679060	2681620	I mean, it didn't develop that way.
2681620	2683740	It's not used that way.
2683740	2685580	Wittgenstein, the late Wittgenstein,
2685580	2688980	who was interested in language, it was kind of aphoristic.
2688980	2693620	You know, try to give an organized system.
2693620	2698020	But if you look at his comments on acquisition of language,
2698020	2701540	they're strict behaviorist.
2701540	2705140	You know, his language games, somebody
2705140	2710780	is showing a rock and somebody says rock and imitated.
2710780	2712780	That's how you learned rock.
2712780	2714780	Nothing like that happens.
2714780	2717820	I mean, there's tons of experimental evidence by now,
2717820	2720580	even just observational evidence.
2720580	2725940	And I think while there are doubtless major contributions,
2725940	2727780	some of them, a lot of the work, I think,
2727780	2729780	is off on the wrong track.
2729780	2734020	So the main contributions, I think, have been in semantics.
2734020	2737580	Donald Davidson's work on event semantics
2737580	2740500	has turned out to be very productive and influential.
2740500	2746220	It was picked up by Languist philosophers, James Higginbotham,
2746220	2750660	Paul Trotsky, others, and it's turned into, my view,
2750660	2752980	one of the most promising approaches
2752980	2755940	to the general semantics of language.
2755940	2757300	It's called philosophy.
2757300	2759740	I don't know why it's called philosophy.
2759740	2763060	It's basically a good, serious study
2763060	2765580	of the semantics of natural language.
2765580	2768660	Analytics philosophy versus continental philosophy.
2768660	2771180	You're classified as an analytic philosopher.
2771180	2774580	You've had some engagements with continental philosophers
2774580	2775580	famously.
2775580	2779540	What is your reflection on the dichotomy
2779540	2781460	between them, the artificial?
2784820	2787340	How do you see going forward?
2787340	2789420	Well, actually, a good deal of my work
2789420	2795020	is on continental philosophy from the 17th through the 19th
2795020	2809500	century, Descartes, Hume, Locke, onto the philosophers
2809500	2813980	of Humboldt on through the 19th century.
2813980	2819500	Contemporary continental philosophy is quite different.
2819500	2823420	There's work that I find interesting,
2823420	2826220	close to a number of others.
2826220	2831780	But most of the modern work, either I don't understand it
2831780	2835700	or I don't find it very interesting.
2835700	2839180	My own background is in what's called analytic philosophy,
2839180	2841900	though I was, as I've just mentioned,
2841900	2845740	I've been rather critical of a lot of the ways it's developed.
2845740	2851540	But I think basically on the way to finding
2851540	2855420	serious understanding of the way the mind works,
2855420	2856980	the way the world works.
2856980	2858980	What I'd like to do now, Nome, and I've really
2858980	2863020	been looking forward to this, is to get your quick sense
2863020	2865500	of some of the big questions that we
2865500	2868580	ask on Close to the Truth, the themes that
2868580	2874580	are the core of our work over two decades now.
2874580	2879300	And we've asked these questions to all leading
2879300	2883260	scientists, mainly physicists, philosophers,
2883260	2885500	neuroscientists, et cetera, and just
2885500	2887140	want to get your sense.
2887140	2890580	So we'll start with philosophy of mind,
2890580	2892300	which is a very broad category.
2892300	2893900	But from your point of view, what
2893900	2896740	have been the major issues or the problems
2896740	2899540	in philosophy of mind, and where have you
2899540	2902380	staked your own personal claims?
2902420	2905500	I don't know how to distinguish philosophy of mind
2905500	2907820	from science of mind.
2907820	2912940	The science and philosophy were pretty much
2912940	2916860	the same field until the 19th century.
2916860	2921340	Then the names diverged, but not in a serious way.
2921340	2927900	So the most serious work in cognitive science, in my view,
2927900	2931980	is a development of a suggestion by clock John
2931980	2937100	Locke in the wake of Isaac Newton's discoveries, who
2937100	2940780	showed that the mechanical conception
2940780	2944140	of the nature of the world that was developed in modern science
2944140	2945540	just didn't work.
2945540	2950940	So Locke concluded, he phrased it in his theological framework.
2950940	2952260	I'll drop that.
2952260	2957700	But just as the material world has properties
2957740	2960860	that we cannot comprehend, but that
2960860	2966340	are there like interaction without contact.
2966340	2972100	So the mind might just be, let me take it in his theological
2972100	2976620	framework, because it sounds better, just as God provided
2976620	2980780	matter with properties that we cannot understand,
2980780	2983460	like interaction without contact.
2983460	2987620	So God might have super-added to matter
2987620	2991140	the certain forms of matter the property of thought,
2991140	2995780	meaning thought is a property of some organized form of matter,
2995780	2998580	whatever matter turns out to be.
2998580	3000940	That's a fundamental insight.
3000940	3005140	And it was developed carefully through the 19th, 18th century
3005140	3006340	by major figures.
3006340	3010980	It culminated in Joseph Priestley's work.
3010980	3013260	Famous chemist, philosopher, distinction
3013260	3015660	wasn't made in those days.
3015660	3018140	Then it was pretty much forgotten.
3018140	3021700	It was rediscovered in the latter decades
3021700	3023660	of the 20th century.
3023660	3028780	It was then considered a radical new idea in philosophy,
3028780	3033580	astonishing hypothesis, new thesis in biology.
3033580	3037500	Actually Locke's suggestion on the work that was done on it.
3037540	3041260	So that's a core part of philosophy of mine, I think,
3041260	3048140	finding out what it is in the structure of the world,
3048140	3049980	whatever the world is constituted of,
3049980	3052220	that has this property of thought.
3052220	3055220	Well, that's the kind of thing we were talking about before.
3055220	3057540	And there are many mysteries there.
3057540	3060340	One of them, by mystery, I mean things
3060340	3064340	in which there's been no progress for millennia.
3064340	3066100	One question is what we were talking
3066100	3069420	about, the nature of concepts, where to come from,
3069420	3071260	how to people acquire it.
3071260	3076140	Another one is simply what was crucial for Descartes,
3076140	3079780	the fact that our ordinary use of language
3079780	3082420	is constantly innovative.
3082420	3086460	New things that were never said before, they're not random.
3086460	3091660	They're appropriate to situations, not caused by situations.
3091660	3095220	I've called it the creative aspect of language use,
3095260	3098660	total mystery, nobody knows where that comes from.
3098660	3101380	Actually nobody knows anything about voluntary action,
3101380	3103900	but this is a complex case of it.
3103900	3107220	So that's another major problem.
3107220	3109900	There are other problems about, you can go on,
3109900	3113020	problems about what constitutes thought,
3113020	3116500	what the animals do, how is human thought different
3116500	3120060	from the cognition of other organisms.
3120060	3123300	These are mixtures of philosophy and science,
3123300	3127060	which I don't think divide very clearly.
3127060	3130980	Philosophers are studying some of the more general aspects
3130980	3133100	of what the science is doing.
3134700	3137820	And plenty of people just cross the boundaries.
3137820	3139260	Don't pay any attention.
3139260	3142900	Are you committed to a purely materialistic,
3142900	3147900	physicalism approach to anything having to do with the mind?
3149020	3150260	Another way to put it is,
3150260	3153780	what is the ontological status of the mental?
3153780	3155460	To be contrary, and again,
3155460	3159020	I've always taken exactly the opposite position.
3159980	3163740	In my, as I've argued at some length,
3163740	3167780	there was a concept of matter
3167780	3171220	in the early scientific revolution.
3171220	3173220	It's called the mechanical philosophy.
3174380	3176740	The world is a complex machine,
3177740	3180140	a much more complex and intricate version
3180140	3184100	of what skilled artisans were developing
3184100	3186580	all around Europe at the time.
3186580	3190340	The world is just a far more complex variant of that.
3190340	3194700	That was held right through the major part
3194700	3197020	of early modern science.
3197020	3201860	Galileo, Descartes, Newton, Leibniz, Huygens,
3201860	3204860	all the great scientists assumed this.
3204900	3206380	Newton disproved it.
3207340	3211140	He showed that the world is not a machine in a sense.
3211140	3212380	He didn't believe it.
3212380	3214180	He thought it was the most so absurd
3214180	3217380	that nobody with any scientific understanding
3217380	3219540	could possibly believe this.
3219540	3222580	And that's why he called his major book,
3222580	3226500	mathematical principles, not physical principles.
3226500	3229020	He said, I don't have a physical theory.
