start	end	text
1374220	1382060	And so what it'll show you is that many of these user accounts use the bash shell.
1382060	1386820	And let's say, notice in this case I'm seeing bash and SH.
1386860	1392460	Let's say I'm only concerned about those users in this file that have the login shell bash.
1392460	1395220	So let's see how we can fix that.
1395220	1401140	Instead of just saying H, I could say bash, and what this will say is the last letter
1401140	1407940	on the line must be an H, but before it must come a B, A, and an S. And now I get exactly
1407940	1411420	the information I want, lines that end with bash.
1411420	1420980	So that's the concept behind positional values within regular expressions.
1420980	1425420	What I have here is a file called demo that contains two lines.
1425420	1429180	One is JSON space, the space prof, and the other line is JSONium.
1429180	1431420	So maybe I have my own element.
1431420	1436300	And if I grab this file for my name, what you're going to notice is that it shows me
1436300	1437500	both lines.
1437580	1441980	Maybe I only want to show those lines where it's actually my name and not my name embedded
1441980	1443220	in another word.
1443220	1448340	And the way I can do this is to add a word boundary to my regular expression.
1448340	1451340	And remember slash B means word boundary.
1451340	1459340	And so now it will only show me the JSON that is up against a word boundary.
1459340	1463660	So it's pretty helpful when you know you have spaces in a file and you want to find words
1463660	1465820	that you know are on a space.
1465820	1470060	The last thing for us to review is the concept of quantifiers in a regular expression.
1470060	1475420	Sometimes you want to look for zero or one or two or three of a certain character to
1475420	1477140	appear in a certain spot.
1477140	1481420	Other times you want to know exactly a specific number of items that you want to appear in
1481420	1484340	a given spot in your regular expression.
1484340	1490940	And so regular expressions come with the plus question mark and star operator.
1490940	1495580	And while the star operator seems to work like it does on the shell, it's important to
1495580	1500820	note that there is a slight difference between the file glob operator on the bash command
1500820	1505180	line as opposed to the star operator within a regular expression.
1505180	1510060	So how would we actually utilize these within some regular expressions?
1510060	1514100	Well let's take a look at some sample regular expressions and then we'll go to the command
1514100	1515940	line.
1515940	1523460	So here's a sample regular expression that matches a phone number in the order of 555-555-5555.
1523460	1529100	So typical US phone number, three digits dash, three digits dash, four digits.
1529100	1533580	And you'll notice that I've got some positional notations here.
1533580	1537580	So the line starts with a carrot and ends with a dollar sign.
1537580	1541100	And notice that I've got a character class zero through nine.
1541100	1546580	And since I know I want to match three characters, I could actually type bracket zero dash nine
1546580	1551500	bracket, bracket zero dash nine bracket, bracket zero dash nine bracket dash.
1551540	1557380	Or notice in this case I can use curly bracket three curly bracket, which says match exactly
1557380	1561140	three of whatever you find before you.
1561140	1566580	So we can actually use these curly bracket number, curly bracket notations to kind of
1566580	1569580	make our regular expressions a little more condensed.
1569580	1573300	So we'll look at this on the command line in a second and discuss.
1573300	1580180	Also talked a little bit about the slash w slash b kind of type word boundary commands
1580180	1583500	and the slash w character class commands.
1583500	1587300	And you'll notice that I've written a really poor regular expression here that matches
1587300	1589140	an email address.
1589140	1592820	Regular expression email address matching can be helpful, but it's not something I would
1592820	1597380	rely on because there's a number of email address formats and it's too complicated to
1597380	1599580	really catch all of them.
1599580	1605100	If you do a Google search for email address regular expression, take a look at some of
1605100	1606100	the answers that you get.
1606100	1608100	They're pretty long and detailed.
1608660	1613140	But what you'll notice is this email address says it's also positionally situated.
1613140	1615140	So it's got a carat and a dollar sign.
1615140	1617340	So the only thing on this line should be an email address.
1617340	1621020	It says find any number of word characters.
1621020	1624300	So you'll notice that the star in this case says, and you'll notice the same thing with
1624300	1629060	the number, the curly bracket three notation is it affects whatever is to the left of it.
1629060	1634980	So this is look for any letter or number or valid email address character and then star
1634980	1641300	after it means any number of valid email address characters, followed by an at, followed any
1641300	1647060	number of valid characters, letters or numbers, followed by a dot, followed by any other number
1647060	1649900	of valid letters or characters.
1649900	1653100	Notice also that because I actually wanted a dot here, I didn't want to look for, remember
1653100	1656140	that a dot has a special meaning with regular expressions.
1656140	1661300	Anytime you want to tell a regular expression to use the actual character and not interpret
1661300	1666060	it as a special regular expression character, you just put a slash in front of it.
1666060	1670580	So let's take a look at how some of these components can work on the command line.
1670580	1675860	I have a file that might be the file you're using for your lab.
1675860	1679540	And if we look at the file lab3test.txt, what you're going to notice is it's a file full
1679540	1681900	of names and phone numbers.
1681900	1684380	So we're just going to look at matching the phone numbers since I've already given you
1684380	1686180	a regular expression that does that.
1686180	1688020	Let's see how that works.
1688020	1694820	I want to build a regular expression to match just valid phone numbers in this file.
1694820	1698420	So I'm going to use egrep and I'm going to put my pattern in here and I'm going to use
1698420	1701100	lab3test.txt as my file.
1701100	1708020	So before I said if I really wanted to match a phone number, I could write a regular expression
1708020	1712140	that looks like this.
1712140	1715780	And if I just run that, I'm not going to type, notice it matches any line that has three
1715780	1719460	numbers in a row, or any instance of three numbers in a row.
1719460	1723100	But notice it also gets these kind of user IDs over here.
1723100	1731380	So then I could say as well, what if I match a dash, let me clear this, and then what if
1731380	1732380	I add a dash?
1732380	1736900	Well now we're getting better, we're getting closer, because it's matching, it's no longer
1736900	1738700	matching these IDs on the left.
1738700	1743180	But it is matching these two multi-formatted phone numbers and by the way, if anybody's
1743180	1747500	dealt with large amounts of data that was input by humans over a period of time, you've
1747500	1751940	probably run into situations like this where you have inconsistent data entry.
1751940	1754660	So again you say, well I kind of just want these dash formats, because these are the
1754660	1757060	only ones I really want to identify.
1757060	1763780	So let's clear this and go back and look at how to fix a regular expression.
1763780	1767980	So what I could do is just add one more number and I'm getting better.
1767980	1772780	But still notice it's still matching out on these other numbers.
1772780	1778140	So you notice that these are greedy matches, in other words, it keeps trying to match things.
1778140	1783300	So I can keep adding these until I get the total number of characters that I want, but
1783300	1785860	this is getting hard to read and getting long.
1785860	1786940	So we just talked about characters.
1786940	1790860	So I know my phone number is going to have three characters.
1790860	1797020	So what this says is, look for a value that could be any value between zero and nine,
1797580	1799060	look for three of them in a row.
1799060	1802900	And they don't need to be the same number, like 222, it could be 215 or whatever.
1802900	1805460	Then follow that with a dash.
1805460	1810660	Then look for another series of numbers, zero through nine, and look for three of those.
1810660	1812580	Let's run it.
1812580	1815620	And it's still being a little too greedy, so we're going to have to extend it out here
1815620	1817180	to get these four numbers.
1817180	1821260	Also notice this file is a broken phone number in it.
1821260	1823500	That's there on purpose, but we'll skip that for this exercise.
1824460	1830900	Now I'm going to put another dash in, zero through nine, and I'm going to put the number four.
1830900	1837300	And so what this says is, find three numbers, followed by a dash, followed by three numbers,
1837300	1841500	followed by a dash, followed by four numbers.
1841500	1847940	By the way, notice I'm using eGrep for this, and notice that it gave me the valid answer.
1847940	1853460	If I use plain grep, I just want to point out that you'll get an error because in these
1853460	1857420	curly brackets, there is a way to make them work in grep, but it's just easier to use
1857420	1863580	eGrep because these curly brackets are part of the extended grep syntax.
1863580	1874660	So just be sure that when you utilize numeric quantifiers that you utilize eGrep to do that.
1874660	1881060	Now let's look at the plus question mark and star operators, and we'll go back to searching
1881060	1883780	through files in the dictionary file.
1883780	1895220	So let's say I wanted to find some words that have, start with a B, have an O, and then
1895220	1899580	have the letter T, like bot.
1899580	1906580	So I get a lot of things, saboteurs, robots, lobotomy, but what's interesting about that
1906580	1909900	is it's definitely more information than I want.
1909900	1919900	So let's say I'm curious about if there are words that have zero or one O's in them.
1919900	1927860	And if I put a question mark, a question mark will say in this specific case that the O,
1927860	1930940	there could be zero O's or there could be one O's.
1930940	1932860	Let's see if we can make any changes.
1932860	1933860	And I do.
1933860	1938860	Notice that it matches subtropical and it matches turbot.
1938860	1944740	It says, well, match any characters where there is an O or not an O.
1944740	1948540	There could be zero O's or there could be one O.
1948540	1953980	The plus sign will match one or more of a character.
1953980	1957860	So in this case, it brings in toll booth as well as sabotage and robot.
1957860	1963700	So notice there's two O's there, one O there.
1963700	1972780	And then finally, we could use the star, which means zero to infinity.
1972780	1984260	And so notice that star actually gives us the two O's, zero O's, and one O.
1984260	1989100	Up to this point, we've been using grep to filter information so we can target stuff
1989100	1991060	that we want in more detail.
1991060	1994860	But we can also use regular expressions to find things and modify them.
1994860	1996780	The set command is the stream editor.
1996780	2000620	And while it can be a very powerful tool, what I want to do here is just kind of introduce
2000620	2005220	how it works very basically so we have an idea how we can use regular expressions in
2005220	2006900	a new and different way.
2006900	2013180	So what this allows us to do is we can basically use the set editor to take stream of data
2013180	2019300	and match against a pattern and then modify that information that matches that pattern
2019300	2020300	in some way.
2020740	2024860	One obvious way you could use this is to go through a bunch of files and find the old
2024860	2028060	boss's name and replace it with the new boss's name.
2028060	2030260	It's one way that I've actually used this.
2030260	2033020	And there's a couple other things that are useful, so it's a great way to find something
2033020	2034020	and replace it.
2034020	2035940	So you can use set to find and replace stuff.
2035940	2039480	It's a really powerful tool and we're going to only look at one aspect of it.
2039480	2044540	So we're going to look at a command very similar to this one that's in this example.
2044540	2046660	Let's jump over to the command line.
2046660	2049020	Let's take a look at how set works.
2049020	2051060	For this to work, we're going to actually need a file to edit.
2051060	2053380	And so we're not going to actually edit the file in place today.
2053380	2057940	We're just going to dump data out to standard output and what we're going to do is just
2057940	2060620	modify what's printed to standard output.
2060620	2064020	We could obviously redirect that back to another file.
2064020	2068020	We could actually edit the file in place, but these are all some more advanced things.
2068020	2070580	We just want to look at using regular expressions in a new way.
2070580	2075900	So I am going to actually utilize the Etsy password file for this.
2075900	2079820	And actually, if we just look at that file real quick, which you'll notice is that everything
2079820	2082540	in here is separated by colons.
2082540	2085220	So let's say I want to get rid of those colons.
2085220	2086220	So let's use set.
2086220	2087860	We'll get rid of this.
2087860	2092620	So set dash E and dash E means I'm going to give set an expression.
2092620	2095660	In this case, I'm going to use single quotes and a couple of things.
2095660	2099100	I'm going to set this up and talk a little bit about what it means.
2099100	2103860	Notice I've got single quote S slash slash slash G single quote.
2103860	2107580	So whatever I want to find goes between the first two slashes.
2107580	2110620	So in this case, I'm saying find the colon.
2110620	2114220	And now I'm going to say replace it with three dashes.
2114220	2118300	And what this will do is, said we'll go through the file, find every instance, and by the
2118300	2120660	way, G stands for global.
2120660	2124020	And that means it will find every instance of a colon in the file and replace it with
2124020	2125020	three dashes.
2125020	2129980	And if you look at my output, now instead of colons, you see a bunch of three dashes.
2129980	2135420	So this can be really helpful for a bunch of reasons.
2135420	2139260	One of the things that we can do too is we can use all of our new found regular expression
2139260	2140420	powers in this file.
2140420	2145820	So if we take another look at that password file, one of the things you'll notice at the
2145820	2148940	top is, let's say there's a user called bin.
2148940	2152540	But then you'll also notice that the word bin shows up a lot of times in this file.
2152540	2155740	Let's say I just want to change that user bin.
2155740	2159020	But I don't want to change any other instance of bin.
2159020	2164620	So what I could do is, go back up to my previous command, and what I'm going to do is, instead
2164620	2168500	of just match bin, which would match everything, I'm going to actually go ahead and what am
2168500	2169500	I going to replace bin with?
2169500	2172460	I'm going to replace it with JSON, really big.
2172460	2179300	So if I just do that, notice it replaces every instance of bin in this file with the word
2179300	2180300	JSON.
2180300	2183940	It replaced the one I want, but then it replaced all these other instances.
2183940	2191940	So what I want to do is, use an anchor.
2191940	2196220	So I'm going to say, only match the bin that's at the start of the line.
2196220	2200460	And now you'll notice that all the other bins are left in place, but if I scroll back up
2200460	2205100	and look, it only replaced the one that was at the start of the line.
2205100	2209140	So said it's a really powerful tool and we'll take a look at it more as the semester progresses.
2209140	2213580	But in this case, I just want to show you that you can use your new found regular expression
2213580	2217780	powers, not just a filter data for viewing, but filter data for editing.
