start	end	text
1608000	1613520	than finalizers, it's still slower than using the auto-closable interface, which we shall get to
1614400	1620080	in the item, later on in the item. So the other problem is, of course, yes, performance penalty,
1620080	1624960	and that's why Dr. Block states there's severe performance penalty for using finalizers and
1624960	1631920	cleaners. It is about 50 times slower to create and destroy objects with finalizers. This is
1631920	1639440	primarily because finalizers inhibit efficient garbage collection. And then we get to probably
1639440	1645760	one of the biggest issues with using finalizers and cleaners, and it's that it does leave our
1645760	1652400	program vulnerable to malicious code and security attacks. This point, despite being an important
1652400	1660000	point, I found it a bit difficult to understand, especially because I couldn't get what he meant
1660000	1667440	by having a malicious subclass. But this is what I meant, but I'm trying to collectively learn here.
1667440	1673920	I did post a question on Stack Overflow, and I got some really good answers. And then finally,
1674480	1682000	Holga, great blog. I'm assuming it's a blog. The person answered the question, and it was,
1682800	1689040	I think it was somewhat clear. It did make sense. So all credit goes to Holga. I'll leave an answer
1689120	1695680	to this question down below in the description, where he explains how finalizers, in fact,
1695680	1701200	do create security problems. And before I read what Dr. Block has stated, let's go through
1702080	1711360	some code and understand what this issue is, practically. So firstly, I've written this
1711360	1717840	class called Finalizer Attack Example, and that also has an inner class. This inner class, in fact,
1717840	1723200	is what is supposed to do the cleaning up. So it's got this check call method, which is kind of
1723200	1728160	like a Boolean, which is just like a security check that verifies where that calls this,
1728160	1734880	has permissions, let's say. That's a bad way of putting it. But just for all the intents and purposes
1734880	1739760	think that all callers are invalid for our demo. And then we have this method, which does some
1739760	1744240	critical action. That's it's really important. So I forgot to mention that since the inner class
1744240	1749360	is static, that won't allow the JVM to garbage collect this resource. And then we have this
1749360	1756880	malicious subclass that extends the resource class. So this is where the issue lies. This resource
1756880	1765280	class, once it was used, should have died on the vine, as Dr. Block would state in this item.
1765280	1769760	It should have got garbage collected, and no one should have access to it to that object.
1769840	1775120	However, because we know that the finalized method can be accessed via the object superclass of resource
1775120	1780800	class. And then the fact that the malicious subclass extends the resource class, all it's
1780800	1785120	got to do is override the finalized method and invoke it. And the moment it's invoked,
1785120	1791200	this object, which is probably a corrupt object now is resurrected. And that gives this malicious
1791200	1798400	subclass access to this critical action method, which probably could do something like access
1799360	1804400	the database or do something that could potentially calm your application and its uses.
1805040	1810080	So which is why when I run this code, you'll see in the public static word main function.
1812080	1817520	Initially, oh, I've added this thread here with the GC. This helps to kind of demonstrate the
1818080	1823920	non-domestic behavior. I'll just show you that too. Initially, in the try statement,
1824000	1831200	it creates a new object. And when it does, it'll say because it ran a couple of times,
1831200	1835760	it would initially say I wouldn't get hands on a resource class. So okay, that's a bit confusing.
1835760	1841200	I can see I shall first get rid of the sleeping of the thread and try running it again.
1845040	1851120	When I don't make the thread sleep, it will throw a security exception.
1852080	1859840	It'll catch that there's an issue here by the check holder and then throw the security exception.
1859840	1866720	But the important point here is finalizes aren't deterministic. It's a problem. So if we do get
1866720	1872480	the thread some few minutes, two seconds to sleep, then what you'll see when you run it is
1873040	1880960	it's printing that look where it's saying, see, I got hands on this object, which is it's printing
1880960	1888560	that from the finalize method, which was a subclass, well, not subclass, which was inherited
1888560	1895440	from the resource class. And then because we got access to this object, you can probably see here
1895920	1902240	you can probably see here what it's printing out is in fact this this object, but then also
1902240	1909120	it has access to the critical action method, which ideally, which not ideally, but which
1909120	1917760	actually the malicious subclass shouldn't have access to because once again, it should have died on
1917760	1925600	the vine. I hope that makes sense. I think I got it. So I was trying to, when I asked a question
1925600	1931280	on Stack Overflow, here's what I said. I'll read out this bit of the chapter, but then I said,
1932160	1940240	in like a very systematic way, my understanding is that finalizes are not deterministic,
1940240	1945120	a malicious subclass can run its finalize method on a particular constructed,
1945120	1951760	corrupted superclass object, which is what we are doing right here by extending the resource
1951760	1960560	class. Moving the corrupt objects reference to a static field doesn't let the GCM garbage collect,
1960560	1967360	not GCM, JVM, I should fix that. So because it's static, it can't be garbage collected.
1967920	1973920	The attacker can use this object that should have died on the vine and do as they will,
1973920	1979680	pass the security flow. So this is the problem with the use of finalizes. I hope that makes sense.
1980640	1985280	I'm asking that question more from myself if I really understood that,
1987120	1991280	but I think I did, but I think I did. At least I'm going to tell myself how to feel better.
1993440	1999280	Now that I've kind of demoed that, even though I admit that was a rather pathetic demo,
2000080	2004880	let's try and get to what Joshua Block has stated here. Please forgive me. I'm trying my best to
2004880	2010240	demo it here, but because he really hasn't given tangible implementations and examples,
2010240	2014800	I'm trying my best to see if I could find code and write code and connect it to what he's trying to
2014800	2020560	say here, given that I haven't really used finalizes before ever in my programming life.
2021760	2025680	But anyway, let's see if what he's stating here makes a bit more sense.
2026560	2034640	Finalizes have a serious security problem. They open your class up to finalize their attacks.
2035200	2041760	The idea behind a finalize attack is simple. If an exception is thrown from a constructor,
2041760	2049440	or it's serialization equivalence, so that would be the constructor, for instance, of let's say this
2049440	2056960	class. The finalize of a malicious subclass can run on the partially constructed object that
2056960	2065360	should have died on the vine. So that was this subclass that extended it. This finalizer can
2065360	2071280	record a reference to the object in a static field, preventing it from being garbage collected.
2071280	2073520	Just a point here. You probably noticed I didn't
2074320	2080800	stole the reference to this resource class anywhere in any static field or didn't really hold the
2080800	2086960	reference in the subclass. The reason for that was because Holger, the answer that I got, said
2086960	2091600	something like this. He said your description is basically correct, but over complicating things.
2092480	2097360	I'm not surprised there. I tend to do that quite a lot. There's no need to store something in a
2097360	2102560	static variable as soon as the finalize method is invoked. The object is already just resurrected
2102560	2107760	as invoking a method on an object implies invoking code with access to the object. That really did
2107760	2111840	make a lot of sense to me because that's exactly what we're doing here in this override method,
2111840	2119040	in the subclass. Storing the object reference in a variable is a way to expand the lifetime
2119040	2124320	beyond the execution of the finalize method. But this is not necessary. But this is not a
2124320	2129680	necessary thing for the attack. Also, instead of using a static variable, the attacker could also
2129680	2135440	make the subclass and inner class and store the reference in the still reachable outer object.
2135440	2139040	So the following program is already enough to demonstrate the issue. So that's the program
2139040	2144080	that I showed to you before, which it's Holger's code. In fact, I just kind of repurposed it and
2144080	2149040	made it a bit more presentable, which is why I haven't done what Joshua Blocker stated here.
2153200	2158480	Once the malinformed object has been recorded, it is a simple matter to invoke arbitrary methods
2158480	2164160	on this object that should have never been allowed to exist in the first place. So that is the
2164160	2168240	arbitrary method, which was critical action that I did invoke.
2170800	2175520	Throwing an exception from a constructor should be sufficient to prevent an object
2175520	2181920	from coming into existence in the presence of finalizes. Unfortunately, it is not. And then he
2181920	2188640	states, which is kind of what I was, I tried to demo here, to protect non-final classes from
2188640	2194960	finalizer attacks, write a final finalize method that does nothing. That's exactly what we can do
2194960	2200800	here. So what you'll see is we have the resource class. And then because the resource class itself
2200800	2207280	obviously has the finalize method, if we create a final protected void finalize, you'll see that
2207360	2213120	it'll throw an error. You can't subclass it because, sorry, you can't override it because
2214080	2220720	this class that inherits that, that subclasses resource class, now can't override it. And that
2220720	2224720	never really solved the problem here. That's one way of protecting ourselves against the finalize
2224720	2228960	method. But the better way is to not use it in the first place. And that, of course, begs the
2228960	2235520	question, given that Joshua Block and the broader Java community, the experts are so adamant as to
2235520	2241280	why one shouldn't use finalizers or cleaners, what is the alternative? What should we use instead?
2242080	2248800	And that's what Joshua Block states here, to use the autoclosable interface. Before I get to
2248800	2254080	what I've written down and taken notes of and kind of try to demo what autoclosable is, let's
2254080	2259280	first go through the definition because that'll set a foundation, let's say.
2259440	2267440	So what should you do instead of writing a finalizer or cleaner for a class whose objects
2267440	2274160	encapsulate resources that require termination, such as files or threads, just have your class
2274160	2279680	implement autoclosable and require its clients to invoke the close method on each instance,
2280320	2286160	when it is no longer needed, typically using try with resources to ensure termination,
2286160	2292720	even in the face of exceptions. So the point on try with resources is in fact the next item.
2292720	2297840	So I shall go into detail as to what try with resources do in the next video.
2297840	2304560	So definition of autoclosable, which enforces encapsulation by Oracle docs is an object that
2304560	2310560	may hold resources such as files or socket handles until it is closed. The close method
2310560	2317200	of an autoclosable object is called automatically when exiting a try with resources block for
2317200	2325360	which the object has been declared in the resource specification header. This construction ensures
2325360	2332560	prompt release avoiding resource exhaustion, avoiding resource exhaustion, exceptions,
2332560	2336720	and errors that may otherwise occur. So let's take a look at a demo. Let's see
2337680	2344160	what at how autoclosable has to be used. Also, there's another caveat he's added here that it's
2344160	2352400	important that when an object has been closed that we should keep track of how if the instance has
2352400	2357760	been closed and we shouldn't rely on the client to do that. It was a bit hard to find a good
2359120	2364480	demo of what this meant. So I did ask a question on Stack Overflow on that too. I asked how to
2364480	2370720	keep track if an instance has been closed with Java autoclosable. I even got a negative
2371360	2376480	download on that question because I realized it's actually quite simple as to how to do that.
2376480	2383280	I just got a thought about it a bit more without being lazy. But nevertheless, I did find an answer
2383280	2390800	and I did post it here. So firstly, the demo, the demo on autoclosable is this. Again, courtesy of
2390800	2396800	Baldang. So we have a demo class which implements autoclosable. And then we have another buffered
2396800	2402480	read instance like the previous one we were going through for the final finalizable class,
2402480	2407680	a similar concept. In fact, the exact class that I've repurposed for this demo.
2409200	2416560	And this here, this Boolean is in fact what does that bit I asked here. It's what keeps track if
2416560	2424320	this instance of, in this case, the demo class has been closed. So when in the constructor,
2424880	2430800	the same way we are accessing a file, reading off the file, creating a new, using a resource reader,
2432560	2438880	and then we're reading the first line, similar thing doing, and we're checking if we can read
2438960	2446240	the first line. And here there's something extra added. We're checking if this resource,
2446240	2453200	so that is reader, has been closed. I think I made a mistake. I said that what this does in line number
2453200	2459200	13 was keep track of if demo class instance has been closed. That is wrong. I apologize.
2459200	2465440	What this keeps track of is if the buffered reader instance has been closed. And that's what we're
2465440	2472000	checking in the read first line method. And if it is closed, we can't access it. So it should
2472000	2478720	throw a illegal state exception. And that's what we're doing here. And then we override the closed
2478720	2489440	method, which is the method in the auto-closable interface. That method right there. And in the
2489440	2494560	class itself, we do the closing. We close that resource. And then, of course, we set the flag
2494560	2500880	to true because now it has been closed. And if not, it'll throw an IO exception, in this case,
2500880	2507520	because it's a buffered reader. So if we go to the unit test, you could see if I'm going to run it,
2511120	2518640	it did pass because all it's going to do is read the line. But of course, if we try to access the
2519200	2524800	resource, read the instance, and it was closed, it would have thrown an error. The test did pass
2524800	2534240	because it's just checking if the line, if this line is this. Oh, I should show the log here, in
2534240	2542400	fact. It's printing this log here, closed buffered reader in the closed method and flag changed to
2542480	2550720	true. So that is this right here. Where is it? I've got so many classes opened up. Oh, yeah.
2550720	2555920	That's printing this bit here, closed buffered read instance, and it's printing the flag, which is
2555920	2561040	true in this case. So that's really, it's quite straightforward, the auto-closable bit and even
2561040	2565920	how it keeps track of how it closes it. I was over-complicating in my head and I was thinking
2565920	2571760	there's some way to do it. In fact, it's tabooly. So despite being told not to use them, and we
2571840	2577280	probably will never have to use them for normal average Java programmers like myself,
2578160	2583680	what really are they useful for? What are they good for? Caviar there, of course, is that as of
2583680	2589280	Java 18 finalizes are in fact deprecated and will be entirely removed in the future. So we'll never
2589280	2595280	use finalizes, but let's say cleaners. What are they really useful for? Firstly, it's for them to
2595280	2603760	act as a safety net. And let's try to understand what that means. One use of Java cleaners,
2603760	2607920	I'm going to stop saying finalizes because it's deprecated, is that one use of that is
2608880	2615040	to act as a safety net in case the owner of a resource neglects to close its, to call its
2615040	2620800	closed method. Well, there's no guarantee that the cleaner or finalizer will run promptly or at all.
2621360	2626640	It is better to free the resource later than never if the client fails to do so. If you're
2626640	2632320	considering writing such a safety net finalizer, think long and hard about whether the protection
2632320	2639520	is worth the cost. So the way I see it, it's just an extra check one adds when writing an API or a
2639520	2646400	class just as a safety net. By overriding that finalize method, we could ensure that any of the
2646400	2652960	resources that should have been closed, sorry, not ensure, we could hope that any of the resources
2652960	2658160	that should have been closed or were closed because of the finalize method, even though
2658160	2662800	it's not a domestic. So that's, it's a trade off one has to make and think about carefully.
2663440	2670320	And then the second use is using it with native peers. What is native peer?
2671280	2676160	As the simplest way to think about it is that native peers are objects that aren't owned by the
2676160	2684000	JVM. They're sort of like a platform specific objects that the JVM runs on, the virtual machine
2684000	2690080	runs on. It could be CEO C++ objects and the JVM can't garbage collect them. And that's why they're
2690080	2694880	called native peers, even though they call peers because the objects still have dependencies on
2694880	2701120	them. But the JVM has no control of these objects in memory. It's quite interesting. I really didn't
2701120	2707120	know much about it. But of course, I found this pretty simple stucco flow answer, which can explain
2707120	2713680	that it said that a native object is not programmed only in Java, but is a, but in a platform specific
2713680	2720240	language, typically CEO assembler, even memory allocated by this code cannot be disposed by the
2720320	2727040	garbage collection by GC. Therefore, you may need to clean it in a finalizer. The native peer is
2727040	2731600	the native part of a Java object. So I'll leave an answer to this question in the description.
2733200	2738720	And that's what I wrote out here by the user Andres on stucco overflow. Thanks for that.
2741040	2747760	And Joshua Block states, a second legitimate use of cleaners concerns objects with native
2747760	2754400	peers. A native peer is a native non Java object. That's an important point to which a normal object
2754400	2761680	delegates via native methods. Because a native peer is not a normal object, the garbage collector
2761680	2766240	doesn't know about it and can't reclaim it when the Java peer is reclaimed.
2768160	2773760	A cleaner or finalizer may be an appropriate vehicle for this task, assuming the performance
2773760	2778400	is acceptable and the native peer holds no critical resources.
2780560	2786560	Saying that finally, we, we in fact get to some actual code in this item, because the other code
2786560	2794320	I showed was code that I wrote and I kind of use from other people. And that is this room class,
2794320	2800960	which demonstrates the concept of it being a safety net by implementing auto closeable. Yeah.
2801120	2808240	So the class is called room. And I do appreciate that pun there because the room must be cleaned
2808240	2814480	before being reclaimed. I like that. I appreciate that. And it implements, as I said, auto closeable.
2815120	2822560	It's got a private static final cleaner, which cleans. And this in a class,
2823440	2832800	which implements runnable is what holds the resources required by cleaner to clean the room.
2834000	2839680	So this in a class is in fact what does the cleaning in a separate thread in the background
2839680	2846480	of this broader class. So what you can see is we're simply registering the cleanable instance
2847440	2853680	with with with the state, which is a variable we hold here in line number 34 and register it.
2853680	2860080	We assign it. And after that, the number of junk piles should be set to zero. And the way that happens
2860080	2869680	is the close method, which is what we override from the auto closeable interface that will invoke
2870480	2875760	the run method, which is inclinable. So once we register it with the with the with the object
2875760	2881360	itself and then the state. So this refers to the current object and then in the state of the room
2882480	2891920	that we pass into the uh, we pass the we invoke the clean method of the of the cleanable instance.
2892560	2898000	And the clean method, what that does is it triggers the run method that sets the number
2898000	2903920	of junk piles to zero. So every time before it's reclaimed, it has to clean all the resources. Now
2903920	2908800	I didn't I think I don't think I did a good job at explaining that. It's a bit difficult to explain
2908800	2917120	because I I lack the verbal visual city and a deep understanding of how cleaner works. Therefore,
2917120	2923120	probably what I'll do is I'll go through Joshua Bloch's description or sorry, his elucidation
2923120	2929520	and then I shall refer to the code as I read them out and kind of learn it live, let's say,
2929520	2935680	which is exactly what I'm doing in this video series. The the room class implements auto close
2935680	2944640	book that I showed here. The fact that it's automatic cleaning safety net uses a cleaner is
2944640	2951600	merely an implementation detail. Unlike finalizes cleaners do not pollute across this public API.
2951600	2957280	That's correct, which is why it's a bit hard to see at first because I'm using it as a client.
2957840	2964240	The static nested state class holds the resources that are required by the cleaner to clean the room.
2964240	2970560	So that is the static nested state class. Also, to understand how nested classes work, just go and
2970560	2977600	read these docs in Oracle. It's pretty simple. It's it's a it's an inner class. I'll leave a link to
2977600	2984000	that in the description. It's got access to all the properties of the outer class in this case.
2987600	2996640	And then and then he continues. And then he continues in this case, it is simply the number of junk
2996640	3001680	piles field, which we need to clean up, which you shall see we're going to be doing this integer value,
3004080	3010480	which represents the amount of mess in the room. Yep. State implements runnable. So you can see
3010480	3015840	here it's going to implement runnable because we need to run this in the background. And its run
3015840	3022960	method is called at most once. So this method, which we're overriding is called at most once and
3022960	3032320	that is this one method is from runnable because we're running a new thread by the cleanable that
3032320	3038320	we get when we register a state instance with our cleaner in the room's constructor. So that that bit
3038320	3043920	here is done right here in the cleanable, which is what I said that we're doing the registering
3043920	3052160	as we create this new state by passing the number of junk files, junk piles, sorry. And that's what
3052160	3057360	we're passing onto this and doing the registering, which is what invokes that run method eventually.
3060160	3066880	The call to the run method will be triggered by one of two things. Usually it is triggered by
3066960	3073440	call to room's close method, calling cleanable's clean method. So that's the close method,
3073440	3079360	which we have overridden here of the out-of-class room. If the client fails to call the close
3079360	3085280	method by the time a room instance is eligible for garbage collection, the cleaner will hopefully
3085280	3092160	call state's run method. So that's what he meant by a safety net because if the client doesn't
3092880	3096880	call the close method and clean up that resource or clear up that resource,
3098720	3101840	then we expect this run method to run, hopefully.
3104000	3109040	It is critical that a state instance does not refer to the room instance. That's important and we
3109040	3113680	shall see why. If it did, it would create a circularity that would prevent the room instance
3113680	3118720	from becoming eligible for garbage collection and from being automatically cleaned. Yes,
3118720	3122480	because for it to be eligible for garbage collection, we have to make sure that there
3122480	3128480	aren't any references to that object in memory. Therefore, state must be a static nested class
3128480	3133520	because non-static nested classes contain references to the end-closing instances,
3133520	3139520	which is why exactly we've declared this static and I said to do some reading on nested classes
3139520	3143520	as to how the difference between non-static and static in the Oracle docs.
3144240	3152720	And then we shall take a look at how this class is used. So if we take a look at, let's say,
