start	end	text
3152720	3160000	teenage up, we're doing some garbage collection manually, explicitly, but we should not depend
3160000	3167520	on this behavior. So if I go run this and run this, in fact, first let's take a look at adult,
3167520	3173360	sorry, where we're using a tri-width resource. So the room's cleanest used only as a safety net.
3173360	3180400	If clients surround all room incantations with tri-width resource blocks, automatic
3180400	3186160	cleaning will never be required. So as you can see here, I'm not, or just your block in this
3186160	3192080	case isn't doing any explicit garbage collection because we've used it with a tri-width resource
3192080	3198880	block. And if I run this, you will see it says goodbye, but also says cleaning the room. So the
3198880	3205520	object's created and it prints goodbye. But afterwards, this cleaning the room along comes from
3210160	3215440	this run method here, which we've all written and written. And that also means that the number
3215440	3220560	of chunk passes zero. So in fact, if you want to print out the number of chunk pass just to,
3220560	3222800	just to make sure that we know what's going on
3228880	3232400	and run that again, you will see it's going to print zero.
3236800	3243200	Yeah, there we go. It printed zero. That's what we expected. But then if you go take a look at the
3243200	3248800	teenager's room and if you run it, it will not run it unfortunately. Oh, it did, but it's kind of
3249120	3254560	so I'm going to try it again. I'm going to keep trying it until it does not run it. Oh, actually,
3254560	3259920	sorry. If I comment the garbage collection, because I had that uncommented, it should have
3259920	3265760	been commented out. Now it shouldn't run it. You see that it just printed our piece out,
3265760	3270960	but there was no cleaning done. And then when I do the garbage collection explicitly,
3271760	3277520	now it's going to print cleaning room. And that's what we expect. And that was though,
3277520	3280560	that cleaning room was imprinted from the previous line.
3283920	3288400	Sorry, it was printed off the previous line, of course, because it ran the run method, but
3289680	3294080	because we did do the garbage collection, that doesn't exist anymore. The memory was cleared.
3296000	3303840	And that's virtually it. That's kind of the utilities of using auto-closable and how it's
3303840	3308320	got to be used and why it's preferred over, let's say, using a final asset, for example. And then
3309760	3316400	just to conclude that point and of that demo, Joshua Block states, you might expect it to print
3316400	3323760	piece out, followed by cleaning room. But on my machine, it never prints cleaning room. It just
3323760	3330480	exits, which is kind of, well, that was before we did do the explicit garbage collection.
3331120	3337360	This is the unpredictability we spoke of earlier. The cleaner spec says, the behavior of a cleaner
3337360	3343520	during system.exit is implementation specific. No guarantees are made relating to whether
3343520	3349200	cleaning actions are invoked or not. While the spec does not say it, the same holds true
3349200	3358080	for normal program exit. On my machine, which is what we did here, adding the line system.gc
3358560	3365200	to teenagers main method is enough to make it print cleaning room prior to exiting. The reason we
3365200	3371840	didn't see that log here in line number 30 is because the moment it cleaned the room and cleared
3371840	3377200	out the resources, it exited and it doesn't really exist in memory anymore. So I repeat that point
3377200	3383840	again, on my machine, adding the line system.gc to teenagers main method is enough to make it print
3383840	3388320	cleaning room prior to exit. But there's no guarantee that you'll see the same behavior on
3388320	3394400	your machine, which is exactly why Joshua Bock states here to test the behavior. But note that
3394400	3402560	you must not depend on this behavior. Again, not to be on that horse, but the biggest problem is
3402560	3407600	the non-determinism. And we don't want that in programming. We want things to be logical and
3407600	3414640	deterministic as script programmers. And in summary, he states, don't use cleaners or in
3414640	3422480	releases prior to Java 9 finalizes, except as a safety net or to terminate non-critical native
3422480	3429920	resources. Even then, be aware the indeterminacy and performance consequences. That's it. That
3429920	3437200	was item number eight, avoid finalizes and cleaners. I hope I did a good job at demoing
3437200	3442640	certain parts of it. As you all know with these tutorials, the best way to understand it is to
3443600	3448880	after watching them or while watching them goes through the code base, because that's the best
3448880	3455920	way to grok these concepts. But nevertheless, I hope my efforts were worth it. I will try and
3455920	3461040	keep enduring and getting through this whole book because I'm really enjoying it. I'm learning a lot,
3461040	3465760	but also I want to kind of get into the habit of putting out these videos
3467040	3470720	in a certain schedule, let's say, at least once every two weeks.
3472080	3476080	But thanks a lot for watching. I hope you gained some value from it and learned something.
3476080	3478880	I'll see you in the next item. Cheers.
