start	end	text
0	6800	Hey everyone, welcome to yet another episode of my video series on Joshua Block's Effective Java,
6800	12160	where I take the items that he has enumerated in this book and expound on them, trying to make
12160	18080	sense of them. And hopefully, as I do that, you can gain some value from it too. You can
18080	23280	hopefully learn something from it. That at least is one reason that I put out these videos
23280	28960	out in the public. Without further ado, let me get started. This is certainly one of the longest
28960	34400	items that I had to go through and probably going to be the longest video of this series as of yet.
35120	40160	In fact, I was thinking if I should break this down into two videos because the video might be
40160	46720	too long. In any case, let's get started with the proviso. I've been doing this proviso slash
46720	51600	instruction in every single video. So if you have been following along, please do skip this bit to
51600	56720	save your time. The first point in the proviso is of course, and it's a very important point,
56720	64080	this is not a tutorial. I'm not a teacher, nor am I an expert. Therefore, don't think of what I say
64080	68720	as gospel's truth. In fact, when I do make mistakes, I'll try and correct them down
68720	74560	during the comment section. And as I've said in the second point, think of this as the blind,
75120	81120	leading the blind. This is purely an exploratory disposition. I'm trying to figure something
81120	90160	out publicly and in a very, let's say, what's what I'm looking for. I'd say thinking out loud,
90160	95200	trying to make sense of these items, not just in the videos itself, but even preparing for them
95200	101680	as I post questions on Stack Overflow, as I try to involve the community. I feel like hopefully,
101680	106240	you know, I'm adding some value into the programming community, the Java community,
106240	111760	by asking certain questions pertaining to this book, as I'm trying to learn, which is why I call
111760	117840	it an exploratory disposition. It's a collective endeavor. And as I did touch on a bit before,
117840	124320	I will inevitably make mistakes. So please point them out, not just for my sake, perhaps even more
124320	132160	for the sake of the viewers, because I certainly don't want to mislead them by sharing any misinformation
132160	138080	to use a politically overloaded term. And of course, as this is a programming video series,
138080	144720	all the code is available on GitHub, not just mine, but even Joshua Bloch's public repository
144720	150880	where he's published the code that he's used for this book. Saying all that, let us get started
150880	156640	with item number eight, which, as I said, is a long one. There are a few concepts that I had to
157440	164560	sort of think about and muse and reflect for a bit to get my head around. But it was a very
164560	169520	interesting item as I found all the items in this book. And especially if you're a Java fan, like
169520	177280	myself, for all, even though I don't program in Java in my day job anymore, Java is my first love
177280	185120	venue. Never forget your first one, isn't it? I'm sorry, that was pathetic, but I can't help myself.
185120	191360	Okay, item number eight, avoid finalizers and cleaners. And we're still in chapter two,
191360	198160	creating and destroying objects. And again, as I said, all the code available on my GitHub repo,
198720	203440	links down below in the description. And I've kind of added like this, another caveat here.
204000	208640	This item does have a lot of theory. So before we get into the code, which of course I have
209360	214720	right here, before we get into any of this code, I think it's important to get through some theory.
216400	223040	Just in general, I prefer doing that to get a conceptual understanding. But specifically this
223040	228800	item, I think has a lot more theory. So as I normally do, let's look at some keywords here.
228800	234240	Avoid finalizers and cleaners. What the hell are finalizers and cleaners? Full disclosure,
234240	240000	I've never used a finalizer nor a cleaner. A cleaner, yes, but I've never used a finalizer
240800	246080	in my day job when I used to do a lot more hands-on Java programming. But here are a few
246080	253360	definitions that I found on finalizers. In fact, they're from Baildang, my favorite Java
254240	261920	learning blog slash website. And then of course, the Oracle docs. So finalizers, the,
264400	268720	sorry, I had to think about that just for a bit. I didn't want to mindlessly read out the definition.
268720	273440	Essentially, I mean, finalizers is simply a method we're talking about, which is in the
273440	279360	object class, which the, in the class hierarchy in Java, the object class is right at the top. So
279360	288240	everything is a subclass of object Java, FII. The finalize method for all intents and purposes
288240	295120	is what we call the finalizer. Even though finalizers is more like a mechanism. And Baildang states
295120	302880	finalizers get involved when JVM figures out that this particular instance should be garbage collected.
303120	311280	So when the JVM understands that a certain object or an instance of a class is ready to be
311280	319200	garbage collected, it can be involved, this finalized method. Such a finalizer may perform
319200	325680	any operations, including bringing the object back to life. That bit, full disclosure, I don't
325680	330960	understand. I didn't really go into detail as to what it means bringing the object back to life.
331920	336560	Perhaps it's referring to the object later again in the code and then, you know,
336560	342400	allocating memory to it. But even in the item, Joshua Block hasn't really got into what that
342400	348720	means. This is just a definition from Baildang. The main purpose of a finalizer is, however,
348720	355920	to release resources used by objects before they're removed from memory. A finalizer can work as a
355920	361600	primary mechanism for cleanup operations or as a safety net when other methods fail.
361600	369280	So at a very high level, just a good bit of start is to think of finalizers being related to
370080	376000	memory management and garbage collection. It's not something particularly done by the JVM.
376000	382800	Programmers could do it too, explicitly. But of course, a caveat is we should in fact avoid
382800	387920	using finalizers and cleaners. That is the caveat here. So even though it's possible,
387920	395360	doesn't mean we should do it. So again, to repeat the point, think of finalizers as something that
395360	402240	relates to memory management and garbage collection and ensuring that any unreferenced
402240	408640	objects are cleaned and that resources are freed up. And then another definition again from the
408640	414880	Oracle docs this time is, as I said, finalize is part of the object class. If you go take a look
414880	422000	at the docs, it'll even state, if only my internet loads, it'll even state the finalize method is
422000	429360	there. As you can see there, it'll say they're called by the garbage collector on an object
429360	434000	when garbage collection determines that there are no more references to the object.
434000	445760	The general contract of finalize is that it is invoked if and when the Java virtual machine
445760	452560	has determined that there's no longer any means by which this object can be accessed by any thread
452560	458640	that has not yet died, except as a result of an action taken by the finalization of some other
458640	465200	object or class which is ready to be finalized. So, okay, effectively this means when the object is
465200	471600	not going to be used, we need to free up that resource and get that memory back to be used
471600	479280	for something else. That's what finalize is. But, again, we shouldn't use them. That's the point
479280	484640	Joshua Book is trying to make. Okay, so the first keyword finalize is we've got a very high level
484640	489200	conceptual understanding of what it is. Let's take a look at what cleaners are, which is kind of like
489200	498400	an evolution of finalizers and is perhaps a bit safer to use, even though that too should try and
498400	509120	be avoided ideally. Once again from the, so cleaner is in fact, let me open it up. It's an interface.
509520	521120	Sorry. Sorry, I meant to say cleaner is a subclass of object. I was thinking of auto-closable,
521120	528640	which is an interface. We'll talk about that later on. And the definitions for the cleaner is,
528640	536720	again, by the Oracle docs. Cleaner manages a set of object references and corresponding cleaning
536720	542400	actions. Cleaning actions are registered to run after the cleaner is notified that the object has
542400	547680	become phantom reachable. So what is phantom reachable? I did discuss this in the previous
549040	554160	item, item number seven. I'm not going to go into too much detail, because you could just
554160	561040	watch that video. But phantom reachable is when an object has no strong soft or weak references,
561600	569600	but at least one phantom reference. So this kind of has to do with how the JVM algorithms,
569600	576240	or how garbage collection algorithms, decide if a certain object has to be, or can be garbage
576240	583760	collected. So basically, strong objects can never be garbage collected. And then it's sort of the,
584800	588960	there's like a cascading effect, not a cascading effect, there's like a triaging process where
588960	593280	it goes from strong, soft, weak, and then the lowest one is a phantom reference.
594000	600880	Read this document by Bialdown, which goes into detail, of course, linked to this in the
600880	605520	description too, for more context. I'm not going to go into detail because it's sort of out of
605520	610720	scope for this item. And as I've said here, these delineate when objects can be garbage
610720	617520	collected. That's what phantom references do. And with cleaners, cleaners are used when an object
617600	623600	has become phantom reachable. That's how it relates. And then another definition from
623600	632320	inside Java by Roger Riggs is, unlike a finalizer, a cleanup function holds the state needed for
632320	637280	cleanup separately from the object because we want the object to be reclaimed as soon as it is
637280	643360	unreachable. When it states, when it states reclaiming an object, what that really means is
643440	649760	freeing up memory. So we can use it for something else. The cleanup function must be able to work
649760	655200	independently from the object. It's correct. It should be able to run on a separate thread for
655200	660080	instance. And that does happen. We shall see an example. If there are any references to the object
660080	663520	from the cleanup function, it would still be reachable and could not be reclaimed.
664080	669440	Any state needed for the cleanup must be encapsulated in the cleanup function.
669920	677680	What does that mean? I believe what this means is, when the cleanup does take place, so a quick
677680	686800	peek in the code, let's say the cleanup happens. Let's say this close method. This is a bit different.
686800	693040	Ignore all this. But the state of an object should be local to the state of an object.
693520	699440	When the cleanup is taking place. I believe that's what it means. It's encapsulated within this
699440	704400	method. Ignore all this, but it's a really sub-art context, but we shall get this code a bit later.
706640	714160	Okay, now we get to the items, what Joshua Block has stated in the item in the book. And the first
714160	720400	thing is, the first thing we need to do is, we need to take a look at the state of an object.
720720	725440	And the first thing is, he's kind of talking to C++ programmers.
727360	736160	And a point he wants to make salient and very clear is that finalizers or cleaners are not
736160	744160	the same as destructors in C++. Now, obviously, because C++, I'm not a C++ programmer in any way,
744720	750080	I've probably written like 10 lines of C++ code in my life, probably a bit more than that.
750080	756320	I did do a unit, a data structure and a patterns unit back in uni, which was a, which was in C++.
757040	763840	And obviously, so because C++ doesn't have automatic memory management or garbage cleaning,
763840	771360	we need to do it ourselves, the programmer. So I believe it's done through destructors.
772240	779120	Take what I say with a great assault. Maybe they'd rather us do it. But one way it is done in C++,
779120	785760	probably the most popular way is using destructors and Joshua Block and once we make it clear
786400	792000	that cleaners and finalizers are not the same as destructors. And here's what he states.
794320	800640	Finalizers are unpredictable, often dangerous and generally unnecessary. I shall also discuss
800640	806400	that bit about them being unpredictable or non-deterministic as to why that's a huge
806400	813600	risk when programming as we go into the item. And then he states, as of Java 9,
813600	819200	this is an important point, finalizers have been deprecated, but they are still being used by the
819200	826800	Java libraries. The Java 9 replacement for finalizers is cleaners. Cleaners are less dangerous
826800	833040	than finalizers, but still unpredictable, slow and generally unnecessary. So this, which is why
833040	839600	we should be avoiding avoiding old finalizers and cleaners. So despite having the caveat that
839600	846080	finalizers and cleaners aren't the same as destructors, he states, or he continues,
846080	854320	C++ destructors are also used to reclaim other non-memory resources. In Java,
854320	860720	a try with resources or try finally block is used for this purpose. And then he continues,
860720	866000	one shortcoming of finalizers and cleaners is that there's no guarantee they'll be executed
866000	869520	promptly. Yes, before I read that, I need to go through the notes that I took down.
871680	875680	So I had to go through the code base a bit and read up again, because I wrote this a while back
875680	881360	and I've forgotten some bits as to how it's all going to come together. In fact,
882320	889040	by my struggle to demo this, to demonstrate this problem, is in many ways the point
889040	893680	Joshua Block is trying to make that it is non-deterministic. I can't exactly show the problem
893680	899040	with finalizers because due to it's, it's not deterministic. And in programming, you'd expect
899040	906320	code to be deterministic and causal. The big problem with using cleaners and finalizers is
906320	912640	firstly that we aren't sure when the garbage collection will take place. We don't, we aren't
912640	922000	sure when the, when GC will run and JVM can do it, which will be anytime it wants. Even though
922000	928400	it is possible, as I will show in a bit, for us to explicitly run a GC or a garbage collection
928400	933520	cycle, it is not, it's ill-advised. One shouldn't, one shouldn't do this. There are many other side
933520	942560	effects that can affect the program. And it's possible that the finalizer thread, so the thread
942640	948800	where the closing of the objects taking place can be of low priority that can lead to an
948800	952640	out-of-memory error. Because some other threads would run, take up all the memory and when this
952640	959120	thread runs, that can throw an out-of-memory error. Even, and then there's again another caveat that
959120	966640	cleaners in fact do run in the background. And the garbage collection is controlled by the class
966640	972720	itself. The class owns that garbage collection. However, there still is a problem of it not
972720	978640	being, of it not running promptly. Sorry, I made a mistake there. The garbage collection doesn't
978640	984960	have, sorry, the class doesn't have control of the garbage collection, but it has control of its
984960	992240	own threads, which we shall see because we use a runnable interface. And nevertheless, it still
992240	1001840	does not guarantee the promptness. And due to the non-determinism in both cleaners and finalizers.
1001840	1008880	Now I'll quickly show what the hell finalizer even is, because there isn't really a proper example
1008880	1015600	given in the book. I found an example courtesy of Byle Dunn. But before I show the code base,
1016160	1023920	let's go through some something a bit more, let's say, clear. And I try to be a bit more
1024880	1029600	explicit as to what Joshua Block has written here, because I think I didn't do a good job at
1029600	1036800	explaining that. Here's what he states. One shortcoming of finalizers and cleaners is that
1036800	1041440	there is no guarantee they'll be executed promptly. It can take arbitrarily a little
1041440	1047120	between the time that an object becomes unreachable and the time its finalizers or cleaners run.
1048640	1054080	This means that you should never do anything time critical in a finalizer or cleaner.
1057040	1063600	The promptness with which finalizes and cleaners executed is primarily a function of the garbage
1063600	1067920	collection algorithm, which varies widely across implementations.
1071680	1079040	So what does that mean? The thing is, even after the finalizer runs, a GC still has to run in the
1079040	1085280	background, clear up resources, clear up memory. But before we get to the idea of the promptness,
1085280	1090640	let's take a look at what the hell a finalizer even is. So I was going through this example,
1091360	1095280	as I said, courtesy of Violet Dung, and let me try to open up that
1097520	1101440	article if I could find it. This one right here.
1103680	1109040	It was this article that he wrote, and he's just given a background as to what finalizers are.
1109680	1115120	Even though in the article S it goes, it does say why you shouldn't use it. It talks about
1116080	1120160	why we should take care of garbage collection, because JVM knows better, in fact.
1122960	1128720	And I have this class called Finalizable, and I have an instance, a buffered read instance.
1130160	1137120	And then the constructor, what I'm doing is reading a file, getting an input stream, and then
1137200	1143760	saving a new buffered read instance in this private variable of declared,
1144880	1152800	class variable of declared here. And it does specify from the specified class part,
1153440	1160720	from some nature quotes. And here we have a method called ReadFirstLine, which reads from the first
1160720	1169280	line. So if this works as expected, it should read without music, life would be a mistake
1169280	1178320	by Mr. Nietzsche, and I very much agree. And then once we have this instance created, we need to
1178320	1184400	clean it. We need to finalize it. And here's where, sorry, we need to close it, apologies.
1184400	1188320	And here's where the problem occurs. Now, once we have this reader, the buffered instance reader,
1188400	1192720	which we declared here, it's used, we do the reading, whatever, and then it's used,
1192720	1197120	and then we're done with it. We need to use a finalized method, which, as you can see,
1197120	1201120	is deprecated. The IntelliJ does specify that, that is deprecated.
1204000	1210960	It needs to be closed, which implies that the method was called, and it has to clean up the
1210960	1220400	resource. So in this finalize method, it'll close the resource. And now when I run the unit test,
1220400	1227840	you will say it'll say closed buffered reader in the finalizer. If not, it'll just throw an error.
1229760	1231440	If I go to the unit test that I wrote,
1231520	1241680	and if I run this, you can see it's printing that line here. I could probably zoom into that
1241680	1248800	a little bit. Closed buffer reader in the finalizer. Really, that's what a finalizer does,
1248800	1254960	even though we shouldn't use it. And yeah, over here, you can go through the code later on.
1254960	1259760	I'm just checking if it's printing the first line. That's not pertinent to the point I'm trying to
1259760	1266640	make. And then this is important, though, because the GC is rather arbitrary. Well, it's not arbitrary,
1266640	1271920	but we don't have really control of when garbage collection will take place. The JVM does that.
1272640	1279840	We're using a system.gc, but it shouldn't be invoked this explicitly. This is not something we should
1279840	1287920	do, again, due to its non-deterministic behavior. So you probably can see it's like a theme that's
1287920	1294560	going to be in this whole item. The big problem with cleaners and finalizers is non-determinism,
1295360	1302320	and it's the fact that it's tardy. It's tardiness that's not prompt, which is why Joshua Block states,
1302320	1310000	as we continue, tardy finalization is not just a theoretical problem. Providing a finalizer
1310000	1315360	for a class can arbitrarily delay reclamation of its instances. And that's a problem.
1316320	1323440	The language specification makes no guarantees, sorry, I'll read that again.
1323440	1329840	The language specification makes no guarantees as to which thread will execute finalizers as there is
1329840	1336640	no portable way to prevent this sort of problem other than to refrain from using finalizers.
1337600	1343120	And then, of course, as I stated, unlike finalizers, we still can use cleaners. Cleaners
1343120	1350320	aren't deprecated yet. And they would give us control of the thread, of the class that's using it.
1351120	1356720	But still, ultimately, the garbage collection, we still have no control. The JVM has control,
1356720	1362160	which is probably why we should avoid using cleaners too. As he states here, as a consequence,
1362160	1368320	you should never depend on a finalizer or cleaner to update persistence state. That's correct if
1368320	1373680	it's like a database connection or something that requires persistence. For example, depending on
1373680	1379920	a finalizer or cleaner to release a persistent lock on a shared resource such as a database is a
1379920	1387120	good way to bring your entire distributed system to a grinding halt. Oh, that is something you
1387680	1395120	certainly don't need. Programming is easy. It's really easy. It only gets complicated once it
1395120	1403920	becomes distributed programming and when concurrency gets involved. And that's why I have a beautiful
1403920	1410160	gift of my favorite actress, Margaret Robbie, probably the most beautiful woman in the world,
1411440	1416560	after a certain other woman that I'm currently in love with. But we shall not talk about that.
1418640	1423600	Don't be seduced. That's the point I'm trying to make. Do not be seduced by Margaret Robbie,
1423600	1433760	nor be seduced by the methods system.gc or system.run finalization. So, which is why,
1433760	1439680	just to go back to the unit as before, I said it here, one shouldn't do this. This is a bad move.
1439680	1446160	This, try and prevent, try and, yeah, try and prevent using system.gc in your code,
1447120	1451600	again, due to its non-determinism, because both of these, the garbage collection and
1452400	1457280	what runs the finalization method makes no guarantee that they'll actually get executed.
1459040	1464240	And in fact, these two methods run finalize their own exit, which are two other methods
1464240	1470400	that can be, that pertains to finalizes have been deprecated because they aren't safe.
1470400	1474880	Another red flag, especially if you're an API designer and aren't all programmers
1474880	1482800	designing APIs these days, is that finalizes ignore uncaught exceptions and doesn't notify the client
1483520	1489680	what the hell is going on if you do use a finalizer and there's a corrupt object. So, for instance,
1491440	1497040	let's say we have an object in corrupt state due to the non-deterministic arbitrary behavior of
1497040	1502080	a finalizer. Let's say we have an object that isn't fully cleaned up or an object that shouldn't be
1502080	1511840	accessed by another thread. When the object crashes, this thread will not be terminated by a finalizer,
1511840	1518080	whereas a JVM would certainly do that. It would make sure that if a thread crashes,
1518080	1523280	if some competition goes wrong somewhere and some error is thrown, it's physically clear and explicit
1524240	1529280	to a user of an API and it would be terminated and cleaned up.
1531200	1541360	This is a problem because if you do use finalizer, it'll allow objects in a corrupt state to be
1541360	1549280	accessed by a client of an API, which is why, again, he states, another problem with finalizes is that
1549280	1556400	an uncaught exception thrown during finalization is ignored and finalization of that object terminates.
1558000	1560800	Uncaught exceptions can leave other objects in a corrupt state,
1561680	1565600	but when an object is left in a corrupt state and an exception is thrown,
1565600	1570160	generally you'd see that exception in the stack trace. With finalizers, there wouldn't be that and,
1570160	1577840	in fact, he says it won't even print a warning. But, however, with cleaners, it's on an issue because
1577840	1584880	with cleaners, the library or a class for all intents and purposes using a cleaner has control
1584880	1590320	of its thread, so the class itself can throw this exception. So it's a bit safer than using finalizers
1590880	1597920	even though the item as a whole states avoid both. The other issue is performance penalty.
1597920	1602480	Finalizers inhibit efficient garbage collection because we are trying to manoeuvre do the
1602480	1608000	garbage collection instead of letting the JVM do it. And even though cleaners are still faster
