start	end	text
1422220	1427340	your cache with you you just get the defaults for all your your commands uh unless you you know and
1427340	1433340	that's it's up to you to kind of decide whether you want to implement uh your bonzai tree command
1434460	1439820	using config uh so which you know can use a centralized config by the way one config for an
1439820	1449260	entire monolith um and because you know you're able to like drill down and versus um you know having
1449260	1454620	having cached variables that are that are that are there now you know the amount of time it takes
1454620	1461100	to read from those variables and all that stuff is so infinitesimally small that it's it's not an
1461100	1466140	issue it's not an issue it might have been an issue in 1976 but it's you know it's not anymore
1467180	1471900	so so that's that's what that's about um that's really all I have to say about that so I I encourage
1471900	1479500	people to um to play around and if you discover a a stateful root of node tree uh root of command
1480300	1488060	some somewhere um let me know and we can you know put these together I'd like I'd really
1488060	1494940	like to kind of see how the world is waking up and throwing get out out thank god uh you know
1494940	1502300	dashes be damned uh you know I the other great thing about this is that these interfaces that
1502300	1510060	we're building can easily be spoken if you pick words that are real if you I've tested this on my
1510060	1515260	on my pixel my google pixel with natural language so I mean people people are already using command
1515260	1522060	lines we have like sales people using command lines because they're using uh slack right so
1522060	1526620	somebody writes a slack bot or a twitch bot and you know maybe they put an exclamation point in
1526620	1532300	front of it but they put a bot in there and then the bot is is processing natural you know
1532300	1538540	is processing these messages all the time and those messages are real so so the more realistic
1538540	1542620	and and human that we make our interfaces is simpler we make them without all the dashes you
1542620	1546780	can never do this with get off right but but if we actually move to a stateful root of node tree
1546780	1553660	command kind of situation all of our commands on the command line can be directly implemented
1553660	1560140	as bot commands with no modification and now you can go into your favorite chat app and slack
1560140	1567260	or a twitch or whatever and you can speak your commands to the thing and that is really the
1567260	1572780	future now you don't need a full blown machine learning algorithm to to process every possible
1572780	1578380	thing here you just need the definition of a domain specific language so that you can tell
1578460	1583660	your bot or your system or whatever about it and then do it alexa's already doing this
1584220	1587900	series already doing this they already have gotten in fact if you go out if you've ever written on
1587900	1593580	alexa uh conversational command i was really into conversational ui for a long time about four years
1593580	1600380	ago i created a thing called skeezix and and sabah which is conversational assistant virtual agent
1600380	1604700	but i that's i haven't gotten anywhere without since then but i do believe that the future is
1604700	1609660	going to be conversational interfaces so the more we can start using stateful rooted tree
1609660	1614060	node tree commands the the closer we're going to get to conversational interactions with our
1614060	1620780	computer i systems to those you know sci-fi's in the 1970s that we saw where people were talking
1620780	1626780	to the computers and telling them what to do until we create conversation until we get to the point
1626780	1633980	where we're getting rid of get ops i can run an ip command by speaking it into my command line if i
1633980	1646300	had a voice interface i can do it i can't do that with gpg imagine that example i i want to create a
1646300	1651820	new gpg key right or i want to encrypt something with gpg can i speak the command to my computer
1651820	1657820	at this moment and have it work no but i could if i wanted to look up the current ip address for
1657820	1662620	for a specific ethernet configuration assuming my conversational interface let me spell out you
1662620	1667500	know individual um ethernet ids which would be great if some of the conversation the uis would
1667500	1671740	start to allow that if they would have a keyword that said spell blah blah blah or whatever we
1671740	1677260	could actually start doing that and then then we can start using our fancy microphones to write code
1678540	1683020	or to interact with these systems and we will not ever be able to do that until the world wakes up
1683020	1689820	as it has been and starts using stateful rooted node node node command trees or if you wish just
1689820	1695100	natural language command line uis which is what it is i mean i kind of think that's probably the
1695100	1699180	better way to say it we should start being we should start to use natural language command
1699180	1706700	line uis and maybe that means that we put you know we make certain words optional maybe maybe we do
1706700	1710380	maybe we say if somebody puts an article in there or something that we you know they don't have to
1710380	1715420	talk like a robot to interact with their command line conversational ui maybe maybe we we we use
1715420	1720540	regular expressions actually that's that's what schesix and kava were they actually i i wrote an
1720540	1725980	app it's i got to go find it again but i started writing a conversational ui that used a regular
1725980	1733900	expression to match any of the root node tree commands and now that i think about it that's
1733900	1743100	probably something we could add to bonsai um the only problem with that is that uh right now the
1743100	1748300	the way that the um the node tree works you have to have a single unique you know thing through it
1748300	1756940	but if we could ever create a way to to add helper words that are ignored you know the or whatever
1756940	1763260	without going full-blown machine learning algorithm model you know or we could we could actually start
1763260	1768780	speaking in very very natural ways to our to our to our monoliths and do things like that
1768780	1773580	so and i i look forward to the day but i mean just being able to tab through something to me is like
1773580	1778620	is like plenty plenty good for now because i don't like reading about all the help and everything i
1778620	1783980	think you should be able to to immediately understand what your options are on on any command just by
1783980	1790220	hitting tab i mean if you can't do that if you have to go slog through a man page uh i mean you
1790220	1794700	should be able to see boom and see all your options and go hmm this one looks really good and you
1794700	1799980	know to cobra's cobra's credit i will tell them this i they you know if you tab tab through this
1800780	1807900	um wait that's not the one i'm thinking of um which is the one that does it there's there's uh
1809980	1817100	there's there's one oh that's not it there's there's one that uh will actually give you a
1817100	1823340	summary like a very long-winded description oh no gh there is it'll give you a long-winded description
1823420	1831100	it runs it into more and everything when you do this right um and i do find that kind of interesting
1831100	1836860	that it that it does that um the reason it's the way it's doing that is it's actually running a shell
1836860	1843500	script uh in order to get you that and that's that's a bonsai thing and that that's very
1843500	1848380	shell dependent and they have different versions for each shell and i i feel like that's nice and all
1848380	1854620	but i it's not it's definitely not portable so um but but i want to show this because it does show
1855340	1859260	how you could break down you know the the description of of what each of the things are but
1859260	1864140	i don't even think you really need that i i think you just need to be able to just do z tab tab um
1865340	1872860	and you should be able to get to look at um you know all of these different things to go
1872860	1877500	hmm well what does that one about right and then just do path help and you'll you can see the help
1877500	1883340	okay path doesn't have that path must be a uh a shortcut to something else and i actually don't
1883340	1887180	know which one it is it is a shortcut i probably should have a shortcuts command or something
1888140	1891900	that is that is something that i want to look at so i mean help here will show me
1892700	1899660	i think actually my help does show my shortcuts it does there it goes uh it does yay i did something
1899660	1908700	good so path path thing is env get path so if i were to do z env uh help and that would give me
1908700	1917340	that and you can actually do help help help help on being repressed um so so yeah you can actually
1917340	1922780	the help command uh has a bunch of sub commands and it does its own parsing of the thing so i mean
1922780	1927740	that's all that's all i have for this youtube video but but i encourage you as i said to to
1927740	1932220	consider you know making human friendly interfaces at the end of the day that's what we're talking
1932220	1937580	about and human friendly these days means conversational and that in this case means you
1937580	1945100	know a stateful commentary uh and and i'm going to just shorten it i'm going to say stateful
1945100	1953500	commentaries uh and there we made up a new term let me know what you think in the comments below
1953500	1959260	am i youtubey enough yet
