start	end	text
1394320	1400000	but you'll be quickly annoyed with that option since, as I said, they have a built-in time limit.
1400000	1406320	So, pro tip, get yourself some 675 hearing aid batteries. They're about the same thickness as
1406320	1411840	the PX625 battery this camera is designed to take, and although they're not the right diameter,
1411840	1417040	a simple loop of wire insulation will center it well enough. You may need to bend the camera's
1417040	1421520	negative tab up slightly, but this simple modification allows you to use batteries you
1421520	1426800	can buy at Walmart for about a buck a piece. And as a happy accident, the battery compartment
1426800	1432240	cover has a couple of holes allowing air in, but they're small enough that in my experience,
1432320	1437520	a battery will last a good couple of months before it's dead. You might also have asked,
1437520	1443520	where is the meter's display, and how is it lit? You can see it in the viewfinder quite clearly,
1443520	1450320	but when you remove the viewfinder, you find just a blank hole where it was. Well, the meter is actually
1450320	1456880	right here. It's tiny, and this piece of translucent plastic up here is what illuminates it.
1457440	1461680	Old cameras are filled with all these clever intricate mechanisms. I mean,
1461680	1466640	think about the linkage connecting the shutter speed dial to the tiny little indicator in the meter.
1467680	1472480	It's amazing. Oh, and you could purchase a different viewfinder, which had its own battery and
1472480	1476720	light source for the meter, but this was never really super useful since the meter doesn't
1476720	1481520	work in low light anyway. For outdoor photography, that little window works surprisingly well.
1482240	1488640	Speaking of, did you notice the off position of the meter is also marked flash? How does that work?
1489360	1495200	Well, it doesn't. Remember, there's no automatic anything, and when this camera was made,
1495200	1500320	you'd use a chart on your flash itself to set exposure correctly based on film speed and
1500320	1506560	distance to the subject. Oh, and that's why the shutter speed 60 is marked in orange. That's the
1506560	1512400	flash synchronization speed of this camera or the fastest shutter speed where the entire shutter is
1512400	1517760	open at once and thus suitable for use with the flash. Since this camera's shutter curtain moves
1517760	1523280	horizontally, its shutter is pretty slow, and you can see even with the smartphone's slow-mo
1523280	1529280	that any speed above 60 doesn't expose the film all at once. This can actually create distortion
1529280	1535600	in certain scenarios. So in a funny way, this old camera has a rolling shutter. Go figure.
1536240	1542240	The shutter mechanism alone is just incredibly intricate and also fascinating. I mean, the
1542240	1548000	curtains themselves are made of titanium, and they're flexible. They roll up into these little
1548000	1553520	compartments here and move as one unit when you cock the shutter and advance the film. You can
1553520	1559600	see the seam right here. But with the press of just one button, they move apart and come back
1559600	1566480	together with precise control in a fraction of a second. All done entirely mechanically. Amazing.
1567280	1571600	This little thing here is the old style flash hookup, though up here in the film rewinder is
1571600	1577360	an older style of hot shoe. These little contacts here, along with those inside the plug, are bridged
1577360	1583520	right when the shutter is entirely open, signaling an electronic flash to flash. But anyway, now
1583520	1587840	we're getting well into the nitty gritty, which we'll save for later. I hope you enjoyed this
1587840	1593360	look into the old fashioned light metering systems of yesteryear. While it's fundamentally very
1593360	1599840	simple, a lot of ingenuity was built in to make it usable, intuitive, and flexible. But we've just
1599840	1605200	scratched the surface on how this camera takes pictures. What about the film itself? How does
1605200	1611360	that store an image? And what about film development? How do film negatives become printed photographs?
1612000	1618080	Oh, don't worry. There's a lot more to explore with analog photography. And before long,
1618080	1620240	we'll get there. See you in the dark room.
1624160	1630160	Single lens reflex also so- I'll race, screw it up. And it's great because I have to retake the
1630160	1637520	other line too. I don't like how I said fundamental. I forgot I need to open that. The more constricted
1637520	1642880	that opening becomes, thus the less light, less light. That means that more of the image is in
1642880	1648720	focus at once, much to the chagrin of bokeh fans. But a higher F, oh, dang it. Yeah, I forgot.
1649440	1658400	Forgot the delivery. So, so, we'll move it over there. How about that? But nobody ever did,
1659600	1666640	nobody ever did believe. It's going so well. But in 1974, the International Standards Association
1666640	1670640	said, organization. Dang it.
