start	end	text
4239420	4241620	But that doesn't mean the,
4241620	4243380	I'm standing in front of you telling you this
4243380	4247420	is the thing that people are excited about.
4247420	4249060	And that's why they want to be there,
4249060	4250900	primarily why they want to be there.
4250900	4254420	So to me, that's what COVID has forced us to deal with,
4254460	4257100	even though I think we're still all in deep denial about it
4257100	4259980	and hoping that it'll go back to that.
4259980	4261580	And I think about 85% of it will.
4261580	4263460	We'll be able to pretend that that's really the way it is,
4263460	4265380	again, and we'll forget the lessons of this.
4265380	4267540	But technically what will come out of it,
4267540	4269100	or technologically what will come out of it,
4269100	4272740	is a way of providing a more dispersed experience
4272740	4275420	through online education and these kinds of remote things
4275420	4276260	that we've learned.
4276260	4279100	And we'll have to come up with new ways to engage them
4279100	4280580	in the experience of college,
4280580	4282100	which includes not just the parties
4282100	4283620	or the whatever kids do,
4283620	4286580	but the learning part of it so that they actually come out
4286580	4288140	four or five or six years later
4288140	4290900	with having actually learned something.
4290900	4294100	So I think the world will be radically different afterwards.
4294100	4296220	And I think technology will matter for that,
4296220	4298460	just not in the way that the people
4298460	4300700	who were building the technology originally
4300700	4302140	imagined it would be.
4302140	4305260	And I think this would have been true even without COVID,
4305260	4307820	but COVID has accelerated that reality.
4307820	4310180	So it's happening in two or three years or five years
4310180	4312180	as opposed to 10 or 15.
4312180	4315380	That was an amazing answer that I did not understand.
4316220	4318180	So it was passionate and meaningful.
4318180	4319180	Shots fired.
4319180	4320380	But I don't know, I just didn't,
4320380	4321460	no, I'm not trying to criticize it.
4321460	4323260	I think I don't think I'm getting it.
4323260	4325460	So you mentioned disaggregation.
4325460	4326420	So what's that?
4326420	4329500	Well, so the power of technology
4329500	4331620	that if you go on the West Coast and hang out long enough
4331620	4333620	is all about we're gonna disaggregate these things together,
4333620	4335940	the books from the bookstore, that kind of a thing.
4335940	4337860	And then suddenly Amazon controls the universe,
4337860	4339540	and technology is a disruptor.
4339540	4340860	And people have been predicting that
4341460	4342900	for a higher education for a long time,
4342900	4343740	but certainly in the...
4343740	4345660	So is this the sort of idea like
4346740	4350180	students can aggregate on a campus some place
4350180	4353580	and then take classes over the network anywhere?
4353580	4354940	Yeah, this is what people thought was gonna happen,
4354940	4357100	or at least people claimed it was gonna happen, right?
4357100	4358980	Because my daughter is essentially doing that now.
4358980	4361100	She's on one campus, but learning in a different campus.
4361100	4363580	Sure, and COVID makes that possible, right?
4363580	4365300	Or COVID makes that...
4365300	4366140	Legal.
4366140	4367460	All but avoidable, right?
4367460	4369500	But the idea originally was that,
4369500	4371220	you and I were gonna create this machine learning class
4371220	4372060	and it was gonna be great,
4372060	4373820	and then no one else would be the machine learning class
4373820	4374900	everyone changed, right?
4374900	4376100	That was never gonna happen,
4376100	4377460	but something like that you could see happen.
4377460	4378700	But I feel like you didn't address that.
4378700	4380820	So why is it that...
4380820	4381700	Why Q?
4381700	4382540	Why?
4382540	4384220	I don't think that will be the thing that happens.
4384220	4385340	So the college experience,
4385340	4387220	maybe I missed what the college experience was.
4387220	4390140	I thought it was peers, like people hanging around.
4390140	4391660	A large part of it is peers.
4391660	4393620	Well, it's peers and independence.
4393620	4395060	Yeah, but none of that...
4395060	4397340	You can do classes online for all of that.
4397340	4398460	No, no, no, no.
4398500	4400860	Because we're social people, right?
4400860	4402300	So one would take the classes,
4402300	4405260	that also has to be part of an experience.
4405260	4407420	It's in a context, and the context is the university.
4407420	4409660	And by the way, it actually matters
4409660	4412140	that Georgia Tech really is different from Brown.
4413340	4416180	I see, because then students can choose
4416180	4417260	the kind of experience they think
4417260	4418380	is gonna be best for them.
4418380	4420420	Okay, I think we're giving too much agency
4420420	4422540	to the students in making an informed decision.
4422540	4423380	Okay.
4423380	4425540	But yes, they will make choices
4425540	4426860	and they will have different experiences.
4426860	4428700	And some of those choices will be made for them.
4428700	4430060	Some of them will be choices they're making
4430060	4431700	because they think it's this, that, or the other.
4431700	4432780	I just don't want to say...
4432780	4433620	I don't want to give the idea...
4433620	4435140	It's not homogeneous.
4435140	4437020	Yes, it's certainly not homogeneous, right?
4437020	4439500	I mean, Georgia Tech is different from Brown.
4439500	4442340	Brown is different from pick your favorite
4442340	4444340	state school in Iowa.
4444340	4445860	Iowa State, okay?
4445860	4447980	Which I guess is my favorite state school in Iowa.
4447980	4449740	But these are all different.
4449740	4450780	They have different contexts.
4450780	4452260	And a lot of those contexts are,
4452260	4453620	they're about history, yes,
4453620	4456060	but they're also about the location of where you are.
4456060	4458300	They're about the larger group of people who are around you,
4458300	4460620	whether you're in Athens, Georgia,
4460620	4463180	and you're basically the only thing that's there
4463180	4465420	as a university, you're responsible for all the jobs,
4465420	4467180	or whether you're at Georgia State University,
4467180	4469060	which is an urban campus,
4469060	4471940	where you're surrounded by six million people
4471940	4473980	in your campus where it ends and begins in the city,
4473980	4475620	ends and begins, we don't know.
4475620	4477380	It actually matters whether you're a small campus
4477380	4478220	or a large campus.
4478220	4479060	I mean, these things matter.
4479060	4481660	Why is it that if you go to Georgia Tech,
4481660	4484940	you're forever proud of that?
4484940	4489460	And you say that to people at dinner bars and whatever.
4489460	4494460	And if you get a degree at an online university somewhere,
4496100	4499020	you don't, that's not a thing that comes up at a bar.
4499020	4499860	Well, it's funny you say that.
4499860	4502820	So the students who take our online masters
4503780	4506660	by several measures are more loyal
4506660	4507900	than the students who come on campus,
4507900	4509380	certainly for the master's degree.
4509380	4510980	The reason for that, I think,
4510980	4511900	and you'd have to ask them,
4511900	4513980	but based on my conversations with them,
4513980	4515540	I feel comfortable saying this,
4515540	4518180	is because this didn't exist before.
4518180	4519780	I mean, we talk about this online masters
4519780	4522140	and that it's reaching 11,000 students
4522140	4523060	and that's an amazing thing.
4523060	4525140	And we're admitting everyone we believe we can succeed.
4525140	4526700	We got a 60% acceptance rate.
4526700	4527900	It's amazing, right?
4527900	4529740	It's also a $6,600 degree.
4529740	4532100	The entire degree costs $6,600 or $7,000,
4532100	4533780	depending on how long you take.
4533780	4535700	Dollar degree, as opposed to the $46,000
4535700	4537940	that cost you to come on campus.
4537940	4540620	So that feels, and I can do it while I'm working full time
4540620	4542260	and I've got a family and a mortgage
4542260	4543420	and all these other things.
4543420	4546260	So it's an opportunity to do something you wanted to do
4546260	4547780	but you didn't think was possible
4547780	4550380	without giving up two years of your life
4550380	4551980	as well as all the money and everything else,
4551980	4553220	the life that you had built.
4553220	4557020	So I think we created something that's had an impact,
4557020	4559700	but importantly, we gave a set of people opportunities
4559700	4560900	they otherwise didn't feel they had.
4560900	4562940	So I think people feel very loyal about that
4562940	4564260	and my biggest piece of evidence for that
4564260	4566980	besides the surveys is that we have somewhere
4566980	4570060	north of 80 students, might be 100 at this point,
4570100	4575100	who graduated but come back in TA for this class
4575100	4576860	for basically minimum wage,
4576860	4578060	even though they're working full time
4578060	4582020	because they believe in sort of having that opportunity
4582020	4583420	and they wanna be a part of something.
4583420	4586060	Now, will generation three feel this way?
4586060	4588100	15 years from now, will people have that same sense?
4588100	4591180	I don't know, but right now, they kind of do.
4591180	4592940	And so it's not the online,
4592940	4596380	it's a matter of feeling as if you're a part of something.
4596380	4597620	We're all very tribal.
4597940	4602140	And I think there's something very tribal
4602140	4604300	about being a part of something like that.
4604300	4605900	Being on campus makes that easier.
4605900	4608260	Going through a shared experience makes that easier.
4608260	4609740	It's harder to have that shared experience
4609740	4612060	if you're alone looking at a computer screen.
4612060	4613340	We can create ways to make that.
4613340	4614340	Is it possible?
4614340	4615260	It is possible.
4615260	4618380	The question is, it still is the intuition to me.
4618380	4621460	And it was at the beginning when I saw something
4621460	4624620	like the online master's program
4624620	4628020	is that this is gonna replace universities.
4628020	4629460	And I won't replace universities, but it won't.
4629460	4631140	But like, why is it, why?
4631140	4633660	Because it's living in a different part of the ecosystem,
4633660	4634500	right?
4634500	4635700	The people who are taking it are already adults.
4635700	4638780	They've gone through their undergrad experience.
4638780	4641940	I think their goals have shifted from when they were 17.
4641940	4643460	They have other things that are going.
4643460	4645580	But it does do something really important,
4645580	4648420	something very social and very important, right?
4648420	4650260	You know this whole thing about,
4650260	4652100	don't build the sidewalks, just leave the grass
4652100	4653700	and the students or the people will walk
4653700	4655380	and you put the sidewalks where they create paths.
4655380	4656220	This is kind of a thing.
4656220	4657620	That's interesting, yeah.
4657620	4659100	Their architects apparently believe
4659100	4660780	that's the right way to do things.
4660780	4665300	The metaphor here is that we created this environment.
4665300	4668700	We didn't quite know how to think about the social aspect,
4668700	4671140	but we didn't have time to solve all,
4671140	4673140	do all the social engineering, right?
4673140	4674260	The students did it themselves.
4674260	4678420	They created these groups, like on Google+,
4678420	4680820	they were like 30-something groups created in the first year
4680860	4684300	because somebody had these Google+,
4684300	4685740	and they created these groups
4685740	4687460	and they divided up in ways that made sense.
4687460	4688340	We live in the same state
4688340	4689340	or we're working on the same things
4689340	4690620	or we have the same background or whatever,
4690620	4692140	and they created these social things.
4692140	4695660	We sent them t-shirts and we have all these great pictures
4695660	4697420	of students putting on their t-shirts
4697420	4698420	as they travel around the world.
4698420	4699380	I climbed to this mountain top,
4699380	4701340	I'm putting this t-shirt on, I'm a part of this.
4701340	4702180	They were part of them.
4702180	4704740	They created the social environment
4704740	4706820	on top of the social network and the social media
4706820	4709460	that existed to create this sense of belonging
4709460	4710580	and being a part of something.
4710580	4712780	They found a way to do it, right?
4712780	4716260	And I think they had other,
4716260	4718180	it scratched an itch that they had,
4718180	4720220	but they had scratched some of that itch
4720220	4721580	that might have required to be physically
4721580	4724500	in the same place long before, right?
4724500	4727300	So I think, yes, it's possible,
4727300	4729740	and it's more than possible, it's necessary,
4729740	4734300	but I don't think it's going to replace the university
4734300	4735260	as we know it.
4735260	4737700	The university as we know it will change,
4737700	4739260	but there's just a lot of power
4739260	4740500	and a kind of rite of passage
4740500	4741580	and kind of going off to yourself.
4741580	4743180	Now, maybe there'll be some other rite of passage
4743180	4746140	that'll happen that'll drive us somewhere else.
4746140	4751220	So the university is such a fascinating mess of things.
4751220	4754740	So just even the faculty position is a fascinating mess.
4754740	4755940	Like it doesn't make any sense.
4755940	4758380	It stabilized itself,
4758380	4762180	but like why are the world-class researchers
4762180	4765300	spending a huge amount of time,
4765300	4768060	or their time teaching and service?
4768060	4770260	Like you're doing like three jobs.
4770260	4775060	And I mean, it turns out it's maybe an accident of history
4775060	4776380	or human evolution, I don't know.
4776380	4778540	It seems like the people who are really good at teaching
4778540	4780500	are often really good at research.
4780500	4782820	There seems to be a parallel there,
4782820	4784540	but like it doesn't make any sense
4784540	4785540	that you should be doing that.
4785540	4788820	At the same time, it also doesn't seem to make sense
4788820	4792140	that your place where you party
4793940	4796420	is the same place where you go to learn calculus
4796420	4799340	or whatever, but it's a safe space.
4799340	4800580	Safe space for everything.
4800580	4802420	Yeah, relatively speaking, it's a safe space.
4802420	4805340	No, by the way, I feel the need very strongly
4805340	4807220	to point out that we are living
4807220	4809540	in a very particular weird bubble, right?
4809540	4810900	Most people don't go to college.
4810900	4812900	And by the way, the ones who do go to college,
4812900	4814380	they're not 18 years old, right?
4814380	4815540	They're like 25 or something.
4815540	4817180	I forget the numbers.
4817180	4819980	The places where we've been, where we are,
4820980	4822420	they look like whatever we think
4822420	4825540	the traditional movie version of universities are,
4825580	4827500	but for most people, it's not that way at all.
4827500	4828980	By the way, most people who drop out of college,
4828980	4831660	it's entirely for financial reasons, right?
4831660	4835380	So, you know, we were talking about a particular experience.
4836780	4840700	And so for that set of people, which is very small,
4840700	4843980	but larger than it was a decade or two or three or four,
4843980	4847220	certainly, ago, I don't think that will change.
4847220	4850500	My concern, which I think is kind of implicit
4850500	4852140	in some of these questions is that
4852140	4854420	somehow we will divide the world up further.
4855420	4857020	Into the people who get to have this experience
4857020	4859300	and get to have the network and they sort of benefit from it
4859300	4861900	and everyone else while increasingly requiring
4861900	4863140	that they have more and more credentials
4863140	4865900	in order to get a job as a barista, right?
4865900	4866980	You got to have a master's degree
4866980	4869020	in order to work at Starbucks.
4869020	4870700	We're gonna force people to do these things,
4870700	4872460	but they're not gonna get to have that experience.
4872460	4873820	And there'll be a small group of people who do,
4873820	4875700	who will continue to, you know, positive feedback,
4875700	4876940	like, et cetera, et cetera, et cetera.
4876940	4878220	I worry a lot about that,
4878220	4881500	which is why for me, and by the way,
4881500	4882940	here's an answer to your question about faculty,
4882980	4884860	which is why to me that you have to focus on
4884860	4886100	access in the mission.
4886100	4888220	I think the reason, whether it's good, bad, or strange,
4888220	4889780	I mean, I agree, it's strange.
4889780	4892220	But I think it's useful to have the faculty member,
4892220	4893900	particularly at large R1 universities
4893900	4896620	where we've all had experiences,
4896620	4901100	that you tie what they get to do
4901100	4903940	and with the fundamental mission of the university
4903940	4905100	and let the mission drive.
4905100	4907100	What I hear when I talk to faculty is
4907100	4908380	they love their PhD students
4908380	4910500	because they're creating, they're reproducing,
4910500	4911340	basically, right?
4911340	4913740	Let's them do their research and multiply.
4913740	4917380	But they understand that the mission is the undergrads,
4917380	4920420	and so they will do it without complaint, mostly,
4920420	4922500	because it's a part of the mission and why they're here,
4922500	4924180	and they have experiences with it themselves.
4924180	4927500	And it was important to get them where they were going.
4927500	4928740	The people who tend to get squeezed in that,
4928740	4930420	by the way, are the master students, right?
4930420	4932260	Who are neither the PhDs who are like us,
4932260	4934860	nor the undergrads, we have already bought into the idea
4934860	4936540	that we have to teach, though.
4936540	4938260	That's increasingly changing.
4938260	4941100	Anyway, I think tying that mission in really matters,
4941100	4944220	and it gives you a way to unify people around
4944220	4946140	making it an actual higher calling.
4946140	4948140	Education feels like more of a higher calling to me
4948140	4949740	than even research.
4950820	4953900	Because education, you cannot treat it as a hobby
4953900	4955220	if you're going to do it well.
4955220	4958420	But that's the pushback on this whole system,
4958420	4963420	is that you should, education, be a full-time job, right?
4964500	4969060	And almost like research is a distraction from that.
4969340	4971340	Although, I think most of our colleagues,
4971340	4973340	many of our colleagues would say that research is the job
4973340	4975140	and education is the distraction.
4975140	4976660	Right, but that's the beautiful dance.
4976660	4981420	It seems to be that tension in itself seems to work,
4981420	4985860	seems to bring out the best in the faculty,
4985860	4987300	or like the ones I've done.
4987300	4988340	But I will point out two things.
4988340	4989260	One thing I'm going to point out,
4989260	4990740	and the other thing I want Michael to point out,
4990740	4993540	because I think Michael is much closer to the,
4993540	4997300	to sort of the ideal professor in some sense than I am.
4997660	4999660	You're the platonic sense of a professor.
4999660	5000900	I don't know what he meant by that,
5000900	5003380	but he is a dean, so he has a different experience.
5003380	5006260	I'm giving him time to think of the profound thing
5006260	5007100	he's gonna say. That's good.
5007100	5008580	But let me point this out,
5008580	5012020	which is that we have lecturers in the college
5012020	5013940	of computing where I am.
5013940	5015700	There's 10 or 12 of them, depending on your count,
5015700	5019180	as opposed to the 90 or so tenure track faculty.
5019180	5021180	Those 10 lecturers who only teach,
5021180	5022900	well, they don't only teach, they also do service.
5022900	5026600	Some of them do research as well, but primarily they teach.
5026640	5029680	They teach 50%, over 50% of our credit hours,
5029680	5031320	and we teach everybody.
5031320	5034160	So they're doing not just,
5034160	5036360	they're doing more than eight times the work
5036360	5039000	of the tenure track faculty,
5039000	5041680	just if you're closer to nine or 10.
5041680	5043080	And that's including our grad courses, right?
5043080	5045160	So they're doing this, they're teaching more,
5045160	5047160	they're touching more than anyone,
5047160	5049560	and they're beloved for it.
5049560	5051720	So we recently had a survey, we do these alumni,
5051720	5052960	everyone does these alumni surveys,
5052960	5054320	you hire someone from the outside to do whatever,
5054320	5056000	and I was really struck by something.
5056040	5057240	I saw all these really cool numbers,
5057240	5058320	I'm not gonna talk about it,
5058320	5059960	because it's all internal, confidential stuff.
5059960	5061200	But one thing I will talk about
5061200	5063160	is there was a single question we asked our alum,
5063160	5064480	and these are people who graduated,
5064480	5065880	born in the 30s and 40s,
5065880	5068520	all the way up to people who graduated last week, right?
5069560	5070560	Well, last semester.
5070560	5071400	Okay, good.
5072520	5073360	Time flies.
5073360	5074720	Yeah, time flies.
5074720	5076440	And it was the question,
5076440	5079760	name a single person who had a strong,
5079760	5082120	positive impact on you, something like that.
5082120	5084400	I think it was special impact?
5084400	5085640	Yeah, special impact on you.
5085640	5087280	And then, so they got all the answers from people,
5087280	5089080	and they created a word cloud.
5089080	5090600	Those clear word clouds created by people
5090600	5092240	who don't do word clouds for a living,
5092240	5094800	because they had one person whose name appeared
5094800	5097920	like nine different times, like Phillip, Phil,
5097920	5099400	Dr. Phil, you know, but whatever.
5099400	5100240	But they got all this.
5100240	5102400	And I looked at it, and I noticed something really cool.
5102400	5106760	The five people from the college of computing,
5106760	5109280	I recognized, were in that cloud.
5109280	5113840	And four of them were lecturers,
5113840	5115280	the people who teach.
5115280	5117360	Two of them, relatively modern.
5117360	5119880	Both were chairs of our division of computing instruction.
5119880	5122160	One retired, one is gonna retire soon.
5122160	5126480	And the other two were lecturers I remembered from the 1980s.
5126480	5128120	Two of those four actually have-
5128120	5129760	Despite the way the fifth person was Charles.
5129760	5130600	That's not important.
5130600	5132960	The thing is, I don't tell people that.
5132960	5135240	But the two of those people are teaching awards
5135240	5136080	are named after.
5136080	5136920	Thank you, Michael.
5136920	5139720	Two of those are teaching awards are named after, right?
5139720	5141760	So when you ask students, alumni,
5141760	5144520	people who are now 60, 70 years old even,
5144520	5145360	who touch them?
5145360	5146680	They say the dean of students.
5146680	5148280	They say the big teachers who taught
5148280	5150280	the big introductory classes, they got me into it.
5150280	5152320	There's a guy named Richard Barker's on there
5152320	5155360	who's known as a great teacher.
5155360	5157000	The Phil Adler guy who,
5158520	5160080	I probably just said his last name wrong,
5160080	5161120	but I know the first name's Phil
5161120	5163120	because he kept showing up over and over again.
5163120	5163960	Famous-
5163960	5164800	Adler is what it said.
5164800	5165640	Okay, good.
5165640	5166800	But different people spelled it differently.
5166800	5167920	So he appeared multiple times.
5167920	5168760	Right.
5168880	5170520	He was a, clearly,
5170520	5173040	he was a professor in the business school,
5174200	5175840	but when you read about him,
5175840	5176680	I went to read about himself,
5176680	5177720	I was curious who he was.
5177720	5178680	It's all about his teaching
5178680	5180080	and the students that he touched, right?
5180080	5182320	So whatever it is that we're doing,
5182320	5183440	and we think we're doing that's important,
5183440	5185360	or why we think the university's function,
5185360	5187760	the people who go through it,
5187760	5189520	they remember the people who were kind to them,
5189520	5191360	the people who taught them something,
5191360	5192480	and they do remember it.
5192480	5193480	They remember it later.
5193480	5195840	I think that's important.
5195840	5197200	That's what the mission matters.
5197600	5201920	Not to completely lose track of the fundamental problem
5201920	5206920	of how do we replace the party aspect of universities.
5208120	5211360	Before we go to what makes the Platonic professor,
5213480	5214440	do you think,
5215760	5217960	what in your sense is the role of MOOCs
5217960	5220040	in this whole picture during COVID?
5221000	5224200	Are we, should we desperately be clamoring
5224200	5225920	to get back on campus?
5225920	5228960	Or is this a stable place to be for a little while?
5228960	5229800	I don't know.
5229800	5232640	I know that it's the online teaching experience
5232640	5236000	and learning experience has been really rough.
5236000	5238320	I think that people find it to be a struggle
5238320	5242040	in a way that's not a happy positive struggle.
5242040	5243160	That when you got through it,
