start	end	text
7092040	7098760	ethical for? So I think when we talk about ethics and AI, we need to go beyond the insane bias
7098760	7104600	discussions and so on, where people are just measuring the distance between a statistic to their
7104600	7111080	preferred current world model. But the optimism, I was a little confused by the previous thing,
7111080	7122840	just to clarify, there is a kind of underlying morality to having an optimism that human
7122840	7128680	civilization will persist for longer than 100 years. I think a lot of people believe
7130040	7134280	that it's a good thing for us to keep living. Yeah, of course. And thriving.
7134280	7139560	This morality itself is not an end to itself. It's instrumental to people living in 100 years
7139560	7147240	from now, or 500 years from now. So it's only justifiable if you actually think that it will
7147240	7152440	lead to people or increase the probability of people being arrived in that time frame.
7152440	7155880	And a lot of people don't actually believe that, at least not actively.
7156840	7162280	But I believe what exactly? Most people don't believe that they can afford to act on such a
7162280	7167560	model. Basically, what happens in the US is I think that the healthcare system is for a lot of
7167560	7171480	people no longer sustainable, which means that if they need the help of the healthcare system,
7171480	7176840	they're often not able to afford it. And when they cannot help it, they are often going bankrupt.
7176840	7181560	It's I think the leading course of personal bankruptcy in the US is the healthcare system.
7182680	7187720	And that would not be necessary. It's not because people are consuming more and more
7187720	7192520	medical services and are achieving a much, much longer life as a result. That's not actually the
7192520	7196840	story that is happening, because you can compare it to other countries. And life expectancy in
7196840	7201000	the US is currently not increasing. And it's not as high as in all the other industrialized
7201000	7205560	countries. So some industrialized countries are doing better with a much cheaper healthcare system.
7206200	7212760	And what you can see is, for instance, administrative bloat, the healthcare system has
7212760	7219400	maybe to some degree deliberately set up as a job placement program to allow people to continue
7219400	7226600	living in middle class existence, despite not having a useful use case in productivity.
7226600	7231880	So they are being paid to push paper around. And the number of administrators in the healthcare
7231880	7236360	system has been increasing much faster than the number of practitioners. And this is something
7236360	7241640	that you have to pay for, right? And also the revenues that are being generated in the healthcare
7241640	7246280	system are relatively large, and somebody has to pay for them. And the result why they are so
7246280	7252120	large is because market mechanisms are not working. The FDA is largely not protecting
7252120	7258760	people from malpractice of healthcare providers. The FDA is protecting healthcare providers from
7258760	7264680	competition. So this is a thing that it has to do with values. And this is not because people
7264680	7270680	are malicious on all levels. It's because they are not incentivized to act on a greater whole on
7270680	7275320	this idea that you treat somebody who comes to you as a patient like you would treat a family
7275320	7280440	member. Yeah, but we're trying. I mean, you're highlighting a lot of the flaws of the different
7280520	7285080	institutions, the systems we're operating under. But I think there's a continued throughout history
7285880	7291720	mechanism design of trying to design incentives in such a way that these systems behave better and
7291720	7297320	better and better. I mean, it's a very difficult thing to operate a society of hundreds of millions
7297320	7304920	of people effectively with. Yes. Do we live in a society that is ever-correcting? Do we observe
7304920	7310280	that our models of what we are doing are predictive of the future? And when they are not,
7310280	7315880	we improve them. Our laws are adjudicated with clauses that you put into every law,
7315880	7319960	what is meant to be achieved by that law, and the law will be automatically repealed
7319960	7324200	if it's not achieving that. If you are optimizing your own laws, if you're writing your own source
7324200	7329320	code, you probably make an estimate of what is this thing that's currently wrong in my life?
7329320	7334200	What is it that I should change about my own policies? What is the expected outcome? And
7334200	7339240	if that outcome doesn't manifest, I will change the policy back, right? Or I would change it to
7339240	7343880	do something different. Are we doing this on a societal level? I think so. I think it's easy
7343880	7350360	to sort of highlight the... I think we're doing it in the way that I operate my current life. I
7350360	7356120	didn't sleep much last night. You would say that Lex, the way you need to operate your life is you
7356120	7361320	need to always get sleep. The fact that you didn't sleep last night is totally the wrong way to
7361320	7367640	operate in your life. Like, you should have gotten all your shit done in time and gotten to sleep
7367640	7372520	because sleep is very important for health. And you're highlighting, look, this person is not sleeping.
7372520	7379560	Look, the medical, the healthcare system is operating... But the point is we just... It seems
7379560	7384520	like this is the way, especially in the capitalist society, we operate... We keep running into trouble
7384520	7390120	and last minute, we try to get our way out through innovation. And it seems to work.
7391000	7395880	You have a lot of people that ultimately are trying to build a better world and get
7396680	7403400	urgency about them when it's... The problem becomes more and more imminent. And that's
7403400	7410360	the way this operates. But if you look at the history, the long arc of history, it seems like
7410360	7416920	that operating on deadlines produces progress and builds better and better systems.
7416920	7423960	You probably agree with me that the US should have engaged in mass production in January 2020
7424520	7430920	and that we should have shut down the airports early on and that we should have made it mandatory
7430920	7437880	that the people that work in nursery homes are living on campus rather than living at home
7437880	7443240	and then coming in and infecting people in the nursing homes that had no immune response to COVID.
7443880	7449400	And that is something that was, I think, visible back then. The correct decisions haven't been
7449400	7454520	made. We would have the same situation again. How do we know that these wrong decisions are not
7454520	7459240	being made again? Have the people that made the decisions to not protect the nursing homes been
7459240	7465720	punished? Have the people that made the wrong decisions with respect to testing that prevented
7465720	7470840	the development of testing by startup companies and the importing of tests from countries that
7470840	7475160	already had them? Have these people been held responsible? Yeah, but first of all, so what do
7475160	7481160	you want to put before the firing squad? I think they are. No, just make sure that this doesn't
7481160	7487480	happen again. No, but it's not that, yes, they're being held responsible by many voices by people
7487480	7493480	being frustrated. There's new leaders being born now. They're going to see rise to the top in 10
7493480	7501160	years. This moves slower than there's obviously a lot of older incompetence and bureaucracy
7501160	7508840	in these systems move slowly. They move like science one depth at a time. So yes, I think
7509560	7515480	the pain has been felt in the previous year is reverberating throughout the world.
7515480	7520120	Maybe I'm getting old. I suspect that every generation in the U.S. after the war has lost
7520120	7524600	the plot even more. I don't see this development. The war of World War II?
7524600	7530360	Yes, so basically there was a time when we were modernist and in this modernist time,
7531640	7536760	the U.S. felt actively threatened by the things that happened in the world. The U.S. was worried
7536760	7545320	about possibility of failure and this imminence of possible failure led to decisions. There was
7545320	7551160	a time when the government would listen to physicists about how to do things. The physicists
7551160	7555240	were actually concerned about what the government should be doing. They would be writing letters
7555240	7560120	to the government. For instance, the decision for the Manhattan Project was something that was
7560120	7565400	driven in a conversation between physicists and the government. I don't think such a discussion
7565400	7571240	would take place today. I disagree. I think if the virus was much deadlier, we would see a very
7571240	7576360	different response. I think the virus was not sufficiently deadly. Instead, because it wasn't
7576360	7583720	very deadly, what happened is the current system started to politicize it. This is what I realized
7583720	7590760	with masks early on. They were not very quickly became not as a solution, but they became a thing
7591320	7596280	that politicians used to divide the country. The same things happened with vaccines,
7596920	7602040	so people weren't talking about solutions to this problem because I don't think the problem
7602040	7609240	was bad enough. When you talk about the war, I think our lives are too comfortable. I think
7609240	7616520	in the developed world, things are too good and we have not faced severe dangers. The
7616520	7622200	severe dangers existential threats are faced. That's when we step up on a small scale and a large
7622280	7632360	scale. That's my argument here, but I did think the virus, I was hoping that it was actually
7632360	7639800	sufficiently dangerous for us to step up because especially in the early days, it was unclear. It
7639800	7651560	still is unclear because of mutations, how bad it might be. I thought we would step up. The mask's
7651640	7659400	point is a tricky one because to me, the manufacture of masks isn't even the problem. I'm still to
7659400	7664680	this day and I was involved with a bunch of this work, have not seen good signs done on whether
7664680	7671160	masks work or not. There still has not been a large-scale study. To me, there should be large
7671160	7676360	scale studies on every possible solution, aggressive. In the same way that the vaccine
7676360	7681480	development was aggressive, there should be masks which test what kind of tests work really well.
7683880	7688840	Even the question of how the virus spreads, there should be aggressive studies on that.
7688840	7694120	To understand, I'm still, as far as I know, there's still a lot of uncertainty about that.
7694120	7701400	Nobody wants to see this as an engineering problem that needs to be solved. That I was surprised
7701400	7706280	about. I find that our views are largely convergent but not completely. I agree with
7706360	7711880	the thing that because our society in some sense perceives itself as too big to fail.
7713400	7717720	The virus did not alert people to the fact that we are facing possible failure
7718760	7723240	that basically put us into the post-modernist mode. I don't mean in a philosophical sense,
7723240	7729240	but in a societal sense. The difference between a post-modern society and the modern society is
7729240	7733560	that the modernist society has to deal with the ground tools and the post-modernist society has
7733560	7739240	to deal with appearances. Politics becomes a performance. The performance is done for an
7739240	7745480	audience and the organized audience is the media. The media evaluates itself via other media.
7745480	7750360	We have an audience of critics that evaluate themselves. I don't think it's so much the
7750360	7755640	failure of the politicians because to get in power and to stay in power, you need to be able
7755640	7761000	to deal with the published opinion. I think it goes in cycles because what's going to happen
7761560	7767320	is all of the small business owners, all the people who truly are suffering and will suffer
7767320	7773640	more because the effects of the closure of the economy and the lack of solutions to the virus,
7774200	7780760	they're going to a prize. Hopefully, this is where charismatic leaders can get the
7781400	7789880	world in trouble. Hopefully, we'll elect great leaders that will break through this
7789880	7797240	post-modernist idea of the media and the perception and the drama on Twitter and all that kind of
7797240	7803880	stuff. You know this can go either way. When the Weimar Republic was unable to deal with the
7803880	7811000	economic crisis that Germany was facing, there was an option to go back. There were people
7811000	7816760	which thought, let's get back to a constitutional monarchy and let's get this to work because
7816760	7823240	democracy doesn't work. Eventually, there was no way back. People decided there was no way back.
7823240	7828840	They needed to go forward. The only options for going forward was to become Stalinist
7828840	7836520	communists, basically an option to completely expropriate the factories and so on and nationalize
7836520	7844120	them and to reorganize Germany in communist terms and ally itself with Stalin and fascism.
7844840	7851320	Both options were obviously very bad. The one that the Germans picked led to a catastrophe
7851320	7858520	that devastated Europe. I'm not sure if the US has an immune response against that. I think that
7858520	7862760	the far-right is currently very weak in the US, but this can easily change.
7865800	7871400	Do you think from a historical perspective Hitler could have been stopped from within
7871400	7879480	Germany or from outside? It depends on who you want to focus, whether you want to focus on Stalin
7879480	7884200	or Hitler, but it feels like Hitler was the one as a political movement that could have been stopped.
7885160	7891480	I think that the point was that a lot of people wanted Hitler, so he got support from a lot of
7891480	7896280	quarters. There were a number of industrialists who supported him because they thought that the
7896280	7902040	democracy is obviously not working in unstable and you need a strongman. He was willing to play
7902040	7908680	that part. There were also people in the US who thought that Hitler would stop Stalin and would
7908680	7915560	act as a bulwark against Bolshevism, which he probably would have done at which cost.
7917560	7923480	Many of the things that he was going to do, like the Holocaust, was something where people
7923480	7928520	thought this is rhetoric. He's not actually going to do this, especially many of the Jews
7928520	7933080	themselves, which were humanists. For them, this was outside of the scope that was thinkable.
7935000	7942920	I wonder if Hitler is uniquely, I want to carefully use this term, but uniquely evil.
7944600	7952040	Hitler was never born if somebody else would come in this place. Just thinking about the
7952120	7959400	progress of history, how important are those singular figures that lead to mass destruction
7959400	7969480	and cruelty? Because my sense is, Hitler was unique. It wasn't just about the environment and
7969480	7976680	the context that gave him. Another person would not come in his place to do as destructive of
7976680	7984440	the things that he did. There was a combination of charisma, of madness, of psychopathy,
7984440	7990840	of just ego, all those things, which are very unlikely to come together in one person in the
7990840	7996760	right time. It also depends on the context of the country that you're operating in. If you
7997480	8004680	tell the Germans that they have a historical destiny in this romantic country, the effect is
8004680	8012440	probably different than it is in other countries. Stalin has killed a few more people than
8012440	8020600	Hitler did. If you look at the probability that you're survived under Stalin, Hitler killed people
8022600	8028760	if he thought they were not worth living, or if they were harmful to his racist project.
8029480	8035080	Basically, he felt that the Jews would be too cosmopolitan and would not be willing to participate
8035080	8041240	in the racist redefinition of society and the value of society and an ethno-state in this way,
8041240	8048040	as he wanted it to have it. He saw them as a harmful danger, especially since they played
8048040	8057880	such an important role in the economy and culture of Germany. Basically, he had some radical,
8057880	8065320	but rational reason to murder them. Stalin just killed everyone. The Stalinist purges were such
8065320	8073320	a random thing where he said that there is a certain possibility that this particular part
8073320	8077320	of the population has a number of German collaborators or something, and we just killed
8077320	8083800	them all. Or if you look at what Mao did, the number of people that were killed in absolute
8083800	8090360	numbers were much higher than the Mao that they were under Stalin. It's super hard to say. The
8090360	8097400	other thing is that you look at Genghis Khan and so on, how many people he killed. You see
8097400	8102040	there are a number of things that happen in human history that actually put a substantial
8102040	8109480	dent in the existing population, or Napoleon. It's very difficult to eventually measure it,
8109480	8117320	because what's happening is basically evolution on a human scale where one monkey figures out a
8117320	8124520	way to become viral and is using this viral technology to change the patterns of society
8124520	8131240	at a very large scale. What we find so abhorrent about these changes is the complexity that is
8131240	8135800	being destroyed by this. It's basically like a big fire that burns out a lot of the existing
8135800	8141640	culture and structure that existed before. Yeah, and it all just starts with one monkey,
8142520	8147400	one charismatic ape, and there's a bunch of them throughout history. Yeah, but it's in a given
8147400	8152280	environment. It's basically similar to wildfires in California. The temperature is rising,
8153160	8158360	there is less rain falling, and then suddenly a single spark can have an effect that in other
8158360	8166600	times would be contained. Okay, speaking of which, I love how we went to Hitler and Stalin from
8166600	8175400	20, 30 minutes ago, GPT-3 generating, doing programs that this is. The argument was about
8175400	8186920	morality of AI versus human. Specifically in the context of writing programs, specifically in the
8186920	8192680	context of programs that can be destructive. So running nuclear power plants or autonomous
8192680	8200600	weapons systems, for example. And I think your inclination was to say that it's not so obvious
8200600	8207880	that AI would be less moral than humans or less effective at making a world that would make humans
8207880	8215720	happy. So I'm not talking about self-directed systems that are making their own goals at
8215720	8221080	the global scale. If you just talk about the deployment of technological systems that are able
8221080	8227480	to see order and patterns and use this as control models to act on the goals that we give them,
8228280	8233080	then if we have the correct incentives to set the correct incentives for these systems,
8233080	8238760	I'm quite optimistic. So humans versus AI, let me give you an example.
8239400	8247480	Autonomous Weapon Systems. Let's say there's a city somewhere in the Middle East that has
8248280	8254920	a number of terrorists. And the question is, what's currently done with drone technologies,
8254920	8260040	you have information about the location of a particular terrorist, and you have a targeted
8260040	8265960	attack, you have a bombing of that particular building. And that's all directed by humans at
8265960	8273160	the high level strategy and also the deployment of individual bombs and missiles. Everything is
8273160	8281240	done by human except the final targeting and the spot, similar thing, like control the flight.
8282680	8291480	What if you give AI control and saying, write a program that says, here's the best information
8291480	8297080	available about the location of these five terrorists, here's the city, make sure all the
8297080	8302680	bombing you do is constrained to the city, make sure it's precision based, but you take care of
8302680	8308440	it. So you do one level of abstraction out and saying, take care of the terrorists in the city.
8309640	8316120	Which are you more comfortable with? The humans or the JavaScript GPT-3 generated code that's doing
8316120	8326440	the deployment. This is the kind of question I'm asking, is the kind of bugs that we see in human
8326440	8332440	nature, are they better or worse than the kind of bugs we see in AI? They're different bugs.
8332440	8340760	There is an issue that if people are creating an imperfect automation of a process that normally
8340760	8347480	requires a moral judgment, and this moral judgment is the reason why it cannot be automated often,
8347480	8354840	it's not because the computation is too expensive, but because the model that you give the AI is not
8354840	8359720	an adequate model of the dynamics of the world, because the AI does not understand the context
8359720	8364680	that it's operating in the right way. And this is something that already happens with Excel,
8364680	8370280	where you don't need to have an AI system to do this. If you have an automated process in place,
8370280	8375960	where humans decide using automated criteria whom to kill when, and whom to target when,
8375960	8381480	which already happens. And you have no way to get off the kill list once that happens,
8381480	8385720	once you have been targeted according to some automatic criterion by people, right,
8385720	8391560	in a bureaucracy. That is the issue. The issue is not the AI, it's the automation.
8392280	8397960	So there's something about, right, it's automation, but there's something about the,
8398840	8403640	there's a certain level of abstraction where you give control to AI to do the automation.
8404440	8410760	There's a scale that could be achieved that it feels like the scale of bug and scale mistake
8410760	8417960	and scale of destruction that could be achieved of the kind that humans cannot achieve. So AI is
8417960	8423560	much more able to destroy an entire country accidentally, versus humans. It feels like
8423560	8430360	the more civilians die as a react or suffer as a consequence of your decisions,
8431000	8435240	the more weight there is on the human mind to make that decision.
8436360	8442680	And so like it becomes more and more unlikely to make that decision for humans. For AI, it feels
8442680	8449640	like it's harder to encode that kind of weight. In a way, the AI that we're currently building
8450120	8455160	is automating statistics, right? Intelligence is the ability to make models so you can act on them
8455160	8461560	and AI is a tool to make better models. So in principle, if you're using AI wisely,
8461560	8467880	you're able to prevent more harm. And I think that the main issue is not on the side of the AI,
8467880	8472280	it's on the side of the human command hierarchy that is using technology irresponsibly.
8472280	8479000	So the question is how hard is it to encode, to properly encode the right incentives into the AI?
8479080	8484440	So for instance, there's this idea of what happens if we let our airplanes being flown
8484440	8489800	with AI systems and the neural network is a black box and so on. And it turns out our neural
8489800	8495640	networks are actually not black boxes anymore. There are function approximators losing linear
8495640	8501800	algebra, and there are performing things that we can understand. But we can also, instead of
8501800	8506040	letting the neural network fly the airplane, use the neural network to generate approval,
8506040	8511080	be correct program with a degree of accuracy of the proof that a human could not achieve.
8511800	8516920	And so we can use our AI by combining different technologies to build systems that are much
8516920	8523480	more reliable than the systems that a human being could create. And so in this sense, I would say
8523480	8531320	that if you use an early stage of technology to save labor and don't employ competent people,
8531320	8535720	but just to hack something together because you can, that is very dangerous. And if people
8535800	8540600	are acting under these incentives that they get evasive, delivering shoddy work more
8540600	8545080	cheaply using AI is less human oversight than before. That's very dangerous.
8545080	8550280	The thing is though, AI is still going to be unreliable, perhaps less so than humans,
8550280	8557480	but it'll be unreliable in novel ways. And yeah, but this is an empirical question. And it's
8557480	8563080	something that we can figure out and work with. So the issue is, do we trust the systems,
8563080	8567960	the social systems that we have in place and the social systems that we can build and maintain,
8567960	8573960	that they're able to use AI responsibly? If they can, then AI is good news. If they cannot,
8573960	8576040	then it's going to make the existing problems worse.
8577080	8581160	Well, and also who creates the AI, who controls it, who makes money from it,
8581160	8586920	because it's ultimately humans. And then you start talking about how much you trust the humans.
8586920	8591080	So the question is, what does who mean? I don't think that we have identity per se.
