start	end	text
28937820	28938940	rate of change
28942540	28950380	or the rate of change at any specific moment equal to the average
28951340	28954620	rate of change
28959820	28965740	so for example if you go on a hour long trip and you average 40 miles an hour on that trip
28966780	28971980	when were you actually driving 40 miles an hour sometimes you're driving faster sometimes you
28971980	28977900	are driving slower but when were you actually equal to the 40 miles an hour or your average
28977900	28982540	for the entire trip and this is what the mean value theorem finds for us
28986220	28987500	the mean value theorem
28989900	28991740	or sometimes called MVT
28994620	28999980	first before we can use the mean value theorem there are two requirements
29000380	29012140	that must be meant and if either of these are not true the mean value theorem does not apply
29013580	29016140	first the function must be continuous
29019500	29022300	on the range we're talking about from a to b
29024620	29028060	and second it must be differential
29030460	29035180	on that same range from a to b
29037900	29044220	if the function is continuous between two numbers and is differentiable on those two
29044220	29052540	numbers or between those two numbers then we can say that there exists
29052540	29056940	at least
29059180	29062620	one point c
29065420	29066460	that is between
29069100	29069660	a and b
29072620	29073260	such that
29073740	29084220	the derivative at that point is equal to the rate of change or the slope
29085660	29090460	the f of b minus f of a over b minus a
29096700	29100700	maybe to help us see this it might help to see it graphically what we're talking about
29103980	29107180	graphically what we're saying is
29109180	29116860	if I take a curve that goes from one point around up into another point
29117900	29124700	from a to b where we've got f of a
29124940	29135660	and f of b on the y-axis if I was to connect the point directly from a to b with a straight line
29136620	29142380	that slope is going to be my average rate of change between the two points
29143660	29151340	and what the mean value theorem states is that there is at least one point then in between them
29151340	29160300	called c where this tangent line is parallel in other words the instantaneous rate of change
29160300	29165340	at that point is the same as the average between a and b in fact you might notice that there's
29165340	29173180	two points on this graph that give us a parallel slope so maybe we could call them c1 and c2
29173180	29179740	this this graph actually has two points where the slope is equal to the average slope between
29179740	29184780	the two points that's what the mean value theorem states is that there's a point in the middle
29184780	29189740	that has the same tangent slope as the secant from a to b
29195020	29204460	so first I mentioned the requirements of the mean value theorem it's always important to check
29205100	29212060	the requirements is it differentiable is it continuous
29215020	29219020	so we could ask the question does the mean value theorem
29222460	29222940	apply
29228060	29231500	or maybe it'd be better to say when does the mean value theorem apply
29231500	29233820	let's change it to that when does
29237980	29240540	the mean value theorem apply
29243260	29251900	to y equals the square root of x squared minus x minus two
29252780	29265340	well we could take the derivative of just about any point and it's continuous at just about every
29265340	29273580	point except for one important point or one important thing what's under the square root
29273580	29280940	must always be greater than or equal to zero so what we're really saying is x squared minus x minus
29280940	29287260	two must be greater than or equal to zero for the mean value theorem to apply because that's the
29287260	29294620	only time it's actually continuous well if we factor that we get x minus two times x plus one
29294620	29300300	is greater than or equal to zero and so we find out we've got these two potential solutions of two
29300300	29305820	and negative one and we want to know when those solutions are positive specifically
29306460	29314780	so if I make a little graph here you can see we've got a zero at negative one and zero at two
29315420	29321660	it's an x squared graph so we should know it's a parabola and specifically we want the graph to be
29321660	29328380	positive we know it's positive on the left and the right but negative in the center when it's
29328380	29335660	negative in the center the graph's not continuous so the range when the mean value theorem applies
29335900	29340620	when it's actually continuous is from negative infinity to negative one
29342380	29345420	and actually we'll include the negative one because it's continuous at zero
29348780	29357180	union from two to infinity these are the points on which our
29357900	29363500	graph is positive the graph of what's under the square root is positive meaning we can actually
29363500	29369020	take the square root it's actually continuous on those points so those are the only ranges when
29369020	29379020	the mean value theorem would apply we could even ask more directly does the mean value theorem apply
29379340	29394460	to maybe y equals the natural log of 5x minus one over the interval from zero to three
29400860	29406940	well we know the domain of the natural log what's inside the natural log must be greater than zero
29406940	29413260	it can't even be equal to zero so what we need to check is 5x minus one greater than zero going to
29413260	29420140	put us outside of the range of zero to three that this problem's interested in add one
29421260	29427740	5x is greater than one divide by five x is must be greater than one fifth
29427740	29437580	so we would say no the mean value theorem does not apply apply because it is undefined
29440540	29448460	from zero to one fifth if we are just going from one to three the mean value theorem would work
29448460	29453340	because it's defined on all those points it's continuous on all those points but because
29453340	29462860	it's discontinuous from zero to one fifth the mean value theorem will not apply over the range of zero
29462860	29472460	to three let's try another one y equals e to the three x squared minus one
29473260	29486300	with e and with x squared and with multiplication and with subtraction we know the graph is
29486300	29495420	continuous there's no jumps no breaks no holes no gaps it's also differentiable on the entire graph
29496300	29500460	the derivative we'd have to use a nice little chain rule but if we took the derivative
29500460	29507180	it would be e to the three x squared minus one times the derivative of the top stuff which is 6x
29510060	29517420	and the minus one goes to zero but this is also defined on all points so there's nowhere this is
29517420	29524380	not this is discontinuous there's nowhere where this is not differentiable i didn't even give the
29524380	29530460	range but let's just give it one because i should have let's say over negative two to two definitely
29530460	29536700	between negative two and two this is all defined so we would say yes the mean value theorem is going
29536700	29544940	to apply to this function on this range which means between negative two and two the average rate of
29544940	29553340	change can be found as an instantaneous rate of change we don't know where but we definitely know
29553340	29563980	it exists okay then let's see now that we've checked the requirements let's see if we can use
29564540	29573340	the mean value theorem first we're going to do it kind of visually i want to graph
29573420	29585100	graph this function and connect the a and b and then show tangent lines
29588220	29594220	there's at least one there might be more so i'll put the s in parentheses with the same slope
29595180	29607980	so the graph we're working with is f of x equals x cubed minus 6x squared plus 8x
29614300	29620860	so let's take an x out to try and graph it gives us x squared minus 6x plus 8
29621820	29633260	continuing to factor that's x minus 2 times x minus 4 and so we have zeros at x equals 0, 2, and 4
29637900	29643580	and so we should be able to graph this before we graph this let's go ahead and figure out what the
29644540	29652380	slope is between the points between the edges i didn't even give a range let's do the range on
29652380	29665020	negative one to six so let's find f of negative one and f of six and we'll have our calculator help
29665020	29681260	with that just to make it a little quicker we have x cubed minus 6x squared plus 8x
29683100	29689980	and i'll go to my table let's delete out the values we don't want at negative one it's equal to negative 15
29690300	29695820	and at six it's equal to 48
29698460	29704780	so we had negative 15 and 48 so this graph's not going to be really to scale
29705900	29712860	but at negative one and then one two three four five six up here is going to be 48
29713660	29719660	which means we've got about negative 15 down here somewhere
29723820	29725980	we have a zero at zero
29728140	29733660	two and four we know at six it's equal to 48
29735260	29741340	and at negative one it's negative 15 so this graph's going to come in go up go down and up
29743180	29748780	but what this problem really wants us to do is connect the end points with this line
29751980	29756620	and then go ahead and just show graphically that we can draw a parallel line that's tangent
29758220	29763740	to the graph at least at one point and you notice there's two points where those lines are parallel
29763740	29767740	probably a little too steep there well too far the other direction
29767740	29774300	uh tricky there we go
29776460	29782780	parallel lines same slope tangent to the points on the graph between
29783660	29787180	our a and our b between negative one and negative six
29790940	29795340	but just doing it graphically is a little boring let's actually find the points
29795340	29799020	let's find the points
29802220	29811100	c where we get that average rate of change is equal to the instantaneous rate of change
29811100	29819020	or f prime of c the derivative at c is f of b minus f of a over b minus a
29819820	29828380	and let's go ahead and do the same function that we did up above we're going to do f of x
29829020	29837260	equals x cubed minus six x squared plus eight x on the same range of negative one comma six
29837260	29843100	and we're trying to find these black dots that we just found where are those points
29843740	29847980	that we're going to get the same slope as the average slope
29850300	29858140	well first let's find the average slope that's f of b minus f of a over b minus a
29860300	29869820	or f of six using the endpoints minus f of negative one over six minus negative one
29869820	29874860	and we just saw that f of six is equal to 48
29877340	29886860	minus f of negative one is negative 15 over six minus negative one so we have 63
29890460	29897500	over seven which is equal to a nice pretty nine
29900700	29904860	so we want to know when the derivative is going to be equal to nine
29906940	29914300	so we're going to find the derivative f of f prime of x which is three x squared
29914300	29920940	minus 12x plus eight we want to know when that's equal to the average slope or equal to nine
29920940	29928060	well we need to subtract nine from both sides to make it equal to zero three x squared minus
29928060	29936380	12x minus one equals zero and you might see that that's not going to factor very nicely
29938780	29944540	so let's see rx then using the quadratic formula is equal to 12
29945340	29951900	plus or minus the square root of 12 squared minus four times three times negative one
29952620	29957980	all over two times three and when I do that on my calculator
29960140	29964060	I'll end up with two values first if we subtract you get negative
29965020	29972460	point zero eight and four point zero eight
29974780	29982140	so my graph's not really to scale but we would have hit those slopes at negative point zero eight
29982940	29991340	and four point zero eight so I went through and made a graph that was more to scale than the one
29991340	29996860	that we had before the red curve that you see here is our function that we've been working with
29997420	30005260	and then what I did is I put a dot at negative one comma negative 15 and six comma 48 and you
30005260	30011900	can see I've connected them with this orange line then what I did is I put a purple dot here at the
30012460	30020060	first point that we had the negative point zero eight and drew a tangent line I also put a dot at
30020060	30026300	the second point that we found at four point zero eight and drew a tangent line and you see that
30026300	30032540	those blue tangent lines are perfectly parallel to the orange tangent line and what that means is
30032540	30039020	that the instantaneous rate of change at those two points on those blue lines is equal to the
30039020	30045580	average rate of change of the orange line that connects the two endpoints and that's visually
30045580	30053900	how the mean value theorem works so our two answers do work the mean value theorem is
30056140	30059740	right there on your screen the big thing we're talking about today
30059740	30065340	is that if the function is continuous and differentiable between the two endpoints
30065340	30071340	there exist at least one point C such that the instantaneous rate of change is equal to the
30071340	30076940	average rate of change or the slope between the two points take a look at the assignment and try
30076940	30084780	a few of these and we'll take a closer look at them in class the derivatives can tell us a whole
30084780	30089980	bunch about the shape of a graph of a function and that's what we're going to look at today we're
30089980	30100140	going to answer the question what do derivatives tell us
30105340	30110940	about the shape of a graph
30110940	30124220	first thing we're going to look at is what is called the first derivative test
30129660	30133500	and to kind of set up what the first derivative test does i'm going to draw a little picture here
30133740	30140780	actually three pictures three little graphs and we're going to compare what the derivative is
30140780	30151820	doing on each so here is some function f kind of curving upwards we'll have some function f
30151820	30160460	curving downwards and then we'll have a function f that comes up to a point and we're going to
30160460	30165900	be interested particularly at a point c kind of in the middle of both of the are all three of these
30166700	30173980	and what the derivative is doing at each one of those now we know the derivative is the slope of
30173980	30181980	the tangent line at that point and so if i draw my point and the tangent line for the one that's
30181980	30189180	go increasing for the one that's curving upwards you see the slope is also going upwards in other
30189180	30202540	words if the function f of x is increasing the derivative f prime of x is positive
30206060	30213180	and similarly at the point c on the curve that's decreasing or going down you'll see that the
30213180	30225500	slope of the tangent line is going downhill it is negative so we'll say that when f of x is decreasing
30228780	30233820	the derivative f prime of x is negative
30233820	30245900	now at the peak here on the third graph you'll notice that it's neither increasing or decreasing
30246700	30250220	and in fact the tangent line is completely flat
30252620	30262540	at that point so if f of x is neither increasing nor decreasing then f prime of x
30264380	30272700	is zero which is neither positive nor negative now we recognize that point
30276140	30283100	as a point when the derivative is zero we call that a critical point we already know that critical
30283100	30291660	points are where the derivative is zero it's either a maximum or a minimum value
30294460	30303820	so let's summarize that conclusion in the actual test the first derivative test
30305740	30309580	what we're going to do with the first derivative test to learn about the function
30309580	30314140	is first we're going to find all critical points
30314300	30326700	and as a reminder that's when f prime of x is equal to zero or it's undefined
30332780	30336700	once we find those points we can use those points to divide
30336860	30343900	f prime of x into subregions
30349740	30355340	and then we can test each subregion
30358620	30363500	and we'll find out where the derivative is zero that's going to be where the graph levels out
30363500	30368220	and then we'll know in between those points is the graph increasing or decreasing
30369260	30376540	based on what the derivative is doing so let's see if we can use that test with an example here
30381100	30383980	the example we're going to play with is f of x
30384140	30393820	equals x cubed minus 12x we're going to decide where is the derivative zero where is it increasing
30393820	30400700	where is it decreasing well first we have to know the derivative f prime of x is equal to
30400700	30408300	3x squared minus 12 and to find those critical points we set it equal to zero
30408540	30415820	so if i add 12 to both sats actually let's just factor it uh let's do 3 times x squared minus
30415820	30424380	four equals zero three times x plus two times x minus two equals zero so our critical points
30424380	30430060	are x equals negative two and positive two those are our critical points
30430860	30436540	then what we're going to do is we're going to divide
30438060	30445580	kind of a number line into those subregions we've got negative two and positive two
30446140	30452140	and we know at those points the derivative is zero the graph is flat at those points
30452700	30458620	so what's f prime in those regions
30461660	30466460	the easiest way to test that is we're going to go to our calculator on the calculator we're
30466460	30471980	going to hit the y equals button and type in our derivative function so we know if the derivative
30471980	30480860	is positive or negative the derivative function was 3x squared minus 12 and we'll go to our table
30481500	30488540	second table let's delete out the old values now first we need to test a point in each of
30488540	30494540	these three regions left of negative two between negative two and positive two and right of two
30495260	30498780	so left of negative two we can pick any number let's pick negative five
30500220	30506620	and we see it's a positive 63 so left of negative two the derivative is positive
30507500	30515900	what that means is that f the function left of negative two is actually increasing
30515900	30517980	because the derivative is positive
30520540	30527100	between negative two and two let's put the number zero in it's negative 12 the derivative is negative
30527100	30534220	between which means the function itself is decreasing between negative two and two
30537100	30543420	greater than two maybe pick the number positive five it's positive all we care about is the sign
30544060	30548860	and so that tells us that it is increasing over that range
30553740	30558860	now we know where the graph is increasing decreasing and then increasing again it's
30558860	30566860	giving us a general idea of the shape of the graph but there's more to the graph than just
30566860	30573580	whether it's increasing or decreasing it helps to know what direction or how it is curving
30573580	30582060	is it curving when it goes up on this left part is it curving up or is it curving
30582060	30593500	up those are two very different curves in red there we need to know what type of curve
30593500	30600620	it's doing as it's increasing and that leads us to our next topic the next thing the derivatives
30600620	30609740	tell us about the graph and this is what we call concavity now concavity might be a new
30609740	30613420	concept to us so let's set it up first with a little bit of vocabulary
30617100	30627020	the first word we need to know is what is concave up concave up means it the graph itself
30627020	30631820	appears to be rotating counterclockwise
30640220	30647900	and if you think about a general parabola starting from the left you see it rotates counterclockwise
30647900	30653580	as you draw the parabola you also could have something approaching an asymptote kind of giving
30653580	30659340	a counterclockwise rotation or even if it was increasing a counterclockwise rotation
30659980	30664300	going from left to right you're moving around the circle counterclockwise
30666300	30670860	and that kind of makes sense counterclockwise if we think about our unit circle which we're
30670860	30677980	very familiar with we count unit circles counterclockwise so that's a positive concave up
30677980	30680220	motion going counterclockwise
30685420	30690300	another way that i like to think about concave up is if i think about the parabola it looks like
30690300	30701180	the u of concave up and that reminds me that u up is concave up as you might expect the next word
30701180	30710460	is concave down and here we are rotating clockwise
30714140	30717980	or if you think about the unit circle in the negative direction if you start from the left
30718540	30725340	a negative parabola is concave down it's going clockwise around and you could also get things
30725340	30732380	approaching asymptotes in much the similar way these all are concave down
30736140	30740460	and as you might expect with calculus we're interested in when we switch between a concave
30740460	30746780	up motion and a concave down motion just like when we switch from increasing and decreasing
30746780	30753500	we have critical points with concavity when we switch between concave up and concave down
30753500	30756940	what we end up with are called inflection points
30762380	30770940	and that is where the concavity changes
30775660	30782780	for example the graph could be first concave up and then it's going to switch to concave down
30783340	30789500	right in the center there you see the rotation direction changes starts out going clockwise
30790460	30797020	or counterclockwise then it changes to clockwise the classic x cubed also let's see this one
30797020	30804380	starts out going counterclockwise and then turning it to clockwise you start concave up and then you
30804380	30811420	change to concave down in the middle those are inflection points where the concavity changes
30813740	30819580	and just like a critical point is when the derivative is equal to zero concavity can
30819580	30825100	also be found the way we find those inflection points is we look at the second derivative
30825100	30829420	f prime prime of x and see when it's zero or undefined
30829420	30842540	now concavity tells us a whole lot when it's combined with the first derivative test and
30842540	30848460	whether the graph is increasing or decreasing let's look at concavity
30849100	30853660	and increasing
30856540	30857980	decreasing relationships
30861900	30864700	and to set this up we're going to do a little tic-tac-toe board here
30870860	30876220	and we're going to look at what happens if the graph is increasing
30878620	30893500	and it's concave up if it's increasing and concave up we have to rotate counterclockwise
30895260	30897260	as we increase
30899980	30904060	contrast that with increasing and concave down
30904620	30912220	now as we are increasing we have to rotate clockwise which takes us off in the other direction
30915260	30918540	similarly we can compare what happens when we are decreasing
30921340	30928220	if we are decreasing and we're concave up as we go down we have to rotate counterclockwise
30928700	30939900	versus if it's decreasing and concave down as we rotate it has to rotate downward clockwise
30941740	30947820	so if we know both of these facts about the graph we will very quickly know the shape of the graph
30947820	30951100	and what is going on at various points
30951740	30958380	and we test for concavity
30964060	30970620	very similar to how we test the first derivative test except instead of finding critical points
30970620	30973980	first we find inflection points
30974940	30983340	and once we find those inflection points we can divide
30985740	30990700	the second derivative f prime prime of x into subregions
30995180	30999900	and again we will test each subregion
31004220	31014940	so let's take a look at just doing that test for concavity
31014940	31016940	and then we'll bring it together here in just a minute
31020460	31025660	so number four going back to that same example we had before
31026380	31032140	where f of x is equal to x cubed minus 12x
31033660	31039020	we already said the first derivative was 3x squared minus 12
31040780	31046540	the second derivative then we can quickly calculate to be 6x
31046540	31052060	and so we're going to divide the number line
31053740	31057500	into subregions based on those inflection points
31057500	31060940	based on when that second derivative equals zero
31062860	31067340	we'll divide both sides by six and x equals zero is my inflection point
31068060	31080060	and so rate at zero is where we are going to split up the f prime prime to see what's happening
31080700	31084380	where is the second derivative positive and negative
31085660	31088860	going to y equals now i'm going to clear out the second derivative
31089420	31093180	or the first derivative we'll put in the second derivative equation which is just 6x
31093420	31097900	and then go to the table to lead out what i don't need
31098780	31103100	and i might have been able to do this in my head in fact i should be able to do this one in my
31103100	31107180	head but just to show you for the more complex equations i'm going to test something to the
31107180	31113340	left of zero maybe negative five and i see the second derivative is zero is negative
