start	end	text
0	9040	In today's video, we're going to take a look at answering the big question.
9040	21360	What is calculus?
21360	36320	And really, calculus is going to be the answer to three questions.
36320	40200	The first question that we're going to attempt to answer, and we're going to focus on here
40200	55280	in chapter two, is what is it getting close to?
55280	62880	And this in calculus, we're going to affectionately call the limit.
62880	66640	The second question we're going to attempt to answer, and it's really the focus of chapter
66640	76680	three, is what is the slope?
76680	80840	Specifically what is the slope at this given point?
80840	90480	And there we're going to call that in calculus the derivative.
90480	102360	The third question we're going to attempt to answer is what is the area?
102360	107400	And we're not going to really dive into that question until we get to calc two next term,
107400	118200	but for now I'll just tell you that that is the integral of the function.
118200	136640	So to kind of set this up, we're going to take a look at first the tangent problem.
136640	159360	For the tangent problem, I want to first consider how fast these lines are changing.
159360	167000	And we really call that our rate of change.
167000	169440	So I'm going to put three graphs up here.
169440	178600	First graph is going to be y equals two-thirds x minus one.
178600	188120	And this graph, I'll have a y intercept at negative one, and it'll rise two and run three
188120	189120	to another point.
189120	193880	So it's going to look something like that.
193880	208040	The second graph we're going to look at is y equals negative three x plus two.
208040	215960	And so that graph has a y intercept at two, and it slopes down three over one, and it
215960	218440	looks like this guy.
218440	227640	And the third graph we're going to look at is y equals negative one.
227640	233320	And that's just a flat line right at negative one.
233320	237840	And the question here that we're considering is how fast are these lines changing?
237840	239600	How are these lines changing?
239600	245280	The first graph here, the two-thirds x minus one, we see it is going uphill from left to
245280	249720	right, but it's going uphill slowly.
249720	258160	It's kind of gradually working its way uphill, which is different than the second graph because
258160	263040	not only is it going downhill, but it's also going down much quicker.
263040	271280	It's going downhill quickly.
271280	275720	And that's going to be different than this third graph, which really isn't going up or
275720	276720	down.
276720	279040	It's kind of flat lined.
279040	289640	So we'll say this is a flat or no change.
289640	294200	Now what's interesting here is these lines are really easy to see how the graph is changing
294200	295520	because they're just a straight line.
295520	297240	They're always changing at the same rate.
297360	302400	A is always going up slowly, B is always going down quickly, and C is always flat without
302400	303400	any change.
303400	306600	But this is not always the case.
307480	331640	Actually, most functions do not have a constant rate of change.
331640	351720	For example, if we consider the graph, y equals x squared plus two.
351720	358240	Now y equals x squared plus two has a vertex rate at two, it's got the point at one three
358240	370840	and negative one three and then six and negative six, or I'm sorry, three six and three negative
370840	374840	three six.
374840	382560	So here is the graph of x squared plus two.
382560	392480	Now if we consider at the point zero where x is equal to zero, if I were to look at
392480	396680	that graph, it's kind of leveled out there at the bottom, we could draw a line that's
396680	401520	tangent to that point, and right now it has a slope of zero.
401520	403320	It's really not changing at that point.
403320	407400	It's not going up or down, it's kind of leveled out at the bottom.
407400	413040	It's a little different than if I consider the point that's just one to the right, because
413040	418640	at that point it's actually got a much steeper tangent line that could be drawn that barely
418640	421240	attaches it.
421240	426440	And there, the slope of that graph, it's going uphill, it's actually rising two and running
426440	427440	one.
427440	434040	If I could grab a different color, we could look at this point at negative one, or negative
434040	435440	two.
435440	441600	Looking at the point at negative two, we see it's very, very, very steep.
441600	448240	In fact, the slope there is going to be negative four, and we'll talk later about how we can
448240	450720	actually calculate those exact slopes.
450720	455800	But what's interesting here is this graph starts out with a very steep negative slope,
455800	462080	and then it levels out and turns into a positive slope, which gets steeper and steeper.
462080	481600	I've already hinted at this, but the lines that touch the graph
481600	493120	are what we're going to call tangent lines, where they touch the graph in one point and
493120	499920	then go off into the distance.
499920	506960	So the question we're going to attempt to find out is, what is the slope of these tangent
506960	510620	lines?
510620	515060	To do that, we're going to set up another thing called the secant line.
515060	531580	We can actually approximate the rate of change
531580	555180	for a tangent line with what we're going to call a secant line.
555180	560540	Here's what we mean by that.
560540	567500	So we've got some graph here, we're going to say it comes in, goes up, and levels off,
567500	574900	and right here we're going to say is A, means if we go up, this point here is going to be
574900	583740	at F of A, and then a little bit over from A is B, and if we go up from B, that point
583740	599300	right there will be at F of B. If we connect A and B with a line, that is called a secant
599300	600300	line.
600300	603500	A secant line is going to go through two points on the line.
603500	609260	In fact, we know what those two points are, let's go ahead and label those in brown.
609260	615500	The x-coordinate of this first point is A, and the y-coordinate is F of A, and the second
615500	625140	one with B, the x-coordinate is B, and the y-coordinate is F of B. If we wanted to calculate
625140	632740	the slope, which we always use M for slope, of the secant line, we know it's y2 minus
632740	635260	y1 over x2 minus x1.
635260	648940	That would be F of B minus F of A over the B minus the A. This is going to be an important
648940	656420	formula for us, the formula for the slope of the secant line.
656420	671220	What's interesting about this is as A and B get closer and closer together, let's draw
671220	692500	another graph, as A and B get close, let's see if I can draw that same graph on here approximately,
692500	702300	and if we keep A at about the same spot, and so F of A is still at the same spot, but if
702300	712100	we put B right next to it, notice it's closer now for F of B, the secant line that connects
712100	718500	them is starting to look like a tangent line that only touches in one spot.
718500	735460	In other words, as A and B get closer together, we get closer to the tangent line.
735460	740540	This is the big idea that we're going to go after today, is can we get A and B close enough
740540	752900	together so that we can estimate what is the tangent line.
752900	758020	Let's try it though with some numbers in there to make things a little clearer.
758020	772620	So let's do number four, we're going to do an example here, we're going to estimate
772620	793300	the slope and equation, while we're at it, of the tangent line to the function F of x
793300	805220	equals two x squared minus three at the point two comma five.
805220	815260	Now the idea here is we want to estimate what it is using a different x and y point
815260	822060	where we're going to try and get closer and closer and closer to our actual point of two.
822060	826980	So we know at two the y coordinates five, so we'll start kind of close to two, maybe
826980	832980	we'll start at two point one, then we'll get a little closer, two point oh one, then we'll
832980	838420	get a little closer, two point oh oh one, and then finally a little bit closer, two point
838420	843660	oh oh one, and we're going to see what y equals at each of these points.
843660	848940	We know at two it's going to hit five, but what's it going to hit as we get close to
848940	854020	two, as we pull B closer and closer to our A. Fortunately this is going to be really
854020	863500	easy to do on our calculators, so if we turn our calculators on and hit the y equals button,
863500	874700	we can type in our function in y equals, and our function is two x squared minus three.
874700	879260	Then what we're going to do is if we hit the second button, and then right above graph
879260	888540	we see in blue it says table, and we should be able to delete these values out of here.
888540	893740	If you cannot delete the values out of your table, first hit second and then above window
893740	900020	you see it says table set, and we're going to change the independent variable the x to
900020	905620	ask, so that we can pick what we want that x to be equal to.
905620	911140	Now go back to second table, and now we can enter in our values we want for x. The first
911140	918780	value we want is two point one, the second value is two point oh one, the third value
918780	929540	is two point oh one, and the third value is two point oh oh one.
929540	935500	And we start to see we get these values for y. Let's record them in our y column here.
935500	943020	That's five point eighty two, the next one was five point oh eight oh two, the next one
943020	956260	was five point oh oh eight, and then finally it was five point oh oh eight.
956260	962420	So now what we really end up with is a third column, let me label it in black here, x comma
962420	966860	y is going to be our third column, these are going to be our points that we're going to
966860	969660	be compared to the original point of two five.
969660	976500	So x comma y is two point one comma five point eighty two, then we had two point oh one comma
976500	985100	five point oh eight oh two, then we had two point oh oh one comma five point oh oh eight,
985100	994820	and then finally two point oh oh oh one comma five point oh oh oh eight.
994820	1001580	We're going to use these points and the original point, the two comma five, to calculate a
1001580	1008500	whole bunch of slopes of the secant line, and again we're going to use the calculator
1008500	1013220	to help us out with that to make some of these calculations easier.
1013220	1018420	If we hit second quit, it'll take us back to the home screen, quit is right above the
1018420	1024580	mode button, and then we're just going to type in our slope formula where the numerator
1024580	1027340	and denominator need to be in parentheses.
1027340	1033700	So the y two we calculated from the first point was five point eighty two minus the
1033700	1042100	y one was five, because we always go back to the original point, divided by the x one
1042100	1048180	from the point we found, the two point one, whoops need to put it in parentheses, two
1048180	1055100	point one minus the two, close the parentheses, and when we hit enter we find our slope right
1055100	1058220	now is eight point two.
1058220	1065080	So let's go ahead and record that, our slope right now is eight point two, but then we're
1065080	1068460	going to move a little bit closer.
1068460	1072180	Now we're going to use our second point, which is the two point oh one comma five point
1072180	1081340	oh eight oh two, again y two minus y one, so five point oh eight oh two minus the y from
1081340	1089780	our original point of five, divided by the two point oh one minus the two, again remember
1089780	1102160	numerator and denominator in parentheses, and now we have a slope of eight point oh two.
1102160	1110620	Let's try our third point, our third point was five point oh eight minus the five, divided
1110620	1119720	by the two point oh one minus the two, and now we're going to get this nice pretty eight,
1119720	1122960	our slope right now is eight.
1122960	1126080	In fact when we do it again for the third point we're going to get the exact same thing
1126080	1132300	because we are so close, the difference is going to be minuscule, five point oh oh eight
1132300	1142500	minus the five, divided by the two point oh oh one minus the two, and again we get eight
1142500	1148920	for the slope.
1148920	1157700	So we can use this fact to estimate the slope of the tangent line now.
1157700	1162500	We see the slope of the secant line is getting closer and closer to eight point oh, so the
1162500	1167740	slope of the tangent line is probably that eight point oh that we're getting closer and
1167740	1171060	closer to.
1171060	1178960	So if it is eight point oh then we're ready to actually calculate the equation at that
1178960	1183880	point, and going back to our algebra days a good equation to remember that the equation
1183880	1193720	of the line is equal to y equals m times x minus x one plus y one, where x one and y
1193720	1203340	one are a point we know that's on the line, and m is the slope.
1203340	1208580	This is a good equation to commit to memory because we are going to use this equation
1208580	1213660	a lot in this course.
1213660	1218220	So for our purposes we've got y equals m, the slope of the tangent line we just found
1218220	1224440	out was eight times x minus x one, going back to our original point the x coordinate was
1224440	1229400	two plus the y coordinate of five.
1229400	1236080	The equation of our tangent line two x squared minus three at two five is this guy y equals
1236080	1245080	eight times x minus two plus five.
1245080	1253060	We can use this concept in physics to look at what's called the average velocity and
1253060	1256820	the instantaneous velocity.
1256820	1262700	Velocity is really talking about speed, so if we're talking about the average velocity
1262700	1275880	or the average speed, speed doesn't really have direction and velocity does have direction,
1275880	1277040	it's only real different.
1277040	1298940	The average velocity of an object can be found by the velocity average is equal to the function
1298940	1306340	at the first point at the initial point of time minus the function at the final point
1306340	1311680	in time, all over the difference in the times.
1311680	1316040	And really you'll notice that this equation, while I mark it as an important equation that
1316040	1325720	we need to know for our course, it really is the same equation as the secant that we've
1325720	1327400	already worked with.
1327400	1332760	And then if that's the average velocity over an amount of time, we can find the instantaneous
1332760	1345260	velocity
1345260	1349740	or how fast the object is moving at a specific point in time instead of an average over a
1349740	1370480	range, it is found by making T2 closer to T1.
1370480	1374480	In other words, the same idea we did before, if we try closer and closer and closer numbers,
1374480	1378800	we'll get closer and closer to the actual instantaneous velocity, which is the slope
1378800	1381260	of a tangent line.
1381260	1391020	So let's try an example problem where we can see that actually done.
1391020	1415800	Let's see, an object is dropped from the top of a 144 foot cliff
1415800	1431100	and it will land three seconds later.
1431100	1434880	We can actually find the function for its height.
1434880	1450200	Its height is given by the function f of x equals negative, actually let's not do f
1450200	1454560	of x, let's make it more descriptive, we're doing height, so let's say height of T or
1454560	1466240	height of time is equal to negative 16 T squared plus 144.
1466240	1492480	We're going to find the average velocity between 2 seconds and 2.01 seconds and between 1.99
1492480	1494600	seconds and 2 seconds.
1494600	1499960	So the average velocity just after 2 seconds and the average velocity just before 2 seconds
1499960	1504120	and see what we can learn about that.
1504120	1510280	So first for the first point, I'll do this first point in blue, the average velocity,
1510280	1513560	we need to know what the height is at those two points.
1513560	1522280	So we'll say h of 2 and I'm just going to plug this into our calculator.
1522280	1534520	Negative 16 times 2 squared plus 144, when I do that on the calculator we get 80.
1534520	1543120	So the height of 2 is 80 and the height just afterwards at 2.01, again if I plug that into
1543120	1564080	my calculator, negative 16 times 2.01 squared plus 144, that's going to equal 79.3584, 79.35,
1564080	1567240	let's just round it to 8.
1567240	1573400	So the average velocity then is going to be the slope between these two points.
1573400	1586320	So the average velocity is equal to y2, which is 80, minus y1, 79.358 over the difference
1586320	1590640	in the x's, 2 minus 2.01.
1590640	1603680	The average velocity here is negative 64.2 feet per second.
1603680	1609720	So just after 2 seconds the object is moving at 64.2 feet per second, it's negative because
1609720	1611120	it's going down.
1611120	1615080	Let's see what's happening just before, we'll do this in green off to the right here so
1615080	1616600	we can keep these separate.
1616600	1623120	So we need to know what the height is at 1.99 and what the height is at 2, fortunately we
1623120	1627440	already calculated the height at 2, that's 80.
1627440	1635280	If we put the 1.99 in our calculator we'll end up with approximately 80.638, so to find
1635280	1642920	the average velocity here we'll subtract the y's divided by subtracting the x's.
1642920	1654680	So 80.638 minus 80 divided by 1.99 minus 2, and when we do this we find out the average
1654680	1665560	velocity just before 2 seconds is negative 63.8 feet per second.
1665560	1672000	And what you'll notice is both of these are really close, 0.2 away of each side of the
1672040	1694640	negative 64, so we can actually find out or estimate the instantaneous velocity
1694640	1700920	to be somewhere in the middle of these two guys, so between 64.2 and 63.8 it's probably
1700920	1707440	at 2 seconds at that exact moment in time moving approximately negative 64 feet per
1707440	1717560	second, that would be the tangent line or the instantaneous velocity.
1717560	1721280	So with this preview so far we've answered really the first two questions, we've been
1721280	1727360	looking at what is the slope or the tangent and then also what is that secant line getting
1727360	1732800	close to, let's take a look at a little preview of the third question of calculus, we won't
1732800	1736240	spend much time on this because it's really a second quarter calculus question, but the
1736240	1750960	question is what is the area, here's what that looks like in calculus.
1750960	1760480	And back to part C addressing the area problem.
1760480	1775680	We are going to consider, actually let's make this number one, consider the area under y
1775680	1791400	equals x minus three squared plus one between the x values of zero to three.
1791400	1796480	We're going to need a really tall graph for this, that shouldn't be too bad, we've got
1796480	1808800	plenty of space here, one, two, three, four, five, six, seven, eight, nine, ten, eleven.
1808800	1813200	So we know x squared is the parabola shape, the minus three moves it to the right three,
1813200	1826760	the plus one moves it up one.
1826760	1837480	So the graph is going to look something like this, and it wants the area between zero and
1837480	1845800	three, so between zero and three what we're really doing is saying what is the area that
1845800	1858680	fills in underneath the graph, what we want is the area shaded in green here, is how much
1858680	1863800	area is underneath the graph.
1863800	1871480	So we can estimate it, and the way we're going to estimate it is we're going to say, hey,
1871480	1874480	it's really easy to find the area of a rectangle.
1874480	1887360	So we can use rectangles where the right corner of the rectangle actually touches the graph
1887360	1888880	that we're talking about.
1889880	1891880	So let me see if I can recreate the graph here.
1902880	1907880	So it hits at nine, three, one.
1913880	1914880	Is that right?
1914880	1926880	It hits at ten.
1926880	1932160	So here's our graph, roughly drawn, and what we're going to do is we're going to take each
1932160	1942680	point and make it into a rectangle where the right corner of the rectangle touches the graph.
1942680	1951160	So each rectangle is one wide, and the first rectangle is one high, the second rectangle
1951160	1959680	you see is too high, and the third rectangle, I think it's five high?
1959680	1963160	Yeah, it's five high.
1963160	1974520	So we could say that the area under here is five plus two plus one, or the area is approximately
1974520	1984720	eight when we use rectangles on the right side, where the right corner hits the graph.
1984720	1988440	But we could also do it the other way because the problem here is we end up a little bit
1988440	1991640	short.
1991640	1994440	Let's use just some gray space for the short.
1994440	1999760	Notice we miss this gray triangle, and another gray triangle, and another gray triangle.
1999760	2002880	We're short because we went to the right.
2002880	2016880	So to avoid being short, we could draw rectangles that the left corner touches the graph.
2016880	2018640	And see how that compares.
2018640	2024240	So one, two, three, four, five, six, seven, eight, nine, ten, and one, two, three, four,
2024240	2025240	five.
2025240	2032920	Putting our key points on here of three, one, move over one and up one, over one and up one,
2032920	2044440	two, three, and then finally the nine.
2044440	2049800	So if I wanted to draw rectangles where the left corner touched the graph, we would start
2049800	2056320	at the top point and say, okay, come out from the left corner, and there is my first rectangle.
2056320	2061600	Then come out from the left corner, go over one unit, and there's your next.
2061600	2064520	And come out from the left, and there's our next rectangle.
2064520	2068600	And so we end up with three rectangles again.
2068600	2072080	And we can find the area of those rectangles.
2072080	2076280	The first rectangle on the left has a height of ten.
2076280	2088480	Actually, let's put, whoops, let's put, ah, wrong color.
2088480	2093480	Let's put the heights on the right here.
2093480	2097880	The height of ten, the second rectangle is a height of one, two, three, four, five, and
2097880	2102200	the third rectangle has a height of two.
2102200	2109160	So when we add those together, the area that we end up with is going to be ten plus five
2109160	2110760	plus two.
2110760	2117640	The area comes out to be approximately seventeen.
2117640	2120380	But again, we've got a problem.
2120380	2124120	Because now instead of having too little area, we end up with too much area.
2124120	2128760	We've kind of got this area that I'm going to color in in gray that sticks up above the
2128760	2131160	graph.
2131160	2136040	So the first time we were too low, the second time we're too high.
2136040	2142920	How are we going to estimate what the actual value is?
2142920	2152000	Well, we could estimate, since we're just estimating, the actual area is in the middle
2152000	2156480	of these two values.
2156480	2162720	So we could just average the eight and seventeen, eight plus seventeen divided by two.
2162720	2168520	When we do that, we get a twelve point five.
2168520	2175760	So we're going to say our final estimate is that the area underneath y equals x minus
2175760	2177960	three squared plus one between zero and three.
2177960	2181040	We're going to estimate that it's about twelve point five.
2181040	2193600	Well, as you might expect, this process is not perfect because actually the actual area
2193600	2195880	is twelve exactly.
2195880	2199400	So we've got an extra point five out of it, but that's not a bad estimate for just kind
2199400	2203840	of drawing rectangles and estimating and making a guess at it.
2203840	2209200	Now in calc two, we'll talk about some methods to find that exact area of twelve, but for
2209200	2214200	now I just want to kind of expose you, this whole lesson today is just a preview of calculus.
2214200	2221140	Just expose you to the idea of the three questions that we're going to be addressing in calculus.
2221140	2222800	What is it getting close to?
2222800	2224040	We call that a limit.
2224040	2226640	We're going to focus on that in chapter two.
2226640	2227980	What is the slope?
2227980	2232240	We call that the derivative and we'll focus on finding that in chapter three.
2232240	2234040	And then finally, what is the area?
2234040	2239040	We call that the integral and we're going to find that in calc two.
2239040	2241560	So I hope you enjoyed this preview of calculus.
2241560	2245440	Take a look at the practice problems in the book and I'll look forward to seeing you in
2245440	2248480	class.
2248480	2254360	As we dive into our study of calculus, we need to answer the first foundational question
2254360	2261600	of what is a limit?
2261600	2266080	So we're going to answer that question kind of broadly today and then a little bit later
2266080	2268600	we'll answer it more precisely.
2268600	2285880	So we're going to kind of say the intuitive definition of a limit.
2285880	2295360	So the general idea that we're going for when we say a limit, we're saying what value,
2295360	2315520	what should be there, even if it is not there?
2315520	2320520	What should be in the function, even if it's not actually in the function at that point?
