start	end	text
8951740	8955940	Another thing I see a lot of times is people put a little box and color it in, as if to
8955940	8959220	check off that it's done.
8959220	8967940	Another thing I've seen is W to the fifth, which stands for which was what we wanted.
8967940	8971860	Now acknowledge though that you've gotten to the end of the proof, QED is really nice
8971860	8976580	because it looks like you know Latin and it looks smart.
8976580	8980540	Let's do one more linear example so that we can see kind of how another similar problem
8980540	8985260	works, but every problem kind of has the same general setup.
8985260	8995140	For this example we're going to prove that the limit as x goes to negative one of x squared
8995140	9005180	plus four x plus three over x plus one is equal to two.
9005180	9010500	Like before, identifying the pieces, what x is approaching, that's my A, what's inside
9010500	9017540	the limit, that's the function, and the answer, that's my limit L.
9017540	9021260	The first line is pretty scripted of every delta epsilon proof.
9021260	9024600	We let epsilon be greater than zero.
9024600	9030360	We choose a delta that's equal to something, leave some space, we'll come back, it's going
9030360	9038160	to be the reciprocal of whatever we're multiplying delta by with an epsilon in the numerator.
9038160	9044440	Then we will assume the absolute value of x minus A, which is negative one, minus the
9044440	9055160	negative ones, the same as plus one, is less than delta.
9055160	9057880	Now the next line is where we do our algebra.
9057880	9063040	We take the absolute value of the function, which is x squared plus four x plus three
9063040	9070080	over x plus one, and subtract the limit of two, and hopefully after massaging it a bit
9070160	9075720	we end up saying this is less than epsilon.
9075720	9079720	With rational expressions, we're really comfortable with factoring to reduce, so when we factor
9079720	9086080	we get x plus three times x plus one over the x plus one, and we still have the minus
9086080	9089920	two at the end.
9089920	9096400	This is really nice because the x plus ones divide out, which leaves us with the absolute
9096400	9102360	value of x plus three minus two.
9102360	9108040	I'm going to run out of space on my next statement, so let's go ahead and use the next line and
9108040	9115040	say equals the absolute value combining like terms of x plus one.
9117960	9122760	This is actually really nice because this already is the part that's less than delta.
9122760	9125960	This time we don't have to factor anything out.
9126000	9129800	Just to keep things consistent though, I'm going to factor out a one, and say that's
9129800	9136800	one times the absolute value, because we know that delta has to be the reciprocal of that
9138960	9141600	number times epsilon.
9141600	9148100	The reciprocal of one is just one, so we have epsilon over one, or just epsilon.
9148100	9155100	Delta equals epsilon, because now I know that the x plus one is less than one.
9156560	9162440	That's from my assume statement.
9162440	9169440	X plus one is less than the delta, and we know that the delta is equal to the epsilon,
9170200	9177200	which is what we defined at the beginning, and QED, we have proven that this limit equals
9179880	9183440	two.
9183720	9188400	Linear examples, our general strategy as we work through the steps is to make delta equal
9188400	9195400	to the reciprocal of whatever is multiplied by delta.
9195400	9200160	But we can also do quadratic examples pretty nicely.
9200160	9207160	Let's do a couple of those quadratic examples.
9214220	9219880	With quadratics, what we're going to have to do is we're going to need a little bit
9219880	9225640	of help to make delta come out right, and so we're going to actually give delta two
9225640	9227360	options.
9227360	9234360	Delta is always going to be equal to the minimum of one, and epsilon divided by something.
9238840	9243080	We need that one to kind of set up what the divided by something is, and I'll show you
9243120	9247120	in just a minute, but with quadratics, when you see x squared, delta is going to be the
9247120	9254120	minimum of one and the reciprocal, again, of what's being multiplied by delta.
9256320	9263320	So let's see if we can prove that the limit as x approaches two of x squared minus three
9264320	9271320	x is equal to negative two.
9275080	9282080	Again, x is approaching our a value, the function is what's inside the limit, and l, the limit
9282360	9289360	is the answer, and we start filling in our proof structure.
9290360	9297360	First we let epsilon be greater than zero, then we choose a delta that's going to be
9301200	9305840	equal to something we don't know yet, but we know with quadratics we have to do the
9305840	9310400	minimum of one and something.
9310400	9317400	We don't know what the something is yet, and then we will assume that the absolute value
9318160	9325160	of x minus two, or our a that x is approaching, is less than delta.
9333020	9336120	Then we go to that absolute value statement.
9336120	9342480	The absolute value of our function, x squared minus three x, minus the limit, minus the
9342480	9347680	negative two, means plus two, and hopefully we'll work this down and ultimately say it's
9347680	9352640	less than an epsilon.
9352640	9356840	With quadratics we're probably very familiar with factoring.
9356840	9361680	With absolute value we just keep the absolute values around each factor, so x squared is
9361680	9368680	x times x, and if we do a minus two and a minus one, we're completely factored.
9369520	9376520	What's nice here is that we've got the x minus two that we know is less than delta.
9377960	9383040	So we're going to be able to say this is less than something times delta, but we need to
9383040	9390040	know what to do with the x minus one bit.
9391720	9396240	This is where it's going to take a little creativeness.
9396240	9402600	How we're going to get to that creativeness is we're going to play with the algebra on
9402600	9409600	x minus two is less than delta, and the fact that we said delta's going to be at most one.
9410160	9416360	It's the minimum of one and something else.
9416360	9422120	Let's see, we're going to play off to the side here, I guess I'll put it underneath.
9422120	9429120	The absolute value of x minus two is less than delta, but delta's no bigger than one.
9431760	9435840	If the absolute value is less than a number, what that really means is that the x minus
9435840	9442840	two is between negative one and positive one.
9444400	9449640	We want to know what to do with the x minus one, so we're going to try and change this
9449680	9456680	middle stuff to become x minus one. To get x minus two to become x minus one, we're going
9457280	9464280	to add one. Of course, if we add one there, we have to add one to all three parts. When
9464400	9471400	we do, we get zero is less than x minus one, which is less than two.
9471400	9478400	Now, we're going to change this back to an absolute value statement that the absolute
9480000	9487000	value of x minus one is less than something. We can either say the absolute value is less
9487000	9494000	than zero or less than two. We always will take the most extreme value because we want
9494200	9499240	to be less than. We want to keep epsilon as small as possible, so we'll take the worst
9499240	9505520	case scenario and say, worst case scenario, the two is more extreme. The worst case scenario,
9505520	9512520	the absolute value of x minus one is less than two. That is what we're going to multiply
9514880	9521880	delta by. x minus one, worst case scenario is two. x minus two, worst case scenario is
9522880	9529880	delta. At least, we know that the absolute value of x minus two times x minus one is
9533960	9540960	less than two times delta. Now, we know what to do with the epsilon. Epsilon divided by
9543760	9549760	two, the reciprocal of the two, because it's multiplied by delta, to make the rest of the
9549920	9555760	proof work. We have two times delta, which is epsilon over two. Two's divide out and
9555760	9562760	we're just left with epsilon. We're done because we've said that the function minus
9565520	9572520	the limit is less than epsilon. We can now say we're done. QED. I'm probably pronouncing
9572520	9579520	that wrong, but you don't know Latin, so you can't prove me wrong. Let's do one more quadratic
9585160	9590360	because these take a little bit more trying to manipulate that second factor in order
9590360	9597360	to figure out what our delta is going to equal. Let's prove that the limit as x approaches
9598360	9605360	negative one of two x squared minus x plus one is equal to four. Again, identifying the
9615760	9622760	pieces, x is approaching our A. The function is what we're taking the limit of and the
9623160	9630160	answer that is L, our limit. The first three statements of our proof are pretty prescribed
9631560	9638560	to us. Let epsilon be greater than zero. We will choose a delta that's equal to, we don't
9641800	9645840	know exactly what it equals yet, but we do know because this is a quadratic, we're going
9645840	9652840	to do the minimum of one and something, the reciprocal of whatever delta is multiplied
9653600	9660600	by. Then we assume the absolute value of x minus our A, or what x is approaching, minus
9666680	9673680	negative one means plus one is less than delta. Now, our algebraic statement is that the
9675840	9682840	step, the function, two x squared minus x plus one minus the limit of four, a little
9685760	9692760	bit of cleanup, the absolute value of two x squared minus x minus three. Hopefully,
9695600	9702600	we can work with this and say it is ultimately less than epsilon. Well, we know we can factor
9703320	9710320	it, two x and x. To kind of help my factoring, I know I'm ultimately going to try and get
9714280	9720080	an x plus one. Hopefully, that x is an x plus one, which means the other one is probably
9720080	9726080	a minus three. When I check that out, it does work. Plus two minus three is the minus one.
9726520	9732800	Nice, that's what we wanted. Now, we have the x plus one that we like. We know that's
9732800	9739800	less than delta, but we have to figure out what delta is multiplied by. We need to play
9740560	9747560	with the two x minus three. Using what we assume, so kind of off to the side in our
9747640	9754640	work, we assumed, going back to that assumption statement, we assume that x plus one is less
9754800	9761800	than delta, which worst case scenario, it's going to be a one, the absolute value. We
9763040	9769880	remove the absolute values by saying that's between positive one and negative one. Then,
9769880	9776380	we want to massage this so that it looks like two x minus three, so we can figure out how
9776380	9783380	extreme our situation is. I recommend doing the two x part first. We get it to equal
9785080	9792080	two x by multiplying by two on all three parts. Make sure we distribute, so we get negative
9792440	9799440	two is less than two x plus two, which is less than two. Bias number white board space.
9804000	9809880	We want it to have a minus three, two x minus three. Right now, it's plus two. To get that
9809880	9814880	to be minus three, we need to subtract five. Two minus five will be the minus three. We
9814880	9821880	subtract five from all three parts, and we get negative seven is less than two x minus
9821880	9828880	three, which is less than negative three. Changing it back to an absolute value expression, two
9832160	9839160	x minus three is less than, and then we pick the most extreme case, so we're always ready
9839160	9843920	for a worst case scenario. This time, the most extreme case is on the right side, seven
9843920	9850920	being more extreme than the three, and positive because we're talking about absolute value.
9851720	9858720	So two x minus three is less than seven. That is what is being multiplied by our delta,
9861440	9868440	which also tells us the reciprocal means divide by seven, so our delta is epsilon over seven.
9870080	9876920	So we have seven times delta, which is epsilon over seven. The sevens divide out, and we're
9876920	9883920	just left with epsilon. So we've shown that f of x minus l is less than epsilon, which
9890240	9897240	QED is what we wanted, that which was to be demonstrated.
9900160	9907160	So that is your general proof for limit. We're just going to work with linear examples
9909640	9914440	and quadratic examples. In this class, you can take more advanced classes if you really
9914440	9919760	want to prove a whole bunch of delta epsilons, but you should be very familiar with how to
9919760	9926240	set up the proof. Always let epsilon be greater than zero. Choose a delta equal to something,
9926240	9931800	and then assume that x minus a is less than delta, and then ultimately we play with f
9931800	9938800	of x minus l, that f of x minus l is less than epsilon, and if you do that, you've got
9941360	9947600	a perfect delta epsilon proof. Practice a few of these. We will see you in class where
9947600	9954280	we can talk more about these proofs in more detail.
9954280	9958240	Number three is going to be all about the derivatives. So to start off, we really need
9958240	9964000	to know what is the derivative. Specifically, when we say the derivative, what we're talking
9964000	9971000	about is the slope of a tangent line to a function. So the question we're going to answer
9971240	9978240	is how do we find the slope of a tangent line?
9985280	9993000	And really, to answer this question, when we want the slope of a tangent line through
9993000	9999840	a specific point, there are two methods. Both work equally well. Sometimes one is better
9999840	10006840	than the other to find the slope of a tangent line.
10015280	10020680	Also, by way of vocabulary, when we say the slope of a tangent line, what we're talking
10020680	10027680	about is what is called in calculus the derivative, the rate of change instantaneously at that
10029280	10036840	point. So the first method we're going to look at, kind of to set it up graphically,
10036840	10043840	say we've got some curve going on here, and we've got some point that we want to look
10044280	10048200	at. We want to know what is the slope, what is the rate of change of the tangent line at
10048200	10055200	that point. So if I go up from a, we get a point on the line, and that is at f of a.
10056920	10061120	Well to get a slope, we need a second point that we can calculate it off of. So we'll
10061120	10068120	go off to the right here, and we'll pick some other random x, which has a point on the line
10068960	10075960	and some f of x solution to that. So the coordinates of that second point in red are x, f of x,
10079360	10086360	and the coordinates of the point in green are a, f of a. And the tangent line is the
10087000	10093840	line that connects those two dots. Actually that's a secant line. But the way we make
10093840	10099120	that secant line, actually let's first talk about the secant line. What is the slope of
10099120	10106120	the secant line? Well to get the slope of the secant line, it's just the slope of the
10107000	10111520	slope formula that we know already, y2 minus y1, and then we divide it by subtract the
10111520	10118520	x's. So for the slope of the secant line, that's going to be f of x minus f of a, subtracting
10119520	10126520	the y's, divided by x minus a, subtracting the x coordinates. And the way we make that
10129280	10136280	secant line into a tangent line is we take x and move it closer and closer to a. We move
10136280	10143280	x to a, and then that line is going to become less secant and more tangent. Well we know
10144280	10151280	how to express that, that the slope of the tangent line then is the limit as x approaches
10151560	10158560	a of that same function, f of x minus f of a, all over x minus a. So that is our first
10165760	10171320	possible formula. It's going to be an important one for us for how to find the slope of the
10171320	10178080	tangent line. There is a second way that's used quite often, and in fact we'll probably
10178080	10185080	use it more often overall in the course, that is similar to what we just did. So again,
10188600	10195600	we'll make our little graph, and we've got some curve going on. And we'll have some
10195600	10202600	a, which goes up to a point at f of a. But instead of going over to some x randomly,
10208360	10214320	we're going to increase what we call h. So we end up with a point over here that's a
10214320	10221320	plus h. And actually let me do that in red. A plus h. And so the a plus h gets this point
10222040	10229040	up here, and so what we actually end up with is f of a plus h. So if we want the slope
10237540	10244540	of the secant line that connects these two together, just like before, the slope of the
10245040	10249960	secant line is going to be equal to the difference in the y's divided by the difference in the
10249960	10255560	x's. Let's go ahead and label that. This red point, the x coordinate is a plus h, and
10255560	10262560	the y coordinate is f of a plus h. And then the green point is a comma f of a again. So
10266760	10273760	for the slope, subtract the y's, f of a plus h, minus f of a, all over the x coordinates
10274120	10281120	a plus h, minus a, which is nice because the a's actually subtract out to zero. So we really
10285320	10292320	have is f of a plus h, minus f of a, all over h. And the way we make this slope into a,
10292320	10299320	or the secant line into a tangent line, is we say we want that h, the amount we move
10304240	10311240	over to be basically zero. So we make the h go to zero. Or we say that the slope of the
10311240	10318240	tangent line is equal to the limit as h goes to zero of that function, f of a plus h, minus
10329360	10336360	f of a, all over h. And that is the second way we can find the derivative at a point.
10337360	10343240	And both of these functions are going to give us the same answer, but it's two ways to
10343240	10350240	get at that same value. And sometimes one way will be easier than another way. So what
10351200	10355240	we're going to do is we're going to work through three examples where we calculate the slope
10355240	10360280	of the tangent line, and also the equation of the tangent line while we're at it. But
10360280	10365120	we're going to solve it both ways so we can kind of compare how the two formulas work
10365160	10372160	together. So our first example that we're going to do is a polynomial. First we're going
10375120	10379680	to find the slope, and then we'll find the equation of the tangent line. Our polynomial
10379680	10386680	is f of x equals x squared minus 3x. And we're going to find the slope of the tangent
10387680	10394680	line at x equals 1. The first thing we need to know is what's the y-coordinate that we're
10396680	10403680	working with. So f of 1 is equal to 1 squared minus 3 times 1, which is 1 minus 3 or negative
10405680	10412680	2. So we're really working with 1 comma negative 2 as our point.
10417460	10422880	So using our first formula to solve for the slope of the tangent line, we know that the
10422880	10429880	slope is equal to the limit as x approaches a of f of x minus f of a all over x minus
10430080	10437080	a. Plugging in what we have then, we've got the limit as x this time is going to 1. Of
10438600	10445600	f of x, which is x squared minus 3x, subtract the f of a, which is what we just found, f
10446680	10453000	of 1 is negative 2, so subtracting negative 2 is the same as adding 2, all over x minus
10453000	10460000	the 1. What we see here is we can't do direct substitution
10460000	10464360	because if we do, we divide by 0. But we worked with this problem a lot with limits in our
10464360	10470860	previous unit, so we know we need to factor that numerator. It's going to be x minus 2
10470860	10477860	times x minus 1 over the x minus 1. And when we do that, the x minus 1's can divide out.
10479500	10486340	And now that we've removed that discontinuity, we can plug into our function the limit value
10486340	10493340	of 1. So x minus 2 becomes 1 minus 2, which means we have a slope of negative 1. Now,
10493340	10500340	I did say there were two definitions. Remember, the second definition would be as we took
10505900	10512900	the limit as h goes to 0 of f of a plus h minus f of a all over h. So we have the limit
10513680	10520680	as h goes to 0 of f of a plus h. Remember, a in this case is 1, so that really means
10528080	10535080	1 plus h. So x squared becomes 1 plus h squared minus 3x, which is 1 plus h. And then we
10536080	10543080	subtract f of a, which we've already figured out in blue up above, is negative 2. So minus
10543080	10550580	negative 2 means plus 2 all over h. Multiplying out the pieces here, we've got the limit as
10550580	10557580	h goes to 0. Squaring it, we get 1 plus 2h plus h squared minus 3 minus 3h plus 2. And
10566080	10573080	all over h. What's nice here is if we do the 1 minus 3 plus 2, 1 plus 2 is 3 minus 3
10577000	10584000	is 0. So now, we've got 2, or the limit, as h goes to 0 of 2h plus h squared minus 3
10595200	10602200	h all over h. Every single term there has an h in it that we can factor out to remove
10603760	10610760	our discontinuity. H times 2 plus h minus 3 all over h. I probably could have combined
10614400	10621400	the 2 and 3, wouldn't matter. But ultimately, those h's divide out, and now we can plug
10622120	10629120	in the 0 for h. So we have 2 plus 0 minus 3, which is negative 1. We get the same slope
10635680	10642680	of the tangent line. The slope at 1 is negative 1. Now that we know the slope, we can find
10642800	10649800	the equation. Remember, the equation is y equals m times x minus 1. Now that we know
10651680	10658680	minus x1 plus y1. So plugging in the pieces, y equals the slope of negative 1 times x minus
10661040	10668040	the x-coordinate is 1, and the y-coordinate is negative 2. We have the equation of our
10668640	10675640	tangent line. Let's try another example where we work through both of the formulas. Let's
10675640	10682640	do a fraction. Let's say f of x is equal to 3 over x plus 1, and we want the slope of
10694040	10701040	the tangent line at x equals 2. Well, first we need to know what the y-coordinate is at
10701640	10708640	2. So we'll find f of a, or f of 2, remember that's the a, is equal to 3 over 2 plus 1,
10716240	10723240	and 3 over 3 is just equal to 1. So we have the point x is 2, y is 1, or a is 2, and
10723800	10730800	f of a is 1. We had two formulas to find the derivative, or the slope of the tangent line
10733800	10738400	at 2. Both of them work, give you the same answer. We're going to do both just so that
10738400	10744900	we can see it worked out both ways. The first is the limit as x approaches a of f of x minus
10745200	10752200	f of a, all over x minus a. So for this function, we're doing the limit as x minus x minus x
10753320	10760320	approaches 2 this time of the function, 3 over x plus 1, minus f of a. We've already found
10762280	10769280	out that f of a is equal to 1, all over x minus the a, which is 2. What we see here is we've
10772720	10777700	got a complex fraction inside a limit, but we've seen this before. We know we can get
10777700	10784700	rid of that by multiplying by the x plus 1, distributing it through on top and bottom.
10788660	10792980	And when we do, be careful with that negative sign. The x plus 1's are gone, and we get
10792980	10799980	the limit as x goes to 2 of 3 minus 1x minus 1, all over x minus 2 times x plus 1.
10808220	10815220	The limit as x goes to 2 of 2 minus x over x minus 2 times x plus 1. And we know 2 minus
10820620	10825420	x and x minus 2 can divide out as long as there's a negative 1 left over, because the
10825420	10831420	subtraction's in the wrong order. And now that we've removed that discontinuity, we
10831420	10836700	can do direct substitution and plug 2 into the fraction. So we have negative 1 over x,
10836700	10843700	which is 2 plus 1, and this gives us negative 1 third for our slope. The slope at 2 is
10847620	10854620	negative 1 third. Let's try and work that out again, this time using our second definition
10857860	10863860	of the derivative at a point, and that's the one where we take the limit as h goes to 0
10863860	10870860	of f of a plus h minus f of a, all over h. So the limit as h goes to 0 of, this time we're
10877140	10884140	going to take a plus h, a is 2, because we're at 2, so 2 plus h, of 3 over x, which is 2
10886620	10893620	plus h plus 1 minus the f of the a. We can do direct substitution and plug 2 into the
10893860	10900860	numerator. We know that's 1, all over x, or all over h. The simplifying step is going
10903420	10907580	to feel almost exactly the same. We need to get rid of that denominator, so we're going
10907580	10914580	to multiply by 2 plus h plus 1 all the way across the numerator and the denominator.
10917340	10922540	We're going to leave the denominator factored, however, because that's going to reduce out
10922540	10929120	the h in just a minute. First fraction, we're just left with 3 minus, distribute the negative
10929120	10936120	one through, minus 2, minus h, minus 1, all over h, don't forget the limit as h goes
10938620	10945620	to 0, all over h times 2 plus h plus 1, and we could have combined the 2 and the 1 if
10945620	10952620	we wanted to. It's not going to make much difference. What's nice now, though, is if
10953860	10960860	we do 3 minus 2 minus 1, that's completely gone. Why don't we do that simplifying? We
10962460	10969460	have the limit as h goes to 0 of negative h over h times 2 plus 1 is 3 plus h. We notice
10969460	10976460	those h's are gone. We've removed the discontinuity, and so we're able to just plug 0 in. We have
