start	end	text
17474060	17479660	the derivative of sine is cosine x times the first and I'll just put it in front to make
17479660	17486660	it obvious that it's not inside the cosine. And then after the product rule we still have
17486660	17492100	to take care of the plus seven x to the negative one. Seven times negative one is negative seven
17492100	17499100	x to the negative two and we've got our derivative. Let's try another one that might be a little
17499620	17506620	more involved. Let's say f of x is equal to the cosine of x minus x to the fifth times
17509780	17516780	the cotangent of x plus the secant of x. Now it should be clear here we're working with
17517540	17524540	a product. Two pieces multiplied together so we have to do the product rule for f prime
17529980	17536180	of x for the derivative. So we'll take the derivative of the first term or the first
17536180	17543180	factor. The derivative of cosine x is negative sine x minus x to the fifth becomes five
17543380	17550380	x to the fourth times the second cotangent x plus secant of x plus the derivative of
17557780	17564780	the second. The derivative of cotangent is negative cosecant squared of x plus the derivative
17564780	17571780	of secant is secant x tangent x and then we have to multiply by the first part, the cosine
17581020	17588020	x minus x to the fifth. And we've got our derivative. One more for this video.
17595500	17602500	f of x is equal to tangent of x minus three x to the fourth over cosecant of x minus seven.
17612940	17619940	Now we're dividing two functions. With division we know we need to use the quotient rule just
17620780	17627780	like we always have before. The quotient rule says we take the derivative of the top. The
17628180	17635180	derivative of tangent we now know is secant squared of x minus three times four is twelve
17636300	17643300	x cubed. The derivative of the top times the bottom cosecant x minus seven minus the derivative
17643780	17650780	of the bottom. The derivative of cosecant is negative cosecant, so a negative negative
17655020	17662020	makes it positive, cosecant x cotangent x times the numerator times the first part. Tangent
17662020	17669020	x minus three x to the fourth. And that's all over the denominator squared, cosecant
17679100	17686100	x minus seven squared. So today's video is really short because there's not a lot of
17686820	17693820	new stuff to add. All we have now is we've added the six trig derivatives, and then we
17694220	17699220	kind of tie them into all the other derivative rules that we've seen before. The quotient
17699220	17705220	rule, the product rule, the polynomial rules, and just continue to practice taking these
17705220	17711220	important derivatives. With calculus and derivatives, practice, practice, practice is the key until
17712140	17719140	you can do these derivatives in your sleep. So go ahead and try some of these off the
17719420	17724140	homework assignment. This video is shorter to give you more time to get into the practice,
17724140	17731140	and we'll dive into these more in class. I'll look forward to seeing you then.
17732340	17736780	Quite often when we're trying to find the derivative of a function, we find that we
17736820	17743820	actually have a composite function, or a function inside a function. And so that's the question
17743820	17750820	we're going to address today is how do we take a derivative of a composite function?
17767540	17774540	A function inside of a function. And really the short answer to that is we use something
17778340	17785340	that is called the chain rule, which officially is written that the derivative of a function
17789460	17796460	with another function inside it is equal to the derivative of the outside function, which
17796780	17803780	is where the inside stays the same. Actually, I should use square brackets there, times
17804980	17811980	the derivative of the inside function. So in words, it's probably easier to remember
17812740	17819740	the chain rule is we take the derivative of the outside times the derivative of the outside
17827780	17834780	of the inside. And that's what we're going to take a look at today. I've got seven examples
17837300	17841460	where we basically do this process over and over again. We take the derivative of the
17841460	17848460	outside times the derivative of the inside. But this chain rule is one that you should
17848980	17855980	be very comfortable with completing, working through, in order to take derivatives. So
17857420	17864420	let's take a look at some examples where we take the derivative of the outside times the
17871500	17878500	derivative of the inside. Let's say we've got a function f of x equals one over 4x minus
17878700	17885700	seven cubed. Now one thing I notice with this to make it easier to remember is that
17886780	17890260	it's really easier to take the derivative. We could use the quotient rule, but that's
17890260	17895140	just way too much work for what we need to do, because we've just got a one in the numerator.
17895140	17900900	This is really 4x minus seven with a negative three exponent, because the negative exponent
17900900	17907900	makes it a reciprocal one over that. So what we see we've actually got here is the 4x
17908900	17915900	minus three as a block is all raised to the negative three power. If this was just x to
17924460	17931060	the negative three, we know the derivative of that is negative three x to the negative
17931060	17937340	four. So that's kind of what we're going to do here, but we're going to use the 4x minus
17937340	17944340	seven in place of that x. So we pull the exponent out front, and f prime of x is equal to negative
17950100	17957100	three times the base, the 4x minus seven, all to the negative four power. Now the only
17957380	17964380	thing we have to do is multiply by the derivative of the inside, and the derivative of 4x minus
17964580	17971580	seven is just four. We'll clean that up a bit. Let's see the negative three times four
17977260	17982260	is negative twelve, so we've got negative twelve times 4x minus seven to the negative
17982260	17989260	four power as our final derivative. But the idea here is we identified that we've got
17990940	17997940	that 4x minus seven inside another function, which is the x to the negative three. So we
17999220	18006220	took the derivative of the outside times the derivative of the inside. So let's look at
18007140	18014140	another one. Let's say we had f of x equals the square root of 3x squared minus seven
18016020	18023020	x plus one. Now again, we recognize square root is really an exponent. We've really got
18025420	18032420	3x squared minus 7x plus one to the one half power. And so what we need to recognize here
18032420	18039420	is we have a function inside of a function. What we really have is the 3x squared minus
18041260	18048260	7x plus one, that function sitting inside a one half power. In other words, this is kind
18049780	18054820	of the same idea as if we had x to the one half power. We know how to take the derivative
18054820	18060820	of x to the one half power, that's one half x to the negative one half, bringing the x
18060820	18066460	exponent out front and then reducing the exponent by one. The only difference is instead of
18066460	18073460	having an x, we're going to have the 3x squared minus 7x plus one. So our derivative is we
18078100	18085100	pull the exponent out front, it's one half times the stuff, 3x squared minus 7x plus
18085580	18092580	one, and then we reduce the exponent by one, giving us negative one half. The only thing
18094260	18101260	we have to do in addition is multiply by the derivative of what's inside. The derivative
18102620	18109620	of 3x squared minus 7x plus one is 6x minus seven, and there we have our final answer.
18110620	18115220	The only thing we might want to do is clean up a bit because we've got that negative
18115220	18121580	exponent in a fraction going on. I'll leave the 6x minus seven in the numerator, the two
18121580	18128580	is in a denominator, and the 3x squared minus 7x plus one with the negative exponent moves
18128940	18135100	down. That just cleans it up, it's not really a needed step, but it does make it a little
18135100	18142100	prettier. But now we have our derivative. Let's try to increase in complexity a little
18144820	18151820	bit as we continue working through these problems. Let's go to a trig problem. What if we have
18153220	18160220	f of x equals the cosine of 5x squared? What if we have the cosine of 5x squared?
18165300	18172300	With this one, what you notice is we have got the 5x squared sitting inside of a cosine.
18176660	18183660	So we'll take the derivative of the outside times the derivative of the inside. The derivative
18184460	18191460	of cosine is, let's mark this as f prime of x equals, the derivative of cosine is negative
18192380	18199380	sine of the stuff, 5x squared, and then we multiply by the derivative of the inside,
18203420	18210420	which is 10x. Clean this up a little bit and we'll move the 10x to the front so we just
18212260	18219260	see negative 10x sine of 5x squared, and we've got r.
18222060	18229060	The derivative of the outside times the derivative of the inside. What about this one? f of x
18235940	18242940	equals secant squared of x. What's the outside and what's the inside function?
18242940	18249940	Another way to think about secant squared of x is, that's really secant of x squared.
18250940	18257940	So actually our inside function is the secant of x. The outside function is that we're squaring
18259220	18266220	it. So we're going to take the derivative of the outside times the derivative of the inside
18266820	18273820	the outside function is that we're squaring it. So if we're squaring it, we know we bring
18276500	18283500	for f prime of x, we bring the exponent out front, and then reduce the exponent by 1.
18287060	18294060	And we multiply by the derivative of the inside. The derivative of secant is secant
18295060	18302060	tangent. Just to clean this up a bit, secant times secant is secant squared. So we have
18305660	18312660	two secant squared x tangent x. And we've got r derivative. And then we're going to
18324660	18331660	try another one. How about if we had f of x is equal to cosecant of 3x squared minus
18340620	18347620	5x? Again, we've got a function inside of a function. Identifying what's inside of
18354060	18361060	the inside is the 3x squared minus 5x. So we'll take the derivative of the outside times
18363820	18370820	the derivative of the inside. And the derivative of cosecant is negative cosecant cotangent.
18372340	18379340	So we have f prime of x equals negative cosecant of the stuff 3x squared minus 5x times the
18384060	18391060	cotangent of the stuff 3x squared minus 5x times the derivative of the inside. Well
18396060	18403060	the derivative of the inside using our power rule is 6x minus 5. There's not much to clean
18407340	18412980	up on this one. The only thing we might be able to do is move the 6x minus 5 to the front
18413000	18419500	so it's really clear that that part is not part of the cotangent or cosecant. So we have
18419500	18426500	negative 6x minus 5, don't lose the parenthesis, cosecant of 3x squared minus 5, cotangent
18429420	18436420	of 3x squared minus 5. And we've found r derivative. And we've found r derivative.
18443980	18450980	To make these a little more exciting, we can combine different rules together to find derivatives.
18455020	18462020	Number 6 is an example of this, where we have f of x equals 4x plus 5 cubed times 2x squared
18465020	18472020	minus 6x plus 1 to the seventh power. This one is a little bit more complicated.
18472980	18479980	This problem is going to combine the chain rule along with the product rule. So we see
18482100	18489100	we're working with a product, but the product is of functions within functions. On the
18490020	18497020	left side we see 4x plus 5 is inside the cube function. On the right side we see 2x squared
18498020	18505020	minus 6x plus 1 is inside the seventh power function. So let's use our product rule along
18515540	18522540	with our chain rule in order to find the derivative. The product rule says we take the derivative
18523540	18529740	of the first part times the second part. So the derivative of the first part, we bring
18529740	18536740	the exponent out front, 3 times 4x plus 5, reduce the exponent by 1, so it's squared.
18539540	18546540	And then we multiply by the derivative of the inside, which is just 4. Then that's the
18547060	18554060	derivative of the first part, we still need to multiply by the second part, 2x squared
18555820	18562820	minus 6x plus 1 to the seventh power. Plus, now the product rule says we take the derivative
18567840	18574840	of the second part times the first part. The second part is a chain rule again, we bring
18575000	18582000	the 7 out front times 2x squared minus 6x plus 1. Now to the sixth power, because we've
18583960	18590960	reduced the exponent by 1, times the derivative of the inside. The inside has a derivative
18593080	18600080	of 4x minus 6, and that part is the derivative of the second part. We still have to multiply
18605480	18612480	by the first part, which is 4x plus 5, cubed. From here, there's just a little bit of cleanup.
18616880	18623880	I'm going to multiply 3 times 4 to get 12 times 4x plus 5 squared times 2x squared minus
18625760	18632760	6x plus 1 to the seventh power. The second part doesn't really have any cleanup to do,
18635160	18642160	so we'll just keep that all the same, 7 times 2x squared minus 6x plus 1 to the sixth power
18642240	18649240	times 4x minus 6 times 4x plus 5 cubed. That big ugly thing is the derivative of our function.
18649240	18656240	Notice to get that derivative, we had to combine both the chain rule and the product rule.
18664960	18670320	We knew the product rule was the derivative of the first times the second, plus the derivative
18670320	18676200	of the second times the first, but in order to take those derivatives in each of those
18676200	18682560	parts, we had to use the chain rule, where we took the derivative of the outside times
18682560	18689560	the derivative of the inside. We not only can combine the chain rule with other rules,
18694680	18701680	we can combine the chain rule with the chain rule. If we've got functions inside of functions,
18702200	18708700	we can just keep applying the chain rule, taking the derivative of the outside times the derivative
18708700	18713940	of the inside, times the derivative of what's inside that, times the derivative of what's
18713940	18720940	inside that, until we run out of things to take the derivative of. For our final example,
18723600	18730600	if f of x is equal to the tangent cubed of 5x squared minus 7 times the derivative of
18732560	18739560	x, what you'll see we have here, and maybe we should rewrite, remember tangent cubed
18740320	18747320	means we really have the tangent of 5x squared minus 7 to the third power. So we've got
18752580	18759580	a tangent inside of cubed, but then we've also got a 5x squared minus 7 times the derivative
18761960	18767480	of 7 inside of the tangent, and those colors are overlapping, making it very difficult
18767480	18774480	to see, but you get the idea. So we're going to first take the derivative of the outside
18778320	18785320	function, which is cubed. So for the derivative of a cubed, we pull the 3 outside, and reduce
18785320	18792320	the exponent by 1, now it's tangent squared of 5x squared minus 7. Then we take the derivative
18799980	18806980	of the inside, well the derivative of tangent is the secant squared of the inside stuff,
18806980	18813980	5x squared minus 7. But we're still not done, because we can take the derivative of the
18818620	18825620	inside stuff, which is going to be the 5x squared minus 7, the derivative of that is
18825780	18832780	just 10x. Cleaning up a little bit, 3 times 10 is 30, so f prime of x is equal to the
18837580	18844580	30x tangent squared of 5x squared minus 7 times secant squared of 5x squared minus 7.
18851940	18858940	And now we've got our derivative, which required us to use the chain rule on the chain rule,
18859940	18866940	which all we do is just start peeling off layers, like peeling the layers off an onion,
18866940	18872300	derivative of the outside, times the derivative of what's in that, times the derivative of
18872300	18879300	what's in that, times the derivative of what's in that, until we finally reach the end.
18880020	18884620	So that's the chain rule, the chain rule is we just keep taking derivatives and multiplying
18884620	18890780	until we reach the far inside of our function. This video is a little bit shorter because
18890780	18896940	it's going to give you time to practice this on your own before you come to class, and
18896940	18901300	then we'll dive into it a little deeper in class and answer any questions. I'll look
18901300	18908300	forward to seeing you then, so that we can work on the chain rule.
18909900	18914420	As we continue to work with derivatives, we want to continue to expand the types of functions
18914420	18918900	we can take the derivative of, and there's another one that we've missed, and that is
18918900	18925900	the inverse trig functions. So the question we're going to answer is what are the derivatives
18932620	18939620	of the inverse trig functions?
18940500	18947500	And before we can actually answer the question about what are the derivatives of the inverse
18948060	18955060	trig functions, we really have to understand how derivatives of inverses work.
18961980	18968980	And there's a nice little theorem that says that if f inverse of x is equal to x, then
18969620	18976620	is the inverse of f of x, then the derivative of f inverse at x is simply the reciprocal
18989020	18996020	of the derivative at that inverse point. Maybe a better way to say that is the inverse
18999620	19006620	point is to say that that's not so mathematical is if a comma b is a point on f of x, then
19015300	19022300	the slope of the tangent line,
19030500	19037500	is f prime of a. We stick that x coordinate into the derivative. We already know that
19037700	19041980	though, that's just our basic definition of the slope of a tangent line that we've been
19041980	19048980	working with thus far. So if a b is a point on f of x, then b comma a, switching the x
19050900	19057900	and y coordinates, is on f inverse of x, and the slope is on f inverse of x, and the slope
19059620	19066620	of the tangent line is, and it turns out to be, just the reciprocal of the slope of the
19074020	19081020	standard function. So the slope of the inverse is the reciprocal of the slope of the function.
19081300	19088300	We'll say 1 over f prime of a, and that's probably an important slope of the slope of
19089820	19096820	the slope to know 1 over the derivative at that point. So let's take a look at how we
19099020	19106020	can do some of these reciprocals of slopes or derivatives to calculate some tangent lines
19110740	19117740	on inverse functions. So for example, we're going to find the equation for the slope of
19119620	19127040	a tangent line of the inverse of f of x equals x cubed minus 7x plus 5 at 5.
19150620	19157620	So we're going to break this down into three parts. First, it's really important as we're
19161580	19167900	talking about this, we keep track of our five, is that the x coordinate or the y coordinate
19167900	19172260	of the function or of the inverse, because the function and the inverse have the same
19172260	19176420	x and y coordinates, they're just switched and backwards, and it's really easy to get
19176420	19183420	those confused. So let's take a moment to really clearly say that 5 is the x coordinate
19185140	19192140	of the inverse. We're finding the equation of the tangent line of the inverse at 5. So
19196380	19203380	5 is the x coordinate of the inverse, which means it is the y or the f of x for the ratio
19206660	19213660	function. Maybe I should say y for the f of x. So it's the x of the inverse and it's
19214580	19221580	the y for the function, which means we need to still find the other coordinate, the x
19225700	19232700	of the f of x. So if f of x is x cubed minus 7x plus 5, then we're going to find the x
19236420	19243420	of 5, and 5 is that y coordinate, this is like saying it equals 5. And we can solve this
19245940	19252940	really quickly for x. We'll subtract 5 from both sides to make it equal to 0, x cubed
19253140	19260140	minus 7x equals 0, factoring out the x from both sides, and then subtracting out the x
19267420	19274420	of both terms, we get x squared minus 7 equals 0. Let's scroll down a little more here, give
19277380	19283380	me some more space. And we'll set each factor equal to 0, so x equals 0, and x squared minus
19283380	19290380	7 equals 0. So x is equal to plus or minus the square root of 7. So we've got three
19290580	19297580	possible values for our x coordinate to make the y coordinate 5, 0, square root of 7, or
19299660	19306660	negative square root of 7. In fact, let's clearly state that on f of x, the point we're
19310420	19317420	talking about is 0, 5, square root of 7, 5, and negative square root of 7, 5, and negative
19317420	19324420	square root of 7, 5. We've got three points, which means on the inverse, we're talking
19326180	19333180	about the opposites, 5, 0, 5, square root of 7, and 5, negative square root of 7. Keeping
19335340	19342340	track of what's x, what's y on which function. Probably the most challenging part of this
19343340	19349820	section is keeping track of what is what. Next thing we're ready to do is, now that we
19349820	19354620	know what our x and y coordinates are that we're working with, we still need to find
19354620	19361620	the slope of the tangent line of f of x, because we know that the slope of the tangent line
19362020	19369020	of the inverse is just the reciprocal of this slope. Just because it's off my screen,
19370020	19377020	I'm going to write the function again x cubed minus 7x plus 5, so that we can take the derivative
19378140	19385140	at 3x squared minus 7. We need to find the slope at each of the three points, at each
19385140	19392140	of the three x coordinates that we just found. We're going to find f prime of 0, f prime
19398980	19405980	of the square root of 7, and f prime of negative square root of 7. We're going to have 3 because
19406020	19409680	we're dealing with three points. I think the homework assignment specifies a specific
19409680	19414600	range, so you're only doing one of the points, but the process is the same. Let's take the
19414620	19420500	extra practice. First, plugging 0 into the derivative, we have 3 times 0 squared minus
19420500	19427500	7, and that's just going to equal negative 7. Plugging square root of 7 in, we've got
19429240	19436240	3 times the square root of 7 squared minus 7. That's 3 times 7, or 21 minus 7, and that's
19437080	19443200	equal to 14. Really similar with the negative square root of 7, because squaring a negative
19443200	19450200	is the same as squaring the positive, so we've got 3 times 7, or 21 minus 7 is 14. Now we can make the equations of the tangent line.
19473200	19480200	Remember, with f inverse, we have to switch coordinates, because x is y and y is x on the inverse. We
19495320	19502320	also have to do the reciprocal slopes. We're going to have to do the reciprocal slope.
19503640	19510640	For our first point, let's see if I can get the points on the screen here. On the inverse,
19513460	19520460	the first point was 5 comma 0, and at that point we found the slope was equal to negative
19521500	19528500	1 seventh, the reciprocal of the negative 7. We have y equals negative 1 seventh times
19529100	19536100	x minus 5 plus the 0. That's the equation of the tangent line at 5-0. What if we wanted
19541060	19547060	to do it at 5 square root of 7? Actually, let's do this in a different color, just to
19547060	19553020	keep the different colors separate. Second point was 5 square root of 7. There the slope
19553020	19560020	is the reciprocal of 14, or 1 over 14. We have y equals 1 14th times x minus 5 plus
19564300	19571300	the square root of 7. We had a third point. Our third point was at 5 comma negative square
19574220	19581220	root of 7. That slope is going to be the reciprocal of 14, which is 1 over 14. For that equation,
19583340	19590340	we've got y equals 1 14th times x minus 5 minus the square root of 7.
19593420	19599300	Now we've got our three tangent lines that are tangent at an x coordinate of 5 to paint
19599300	19603380	on the y coordinate, because this inverse isn't actually a function. We probably should
19603380	19608100	have restricted the domain, but it provided us the chance to practice three times with
19608180	19615180	this process of finding the slope of the tangent line to the function, knowing the inverse
19616900	19623900	is the reciprocal slope. Let's try one more example that uses this idea before we get
19624740	19631740	to trig. How about this example? The point 4 comma 1 is 4 comma 1 minus 4 over 4.
19638240	19649240	It is on the inverse of f of x equals x to the 5th minus 3x squared plus 4 squared.
19649240	19656380	Find the equation of the tangent line. We know that the tangent line is going to have
19679540	19686540	the reciprocal slope of the function's tangent line slope. Let's find the function's tangent
19687040	19692160	line slope, f prime of x equals, this is a chain rule here. We'll take the derivative
19692160	19699160	of the outside, which is 2 times x to the 5th minus 3x squared plus 4 times the derivative
19699920	19706920	of the inside, which is 5x to the 4th minus 6x. Remember, 4 1 is on the inverse of x
19709240	19716240	to the 5th minus 6x. The point we want that's on the standard function before the inverse
