start	end	text
1469680	1474680	So I then began, I noticed this was just created with mechanical objects.
1474680	1479680	So I ran around the neighborhood and I gathered mechanical objects.
1479680	1482680	Little things from radios, broken bicycles.
1482680	1487680	This was an era where you were allowed a 60-year-old kid to go around the neighborhood and collect these things.
1487680	1490680	You'd probably get arrested today.
1490680	1494680	And I went around saying, I have no idea how to put these things together.
1494680	1498680	But someday I'm going to figure that out and I'm going to be able to solve any problem.
1498680	1500680	Be able to go to other places.
1500680	1503680	We'll be able to live forever and so on.
1503680	1506680	I remember actually talking to these very old girls.
1506680	1510680	I think they were 10 and they were quite fascinated.
1510680	1514680	And they said, well, you have quite an imagination there.
1514680	1518680	So other people were saying what they wanted to be.
1518680	1521680	Fighting fires or educating people.
1521680	1523680	I said, I know what I'm going to be.
1523680	1525680	I'm going to be an inventor.
1525680	1534680	And starting at eight actually created a virtual reality theater that was a big hit in my third grade class.
1534680	1538680	So I got into inventing.
1538680	1543680	And the biggest problem was when do you approach a certain problem?
1543680	1547680	Like I did character recognition in the 70s.
1547680	1549680	I did speech recognition in the 80s.
1549680	1551680	Why did I do it that way?
1551680	1557680	It's because speech recognition requires actually more computation.
1557680	1561680	So I began to study how technology evolves.
1561680	1567680	And really about 40 years ago I realized that computers were on this exponential rise.
1567680	1574680	And so I didn't get into futures for futures itself.
1574680	1578680	It was really to plan my own projects and what I would get involved in.
1578680	1590680	And so if I look forward five years, 10 years, we're now actually at a very fast pace of this exponential path as you can see.
1590680	1594680	I'll see what are the capabilities going to be.
1594680	1597680	And then you needed to use a little bit of imagination.
1597680	1604680	What can we do with the computers of this power and other types of things that we can manage?
1604680	1609680	But that's really been my plan is to figure out what is capable.
1609680	1611680	And you saw that chart.
1611680	1613680	It's an absolutely straight line.
1613680	1618680	I had it 40 years ago and projected it as a straight line and it's exactly where it should be.
1618680	1624680	And then you can use imagination as to what you can do with that type of power.
1624680	1626680	So that's how I go.
1626680	1629680	Ray, just to point out, it's a straight line on a log scale.
1629680	1632680	Meaning it's going exponentially, yes.
1632680	1634680	Exactly.
1634680	1636680	Thank you.
1636680	1637680	Mike.
1637680	1639680	Hi, great to meet you, Ray.
1639680	1641680	Quick question.
1641680	1646680	When do you think that quantum computing will break RSA encryption?
1646680	1651680	Well, a little bit skeptical of quantum computing.
1651680	1656680	I mean, people go around saying, oh, we've got this 50 qubit computers.
1656680	1659680	But it creates lots of errors.
1659680	1665680	And we've actually figured out how many qubits you would need to actually do it perfectly.
1665680	1671680	I mean, computation that creates lots of errors is pretty useless.
1671680	1680680	And so it takes about at least a thousand, maybe even 10,000 qubits to create one qubit that's actually accurate.
1680680	1686680	Now, the last time I checked, 50 divided by a thousand is less than one.
1686680	1689680	And we really haven't done anything with quantum computing.
1689680	1691680	And that was the same thing 10 years ago.
1691680	1694680	So maybe we'll figure out how to overcome this problem.
1694680	1696680	I know there are people working on it.
1696680	1699680	They've got some theories as to why that will work.
1699680	1705680	But all the predictions I make have to do with classical computing, not quantum computing.
1705680	1708680	And you can see the amazing things that we're doing.
1708680	1715680	And if you look at what humans can do, we can definitely account for that with classical computing.
1715680	1719680	Thanks.
1719680	1720680	Hello, Ray.
1720680	1722680	My name is Neil from Sacramento, California.
1722680	1731680	Many of the technologies that we're seeing are going to be more readily available to people with the financial resources and the education to immediately take advantage of.
1731680	1739680	But what do you believe are the technologies that will be most ubiquitous and will have the biggest impact perhaps on the middle class and the working class communities?
1739680	1747680	And how would we best educate our broader communities to be able to understand and help embrace those technologies?
1747680	1749680	Well, they're all working together.
1749680	1755680	I think we need a little bit more work, for example, on virtual reality.
1755680	1768680	But that allows people to go anywhere and interact with people that don't exist now but might have existed tens of millions of years ago.
1768680	1771680	And also put people together.
1772680	1776680	I mean, the virtual reality we're using right now is a little bit limited.
1776680	1783680	There's actually some new 3D forms that I've actually begun to use where it actually appears like I'm there and can actually shake people's hands and so on.
1783680	1786680	So that's all coming.
1786680	1794680	We use computers and this type of technology to bring us closer together.
1794680	1798680	I mean, I just watched the movie Around the World in 80 Days.
1798680	1802680	It was quite amazing to actually get around the world in 80 days.
1802680	1811680	But today you can meet people almost instantly and also really be great to actually be able to hug each of you and so on.
1811680	1813680	That's all coming.
1813680	1821680	So increasing communication and also to meet my grandmother's view of one life is not enough.
1821680	1823680	She does not have an answer to that.
1823680	1827680	But I think we're going to be able to keep ourselves here.
1827680	1835680	I mean, when people are around for a while, they actually gain some wisdom and they're good to keep us around for a while longer.
1835680	1837680	Thank you, Ray.
1837680	1838680	Mike.
1838680	1839680	Hello, Ray.
1839680	1841680	Mike Wandler from Wyoming.
1841680	1845680	Peter was showing us the AI enabled mind reading.
1845680	1852680	Really curious about how that works and especially the connection to collective consciousness or consciousness.
1852680	1862680	So Ray, this is recently they put some subjects in a functional MRI and then fed the output to stable diffusion.
1862680	1866680	I've actually done that.
1866680	1869680	This was maybe five years ago.
1869680	1874680	It wasn't perfect, but it was significant.
1875680	1885680	I mean, things that go on inside our minds actually, it affects things that we don't usually notice like our eye blinking and so on.
1885680	1889680	And regaining more ability to do that.
1889680	1899680	We can do pretty good telling if people are telling the truth or not.
1899680	1901680	So that's going to happen.
1901680	1905680	And there are ways in which some of these things are positive and negative.
1905680	1907680	I mean, I write mostly about the positive.
1907680	1912680	I think things are moving in a positive direction in this new book.
1912680	1920680	I've got 50 graphs showing all the things we care about are moving in the right direction.
1920680	1922680	But that never reaches the news.
1922680	1925680	You watch the news, everything is bad news.
1925680	1929680	And the bad news is true, but we completely ignore the good news.
1929680	1934680	I mean, look at what life was like 50 years ago or 1900.
1934680	1936680	Human life expectancy was 48.
1936680	1939680	It was 35 and 1800.
1939680	1942680	It's not that long ago.
1942680	1954680	So anyway, we are able to begin to tell what's going on inside our minds with some greater accuracy.
1954680	1958680	Hi, Ray Sadoq Cohen from Istanbul, Turkey.
1958680	1966680	It looks like LLMs are, with the aid of some expert systems, the way to go to general intelligence.
1966680	1972680	Do you think that means that's a hint of how the brain or our brain really works?
1972680	1976680	And if that's the case, does it mean that the more we understand the LLM models,
1976680	1979680	the more we understand our brain and be able to hack it?
1979680	1984680	And is that a hint that we are more deterministic than we thought we were?
1984680	1986680	Well, it's a very good question.
1986680	1989680	It uses a somewhat different technique.
1989680	1998680	Neural nets, every phase, it's able to get itself closer to the truth.
1998680	2001680	We don't actually see anything in our brain that actually does it.
2001680	2003680	It does it a different way.
2003680	2006680	But somehow we have all these different connections.
2007680	2010680	And the large language models that are effective,
2010680	2016680	I mean, we actually had large language models that had 100 million connections.
2016680	2019680	That sounds like a lot, but it actually didn't do very much.
2019680	2024680	When I got to 10 billion and started to do things,
2024680	2031680	the recent ones started now at 100 billion, going to a trillion connections.
2031680	2036680	And it basically is able to look at all the different connections between them.
2036680	2039680	And that's exactly what our brain does.
2039680	2042680	And these things are going to go way beyond what our brain does.
2042680	2044680	We see that already.
2044680	2046680	I mean, I can play Go.
2046680	2049680	I'm hardly the best player.
2049680	2054680	But Lisa Dahl, who is the best human player,
2054680	2057680	and that used to be significant because he could just look at the board
2057680	2060680	and be able to do something that no one else could do.
2060680	2064680	And he says he's not going to play Go anymore because he can't compete with a computer.
2064680	2067680	In my view, though, we're going to add this to ourselves,
2067680	2074680	and we'll all become master Go players of Go and everything else that we want.
2074680	2080680	But yes, it's using the same ability to connect things.
2080680	2085680	And if you get enough of them, it seems to be basically a trillion seems to be,
2085680	2088680	you know, way beyond what humans can do.
2088680	2091680	We can be very intelligent.
2091680	2095680	Thank you.
2095680	2096680	Hi, Ray.
2096680	2098680	I'm Annie Chahal-Honen.
2098680	2100680	It's nice to see you again.
2100680	2105680	I had the pleasure of seeing you at an A360 Singularity Executive Program.
2105680	2108680	And I'm going to ask you the same question I asked then
2108680	2112680	because I hope that all these amazing innovators out there are going to hear this.
2112680	2115680	I asked you, when you're struggling with a problem,
2115680	2117680	because you're this amazing inventor,
2117680	2123680	what's your approach and process to solve it or get to the next step?
2123680	2129680	Well, something I think that Peter and also Salim would agree with
2129680	2134680	is that failure is just a step towards success.
2134680	2138680	I mean, failure is really a delayed form of success.
2138680	2143680	When Edison was trying out many thousands of different things
2143680	2148680	that would quickly create a light bulb and he tried it out and it didn't work,
2148680	2151680	his feeling was, okay, I now know that this doesn't work.
2151680	2152680	We'll go to the next one.
2152680	2154680	And he finally solved the problem.
2154680	2157680	So diligence is very important.
2157680	2160680	Believing in your own mission.
2160680	2163680	You've got to have some idea.
2163680	2166680	Generally, if I'm trying to solve a problem,
2166680	2172680	I imagine I'm giving a speech four years from now
2172680	2176680	and I'm explaining how I was able to solve this problem.
2176680	2179680	And in order to solve the problem where we had to do this, this, and this,
2179680	2182680	in order to do these, we had to do these other things.
2182680	2188680	And I worked backwards from the solution to where we are today.
2188680	2190680	And generally, that seems to work.
2190680	2193680	We can actually figure things out even though they seem impossible.
2193680	2197680	If you actually imagine, how could this possibly work?
2197680	2202680	And write that down and study each of those steps,
2202680	2206680	you can solve really any type of problem.
2206680	2209680	Thank you.
2209680	2210680	Hi, Ray.
2210680	2211680	I'm Dom from Munich, Germany.
2211680	2215680	And I was wondering, as many of us probably think that the best investment
2215680	2217680	that you could take is in yourself.
2217680	2220680	I was wondering if I can have an AI twin.
2220680	2226680	So I want to train my own AI model to shadow me and to help me make better decisions,
2226680	2229680	and leverage my strengths, but also balance my weaknesses.
2229680	2233680	And I was wondering if you were training and Ray Kurzweil, LLM at the moment.
2233680	2236680	And if so, how many times you spend on it and how you do it.
2236680	2237680	So would you help?
2237680	2238680	Yeah.
2238680	2242680	Well, I mean, I write down lots of things.
2242680	2249680	We came out with a product that you could actually search a book
2249680	2255680	and ask a question and we'll find the best answer in what you've written.
2255680	2256680	It's called Talk to Books.
2256680	2258680	You can actually go to it.
2258680	2259680	It's got 200,000 books.
2259680	2265680	You ask a question and it will actually read every sentence in 200,000 books
2265680	2269680	and give you an answer, which is quite remarkable.
2269680	2271680	But I did that, for example, with my father.
2271680	2274680	My father died actually 50 years ago.
2274680	2276680	And I still would like to bring him back.
2276680	2280680	So I actually went through and collected everything he'd ever written.
2280680	2284680	I didn't write quite as much as I did because we didn't have word processors then.
2284680	2288680	But he wrote a number of things and put them in there.
2288680	2292680	And then I used Talk to Books and asked him questions.
2292680	2294680	And it was really like talking to him.
2294680	2296680	I mean, I didn't know what answer it would come out with.
2296680	2298680	It would go through everything he had written and said,
2298680	2301680	okay, this is the right answer to that question.
2301680	2304680	And it was a little bit like talking to him.
2304680	2308680	And I'm doing that with myself.
2308680	2312680	And ultimately we'll actually have computers on ourselves
2312680	2315680	that monitor everything that's happened.
2315680	2319680	I mean, I met my wife actually now 50 years ago.
2319680	2323680	Every time I say this, I'm amazed where does the time go.
2323680	2328680	And I met her at a party and we had some small talk.
2328680	2330680	What the heck did we talk about?
2330680	2332680	Neither of us can remember.
2332680	2335680	But we could actually go back and watch that.
2335680	2338680	So we should actually be monitoring everything we do
2338680	2341680	when we can go back, not relive everything,
2341680	2346680	but certain things you might want to actually see what happens.
2346680	2349680	And that's going to happen right now.
2349680	2353680	If you want to use a search engine and you have to do it,
2353680	2355680	you got to like turn the machine on.
2355680	2356680	You got to find the right place.
2356680	2358680	You got to put in the answer to the question.
2358680	2361680	It should actually be listening and say,
2361680	2366680	okay, the actress you want is so-and-so before you even ask it,
2366680	2369680	because we'll see that you're trying to figure things out.
2369680	2371680	So these are some of the things that we can do
2371680	2375680	actually with technology that we already have.
2375680	2377680	Perfect. Thank you.
2377680	2378680	Great question, Don.
2378680	2379680	Howard.
2379680	2380680	Hi, Ray.
2380680	2383680	Howard Lederman, originally St. Louis, now Pompano Beach.
2383680	2387680	And I had my original question kind of was on the direction
2387680	2389680	of what he was asking.
2389680	2392680	So I had a second question and I'm going to go with that one.
2392680	2395680	I'm actually here and I've been here previous years
2395680	2398680	looking for solutions for caregiver shortage
2398680	2401680	that we're experiencing already
2401680	2403680	and is just going to be accelerating.
2403680	2406680	Of course, robotics are somewhere out there.
2406680	2411680	And I was kind of curious on your thoughts
2411680	2415680	on the challenges of the aging population curve
2415680	2417680	and caregivers.
2417680	2419680	I mean, there's a number of answers to that.
2419680	2424680	First of all, the kind of changes that we see when people age,
2424680	2427680	I think we're going to be able to overcome.
2427680	2429680	I mean, that's really the most important thing.
2429680	2432680	I mean, I run into people that are aging
2432680	2435680	and they can't remember things and I think we'll be able
2435680	2439680	to have older people be as vital as younger people
2439680	2442680	because they'll remember everything.
2442680	2448680	And also large language models are already pretty close to human.
2448680	2451680	I mean, you can talk to them and it's like talking to a human
2451680	2455680	and you can actually program the kind of personality you want.
2455680	2457680	I mean, I've actually taken them and say,
2457680	2460680	okay, I want you to act like Shakespeare or E Cummings
2460680	2463680	or some other poet and they'll actually act like that
2463680	2465680	and I can talk to them.
2465680	2469680	But again, it's not going to be a difference
2469680	2471680	between human and machines.
2471680	2473680	We're going to be all mixed up.
2473680	2475680	We're already very mixed up.
2475680	2478680	I mean, you're looking at your phone there
2478680	2481680	to see what your question was.
2481680	2485680	Computers are going to help us get through the day
2485680	2488680	and so we're not going to be interacting just with humans or machines.
2488680	2491680	Machines is part of who we are
2491680	2494680	and that's actually the big difference between human beings.
2494680	2498680	There are other species that have as big a brain as us.
2498680	2502680	A whale, an elephant actually has a larger brain than we do,
2502680	2505680	but they don't have this thumb.
2505680	2507680	So they can't look at the tree and say,
2507680	2509680	oh, I could take that branch off.
2509680	2512680	I could strip off the leaves and I could create a tool.
2512680	2514680	They just weren't able to do that.
2514680	2517680	So our brain, plus the fact that we can actually manipulate
2517680	2521680	the environment, has allowed us to create technology
2521680	2526680	and the technology is going to allow us to go forward.
2526680	2531680	Thank you.
2531680	2533680	Good morning, Ray.
2533680	2535680	My name is Gloria and I come from Spain.
2535680	2539680	I just wanted to share an idea that I woke up with this morning.
2539680	2541680	It's a bit crazy.
2541680	2545680	But I woke up with this image of neurons in a dish,
2545680	2548680	in a battery dish, playing ping-pong.
2548680	2553680	And I thought, what about if we put these neurons on sensors
2553680	2556680	and connect them to AI, quantum computers, whatever,
2556680	2559680	and have them feeling stuff.
2559680	2563680	So they can be more empathetic and understand the humans
2563680	2567680	or sentient beings, animals, whatever.
2567680	2570680	And I don't know where they come from,
2570680	2573680	but maybe that will evolve into something greater
2573680	2578680	and not just to have the machine embedded in our brain,
2578680	2585680	so to actually grow neurons and connect these sensors to the AI.
2585680	2586680	Yeah.
2586680	2590680	Well, you bring up a number of interesting issues.
2590680	2593680	Our cells don't have to be in this body.
2593680	2597680	We can have sensors that are even thousands of miles away
2597680	2600680	that are really part of who we are.
2600680	2603680	And you're talking about feelings.
2603680	2604680	I mean, that's a big issue.
2604680	2607680	Where do feelings come from?
2607680	2610680	It's actually not a scientific issue.
2610680	2613680	I can't put an entity into something
2613680	2616680	and it would scan and say, yes, this is conscious.
2616680	2619680	No, this isn't conscious.
2619680	2623680	There's actually nothing that would actually tell us that.
2623680	2626680	So that's actually a philosophical question.
2626680	2628680	I used to discuss this with Marvin Minsky,
2628680	2630680	and he says, oh, well, that's philosophical.
2630680	2632680	We don't deal with that.
2632680	2634680	And he dismissed it.
2634680	2640680	But actually, he did actually evaluate the ability of people
2640680	2643680	to be intelligent.
2643680	2645680	And really, the more intelligent you are,
2645680	2648680	the more you can process things,
2648680	2649680	the more feelings you have from it.
2649680	2652680	I think that's where feelings come from.
2652680	2656680	And yes, we can actually grow things that are outside of ourselves
2656680	2659680	that could be part of our feelings as well.
2659680	2663680	My idea was that who says that consciousness doesn't want
2663680	2666680	to experience itself through the machine.
2666680	2670680	With these sensors, we can have pleasure and pain or whatever.
2670680	2672680	It's just a thought.
2672680	2673680	Thank you.
2673680	2674680	Thank you.
2674680	2677680	We're going to pause and go to Zoom one second.
2677680	2680680	Dagmar, please go ahead.
2680680	2682680	Hi, everybody.
2682680	2684680	Where are you in the planet, Dagmar?
2684680	2685680	Germany.
2685680	2686680	In Germany.
2686680	2687680	Great.
2687680	2689680	Now, with the history of Germany,
2689680	2692680	I really has a very big challenge here
2692680	2696680	because there are people who are really afraid of reviving
2696680	2699680	a basic big brother angst.
2699680	2705680	So, Ray, thank you very much for answering maybe this question.
2705680	2708680	How to overcome this fear?
2708680	2711680	Because the thing is really we need to learn and explore
2711680	2715680	and play with the tech so that we actually can deal with it
2715680	2717680	and learn about it.
2717680	2721680	So where do you see the power to create this framework
2721680	2723680	for learning?
2723680	2728680	Well, I was actually just in Germany a few months ago.
2728680	2737680	And I think they've considered their past and how that happens
2737680	2740680	and how we can avoid it's happening, I think,
2740680	2743680	more than any other country.
2743680	2748680	And I really felt that while I was there.
2749680	2753680	Really to understand humans, I think large language models
2753680	2756680	because it actually incorporates all of the learning of humans.
2756680	2760680	We can actually begin to appreciate that.
2760680	2767680	And I've asked these machines questions which no human could answer
2767680	2772680	because we can't actually hold all of everything that's happened
2772680	2774680	to humans in our mind.
2774680	2778680	But if you can actually have something that has experienced
2778680	2782680	everything and can look through that,
2782680	2786680	we can avoid the kind of problems we've had in the past.
2786680	2788680	Thank you so much.
2788680	2790680	Let's go to Jason on Zoom.
2790680	2792680	I know we have a number of hands up there and we'll come back
2792680	2794680	to you gentlemen in a second.
2794680	2795680	Jason, good morning.
2795680	2796680	Where are you on the planet?
2796680	2797680	Hey, Ray.
2797680	2800680	I'm in Calgary, Alberta, Canada.
2800680	2804680	And I love the optimism around where we're headed,
2804680	2806680	a future of abundance.
2806680	2809680	What I would really love to know is your perspective on
2809680	2813680	as we cure diseases, as we have access to this knowledge
2813680	2817680	instantly, what are some of the downsides or the threats
2817680	2819680	that we might be missing, that we're going to have to face
2819680	2821680	in the future?
2821680	2822680	Yeah.
2822680	2827680	Well, each of my books actually has an apparel's chapter.
2827680	2829680	My generation was the first to grow up with that.
2829680	2831680	I remember in elementary school,
2831680	2835680	we would have these drills to prepare for a nuclear war
2835680	2837680	and we would actually get under our desk,
2837680	2841680	put our hands behind our hands.
2841680	2843680	It seemed to work.
2843680	2847680	We're all still here.
2847680	2850680	But these new technologies do have downsides.
2850680	2855680	You can certainly imagine AI being in the power of some body,
2855680	2859680	could be a human or any other type of entity that wants to
2859680	2861680	control us.
2861680	2864680	And it could happen.
2864680	2868680	I was actually part of the Asilomark conference on bringing
2868680	2872680	ethics to AI to prevent that kind of thing.
2872680	2876680	I am optimistic, but I'm also worried about it.
2876680	2880680	Nanotechnology, biotechnology.
2880680	2886680	I mean, we just had this COVID go through our planet.
2886680	2889680	We don't actually know where it came from,
2889680	2891680	but somebody could create somebody.
2891680	2895680	Right now, viruses, they either spread very easily,
2895680	2897680	but they don't make us that sick,
2897680	2900680	or they don't spread that easily and they can kill us.
2900680	2903680	We generally don't have anything that could go through
2903680	2908680	the entire human beings and kill everybody.
