start	end	text
0	4600	It seemed to me that a huge revolution was going on.
4600	5760	Now it's changed.
5760	8240	I am optimistic, but I'm also worried about it.
11240	15760	I've been in the field of AI for 60 years.
15760	17240	I was 14.
17240	20400	I met Marvin Minsky who was in his 30s.
20400	22400	Frank Rosenblatt created the Perceptron,
22400	24040	the first popular neural net.
24040	26160	But in the early years, it was really not clear
26160	28280	that neural nets could do anything successful.
28320	30840	And they're showing now that this is really the path
30840	32800	to artificial general intelligence.
32800	34960	It's not just us versus AI.
34960	37120	The intelligence that we're creating
37120	39440	is adding AI to our own brains.
39440	43480	2045 is when I said we will actually multiply
43480	46400	our intelligence millions fold.
46400	48160	And that's going to be true of everybody.
48160	51640	And we'll be able to get rid of terrible lives that we see
51640	54680	through poverty and lack of access to information.
55680	56680	Great.
56680	57680	Good morning.
57680	58680	Good morning to you.
58680	60680	It's great to be with you, Peter.
60680	62680	And also Salim.
62680	64680	I've done lots of presentations with Peter.
64680	69680	It's really remarkable what you've contributed.
69680	74680	So I just want to share a few ideas.
74680	78680	I've been following large language models
78680	80680	for almost three years.
80680	84680	There was Lambda, now barred from Google,
84680	87680	different GPT versions from OpenAI.
87680	92680	It seemed to me that a huge revolution was going on.
92680	93680	Now it's changed.
93680	97680	OpenAI changed GPT-3 to chat GPT.
97680	100680	It was the fastest growing app, I believe, in history
100680	102680	with over 100 million users within the first two months
102680	104680	of its launch.
104680	107680	And lots of other companies, particularly Google,
107680	110680	are introducing Google Just Introduce Barred,
110680	112680	I think, a few days ago.
112680	117680	OpenAI has also introduced GPT-4.
117680	120680	Without going into comparison with these LLMs,
120680	122680	because it changes like every day,
122680	125680	I can write things in one style and ask
125680	129680	it to re-articulate it in the style of Shakespeare,
129680	133680	E.E. Cummings, any other poet or writer.
134680	137680	The results are amazingly impressive.
137680	141680	In my opinion, this is not just another category of AI.
141680	146680	To me, it's as significant as the advent of written language,
146680	149680	which started with cuneiform 5,000 years ago.
149680	152680	You remember using cuneiform 5,000 years ago.
152680	156680	Homo sapiens evolved in Africa 300,000 years ago.
156680	159680	So for most of that history, we had no ways
160680	163680	of documenting our language.
163680	168680	In the past century, we've added to written language.
168680	171680	We've added word processes and other means to help us.
171680	174680	But this latest breakthrough allows us to creatively
174680	177680	create written language based on the LLMs'
177680	179680	own understanding.
179680	183680	It's going to go in all directions and at a very high speed.
183680	185680	I mean, just look at it in the last two years.
185680	187680	It's been unbelievable.
187680	189680	It's going to change everything we do.
189680	191680	You can write code perfectly.
191680	196680	You can convert code into human terms, deal with all languages,
196680	200680	different styles of communicating, and so on.
200680	203680	It's been already very extensively used to create answers
203680	205680	for subtle questions.
205680	211680	So I actually took a couple of the top LLMs,
211680	213680	and I asked the various questions like,
213680	216680	how do my views of consciousness relate to those
216680	219680	of Marvin Ninsky, and how do they compare?
219680	222680	Now, that's kind of a subtle question.
222680	225680	I'm not sure I've actually ever read anything
225680	228680	that answered that question.
228680	232680	I asked LLMs from Google and from OpenAI.
232680	235680	The answers were really quite remarkably subtle,
235680	240680	very well stated, and they were not copied from anywhere else.
240680	244680	Now, many people are concerned that large language models
244680	248680	may promote ideas that are not socially appropriate,
248680	252680	that engender racism or sexism and so on.
252680	256680	It's definitely very worthwhile for us to study this
256680	258680	that may happen from time to time,
258680	262680	but I've actually used LLMs probably close to a thousand times.
262680	265680	I've actually not seen anything that could be categorized that way.
265680	267680	Maybe it's the way I asked the question.
267680	269680	It also seems pretty accurate.
269680	272680	The only mistake it made is that I thought my son,
272680	274680	Ethan, went to Harvard as an undergraduate.
274680	276680	He actually went there for an MBA.
276680	280680	I've written a new book, which I've talked about for years.
280680	283680	The Singularity is Nearer.
283680	285680	It should be out in about a year.
285680	288680	I keep writing because literally every week that we can't come
288680	291680	out with this without covering this,
291680	293680	but that's been happening now every few days.
293680	295680	So I finally had to give up on that.
295680	298680	By the time it comes out, it'll be out of date,
298680	300680	but it's not just covering today.
300680	302680	It's covering what's how we got here
302680	305680	and what will happen in the near future.
305680	311680	Critics of AI very often show how large language models
311680	313680	may not be perfect.
313680	315680	There was one recently said,
315680	320680	well, it can't, if you put mathematics inside language,
320680	321680	it doesn't do that correctly.
321680	323680	But now within a year of saying that,
323680	325680	that's no longer true.
325680	331680	So one of my themes, and this is also true of Peter and Salim,
331680	333680	has been the acceleration of progress
333680	335680	in information technology,
335680	338680	but also everything that we work on.
338680	340680	So here's a chart.
340680	342680	I actually came out with this.
342680	348680	For each year, the best computer that provided
348680	351680	the amount of computations per second.
351680	354680	And it's pretty much a very straight line
354680	357680	on an exponential growth.
357680	360680	And people were not even aware of this.
360680	363680	I mean, I came out with this graph 40 years ago.
363680	367680	It's 40 years after the progress of the computer.
367680	370680	I mean, I came out with this graph 40 years ago.
370680	373680	It's 40 years after the progression started.
373680	376680	And I've been updating it ever since.
376680	379680	People very often call this Moore's Law.
379680	382680	I really believe we shouldn't do that anymore
382680	384680	because there's nothing to do with Moore's.
384680	387680	I mean, this started decades before Intel was even created.
387680	390680	It's been going on for 40 years before anyone even
390680	392680	knew it was happening.
392680	394680	If you go to the bottom left,
394680	400680	the first programmable computer was the ZUSA 1, 1941.
400680	409680	It performed 0.0007 calculations per second per dollar.
409680	411680	ZUSA was a German.
411680	415680	It was not a fan of Hitler, but it was shown to Hitler.
415680	418680	And some people were excited about getting behind this,
418680	420680	but they didn't get behind it.
420680	423680	They saw no military value to computation.
423680	427680	A big mistake for them, among a lot of other mistakes.
427680	430680	The third computer on here is the Colossus,
430680	433680	created by Alan Turing and his colleagues.
433680	437680	Now, Winston Churchill felt that this computer would be the key
437680	440680	to winning World War II, and that was true.
440680	443680	They got totally behind the Colossus computer,
443680	447680	and they used it to completely decode Nazi messages.
447680	451680	So everything that Hitler knew, Churchill also knew.
451680	455680	And so even though the Nazi air power was actually several times
455680	459680	that of the British, they used the Colossus to win the battle
459680	463680	of Britain anyway with this computer and provide the allies
463680	466680	with a launching pad for its D&A invasion.
466680	469680	So if you go along this chart, there are many stories
469680	472680	behind all the computers on this chart.
472680	475680	It almost looks like someone was behind this exponential trend,
475680	477680	like someone's following it.
477680	479680	Okay, we're at this point now.
479680	481680	We're here for the next year.
481680	485680	But for the first 40 years, no one even knew this was happening.
485680	487680	It just happened.
487680	490680	That's the nature of exponential growth.
490680	492680	And this is just one example of exponential growth.
492680	495680	It's not that everything comes from this graph.
495680	497680	This graph just shows you one example
497680	501680	of how technology expands exponentially.
501680	506680	And whether we're aware of it or not.
506680	509680	So exponential growth impacts everything around us,
509680	512680	including everything that we create.
512680	520680	And I projected that this would continue in the same direction
520680	522680	that I noticed 40 years ago.
522680	525680	And as you can see, it's done that.
525680	531680	It's gone from telephone relays to vacuum tubes to transistors
531680	533680	to integrated circuits.
533680	536680	As I mentioned, people have called this Moore's Law,
536680	538680	but as I say, that's not correct.
538680	541680	It started decades before Intel was even formed.
541680	546680	Of the 80 best computers in terms of computations per second per dollar,
546680	551680	only 10 of these out of 80 have anything to do with Intel.
551680	556680	Now, every five years, people were going around saying Moore's Law is over.
556680	560680	You might remember that this started when the COVID pandemic started
560680	563680	just a few years ago, people were saying Moore's Law is over.
563680	566680	And of course, I went around saying that it should not be called Moore's Law,
566680	571680	but regardless of that, whether Intel chips were the best value or not,
571680	576680	this exponential progression has never stopped.
576680	580680	Not for World War II, not for recessions, not for depressions,
580680	582680	or for any other reason.
582680	588680	It's gone for 80 years from .0007 calculations per second per dollar
588680	592680	to now .50 billion calculations per second per dollar.
592680	596680	So you're getting a lot more for the same amount of money.
596680	601680	And it's only in the last three years that large language models have been feasible.
601680	604680	So people believe that neural nets were effective decades ago,
604680	609680	did so really based on their inclination, not any evidence.
609680	614680	I've been in the field of AI for 60 years.
614680	618680	It's quite amazing, like where does the time go?
618680	620680	I was 14.
620680	623680	I met Marvin Minsky who was in his 30s.
623680	628680	Frank Rosenblatt created the Perceptron, the first popular neural net.
628680	637680	As far as I'm aware, I don't think anyone else has 60 years experience or more in AI as I've had.
637680	640680	But if you've been there for more than that, let me know.
640680	643680	I have a lot of stories about that.
643680	648680	But in the early years, it was really not clear that neural nets could do anything successful.
648680	653680	And they're showing now that this is really the path to artificial general intelligence.
653680	659680	We will have large language models that can understand lots of different types of written language,
659680	663680	from formal research articles to jokes and so on.
663680	667680	They're now mastering mathematics within the language.
667680	672680	They can code and do so perfectly and at very high speed.
672680	679680	Now, this obviously brings up, not just that, but all the things it can do brings up concerns about its effect on human employment,
679680	682680	which we were just talking about.
682680	687680	But employment is really not necessarily the best way to bring resources to human.
687680	689680	I mean, look at around the world.
689680	696680	France is now dealing with protests because they're adding a couple of years before people can access their retirement.
696680	700680	It tells me that people really don't like the jobs they do for employment.
700680	702680	So that's, I think, a difference.
702680	706680	We'll actually be able to do what we are really cut out to do.
706680	712680	And in my opinion, it's not just us versus AI and people say, well, how are we going to compete with AI?
712680	720680	The intelligence that we're creating is adding AI to our own brains, just the way our phones and computers do already.
720680	724680	This is not an alien invasion of intelligent machines coming from Mars.
724680	730680	I mean, how many people here have come to this meeting without your phone?
730680	732680	It's already part of our intelligence.
732680	734680	We can't leave home without it.
734680	740680	It ultimately will be automatically added to our intelligence and it already is.
740680	746680	I'll add one more AI topic and I'm sure we'll get into a lot more doing the questions and answers.
746680	751680	But something else that's also extremely exciting, which is simulated biology.
751680	753680	This has already started.
753680	764680	The Moderna vaccine was created by feeding in every possible combination of mRNA sequences and simulating in the computer what would happen.
764680	771680	They tried several billion of such sequences and they went through them all and seeing what the impact would be.
771680	775680	It took two days to process all several billion of them.
775680	777680	And then they had the vaccine.
777680	779680	It actually took two days to create.
779680	783680	It's been the most successful COVID vaccine.
783680	785680	And we did test it with humans.
785680	787680	We're going to get over that as well.
787680	792680	We're ultimately going to be used biological simulation of humans to replace human testing.
792680	800680	I mean, rather than spending a year or several years testing results on a few hundred subjects, none of which probably match you.
800680	807680	We will test it on a million or more humans simulated humans in just a few days.
807680	818680	So to cure cancer, for example, we'll simply feed in every possible method that can detect cancer cells from normal cells and destroy them or do anything that would help us.
818680	819680	And we won't evaluate them.
819680	824680	We'll just feed in all the ideas we have about each of these possibilities into the computer.
824680	835680	The computer will evaluate all of the many billions of sequences and provide the results will then test the final product with simulated humans also very quickly.
835680	838680	And we'll do this for every major health predicament.
838680	842680	It will be done a thousand times faster than conventional methods.
842680	851680	And based on our ability to do this, we should be able to overcome most significant health problems by 2029.
851680	855680	That's by the way, my prediction for passing the Turing test.
855680	857680	I came out with that in 1999.
857680	861680	People thought that was crazy that Stanford had a conference.
861680	866680	Actually, 80% of the people came didn't think we would do it, but they thought it would take 100 years.
866680	870680	They keep polling people.
870680	878680	And now everybody actually thinks that we will actually pass the Turing test by 2029.
878680	883680	And actually to pass the Turing test, meaning it's equivalent to humans, we're actually going to have to dumb them down.
883680	889680	Because if it does everything that a computer can do, we'll know it's not a human.
889680	901680	But this will lead people who are diligent about their health to overcome many problems, reaching what I call longevity escape velocity by the end of this decade.
901680	903680	Now, this doesn't guarantee living forever.
903680	910680	I mean, you can have a 10 year old and you can compute their life expectancy, whatever, many, many decades, and they could die tomorrow.
910680	913680	So it's not a guarantee for living forever.
913680	918680	But the biggest problem we have is aging and people actually die from aging.
918680	922680	I actually had an aunt who's 97. She was a psychologist.
922680	928680	And she actually was still meeting with her patients at 97.
928680	931680	And the last conversation I had with her, she's saying, well, what do you do?
931680	934680	And I said, well, I give lots of speeches and what do you talk about?
934680	936680	And I said, longevity escape velocity.
936680	937680	Oh, what's that?
937680	938680	And I described it.
938680	947680	And the very last thing she said to me, this longevity escape velocity, could we do that a little faster than you're doing it now?
948680	953680	So anyway, I look forward to your questions and comments.
953680	955680	And it's really delightful to be here.
955680	956680	Thank you, Ray.
956680	957680	All right.
960680	964680	I'm going to take privilege and ask the first question. Ray, we've seen LLMs.
964680	971680	What's the next major breakthrough that you expect to see on the road of evolution of AI?
971680	976680	Well, LLMs, I mean, they do remarkable things.
976680	978680	But it's really just the beginning.
978680	983680	I mean, the very first time I saw an LLM was three years ago, and it actually didn't work very well.
983680	986680	Every six months, it's completely revolutionary.
986680	991680	So it's going to give us new ways of communicating with each other.
991680	998680	And as I said, I think it's the biggest advance since written language, which happened 5,000 years ago.
999680	1006680	I mentioned advancing longevity escape velocity, doing simulated biology.
1006680	1007680	We've actually done that.
1007680	1011680	People are taking this test, which was done with simulated biology.
1011680	1013680	Lots of people are going into this.
1013680	1017680	It's a way biology is going to be done.
1017680	1024680	And we're going to see amazing progress starting, really, I'd say, in a few years.
1025680	1027680	It's going to do everything that we do.
1027680	1030680	But as I said, it's not competing with us.
1030680	1033680	I mean, we're creating these tools to overcome ourselves.
1033680	1039680	And I mean, how many people today have a job that was common 100 years ago?
1039680	1043680	I mean, 200 years ago, 80% of the American public were working in farming.
1043680	1045680	Today, that's 2%.
1045680	1050680	So we're all doing things that didn't even exist even 10 years ago.
1050680	1054680	So we're going to be doing amazing things, harnessing our computers.
1054680	1057680	They're really part of ourselves.
1057680	1058680	Great.
1058680	1059680	Harry.
1059680	1060680	Hey, Ray.
1060680	1061680	Good to see you.
1061680	1068680	So Ray and I have been collaborating for actually probably 20 years on something else,
1068680	1072680	not natural language programming, but humanoid robots.
1072680	1075680	Ray, I wanted to get your opinion.
1075680	1082680	So at Beyond Managed Nation, we're creating AI powered robots called Beomni.
1082680	1089680	And we have a lot of discussions about AI for natural language, for images.
1089680	1096680	Where do you see AI and humanoid robots going in the future to impact physical work?
1096680	1097680	Yes.
1097680	1099680	That's a very good comment.
1099680	1102680	I'd be very pleased to hear of your amazing progress.
1102680	1109680	I mean, you have a robot that can actually take something and actually flip a cap off
1109680	1110680	a jar.
1110680	1114680	No one else can do that.
1114680	1118680	We've not made as much progress in this area.
1118680	1123680	We can do fantastic things with language, but if I give you a table that has where you
1123680	1129680	need to put it in the dishwasher and now went to wash out dishes and so on, we have not
1129680	1131680	been able to do that.
1131680	1133680	You're actually working on that.
1133680	1137680	And I think that's going to be amazing with these types of robots.
1137680	1140680	You could send someone into a burning building and save people.
1140680	1147680	You could have a surgeon in New York perform surgery on somebody in Africa.
1147680	1151680	So we're going to actually master the human body and how we move.
1151680	1155680	And we're going to be using neural nets to do that.
1155680	1160680	And I think that's another thing we're going to see really starting now.
1160680	1163680	And it will be quite prevalent within a few years.
1163680	1167680	Over the years, I've experimented with many intermittent fasting programs.
1167680	1173680	The truth is I've given up on intermittent fasting as I've seen no real benefit when
1173680	1174680	it comes to longevity.
1174680	1180680	But this changed when I discovered something called Prolon's five day fasting nutrition
1180680	1181680	program.
1181680	1183680	It harnesses the process of autophagy.
1183680	1188680	This is a cellular recycling process that revitalizes your body at a molecular level.
1188680	1194680	And just one cycle of the five day Prolon fasting nutrition program can support healthy
1194680	1198680	aging, fat focused weight loss, improved energy levels and more.
1198680	1199680	It's a painless process.
1199680	1202680	And I've been doing it twice a year for the last year.
1202680	1207680	You can get a 15% off on your order when you go to my special URL.
1207680	1215680	Go to prolonlife.com, backslash moonshot.
1215680	1219680	Get started on your longevity journey with Prolon today.
1219680	1221680	Now back to the episode.
1245680	1248680	What are some of the things you want to do to grow with AI?
1248680	1253680	Well, yes, I mean, we're going to be using these types of capabilities to learn.
1253680	1259680	One of the biggest applications of LLM is to help education.
1259680	1266680	In many ways, we're educating people the same way when I was a child or my grandparents
1266680	1267680	were children.
1267680	1270680	We really need to go beyond that.
1270680	1272680	We can learn from computers.
1272680	1273680	They know everything.
1273680	1276680	They can become very good at articulating it.
1276680	1283680	They can actually measure where a student is and help them to learn, overcome their
1283680	1284680	barriers.
1284680	1287680	And they're going to be then part of the solution.
1287680	1290680	Again, these computers is not something we need to compete with.
1290680	1294680	We need to know how to use them together.
1294680	1304680	And another big application of education is socialization, getting to learn other people
1304680	1305680	and make friends and so on.
1305680	1308680	So we're going to have to actually do that as well.
1308680	1310680	Computers can definitely help there.
1310680	1319680	But we're going to completely use large language models that are coming out very soon to really
1319680	1322680	revamp education.
1322680	1325680	Thank you.
1325680	1327680	Good morning, Ray.
1327680	1329680	I'm Yi Xiang Liu.
1329680	1331680	I'm from Texas.
1331680	1335680	Very much looking forward to meeting you today.
1335680	1337680	Thank you, Peter, for having me here.
1337680	1344680	My question to you is how do you predict the future with such accuracy?
1344680	1349680	Is it because you help to shape it and then deliver it?
1349680	1356680	Or you calculate the laws that other people don't, and then you can predict it?
1356680	1359680	So which one is actively shaping it?
1359680	1361680	Which part is missing?
1361680	1364680	That's a very good question.
1364680	1370680	I'll give you a very brief idea of how I got into what I'm doing.
1370680	1377680	My great grandmother actually started the first school that educated women to 14th grade.
1378680	1386680	In 1850, if you were able to get an education at all as a woman, it went through ninth grade.
1386680	1391680	And she went around Europe educating why we should educate women.
1391680	1393680	It's very controversial.
1393680	1395680	Why do you want to do that?
1395680	1401680	Her daughter became actually the first woman to get a PhD in chemistry in Europe.
1401680	1403680	She took over the school.
1403680	1406680	They ran it for 80 years called Sternschule in Vienna.
1406680	1409680	There's a book about it.
1409680	1411680	And she wrote a book.
1411680	1414680	Actually, the title of it would be very appropriate for one of my books.
1414680	1417680	It's called One Life is Not Enough.
1417680	1420680	But she wasn't actually talking about extending life.
1420680	1422680	She didn't have that idea.
1422680	1428680	But she noticed that one life really is enough to get things done.
1428680	1432680	So she showed me when I was six years old, she showed me the book.
1432680	1436680	And she showed me the manual typewriter that she created it on.
1436680	1439680	I got very interested in the book many years later.
1439680	1441680	At that time, I wasn't that interested in the book.
1441680	1445680	But I was amazingly interested in the manual typewriter.
1445680	1447680	I mean, here's a machine that had no electronics.
1447680	1449680	There's manual typewriter.
1449680	1454680	And it could take a blank piece of paper and turn it into something that looked like it came from a book.
1454680	1456680	So I actually wrote a book on it.
1456680	1458680	It was 23 pages.
1458680	1463680	It's about a guy that travels on the back of geese around the world and wrote it on the book
1463680	1469680	and actually created pictures by using the dot and X keys to create images.
