start	end	text
1050160	1052640	if there weren't algorithms to help us sort through
1052640	1055280	all of the content on social media platforms,
1055280	1057120	it would be impossible to wade through it.
1057120	1057760	And then additionally,
1057760	1059840	there is the issue of the material support
1059840	1062400	related for a claim under the Anti-Terrorism Act.
1062400	1065520	Now, the Department of Justice's brief in support of the plaintiffs
1066160	1068080	argues that algorithmic recommendations
1068080	1069840	convey the website's own implicit message
1069840	1072000	that users will find the information relevant,
1072000	1073360	and that makes the website liable
1073360	1076560	because it's acting just like ISIS itself.
1076560	1078880	Now, plaintiffs didn't claim this in their original complaint,
1078880	1081440	instead they focused on how YouTube's recommendations
1081440	1082800	amplify the ISIS speech,
1082800	1084800	making it more visible to more users.
1084800	1086480	But the US government urged the Supreme Court
1086480	1089200	to adopt a narrow reading of Section 230
1089200	1090800	that would permit a finding that Google
1090800	1092240	materially contributed to the content
1092240	1094400	by matching it to user preferences.
1094400	1096720	Again, basically, the Department of Justice,
1096720	1097760	as well as the plaintiffs,
1097760	1102480	are arguing for a standard that if any website promotes content,
1102480	1105680	uses an algorithm, or recommends content to users,
1105680	1107600	that that website then becomes liable
1107680	1111040	for all of the speech contained within that recommendation.
1111040	1113440	What happens when websites are liable?
1113440	1114720	Well, remember I mentioned
1114720	1117280	that this has actually happened before?
1117280	1118240	Well, it has.
1118240	1120720	In 2018, then President Trump signed into law
1120720	1123920	two bills making it easier to fight sex trafficking online.
1123920	1126240	That was the Fight Online Sex Trafficking Act
1126240	1129040	and the Stop Enabling Sex Traffickers Act,
1129040	1130800	otherwise known as FOSTA and SESTA.
1130800	1132560	And those two laws created an exception
1132560	1134320	to Section 230's Safe Harbor Rule
1134320	1137520	by stating that websites could be held legally responsible
1137760	1140320	if third parties posted ads for prostitution
1140320	1141360	on their platforms.
1141360	1142720	The law penalizes websites
1142720	1145680	which quote, promote or facilitate prostitution.
1145680	1148080	And while this includes sites that promote illegal sex work,
1148080	1151040	it also allows the police to investigate any site
1151040	1153440	that is knowingly assisting, facilitating,
1153440	1155040	or supporting sex trafficking.
1155040	1156880	This language can be read to include sites
1156880	1159680	with content that is legal, such as escort services,
1159680	1161520	personal ads, and pornography.
1161520	1163920	Now, critics of FOSTA and SESTA warned
1163920	1165520	that the new laws were too broad
1165600	1167600	and they would end up killing internet content
1167600	1169920	that has nothing to do with sex trafficking.
1169920	1171680	And they turned out to be correct.
1171680	1173520	If a third party posts content
1173520	1175840	that is covered by FOSTA or SESTA,
1175840	1178000	and the website fails to prevent that content
1178000	1180720	from being posted, that website can be sued.
1180720	1183760	And that was simply too much legal risk for several websites.
1183760	1186320	You should have gone for the head.
1188160	1191520	Craigslist shut down its entire personal section.
1191520	1193760	Tumblr banned all adult content
1193760	1195600	and Reddit removed several subreddits
1195600	1198480	and other websites just simply shut down entirely.
1198480	1200560	So you might ask, did any of this assist
1200560	1202880	with the prosecution of sex trafficking?
1202880	1206000	Well, in 2021, the U.S. Government Accountability Office
1206000	1209280	released a report on the first three years of FOSTA and SESTA
1209280	1211040	finding that quote, over three years,
1211040	1213520	the Department of Justice filed just one case
1213520	1215040	under its rules against promoting
1215040	1217200	or recklessly disregarding sex trafficking.
1217200	1219120	So ironically, this provided essentially
1219120	1221920	the perfect natural experiment to find out what happens
1222000	1225520	when websites are liable for the speech content of its users.
1225520	1226720	One of two things will happen.
1226720	1229120	Either the website shuts down that section
1229120	1230720	or shuts down the entire department,
1231360	1234160	or the website employs an army of moderators
1234160	1236960	to remove anything even remotely offensive.
1236960	1238560	You basically either live in a world
1238560	1242320	where a website allows everything, scams, spam,
1242320	1244800	pornography, ultraviolence,
1244800	1246800	just everything that you can possibly imagine
1246800	1249840	that you probably don't want to see in your everyday life,
1249840	1253040	or you live in a world where they employed
1253040	1255200	extremely expensive moderators
1255200	1258000	who prevent anything that might possibly be offensive.
1258000	1259280	And that of course assumes that a website
1259280	1261760	can even afford to employ those moderators.
1261760	1263520	So there are those who want to see
1263520	1265760	section 230 modified or scrapped altogether
1265760	1267600	and have argued that these online services
1267600	1269440	are acting like content developers.
1269440	1271200	Now oral argument in front of the Supreme Court
1271200	1273120	is next week, and I'm putting my money
1273120	1274480	where my mouth is on this one.
1274480	1276000	I filed a brief in the Supreme Court,
1276000	1278000	along with Dr. Mike, Mythical Entertainment,
1278080	1280720	Chubby Emu, Tim Schmoyer, and The Author's Alliance,
1280720	1282400	and a bunch of other creators.
1282400	1284160	We filed an amicus brief explaining
1284160	1285840	the potential dire consequences
1285840	1287120	of a really bad ruling on this.
1287120	1288480	So we'll see how it goes.
1288480	1289280	But in the meantime,
1289280	1290960	I'll probably just be stress eating
1290960	1292160	at the end of the internet.
1292160	1294400	Unless I use today's sponsor, Factor 75,
1294400	1296560	because Factor makes meeting your nutrition goals
1296560	1298080	easier than ever by delivering fresh,
1298080	1300000	never-frozen, dietitian-approved meals
1300000	1300880	right to your doorstep,
1300880	1302880	and the meals are completely ready to eat.
1302880	1304560	Another team of gourmet chefs creates
1304560	1306400	each meal using ingredients with integrity
1306400	1308080	to help you feel your best all day long.
1308080	1309920	And I can tell you from experience,
1309920	1311920	they really are extremely delicious.
1311920	1313920	Factor supports wholesome eating, made simple.
1313920	1315280	Their menus are updated weekly
1315280	1316960	with 34 different options.
1316960	1318160	Choose your favorite meals,
1318160	1319680	or let Factor craft the order
1319680	1321840	based on your taste preferences in meal history.
1321840	1323680	Factor takes the guesswork out of grocery shopping
1323680	1324240	and meal prep,
1324240	1326240	saving you time and energy for other things.
1326240	1327920	There are no hassle-prepared foods.
1327920	1330720	Make sure you always have something nutritious on hand
1330720	1332960	when you don't have time to think about making a meal.
1332960	1335280	And sometimes I just want a good, healthy meal
1335280	1336560	without having to cook,
1336560	1338720	or obviously shop for the ingredients.
1338720	1340400	And Factor's meals arrive preprepared
1340400	1341920	and ready to eat in just two minutes.
1341920	1343120	And I can always scale up my meals
1343120	1344800	if I need the extra energy
1344800	1346320	after a long day of lawyering.
1346320	1348720	So give Factor a try by heading to Factor75.com
1348720	1350560	and use the code LegalEagle50
1350560	1353040	to get 50% off your first Factor box.
1353040	1355200	Or just click on the link that's on screen right now
1355200	1356240	or down in the description
1356240	1357920	and use the code LegalEagle50
1357920	1360240	to get 50% off your first Factor box.
1360240	1362400	And clicking that link really helps out this channel.
1362400	1363840	And after that, click on this box over here
1363840	1364800	for more LegalEagle,
1364800	1366480	or I'll see you in court.
