start	end	text
1611620	1619020	you spend your loony at Tim Hortons or any other thing in our daily lives, every
1619020	1625140	time we spend something, it's a call on energy. Economic textbooks tell us that
1625140	1631780	money is lent out from existing capital at banks. This is incorrect. The reality is
1631780	1637140	is that the vast majority of money is lent into existence. Banks don't lend
1637140	1643020	money. They create it. And when they create it, the financial system is in
1643020	1648020	balance. There's the same amount of assets and liabilities. But the bio
1648020	1653580	physical world is not because when 10 million Canadian dollars come into the
1653580	1659460	system from a bank, the same amount of timber or moose or copper or dolphins or
1659460	1667340	trees exist. So here's a conceptual showing from time from left to right
1667700	1674300	that we had sustainable flows of the biogeochemical use of nature, the soil,
1674300	1681300	the sun and the wind. And in around the 1700s, we hit a capacity on that. There's
1681300	1686580	a different sort of curve, which is a Gaussian or normal curve, which is for
1686620	1691620	finite resources. And we started to access things like oil and copper and
1691620	1695620	coal. These were buried underground, but they're finite. And we started to add
1695620	1699900	them to our economic system. But there will be a peak and a decline of these
1699900	1705540	like their will on the carbon pulse. Overlaid on all that is a monetary thing,
1705540	1710540	which is a cultural creation by our species that we create monetary markers
1710540	1715780	for all this stuff. And if you put all these three things together, they create
1715780	1720220	this little graphic. And with access to these, this ancient sunlight, which is
1720460	1725620	indistinguishable from magic on human time scales, our economic system grew so
1725620	1730020	fast and large that land no longer explained our wealth. And gradually,
1730020	1734740	the economics profession parsed our explanations into capital and labor.
1735380	1741300	And using the social construct of credit, which is largely run by central banks
1741300	1746460	in the world right now, we pulled resource consumption forward in time. Now
1746460	1752020	our world views our future and our culture through a financial lens. We have
1752020	1756580	not only financialized the human experience, but also the explanation of
1756580	1762580	it. Okay, that's the energy material tech part of the story. Now, what about
1762580	1768100	the environment? What about the pollution that comes from our economic system?
1769100	1774380	This could be its own two hour talk, but I'll just give the highlights right
1774380	1780140	here. It's not just climate, but there are many aspects that the human system
1780140	1787580	is affecting the natural world. This shows the last 400,000 years of CO2 in
1787580	1791860	the atmosphere shown in green, global temperatures shown in the middle panel
1791860	1798100	in red, and sea level rise shown in the bottom in blue. We have already had
1798100	1803580	400 feet of sea level rise in the last 20,000 years, and we are in uncharted
1803580	1810100	territories from any time before the emion. We are now going into a warmer
1810100	1815020	period than at any time when humans lived on this planet. And I could argue
1815020	1820580	that humans are changing climate today, but climate change actually caused
1820620	1826900	humans. The red chart in the bottom is expanded here in the last 20,000 years.
1827900	1834060	Around 15,000 years ago, the climate warmed and stabilized, unbelievably
1834060	1838580	stable for the last 10,000 years, which is when we expanded around the world
1838580	1843780	with agriculture and settlements and hierarchy and technology, etc. And now
1843780	1848140	we're moving out of that stable band into the unknown. The only known is
1848140	1853580	it's barring a nuclear holocaust. It's likely to be warmer to much warmer.
1853780	1860340	So this carbon pulse that we are living through, yet it's invisible to us, is
1860340	1867060	really distinctly important because many, most of the prior mass and many
1867060	1873820	extinctions were correlated with carbon pulses. The blue spikes here show the
1873820	1878500	percentage of the genus level extinctions on Earth over the last
1878500	1884780	300 million years. And the magenta bars are when there were large outgassings
1884780	1892220	of volcanic provinces that were near term pulses of carbon. And this ended up
1892220	1898100	being disastrous for species on the planet. Unlike most mass extinctions
1898100	1903780	linked to volcanic pulses, our pulse is not from volcanoes, but from Volkswagen's
1903820	1910340	and vacations and deforestation and other things. This is a monthly graph of
1910340	1915860	the temperature anomaly from the pre-industrial baseline. You can see
1915860	1924700	that many of the hottest divergences are this year, 2024. One could argue that
1924700	1928860	this would be the coolest year of the rest of your lives. I'm not sure that's
1928860	1935220	entirely valid because this is an El Nino year, but you can see that the heat
1935260	1941420	is on. Part of the climate discussion that is not often discussed is the impact
1941420	1945780	on oceans and there are many, many ocean risks. There's ocean acidification.
1946180	1954380	There is the erosion of coastlines since the sea level is going to rise as the
1954420	1961660	glacier and ice melts. There's overfishing. There is the loss of some calcium
1961660	1967580	carbonate in shells. There's the impact on food webs. Ocean oxygen content is
1967580	1974820	already declined by 2% and 20% in the shallows. There are many, the AMOC, the
1974820	1978980	Atlantic Meridional Overturning Circulation in the Atlantic Ocean, has
1978980	1985340	slowed already 15%. This is all because the oceans are absorbing 90% of the
1985340	1992300	heat from the extra thermal warming from fossil fuels. Beyond climate itself
1992340	1996380	and climate is the key because it affects all the other things I'm talking
1996380	2001140	about, we neglect our impact on the other 10 million species we share this
2001140	2007620	planet with, what I refer to as the real stock market. Since I was born, we have
2007620	2014340	lost almost 70% of the animal populations on this planet and it's
2014340	2018460	probably worse than that because that's status is six years old. We don't see
2018460	2025100	that that much in North America because we've only lost 25% here, but in Asia
2025100	2031100	and Latin and South America, it's much more extreme. This chart shows on the
2031100	2037780	left the estimated biomass of wild animals 100,000 years ago relative to
2037780	2044220	the orange of wild animals today, relative to the light pink, which is our
2044220	2050580	cows, pigs and sheep and humans. So humans in our livestock now outweigh wild
2050580	2056260	mammals at a ratio of 50 to 1. It's not only animals, insects are declining at
2056260	2062260	1 to 2% a year in biomass. This is trillions of tiny robots doing tasks
2062260	2067300	humans couldn't do without them that we take for granted. Birds eat insects.
2067580	2072380	Birds are also declining. These are Canadian statistics here showing the
2072380	2078260	percentage decline of various types of birds. One thing that's increasingly in
2078260	2083540	the media is the impact not only of plastics like plastic bottles and the
2083580	2089500	fact that plastic now outweighs all animals on earth and will eventually
2089500	2094220	outweigh all the fish in the ocean, but microplastics. There's something called
2094220	2099260	PFAS, which is a forever chemical. We don't, scientists don't really understand
2099500	2105780	the endocrine disrupting impacts. However, sperm count in humans and in other
2105780	2110980	animals is declining at an accelerated pace globally. Sperm count is dropping at
2110980	2117580	around 2.5% a year. Right now, one couple in seven cannot have a baby because
2117580	2122660	of lack of sperm motility. And that's shocking. But what's even more shocking
2122660	2127220	is 20 years ago, it was zero in seven. And there are some estimates by 2050
2127220	2132300	under current trends that we won't be able to have babies. Okay, that's a
2132300	2136580	pretty rugged little summary I went through there. And it's as many times as I
2136580	2140700	say it, I still get kind of a pit in my stomach as I'm sharing this with
2140700	2145340	strangers online, because many of you are aware of those things. But if you
2145340	2149660	haven't heard those things before, it can feel like a punch to the gut. And I
2149660	2155460	will just empathize with you that that is a normal, totally acceptable reaction.
2155500	2160020	And if that is your reaction, I offer you a brief apology, but these are the
2160020	2163340	times we're alive. This is why I'm sharing this stuff, because I think most
2163340	2168060	people, more people need to understand and engage with these issues. Okay, let's
2168060	2173940	moving on to the core driver of this stuff, which is the human human behavior,
2174300	2181620	starting with our feelings. So we are related to every single other creature
2181620	2187380	on earth. We share a common universal ancestor. If you look on the tree of
2187380	2193100	life, there's humans way down here in the corner. We're 99.9% related to all
2193100	2198460	other humans, including Canadians, were 98% related to other apes, bonobos and
2198460	2204940	chimpanzees, 90% related to cats, 85% genetically related to mice, 80% to
2204940	2211740	cows, 60% to fruit flies, 60% to chickens, and we are 50% genetically related to
2211740	2216300	mushrooms. We are kin with everything else on this blue green earth. And we
2216300	2221940	often forget that. We go through our life, like other biological organisms,
2221940	2228260	trying to match the same emotional states of our successful ancestors. So
2228260	2234020	bagging a gazelle on the Pleistocene savanna. Today we make a stock trade or
2234020	2241620	make a Bitcoin profit and with the same areas in our brain light up. Humans are
2241620	2247540	intensely social and status conscious. This has to do with the concept of sexual
2247580	2254980	selection in nature, which in the case of a peacock, this giant ornate tail has
2254980	2261260	three fitness hits to the peacock. It is a cost of all its minerals and
2261260	2266580	calories going to this tail. It makes it more apparent and obvious to a predator
2266580	2271300	and if a predator chase it, it's harder to get away. All three of those were
2271300	2276900	overcome by the preference from the female peacock for such a display. And
2276980	2281060	are we that different than this? This picture here shows Tiger Woods, who's a
2281060	2286740	billionaire, his yacht pulling into a marina where his ex-wife's boyfriend's
2286740	2293220	yacht is 10 feet longer than his. So we constantly compare ourselves to others
2293220	2301300	at various scales, planet wide. We also have neural circuitry that hijacks our
2301300	2306500	ancestral reward system and tricks us into thinking that the things we're
2306500	2312020	doing are actually good for us and good for our status and our respect in our
2312020	2317860	tribe. For instance, some students may be watching this presentation, might play
2317860	2325380	Overwatch or some video game and their brains feel like they're bagging a
2325380	2329940	gazelle for their tribe, but they're actually sitting in a couch in their mom's
2329940	2335060	basement accessing a coal-fired server. The dopamine superhighway is really
2335060	2339700	central to planetary overshoot and our consumption because what ends up
2339700	2344580	happening, shown in this graph, there's academic research reference on the
2344580	2350660	bottom, that we get the signal and the signal causes the behavior and we do
2350660	2355380	the work and then we get the reward. We don't get the dopamine when the reward
2355380	2360340	happens, but before it's the anticipation of reward. But what ends up
2360340	2365060	happening in our culture is energy has become so cheap and we have such a
2365060	2370100	smorgasbord of consumption that our work and our behavior is disconnected from
2370100	2374020	the reward because we get reward all over the place all the time without doing
2374020	2379860	the work. So we end up in a situation and this is a picture of my storage shed
2380580	2387220	where the ghost of dopamine past ends up buying things constantly and the
2387220	2393220	wanting of things ends up being a more powerful driver of our behavior than
2393220	2397220	the having of them. All of you go home this weekend and look in your
2397220	2402660	garage, in your storage shed, etc. We got short-term dopamine hits for those
2402660	2407540	purchases, but they weren't sustainable and we had to buy more to feel the
2407540	2413300	same way at some point in the future. So important point, our brains are flow-based,
2413860	2419380	but our world, our economic system is stock-based and we're driving down the
2419380	2425460	stocks of non-reluable energy and resources millions of times faster than
2425460	2430500	they were built up in order to get ephemeral dopamine. In effect, we're
2430500	2435940	turning billions of barrels of ancient sunlight into microliters of neurotransmitters.
2435940	2442100	We also have different belief systems and the human brain can utter millions of times
2443140	2449460	more sentences than can exist in biophysical reality. So the virtual world in our minds
2450500	2456420	is really more powerful than our biophysical reality and this is why science in the academy
2456900	2464100	are hopefully can play a vital role in our path going forward because science is
2464100	2470900	a light in the dark and can distinguish fantasy from reality. It's the best tool that we have.
2472420	2480180	We are incredibly in-group and out-group oriented. We quickly and strongly form groups and we defend
2480180	2485620	and support our group and tend to ostracize and root against others. Groups could be a few people
2485620	2491860	or they could be nation-state size. Shown here is Canada beating the U.S. in hockey.
2493060	2501380	We are very social. We're ultra-social so our behaviors are plastic but we copy other humans
2501380	2507620	and this is good news because cultural evolution happens at lightning speed versus biological
2507620	2515460	evolution. Okay so those are the the primary drivers of the human ecosystem. How do those
2515460	2520980	fit together? How does the whole system fit together into a narrative that explains our
2520980	2527780	current reality? I'm sure you've seen starlings in nature. Starlings follow three simple rules.
2527780	2534500	Do what your neighbor does. Don't get too close and fly towards the center. Those three simple
2534500	2541460	rules result in this emergent behavior of these beautiful murmurations of birds in the sky that
2541460	2547620	look like they're choreographed but they're not. It's an emergent property. Humans do something
2547620	2554260	similar. In our current world importantly this is not the way that it always was and it's not the
2554260	2561860	way that it has to be in the future but we coordinate in our families, in our small businesses,
2561860	2569940	in our corporations, even as entire nations to acquire financial surplus which is linked to energy.
2569940	2576420	We spend the surplus and we pursue culturally accepted behaviors. The emergent property of that
2576420	2586820	is this vast interconnected material and energy hungry system of human habitation and commerce
2586900	2593300	across the planet. If you look at this, the brake lights and the headlights in this aerial view of a
2593300	2600900	city are not biophysically too dissimilar than the veins in the arteries of a human body and the
2600900	2606820	hemoglobin that is being passed through these veins and arteries is gasoline and diesel fuel
2606820	2613540	from oil and we have a global transport system. This is the airline routes through the earth.
2614420	2620740	So our culture keeps score of this system by gross domestic product. If you add up all the
2620740	2629620	countries in the world it's gross world product. Well GWP given the 99% correlation between energy
2629620	2639460	and GDP could rightly be named gross world burning because energy and GDP are and will remain tightly
2639460	2647700	linked. So my economic research, my academic research has likened human culture to an energy
2647700	2656500	dissipating structure, a mindless superorganism akin to a blind hungry amoeba. So human society
2656500	2663860	has a metabolism and metabolism has a waste product in the form of CO2 and other things.
2664580	2671940	So the global north has been trying to go to renewable energy, getting rid of coal although
2671940	2677940	we're still using natural gas, but the developing world especially China and India are growing
2677940	2685300	as much energy as they can. So since the 2015 Paris Agreement we actually have a global increase
2685300	2691860	in coal use. China is building six times more new coal plants. India plans to double their coal
2691860	2696740	production. They are aware of climate. India is going to be one of the most susceptible countries
2696740	2700900	to climate. The reason they're doubling their coal is because it's the cheapest thing that they can
2700900	2707620	do and they need more air conditioning and fans. So trying to mitigate climate change within our
2707620	2714580	existing economic structure is like arguing with a forest fire. This is an uncomfortable conclusion
2715380	2721300	but it's one that I've come to believe. There is no one driving the bus of our economic system,
2721300	2729220	not politicians, not billionaires, not the rich and powerful. The market is pulling us forward
2729220	2734980	and we have outsourced our wisdom and decision making to the financial markets. So this is kind
2734980	2742020	of a metaphor from Lord of the Rings, the Tower of Sauron. I've graphically shown here the history
2742020	2749620	of humans and technology. Shown in the bottom is we left our hunter-gatherer ancestry and started
2749620	2756260	to produce agriculture which created agricultural surplus which we could trade. We had hierarchy
2756260	2762980	then. We had mayors and kings and artisans and warriors and accountants and then a couple hundred
2762980	2770020	years ago we accessed the power in flammable fossils and then we turbocharged this faster by
2770580	2776420	creating fiat currency that were markers for real things and we accelerated the whole thing
2776500	2783620	and now we're using artificial intelligence to make all these processes even faster and this whole
2783620	2792740	thing is this Borg or this Eye of Sauron pulling this economic system forward and it's my opinion
2792740	2798420	and there's ample evidence in the last few months to underpin this is under our current
2798420	2805540	economic aspirations and goals which are of course fluid in our lifetimes. Artificial intelligence
2805540	2812180	is going to much like shale fracking act as a larger draw on the energy in the environment and
2812180	2817940	that doesn't include it doesn't focus only on how much energy the servers are. Today a news story
2817940	2823700	came out that said that just the data servers alone in the United States are going to use as much
2823700	2831700	energy between now and 2030 as 150 million electric vehicles. That's not the point. The point is that
2831780	2836660	AI is going to make energy extraction. It's going to make alternative energy. It's going to make
2836660	2843380	all the processes in our world more efficient potentially and all of that is going to accelerate
2843380	2848260	impact on the environment. Okay we're getting nearer to the conclusions of this part one.
2849140	2852740	Under the framing that I presented here what is not likely to happen?
2853380	2857780	Growing the economy and mitigating climate change and the six mass extinction.
2858580	2863860	Growing the economy by replacing fossil fuels with renewables we're actually adding.
2864740	2871460	Culture en masse choosing to leave fossil carbon in the ground and governments embracing limits
2871460	2877940	to growth before limits to growth are well past. Under this framing what is likely to happen?
2877940	2884340	A growth in gross energy while net energy declines. Massive money creation and financial
2884340	2890980	market support by central banks and governments. Wider and deeper poverty globally and more inequality.
2891700	2897780	AI is going to accelerate the energy and environmental problems unless we shift our goals.
2898580	2905860	A right word shift in politics because as things get scary and uncertain people tend to get more
2905860	2911540	conservative and want ways things to be the way they used to be in the past. This is happening
2911540	2917780	rapidly in Europe. We're yet to see what's going to happen in North America. A reduction paradoxically
2917780	2923140	in global environmental regulations and under the superorganism framing it's going to be
2923140	2929860	pedal to the metal until we hit some sort of a crisis or hit a wall. Implications and scenarios
2930420	2938420	of all this. So there are generally four scenarios that are discussable. One is a green growth future
2938420	2944500	that we use technology and create more productivity in the world and we become
2944500	2949220	so profitable and productive that we can use the excess to heal the environment.
2950740	2956900	The second scenario is what I refer to as the Mordor economy which is we are going to continue
2956900	2965460	to grow but more and more of our economic energy and materials will be directed to the energy and
2965460	2972660	mining sector of the economy meaning there will be less available for hospitals and universities
2973220	2980340	and entertainment and travel and things like that because our economy will instead of using
2980340	2985700	five percent of our energy to get the energy materials it'll be 10 percent and 15 percent and
2985700	2992740	18 percent leaving less for discretionary society. I call this the Mordor economy and I would say
2992740	2999620	this is the default. We're also going to need more and more energy and money to mitigate environmental
2999620	3008580	problems like droughts and floods and hurricanes and heat problems etc. Let me explain the trajectory
3008580	3016500	of the Mordor economy using this chart. The red line on the far left is when Reverend Thomas Malthus
3016500	3024740	lived on the planet and he said that the geometric production of humans would outstrip our arithmetic
3024740	3031700	production of food and he was wrong. He was wrong because he didn't know about fossil fuels that were
3031700	3038420	underneath the ground. Fast forward to 1969 and Paul Ehrlich wrote a book called The Population Bomb
3038420	3044820	saying many similar things and he was wrong at least about that at that time because he didn't
3044820	3052740	know about debt that we have increased our debt faster than we've increased our GDP in every single
3052740	3059940	year since 1969 and he didn't know about globalization that we could outsource the production of things
3059940	3067620	to the least cost areas in the world. Fast forward to 2009 the next red line and we had a great financial
3067620	3074420	crisis that was bailed out by the central banks taking over the role of monetary creation from
3074420	3081140	the commercial banks. We had COVID in 2020 again the bazooka of the Federal Reserve and other
3081140	3091220	financial guarantees and what will be the next can to kick. If we grow at 3% a year that means the
3091220	3099540	energy and materials given the stats I said earlier will double every 30 years so if there is a 15
3099540	3106100	year old watching this presentation by the time she is 75 there will not only be a doubling but
3106100	3114500	a quadrupling in the energy and material use of the human economy. Is that possible? Is that desirable?
3114500	3118900	What happens if that happens? What happens if it doesn't happen? These are some of the central
3118900	3125620	questions of our time. So that is the Mordor economy. The third category which is what I've
3125700	3131940	named my podcast in my work is called the great simplification which is we will not continue
3131940	3139540	to grow but we manage a graceful descent. The average person in America uses 100 times more
3139540	3145620	energy than our bodies need in terms of calories. If we went down to 70 or 60 or 50 it wouldn't
3145620	3153060	necessarily be a bad thing. So the great simplification is at some point in coming decades
3153060	3159780	when we remove this ubiquitous credit with a shift to more costly energy and resources
3159780	3165780	and a return to solar inputs and renewables which are viable but more costly in a system wide
3165780	3171220	perspective we will no longer be able to maintain our system of financial claims and one of the
3171220	3177860	next three recessions will be a depression. There is a musical chair element to our current
3177860	3183700	system of claims and I refer to this as a great simplification shown here as one trajectory out
3184820	3191220	for the next 30 years. Lastly there would be the fourth quadrant would be the Mad Max scenario
3191220	3198900	which is that we decline and there is no stability and social contract holding things together and
3198900	3204500	I'm sure you've seen enough movies about that scenario. However in our social discourse the
3204500	3210020	vast majority of people talk about this one scenario and the other three scenarios are really
