start	end	text
1326000	1331360	sitting at your elite school pretending because you watched TikTok twice and got an A plus on some
1331360	1335920	crazy paper because your professor couldn't get a job anywhere else that you actually understand
1335920	1344960	the world. And you're not welcome at my company. I think things are different now. I don't know,
1344960	1348640	what do you got? Am I right? Am I wrong? Am I just naive, optimistic, too hopeful?
1349760	1355600	Well, yeah, I mean, so, you know, Solana, you and I, again, we're like literally grizzled combat
1355600	1362000	veterans at this point, 10, 10 years in the meme wars, right? Yeah. And last five is really,
1362000	1365280	I think, where most of the action took place. That's right. That's right. So basically,
1366960	1372880	you know, tech versus media, you know, I kind of, all right, I'm just going to rattle off the history
1372880	1378720	here. And then I'll be turning this into a blog post and so on and so forth with the rules and
1378720	1384880	the history and then the history history, the deep history, right? But very roughly, tech kind of
1384960	1389040	arguably, you can argue when tech exists as a culture, but maybe you date it to
1389680	1398880	95 with the graphical web browser, okay? And then from 95 till, you know, 2008 or so,
1399760	1405120	because of the dot com crash, media didn't even really take tech seriously. They're just like
1405120	1410080	gadget guys or what have you just doing their stuff on the West Coast and they were considered
1410080	1416400	basically an auxiliary of the Democrat Party, like you had, you know, unions and you had this group
1416400	1420560	and that group and then there were Steve Jobs and the tech guys making gadgets over there in the
1420560	1425840	corner over there. And media concerned themselves with their expense accounts and the rock and all
1425840	1431760	this other stuff going up into 2008. There's even this article at that time, I think by Joel Stein,
1431760	1436320	that's enumerating like the power centers of the USA and it's real time capsule from 2008,
1436320	1440400	because you know it's not on there. What's on there is a Pentagon and Wall Street and so on.
1440400	1448080	You know it's not on there. In 98? 2008. 2008, what's, oh, social media. Silicon Valley is not on
1448080	1457200	there as a power center in 2008. At all. At all. Yeah, that is, the phrase big tech had not even
1457200	1463280	been innovated at that point. Exactly. This whole system that we're in is so much more recent than
1463280	1467840	people think because what happened was after 2008, after the financial crisis,
1469920	1478080	tech revenues went vertical. Okay. There's a great graphic that shows what happened. All right.
1478080	1484800	Bam. Okay. The hate is Kazanus. What is this graph? This is showing print media revenue top set at
1484800	1490400	$67 billion in year 2000. Then it's like down after the dotcom crash, but it's flat ish.
1490400	1497440	And then a complete collapse down to like $16 billion in like 400 years. This is advertising
1497440	1501200	revenue in newspapers. Advertising revenue in newspapers is a blue line, right? And then
1501200	1505520	including digital, digital doesn't save them, doesn't come on fast enough. And Google eats their
1505520	1509280	lunch and then Facebook eats their lunch. That's a green line over here. Google is the red line.
1509280	1516240	All right. So basically it's one thing to, you know, see your neighbor become like a billionaire.
1516240	1519440	It's quite another thing for them to become a billionaire while you become
1520720	1526960	a thousandaire or whatever. Right. Okay. And so these guys essentially over the first four years
1526960	1532000	of the Obama administration saw these tech guys who had been in, you know, a box or whatever,
1532000	1538160	they didn't think of as anything, suddenly rock it up ridiculously fast. And because that was the
1538960	1543360	iPhone and that was the reallocation of budgets after the financial crisis to online ads,
1543440	1549120	which are finally mature and converting. That was the fact that like SaaS was starting to work.
1549120	1554000	Y Combinator actually, you know, remember Y Combinator started in 2005, that whole modern
1554000	1558000	seed era of things only really started working in the late 2000s. There are a bunch of great
1558000	1563840	companies found around that time, Stripe, Airbnb, Uber, all of that basically by 2013,
1564640	1569920	after Obama got reelected, even in 2012, by the way, do you guys remember in 2012,
1569920	1574320	the nerds go marching in? How a dream team of engineers from Facebook, Twitter and Google
1574320	1579760	built the software that drove Barack Obama's re-election. Okay, when the nerds go marching in.
1579760	1583840	You see that? Yeah, I remember that narrative of the Obama being the first sort of internet
1583840	1589600	president. He had this team around him from tech basically. That's right. Not fully believing it,
1589600	1596800	but. Well, and the reason for that is because, you know, Facebook and then Twitter started in
1596800	1603520	very blue zones in the Harvard area and in San Francisco. And so it was assumed that technology
1604080	1609280	was blue and blue was tech and that it was just good and that if it had any effect on politics,
1609280	1613600	it would be to overthrow oppressive regimes and overthrow, you know, cause the Arab Spring. Go
1613600	1618080	ahead. Right. That was just assumed until Arab Spring, which they thought was great. We don't
1618080	1622720	hear much about the sort of consequences of that today. A lot of disasters, a lot of people
1622800	1627760	dead unfortunately, right? So we can come back to that point, but basically what happened then
1627760	1633840	from 2012 to 2016, a bunch of things happened. First is all these conservatives started getting
1633840	1638720	Android phones. Okay. And there's a really interesting sort of meme that makes this
1638720	1643200	concrete. If you're seeing, and this is kind of late 2010s, starting to get a little obsolete or
1643200	1650160	whatever, right? But there's a, there's a collage of a bunch of Democrat visages and a bunch of
1650160	1658080	Republican visages on Twitter. So Democrat visages are guys with glasses indoors and like,
1658080	1663040	you know, kind of unshaven or whatever, right? They're like unshaven programmer, graphic designer,
1663040	1667920	Yasqueen types or whatever, you know, the guys pointing at the thing, right? Okay. And
1669760	1673600	but the Republicans are more interesting or this is like, it's an interesting different kind of
1673600	1680080	visage. They're people with sunglasses in trucks outdoors, taking selfies on their phone.
1681680	1685920	So the fundamental difference is the Democrats are indoors and Republicans are outdoors.
1687120	1691200	Because almost all the Republicans are in sunglasses and they're clearly on the go,
1691200	1695840	with some like cheapo Android phone. So part of what happened from 2012 to 2016 is the
1695840	1699760	polls got online and that started shifting Twitter and the internet to the right. The
1699760	1705360	other thing that happened is after Obama got reelected in 2012, the media, which had played
1705360	1709440	nice with tech guys because they needed them to get Obama to get reelected, now had four years to
1709440	1715280	settle scores. And all the knives came out and all the valleywag type stuff happened around that time.
1715280	1718880	Would you just look at all those rich people? That's valleywags editorial vision in nutshell,
1718880	1723840	but could be so much more by Monju, who's become a full communist now and radicalized, right?
1723840	1728320	But that was like 10 years ago when he was ostensibly central left, he was complaining about
1728320	1734080	attacking them as rich people and so on and so forth. That's crazy. I remember people being mad
1734080	1738240	about that. But in my mind, I remember Dave Moore and complaining about this, which made sense
1738240	1743760	because he was being attacked. I don't remember the press rising to the defense of those guys.
1743760	1748240	That's interesting. That's right. So basically a few years later, he's all abolished billionaires.
1748240	1752480	It's literally he's writing that. Okay. The radicalization happened to the journals.
1752960	1762400	Okay. And essentially, though, it was a boxer's clinch where that tech and media alliance didn't
1762400	1767360	make sense anymore because the media guys were like, wait a second, these tech guys aren't just
1767360	1773120	like some vote bank gadget bank, whatever that's making the the bejeweled toaster on my desk that
1773120	1779040	is an iMac, they're coming for everything. Yeah. And then toothless really. I mean, it was
1779840	1785200	Gawker is destroyed. Yeah. That was that comes that comes a little bit later. But yes, that's
1785200	1789280	right. That's right. Of course, it's an important episode. And then trouble wins the election. And
1789280	1796400	at that point, it's worse. That's right. But crucially, the negative coverage starts in 2013.
1796400	1801200	In 2012, you can even find them writing articles like there's no such thing as a brogram or and
1801200	1806800	so on. Right. So this goes back to that visual I had of the blue tribe, right, red tribe,
1806800	1811680	gray tribe, if you're part of the tribe, you get friendly coverage. If you are not part of the tribe,
1811680	1816960	it's information warfare. Yeah. Right. And now that can mean by the way, you can be part of the
1816960	1820960	tribe and then kicked out of the tribe or you can choose to leave like Glenn Greenwald has,
1821680	1826240	you know, he was he was like, he had all the prizes. That's why I give him a lot. I don't
1826240	1831360	agree with Glenn on every issue. But I respect him because he had all the prizes within blue and
1831360	1835840	decided to kind of go and do his own thing and stand for a principle that he stood for. Right.
1835920	1840320	Conversely, it is also possible for someone to be kind of a renegade,
1840320	1847280	but then to become incorporated into blue and to be part of this Borg, right. Like Google,
1847280	1853840	early Google was much more buccaneering and swashbuckling and so on than what's become,
1853840	1859760	which it's not as blue as it was like a few years ago, maybe, but it's pretty blue, right.
1859760	1865520	So so once you kind of have that visual, it's really the, you know, that's the friend enemy
1865520	1871600	of the tribal distinction. And it's not exactly left, right, or what have you. It is group non-group.
1872240	1876480	Let me pause there. I've got a lot more. Well, I want to, I mean, I have a slight pushback,
1876480	1882000	which is that I agree with, I mean, the whole history, I think is correct and insightful,
1882000	1888560	especially the piece on the revenue is really important. It's, you know, we, I think I maybe
1888560	1895040	get somewhat distracted sometimes by the ideological combat component of all this. It just very
1895040	1899520	clearly feels to me like a classic information war and maybe not classic. It's not classic. It's
1899520	1903920	new. It's a new kind of, it's a very scaled up information war. It's live. It happens every
1903920	1909840	day. It lives in our pocket. It never ends. But at the end of the day, like we are, and this is a
1909840	1915440	point that is, you know, I've heard before I just forget, it's like we're in cop, we're competitive.
1915440	1919040	We're competitive. There's a business piece that's competitive, like just hot, like industries are
1919040	1924240	competing. And then online, that I think the new thing that we've seen over the past few years,
1924240	1930480	and let's just focus on tech for a moment, is we're not just, it's not just a money issue. Like
1930480	1939680	it's an actual, the all in pod is a massive success. And that is, you know, a side project for David
1939680	1946160	Sacks. And that would be a dream come true for every single person in media. So it's not like the
1946160	1950000	platforms are taking the money. It's like the people on the platforms are also taking the
1950000	1954080	attention from them. They're not even, they don't even get to be the attention people anymore.
1954080	1958720	Or not exclusively, there's combat, there's competition there. So separate from the ideological
1958720	1963440	piece, there's just, there's the reality of just competition. And when you're in it with someone
1963440	1968160	for something that you consider your life. So it's, it's funny you say this, because, you know,
1968160	1973040	now again, this feels like an ancient, actually, GV, I want you to jump in because we were just
1973040	1978880	chatting. So, did you want to say something or? Yeah, yeah, there's kind of the broader,
1979600	1984880	there's the broader informational war between tech and, and, you know, the paper built
1984880	1989600	aligned media. But, you know, the media, they're kind of the pit bull for, for some of the,
1990560	1996720	the paper belt against, you know, whoever in tech is an enemy of whoever is like helping place
1996720	2002320	various stories. You know, to me, it's been like, I've been trying to like figure out like trying
2002320	2008480	to back propagate, why did this happen to me? Like, where did I cross the threshold of becoming
2008480	2015200	enough of a problem that they needed to have leverage over me and expose me? And, I mean,
2015200	2021360	obviously, you know, Mark and Gary have been supportive of the movement, you know, for all
2021360	2026480	sorts of reasons, one of which is like, obviously, we think that, you know, the current sort of
2026480	2034000	regulatory capture attempt by, you know, AI safety, the AI safety complex and some of the big incumbents,
2034720	2040400	you know, it's camouflage is like anti-doom, trying to, trying to save us, you know, trying
2040400	2045040	to, trying to save us from open source models, right? Their dual use and so on. And, you know,
2045040	2049600	we were calling that out and getting, getting people fired up, calling this out and it became a
2049600	2056240	problem. And of course, you know, Gary tweeted this that, you know, FTC chair, Lena Khan,
2057200	2060720	was invited to YC, you know, and I was there and we had a little chat.
2060800	2065680	And, you know, I've voiced, I've voiced our concern of our, the concerns of our community,
2065680	2070480	that like, hey, actually, this is, this is, you know, kind of some of the big incumbents kind of
2070480	2076240	covering up the fact that they're trying to capture the market with sort of like, oh, this is for
2076240	2081920	your own, your own safety. And that's when I became like officially a political problem, right? And,
2081920	2086480	you know, there's all sorts of interests in the background, you know, trying to pull strings
2086480	2092000	here. You know, I have some hypotheses, maybe I won't go into like exactly who I think is pulling
2092000	2096560	the strings. I have my, I have my thoughts on that. But what, what's been public is that, you
2096560	2104800	know, Secretary Ramondo, I believe, called out EX specifically as like a dangerous movement and
2104800	2112560	something we should suppress with AI. They want to, like our movement is about free speech,
2112640	2117760	freedom of compute, freedom of AI and not like top down oppression aided with AI. And they're
2117760	2122880	literally proposing shutting us down with AI, which proves our point, which is kind of like,
2122880	2127040	by the way, by the way, you know, that's like, it's like, well, nobody rid me of this meddlesome
2127040	2133680	priest kind of thing, right? Well, no one rid me of this meddlesome EAC, right? Like EAC is a problem.
2133680	2138480	And that's like a decentralized signal to the journals to go in, you know, right? It's stochastic
2138480	2145360	journalism. Yes. Come on, that's pretty good. Right? No, I agree. Yeah, you're holding up the
2145360	2149680	target. This is where I'm trying to think of what the illusion to stochastic terrorism. Okay,
2149680	2154400	I thought it was funny. Stochastic journalism, stochastic terrorism. Okay, I want to talk about
2155120	2160960	it was funny. I want to talk about EAC. You were just getting into it. I mean, what
2162800	2165440	this is a little bit off topic, and we can, you know, revisit any of the stuff that we just talked
2165440	2174640	about, there's a ton there on the war piece. But this, you know, it's dangerous and whatnot.
2176240	2179360	What is EAC? How would you even describe it?
2180960	2189200	What is EAC? I think for me, it's kind of like a cultural framework, really, or a
2189200	2193520	medical cultural framework. We're trying to understand, where's this whole thing going?
2193600	2197440	Where's civilization going, you know, from first principles? At the end of the day,
2197440	2203680	the only laws are the laws of physics. And I'm a former theoretical physicist, and, you know,
2203680	2210160	I do physics based AI now. You know, I always think about physics. And nowadays, I think about
2210160	2215760	self organizing systems. And, you know, to me, it was just an exercise in writing and trying to
2215760	2221760	understand where it's all going. And rather than have like, like completely, like,
2223680	2228400	unanchored to reality sort of theories, like, like the doomers do of like, AI taking over,
2228400	2232320	as soon as it reaches human level AI, it takes over and fooms and takes over the planet. Like,
2232320	2236480	I've been trying to actually find like, where's this thing going? It's like, okay, well,
2238080	2244240	you know, civilization at the end of the day is a system that's like alive. All systems that are
2244320	2250560	alive, or that are basically life from a physics standpoint, seek to grow, they acquire energy
2250560	2255440	to maintain their sort of state, and they seek to grow and increase their ability to acquire
2255440	2259600	free energy. It's like, okay, well, civilization wants to go up the what is called the Kardashev
2259600	2265600	scale. So it is the scale of energy production or consumption. And so that's where we're going,
2265600	2271600	you know, and that's where the system wants to go. And, you know, it keeps morphing itself,
2271600	2276000	it, you know, searches over the space of technologies, of cultures, of memes, of
2276000	2284960	genetics, of everything, in order to ascend this scale. And, you know, basically, it's like,
2284960	2291120	we're just pointing that out. And to us, like, like, it's first a framework of like, what is,
2291120	2295200	and, you know, that's what's going on. And then it's like, how should you live your life,
2295200	2299920	given this fact? It's like, well, actually, if you help the growth of civilization,
2300640	2307600	you know, you will likely prosper. And it's kind of a self fulfilling prophecy. If you're
2307600	2312640	optimistic about the future, you work on hard things, right, because you believe in a better
2312640	2319040	future. So you want to contribute it to it so that you own a piece of it. And, and then you go out
2319040	2323920	and build and do hard things. And then the good future happens. Whereas if like you believe in
2323920	2328800	doom, and nothing good is going to happen, you know, a longer build, you don't longer want to
2328800	2333280	have kids, you don't bet on the future. And then the future is actually worse. Right. And to us,
2333280	2340320	it was a sort of reaction to the pervasive demerism, and the the person pervasive pessimism,
2340320	2347200	tech pessimism, that was just dominating the news cycles. And we were like, can we have a viral,
2347200	2354960	optimism movement that, you know, hyperstitiously induces growth of civilization, right? Don't
2354960	2358560	we all want that? Don't we all want to be, you know, amongst the stars?
2359360	2365120	It's more no, that's the thing. No, that's actually, I mean, for us, us three, yes. But
2365120	2369040	that's actually like a core. Yeah, it's not different. It's, yeah.
2369680	2373440	Acke, obviously ACC, we're talking about acceleration is the word that you're using. It's
2373440	2380720	EA, you're making a play on effective altruism. The effective altruists are very concerned with
2380960	2387040	accidentally building a god that kills us, really, is like where their heads at. And they,
2387920	2391360	not just they, now you have the safetyists in the media who have, they want to slow down tech
2391360	2396480	for all sorts of reasons. But their position, all of them in this sort of uneasy alliance between
2396480	2402640	very smart people in AI who happen to be EA-pilled and a little bit of a doomer, and the press,
2402640	2407120	and, you know, the government that wants to slow all this shit down. It's, it is that it's slowing
2407120	2411840	things down. Endlessly in the process, especially you hear, you know, Mark Zuckerberg said, move
2411840	2416240	fast and break things. And then things broke. We have to move more slowly. And you're not saying
2416240	2420960	that you're saying we need to accelerate. So the positive vision is there. It's awesome. And I
2420960	2424720	thank you for your service, sir. It is very important. The memes are excellent. And I think,
2424720	2428640	I agree, they are powerful. I think they're motivating. I think they are helpful. But they
2429440	2437120	identified correctly your critique of them. And, and so that is, you know, you're, you're locked
2437120	2441840	in a sort of at that point, it's, if people hate you a lot, and I mean, I've seen it. Why,
2441840	2446880	how much they hated you until this week? They're definitely mad. Can I make, can I make a couple
2446880	2453680	points there? Yeah. So there are decelerationists. And there's also what the current US establishment
2453680	2460320	is, which are stagnationists, right? What they want to do is they're in their own way, conservatives,
2460320	2466560	where they want to freeze the world in amber. And so you will find, for example,
2468480	2475440	that, you know, for example, Raimondo is talking about the tariffs and so on and export controls.
2475440	2480000	And they want to kind of freeze China as a power. And actually, I can understand that. Okay.
2480800	2485280	But, and so they're like, Oh, you know, the US needs to be a leader in AI. So we're going to ban
2485280	2491040	exports in there. And then literally, you know, that's what they're saying on Mondays and Thursdays.
2491040	2496880	And then on Tuesdays and Fridays, they're doing AI bans in the US and saying, you need to slow down
2496880	2501840	and not accelerate and so on and so forth, right? So they want to kind of think they think they can
2501840	2507200	be a policy lovers, which, you know, they're not Silicon Valley, they're not Shenzhen,
2507280	2511760	you know, they're neither of these things. But Washington DC thinks they can freeze the current
2511760	2516960	dispensation in amber, where they've got a healthy lead, and nobody abroad, and nobody at home goes
2516960	2522800	too fast. And nobody, they just want to stop the disruption. Because that's the thing. Acceleration
2524320	2526960	is good for lots of people, but it's not good for them.
2526960	2530720	It's not good for power, any technological innovation, I think, pretty much.
2530720	2535280	Well, so that's the thing. So I've got it. I've got a perspective on this being out here in Asia,
2535280	2542560	right? And India loves tech. India loves tech. And the reason Indians love tech is, you know,
2542560	2548480	you've got a guy who was on a, you know, like a very poor 10 years ago, who's now got an Android
2548480	2552080	phone, and they've got a lifeline to the world, and they're able to study and they can earn and
2552080	2556720	all this stuff. So it is correlated with the massive improvement in their living standards,
2556720	2561360	right? But for the journals, and more generally, the US establishment, you saw that graph, it's
2561360	2566000	correlated with a massive decrease in their living standards. So they have a learned correlation
2566000	2571200	where the faster the tech grows, the less money they have, the less power they have,
2571200	2576800	which is kind of true for, you know, it would be extremely painful for you, right? Acceleration
2576800	2582720	is extremely painful for them, right? And so that's why they're fighting the internet,
2582720	2587520	and they're fighting every force that's against them, in actually a conservative way.
2587840	2591440	Always feels like this. And then in this case, you're talking about generative, obviously,
2591440	2596800	as many things, but the thing that the most attention at this point is are the generative
2596800	2601200	models when you're talking about like language specifically, this is something that it looks
2601200	2606480	like a journalist that knows the true NPC level. It's literally the thing is, you know, this guy,
2606480	2610800	I got to get this guy to put this project back up, which, you know, I used to say,
2611520	2617040	not even jokingly that these journalists, you know, there are just like a sports article,
2617040	2621280	it's a wrapper around a box score, you know, box score is like the, you know, how many rebounds,
2621280	2626320	how many says steals, whatever, in a basketball game, or a financial article, it's a wrapper around
2626320	2630240	a ticker, like, you know, stocks were up on heavy trading, blah, blah, blah, it's just like a verbal
2630240	2635120	narrative. I used to say that these articles are just wrappers around tweets, you give it three
2635120	2639600	tweets, and you can write the article. And I used to say that as a joke, you can go find,
