start	end	text
1147680	1152160	the expense of other people or if you lose, then you're not kind of just left to starve or die or
1152160	1152960	whatever.
1152960	1156160	So we need to make the game, you know, played a slightly different way.
1157200	1162080	And, you know, that's basically the difference, I suppose, between kind of neoliberalism and
1162080	1163360	more progressive liberalism.
1164320	1169360	The thing I think that socialists should come in and say, or maybe we don't often, we always do
1169360	1175840	this, is actually to point out that the entire game is being played based on rules that have been,
1176480	1180240	you know, developed by someone else and in which, you know, working people are always going to be
1180240	1181360	designed to lose.
1181360	1185040	So ESG, the right will say, no, you want competitive markets.
1185040	1186400	This makes markets as competitive.
1186400	1192080	The left would say it helps us to deal with, you know, negative externalities that actually
1192080	1193520	make society more progressive.
1193520	1198160	And Marxists would come in and look at this and say, well, this is a way of shoring up the
1198160	1202000	legitimacy of a capitalist system that is fundamentally not based on free markets, is
1202000	1207760	actually based on the governance of society and control over society by huge corporations that
1207760	1214000	are able to exploit their workers and wreck the planet without any, really, any kind of pushback
1214000	1217760	from the state whatsoever, because the state itself is also largely influenced by those
1217760	1218880	corporate interests.
1218880	1224800	So ESG comes in as this kind of auto critique by the people who govern the system as a way of
1224800	1229040	saying, look, we know what we're doing and we're responsible and you can trust us to be able to
1229040	1231600	look after this system in your interests.
1231600	1236240	But there is absolutely no way that we will cede any of that control to you.
1236800	1240400	We will look after the system maybe in a more enlightened way.
1240400	1243680	We will consider some of the things you're talking about, but you're not ever going to
1243680	1246720	be able to actually be in the rooms where we make the rules.
1246720	1251760	And I think that's like what should differentiate a Marxist and a socialist from a progressive,
1251840	1257040	liberal or whatever, is actually saying, we don't just want to make the system a bit fairer,
1257040	1258400	we want to give people power.
1259760	1263440	Just on ESG as well, it's a huge money making opportunity.
1263440	1269360	So BlackRock's ESG Aware Fund charges fees five times higher than its core S&P 500 fund.
1269920	1273440	And ESG investment funds have 43% higher fees than conventional investment funds.
1273440	1277600	So they make more money, we'll talk about the kinds of companies involved in this,
1277600	1279520	they make more money around these products.
1279520	1283120	And like you say, it also fulfills a really important political role.
1284560	1287840	But it also means there's tremendous power that's now being
1288960	1291840	concentrated amongst the financial elite.
1291840	1296560	And like you say, before that was a concentration of economic and political power
1296560	1298160	based upon the idea that greed is good.
1298160	1301760	Gordon Gekko is the kind of main character archetype of the 1980s.
1301760	1303600	That was what our society was.
1303600	1306480	It does feel like in the last, well, citizens of the global financial crisis,
1307040	1310960	as Anglophone elites are trying to resurrect political legitimacy, consent,
1311680	1317280	they're having to change that archetype a bit more to caring enlightened characters.
1317280	1320560	Now, do you think they've been compelled to do that?
1321520	1326720	Is it just them trying to exploit an opportunity from, you know,
1326720	1329520	do good in liberals who would like them to be like that?
1331520	1332800	Where's it coming from?
1332800	1334960	Because it does get that criticism from the right as well.
1334960	1337600	And they would say, I don't agree with it.
1337600	1339360	I don't agree with the point behind it.
1339360	1341440	But it's coherent, which is, well, look,
1341440	1345040	private enterprise is designed to first look after customers,
1345040	1348080	secondly, look after shareholders, thirdly, look after workers,
1348080	1349200	forget the rest of this crap.
1350080	1352160	So where has it come from?
1352160	1355360	And why has it become so prominent in the last, say, 10 years?
1355360	1359360	So to understand where it comes from, you know, I think we need to look,
1359360	1361440	we've been talking kind of, well, I've been talking kind of
1361520	1366640	quite abstractly in terms of structures and like, you know, and classes and that sort of thing.
1366640	1371200	We need to think about how the people in positions of power, you know,
1371200	1374320	who have the capacity to kind of make decisions that will affect everyone else,
1374320	1376160	what they're thinking about when, you know,
1376160	1378480	developing and implementing things like ESG.
1378480	1384320	Now, it is obviously very clear to anyone with eyes that capitalism has,
1384320	1389040	at least since the global financial crisis, if not really since 1980s,
1389040	1395040	been suffering from both a crisis of kind of legitimacy and really kind of a crisis
1395040	1397680	which is pitting capitalism against democracy on the one hand,
1397680	1403040	and also a crisis of kind of reproduction of accumulation, basically,
1403040	1410400	in which it is becoming harder and harder to produce the stuff that we rely on to survive.
1410400	1414000	And that, you know, capitalism relies on for constant growth,
1414000	1418960	either because of, you know, climate imperatives, or because of collapse in productivity,
1418960	1421360	or because of, you know, escalating inequality,
1421360	1424080	all these sorts of reasons that play into the kind of long-term
1424880	1428720	productivity crisis that we've had and the associated financial
1428720	1431120	breakdowns that have come alongside that.
1431120	1434000	So there's this kind of legitimacy crisis and a kind of, you know,
1434000	1438640	a crisis of the reproduction of capitalist productive relations and social relations.
1439200	1444080	And if you are a member of, you know, the ruling class, let's say you are, I don't know,
1444720	1448160	Larry Fink, and you're the head of BlackRock, one of the world's largest asset managers,
1448880	1452560	and you, as, you know, the head of one of the world's largest asset managers,
1452560	1455840	have a portfolio, well, you don't have a portfolio, you will have a portfolio yourself,
1455840	1460480	but you govern a company that has lots of portfolios that invests in asset classes across the whole
1460480	1466880	economy that has a stake in pretty much every, you know, large firm in, say, the S&P 500,
1466880	1469840	just by virtue of the fact that you're so big, you have to be that diversified.
1469840	1470960	And it is almost all of them, right?
1470960	1476640	Yeah, yeah, totally, yeah. You're thinking, right, well, if my business is going to continue to grow,
1476640	1481760	I need not just, not the kind of, you know, the dynamics that you might want if you're a hedge fund,
1481760	1487200	which is lots of, you know, massive up and down, ups and downs, lots of crises that can be exploited
1487200	1492640	to, you know, make use of arbitrage strategies and make clever quick trades that are going to
1492640	1497280	make you money in the short term. You want really kind of long-term stable growth, you want
1497280	1501680	corporations to grow, you want corporate profits to grow, and you want people to be able to accumulate
1501680	1507040	savings that they can invest in your assets. And more generally speaking, you know, you want
1507040	1513200	a society that is characterized by relative stability. And that is true across a whole range
1513200	1517680	of industries, it's true across, you know, the political class in general, who if you were to
1517680	1522320	look at it from a kind of Marxist perspective would see their role as not just like maintaining
1522400	1527280	individual capitalist enterprises, but actually maintaining the broad conditions that allow
1527280	1530960	capitalist social relations, capitalist reproductive relations to reproduce themselves.
1532320	1536640	Then, yeah, you know, you are going to be worried about things like climate breakdown,
1536640	1541360	because that threatens, you want all of those levels, it threatens the legitimacy of the system
1541360	1545840	because people are going to get scared, people are going to die, it threatens the,
1546800	1550880	the relations of production, it threatens, you know, the relationships between
1550880	1554640	different social classes. I mean, if you look at the global economy and the way in which
1555440	1559200	climate breakdown is like to affect different parts of it, we're going to see breakdowns in
1559200	1562800	global supply chains of the kind that we saw during the pandemic much more frequently.
1564000	1568800	And it threatens the kind of very foundations of accumulation, just because like it's going to
1568800	1573760	be harder to get things out of the ground and like create the crops that people need to survive and
1573760	1577440	all those different sorts of things. So that's one argument, which is that ESG is about like a
1577440	1582400	long-term rational self-interest on the behalf of the capitalist class. But the companies with
1582400	1586320	the best ESG scores in America, and I find this fascinating, and right now it's a right-wing
1586320	1590800	talking point, but on this, they're correct. The companies with the best ESG scores in America
1590800	1597200	are Google, Microsoft and the Bank of America. Meanwhile, Tesla, which produces literally,
1597200	1601440	you know, electric vehicles, and you might agree, I disagree obviously with their labor standards,
1601440	1605520	and we need to have a conversation about using recycled lithium for EVs, but whatever.
1605520	1611040	EVs are clearly better. We want more public transport. EVs are clearly better than the cars
1611040	1616080	that people were producing, you know, 20 years ago and for the century preceding that. And the idea
1616080	1622080	that the Bank of America has a much better ESG score than Tesla. And that's a right-wing talking
1622080	1626160	point. And I'm just like, yeah, but they're kind of right. Even if you don't like Tesla,
1626160	1631600	Tesla has accelerated the adoption of electric vehicles by 10, 15, maybe 20 years. And it's
1632160	1636800	really accelerated the process for Detroit, car manufacturers all around the world, China.
1637360	1642400	So the idea that that somehow gets like middling ESG scores, I think it's quite fair to say
1642400	1646480	something's not quite right here. It's not just about the rational self-interest thing, you know?
1646480	1651280	Well, I think there's two things, again, going on, which is the rationale behind it. And the rationale
1651280	1656080	behind any climate policy that a government will implement will come from this, we need to protect
1656080	1660080	capitalism. Basically, you know, it's kind of the Keynesian idea. Jeff Mann wrote that book that was
1660080	1664240	like, you know, the Keynesian philosophy is basically like protecting capitalism means
1664240	1668640	protecting civilization. And there is an argument, you know, that these people will view themselves
1668640	1675520	as these enlightened, you know, platonic rulers whose job it is to basically make sure that
1675520	1681280	they have this view over society as a whole and can put in place the, like, the conditions that
1681280	1686640	give rise to the continuation of capitalism itself. But, and this is the interesting thing,
1686640	1691520	this is where things actually get interesting. If you're looking at, say, the state as a set of
1691520	1699680	institutions or, you know, a mechanism of organizing power, it is not staffed by enlightened technocrats
1699680	1705680	or platonic rulers who can just make policy based on what they consider to be the interests of
1705680	1709280	society as a whole. They say it is, you know, you ask a politician why they're doing what they're
1709280	1713120	doing, they say they govern in the general interest. This was Ralph Miliband's famous critique of the
1713120	1716400	capitalist state and the way that the Labour Party got sucked into it. It was because there's
1716480	1721360	this idea of state elites as governing the general interest, which is very hypnotic. It's like,
1721360	1724240	yes, of course, we'll give these people power because they're doing what's good for the rest of us.
1724240	1729120	But actually, the state isn't that. It's, you know, broadly speaking, as we think of capital,
1729120	1734000	it's a social relation in the sense that what goes on within the state and the way that state power
1734000	1740240	is exercised reflects social struggles that take place within society as a whole. That's kind of
1740240	1745440	abstract. But, you know, you can broadly think of it as like battles that are taking place within
1745440	1750560	state institutions, whether that's within, you know, the Treasury or any government department.
1751760	1758960	The players in that battle will be linked to wider groups that will have support from
1760240	1766080	different, you know, corporate institutions, historically unions, think tanks, basically
1766080	1771840	different groups that make up constellations of class interests that structure all capitalist
1771920	1778640	societies. And they will influence state policy, not just in a way that is meant to kind of
1778640	1782720	protect the interests of their class as a whole, but in a way that is meant to protect and promote
1782720	1787440	specific interests. So like look at like Biden's climate policies, for example, he comes in and
1787440	1791440	says, we need to save the planet for all these very good reasons. He's backed by capitalists
1791440	1795920	like Larry Fink who say, yes, actually, we do need to save the planet for the sake of capital.
1795920	1801440	And yet, because of the power of these different groups, these different specific interests,
1801440	1805920	as opposed to the general interests of capital as a whole, you end up getting this hodgepodge of
1805920	1810240	climate policies, which actively undermine each other in some senses, even though the narrative
1810240	1814560	is we're doing something about climate change, everyone can see that ExxonMobil still has a
1814560	1817920	huge amount of power, can still see that, you know, all these like these banks that are funding
1817920	1823600	climate change still have a huge amount of power. And so you have this weird like, not only like
1823600	1829280	the weird fact of policies that go against each other, but the weird show of politicians saying
1829280	1833280	we're doing something in your interest when it's very clear that they're actually acting on
1833280	1838080	behalf of a very specific interest. Yeah, I think it and it leads to really messy policy. Yeah,
1838080	1841920	which neither the left nor the right can really understand. So a really good recent example
1841920	1845600	is this recent house building announcement by Michael Gove. What does it look like? Well,
1845600	1850080	they're saying that legislative changes, which result really from an EU dictate, of course,
1850640	1855520	in 2017 have led to fewer housing starts and completions. First of all, that's not true. We
1855520	1861200	completed more houses in 2018 and 2016, but park that for a moment. The solution, therefore, is to
1861200	1869440	basically allow people building homes to to have those homes put more crap into local waterways.
1869440	1874240	That's fine. You know, it's called sediment, but they basically mean effluent and garbage and rubbish
1874240	1880240	that we flush down our toilets. Now, okay, you would think that's bad if you care about clean
1880240	1884480	waterways. You might think it's good if you think we're actually building houses are more important.
1884480	1888960	But here's where it gets really interesting, because it isn't just a regulatory change. They
1888960	1894640	like to say, we're not going to step back and we're cutting red tape. No, 700 million pounds of
1894640	1899200	taxpayer money is being spent. How hundreds of millions of pounds are being given to house builders
1899200	1903280	by the taxpayer, by the state. Hundreds of millions of pounds are being given to private
1903280	1906320	water companies. Apparently they're private. They pay dividends to their shareholders. And
1906320	1910560	yet the taxpayers having to pay for stuff here. So what we're doing is we're paying 700 million
1910560	1916000	pounds to allow some people to stop polluting, some people to start polluting, and apparently
1916000	1919600	it's so we can build more homes. And you think, hold on, couldn't we just use the 700 million
1919600	1924000	pounds to build to build the homes? Do you know what I mean? Yeah. But it's just this like, and
1924000	1928800	it's really messy, chaotic and like screwed up. Yeah. And I think that's a big part of the political
1928800	1933040	debate right now is why the left and the right struggle to get a handle on anything. And it's
1933040	1936880	why everybody says, look, nobody could minister anything. And I think like you say, it's because
1936880	1942400	you have these competing interests and also competing ideas, which because they're not governed
1942400	1946800	in a coherent, structured way, which they were, let's say until 2008, or if you're being really,
1946800	1954000	you know, skeptical, you know, maybe the 1990s, it's just a mess. Well, I mean, I think this is
1954000	1958880	the point, right? Because we've been stuck in politics for such a long time in this
1959440	1965200	sterile debate between left progressives or liberal progressives and neoliberals or right
1965200	1970880	wingers. And the debate is basically like, the state needs to do stuff on the left, you know,
1970880	1974880	the state needs to do stuff, we need to protect people from the markets, the free market is fine,
1974880	1978880	but it needs to have some regulation over it. And the right saying the free market is good,
1978880	1984160	state intervention leads to corruption, you know, we need to get rid of like, you know,
1984160	1988320	nanny state and bureaucrats and all these different sorts of things. And we have the same
1988320	1993120	debate we've been having for 100 years, and no one's any the wiser. And of course, that's because
1993120	1997760	we've lost what should be the socialist or Marxist critique of all this, which is that we don't live
1997760	2003280	in free markets. Not only are the markets that, you know, do exist under capitalism, not free,
2003280	2007840	but most of our lives are structured by decisions that are made by big corporations, financial
2007840	2012320	institutions, states, politicians, who are insulated from democratic accountability precisely
2012320	2016960	because they're in the pockets of big businesses. And what is really missing there is just an
2016960	2022000	understanding of the way that power actually works. We have these big ideological debates and
2022000	2026560	that people who do PPP like to have about freedom versus competition versus, you know,
2026560	2031760	protection. And actually, none of that matters when it's just the brute fact of power that is
2031760	2037600	being exercised by people who are in positions of authority over everyone else, who basically
2037600	2043440	like live in a game that has been designed so that they lose. No wonder you get people, you know,
2043440	2047840	going for these kind of conspiracy theories, which are like, you know, the world is being run
2047840	2052560	in this one room by like the World Economic Forum. It's like, that isn't true. You can
2052560	2060720	understand why they think that because there is this like fairly coherent network of institutions
2060720	2066240	and actors that govern those institutions that whenever a crisis happens, do seem to get together
2066240	2070640	in a room and say, right, this bank gets bailed out, that one gets to collapse in the pandemic,
2070640	2074480	this company gets a bailout, that one gets to gets to collapse. And at the same time,
2074480	2077520	you're being told, oh, we live in a free market. And if you go out and work really hard and
2077600	2081280	compete in that market and do really well, then you'll come out on top. But also, if the company
2081280	2086640	that has been exploiting you for 10 years gets, you know, extremely over indebted and needs a
2086640	2089760	bailout, we'll give them one. But if you get extremely over indebted and need a bailout,
2089760	2092640	then you're out on the street. Like, of course, it sounds like the system is rigged. You're told
2092640	2097600	you're living in a free market system. And actually, you live in this, you know, it's like
2097600	2103280	the iron fist of the powerful versus like the invisible hand of Adam Smith.
2103280	2107120	Yeah, this was really brought home to me though that I was watching GB News with Darren Grimes.
2107680	2112080	My regular Saturday viewing. And I was watching because I was about to go on, actually. And I
2112080	2117680	was preceded by a guy called John Rental, who's this sort of new labor, you know, the Russian
2117680	2123200	Soviets had a great word for this, ideologist. Yeah, not an ideologue, an ideologist. And PPE,
2123200	2129920	PPE, the job of PPE, by the way, is to train ideologists of market capital. And he was on
2129920	2132960	there. And Darren Grimes, and this is what worries me, because Darren Grimes is talking
2132960	2136400	more sense than John Rental. Darren Grimes says, well, look, there's this massive difference
2136480	2143360	right now between savings rates and, and things like mortgage rates or credit card debt. So
2144080	2147760	the base rate of interest 5.25% of the moment, we all know it's been going up for 18 months.
2147760	2151520	What's the base rate of interest? It's the, it's the, it's the, it's the rate of interest at which
2151520	2155120	the bank of in and gives money to private banks. Obviously they have to make profits because they're
2155120	2160560	private enterprises. So they have rates slightly higher right now, their savings rates, I think
2160560	2167040	the average is about 2.6, 2.7%. The average mortgage is almost 6%, 5.75, 5.8%. So there's
2167040	2171600	this huge difference, right? So they're basically skimming profits. They're charging far more than
2171600	2175600	they should be with regards to, you know, if you want to take out debt from them, but if you're
2175600	2179440	depositing savings, they're not really giving you enough. So it's clearly unfair. Darren Grimes
2179440	2183280	said that in his own way. And John Rental goes, no, no. And he said, should politicians be doing
2183280	2188080	anything about this? And by the way, Jeremy Hunt called this a problem. Jeremy Hunt and John Rental,
2188080	2192480	this Blair ideologist says, oh, there's no problem with this. It's the free market. We
2192480	2196720	shouldn't be getting involved. Oh, bless him. It's the free market. That's so stupid. It's so
2196720	2201280	stupid. Like the UK financial system is so far from a free market. It's been like accused of
2201280	2207360	oligopolistic behavior in like loads of reports going back like years. It's the free market. So
2207360	2211680	first of all, first of all, first of all, we're talking about monetary policy. So that's set by
2211680	2215520	the Bank of England is set by like a bunch of people in a room. There's no invisible hand.
2215520	2219040	They arbitrarily determine what it is. They would say, this is the interesting because
2219040	2223200	historically they would say, oh, they are just setting the current interest rate to align with
2223200	2228320	the long-term natural rate of interest, which is set by the market. And actually QE and the
2228320	2231440	policies surrounding that have kind of done away even with that idea. So it's now become obvious
2231440	2234560	that actually central banks just set interest rates. There's no natural rate of interest.
2234560	2237120	But then Darren Grimes says something really interesting. He says, but hold on, you're saying
2237120	2240720	it's the free market. We bailed out the banks in 2009. That wasn't the free market. And I'm thinking,
2240720	2245360	oh, God, he's gone in. And John Rental was, no, no, no, no, that wasn't, we made money from that.
2245360	2248960	It wasn't a bailout. Of course it was a bailout. And it wouldn't fucking exist anymore if we hadn't
2248960	2255760	used taxpayer money to guarantee their liabilities. They were insolvent. And you know, that's where
2255760	2260400	I get, and we're talking, and it's really important to disaggregate. Let's say progressive liberalism
2260400	2265120	from the left, what John Rental is presenting there is progressive liberalism. And it makes no
2265120	2270480	fucking sense. And the right take from Darren Grimes makes him measureably more sense.
2270480	2275200	And that's where, as you say, people like yourself come in with something a little bit different.
2275200	2278720	Well, I mean, this is the point, right? Because there's two ways of responding to that. Once you
2278720	2284880	kind of, once you peek past the veil of capitalist ideology, once you take, what is it, the red pill,
2284880	2288240	the blue pill? Are you supposed to take? I can't remember. What is it? They say they've been red
